총점,회사,날짜,별점,요약,장점,단점,경영진에게
1.8,(주)에스엔텍,2018. 08,2점,"""회사의 도약의지가 강한곳 그러나 직원은 고되다""","사람들 좋고 친밀하게 지내는 분위기
이것저것 많은 장비를 다루기에 실력업하기 좋다","21시 칼퇴 22시 기본 24시 자주 퇴근함
한달에 한두번 18시 퇴근 한듯
건강이 악화된다.",좋은 기억 가지고 있습니다만 매우 힘들기도 했습니다.
1.8,(주)에스엔텍,2018. 08,3점,"""인원만 많고 효율성에 많이 떨어짐, 전체적 설계능력이 떨어짐, 시간때우기식 야근하면서 일하는사람 별로 없음, 단합된분위기 없이 개인풀래이 만ㄹ음""","연차 쓰는것 자유로움 , 아침식사 안한분을 위해 컵라면 준비해준것 , 회식비 부서 별로 월지급해 필요할때 회식하는 것","기존에 다니는 직원들 신입사원들 이끌어 주는 분위기 없음, 너무 신입사원들이 많아 이직율이 높음, 현실에 안맞는 서류정리가 많아 업무 효율이 떨어짐",바로 앞에 닥치는 문제점들 개선이 먼저이고 장래의플랭도 중요하지만 현실에 기반을 두고 생각했으면 하는 바램
1.8,(주)에스엔텍,2018. 06,1점,"""제조업인데 사무직이 더많고 현장에 대한 관심도가 많이 부족함""",식당아주머니가 친절하고 직원들이 친절하며 기업의 비전은 있어보임,장기근속자의 대우가 없고 일량의 대한 스케줄 압박이 많음,장기근속자의 대우가 경력직으로 새로입사하는 사람처럼 연봉이 근속년수의 따라 올랐음 합니다
1.8,(주)에스엔텍,2018. 06,2점,"""왠만하면 다른데 찾아보세요 퇴사율도 높고 근무환경 열악""",장점이 먼가요 먹는건가요?? 아~ 신축건물이라 깨끗해요 끝. 근데 진짜 쓸만한 장점이 없음 ㅠㅠ,"오너 위주의 회사임 전형적인 소기업 대표이사가 다혈질임. 디스플레이장비회사인데 엘지비중이 너무높음 마진 별로 안남음 인센티브 기대 하지마시길
이작은 회사에 임원은 왜이렇게 많음??",마진좀 남겨서 인센티브좀 받게좀~~ 급여수준도 좀 올리고~ 복지도 좀 신경쓰고 화는 임원한테만 내시길~
1.8,(주)에스엔텍,2018. 06,5점,"""사람이 젊고, LGD를 고객사로 두고 있어 나름 탄탄함.""","1. 깨끗한 사옥
2. 사람들이 친절한 편
3. 식사 맛있음
4. 성장가능성이 높은 회사
5. 신규교육 받을때 동기부여 됨","1. 야근이 많음
2. 수당을 더 올려줬으면 함
3. 통근버스 없음","회사가 크고 있는게 정말 좋지만... 그거에 맞춰서 직원들 복지나, 수당도 챙겨주면 정말 큰 회사가 될 것 같음"
1.8,(주)에스엔텍,2018. 06,1점,"""젊은 기업이나 젊어서 좋은 점을 느낄 수 있는지는 모르겠다""",밥은 괜찮음 사옥도 깔끔함. 수원이라는 점 정도가 장점이다,야근 12시간 이상도 허다함. 수당은 제대로 있었으면 시키지도 못했겠지..,적당히 보통의 일을 할수있도록 해줍시다.. 이건 아니자노아
1.8,(주)에스엔텍,2018. 05,1점,"""LG에 반도체 장비 납품하는 회사
9시에 출근해서 9시에 퇴근하는 회사""","대기업 다음으로 밥이 정말 맛있습니다.
신입 OJT, 개인컴퓨터(듀얼), 신축건물이라 깨끗함
시간지나면 자동 승진","불필요한 업무보고서, 빡센업무량, 야근필수, 눈치를 많이보게 됨",말도 안되는 야근수당을 다시한번 생각해보시기를...
1.8,(주)에스엔텍,2018. 02,1점,"""짧은 평균 근속연수가 그 회사의 중요 평가 지표임. 따라서 shit!""","저축 많이 할 수 있음. 높은 연봉때문이 아니라 돈 쓸 시간이 없음.
대빵 코드에 맞추면 고속 승진.","특수관계인 다수
야근, 특근 많지만 수당은 거의 없음(최저 시급도 안됨) 노동력 착취.
대빵의 거친 입. 막말에 퇴사한 사람들 꽤 됨.
구호/슬로건과 현실의 괴리 너무 큼.","직원들 갈구기 전에 자신을 돌아봐야 함.
자신이 무시하는 직원의 수준이 회사 수준임을 알아야 함."
1.8,(주)에스엔텍,2018. 02,1점,"""현직원의 말보다는 전직원이 쓴 글을 믿으세요""","회사에서 점심과 저녁을 제공해줍니다
사람들은 좋은 편입니다","저녁있는 삶은 포기해야합니다
바쁘면 새벽까지 철야를 할때도있고
쪽잠 자고 다음날 정시 출근해야합니다
건강과 저녁잇는 삶을 원한다면 피해야 할 기업입니다.
하지만 제조업은 어딜 가나 똑같지만
여긴 그냥 다 방관자들 같은 느낌",퇴근시간만 잘 조정해주면 애사심이 살아날겁니다..
1.8,(주)에스엔텍,2018. 02,3점,"""자유롭고 수평적 관계에서 회사 내 업무 분위기는 좋은 곳.
복지는 아직 발전이 더 필요함""","자유로운 분위기, 업무량이 많을 때는 퇴근이 늦지만 없을 때는 눈치 안보고 퇴근 가능, 젊은 나이 때, 개방적 사고, 꼰대가 없음, 사옥이 깨끗하고 넓음, 점심 식사가 맛있음.",부서간 업무강도 차이가 많음. 고객사로 인한 업무 스트레스가 많음. 복지가 별로 없음. 업무량에 따른 급여가 만족스럽지 않음,직원 복지와 사업 영역의 확대(매출처의 다양화) 가 되었으면 합니다.
1.8,(주)에스엔텍,2018. 02,2점,"""지원/관리 부서가 지원을 하지도 않고 관리를 하지도 않는다. 일반직원들의 편의를 전혀 살피지 않고 나몰라라식이다. 지겨울 정도로 반복해서 말해야 한달뒤쯤 처리가 이루어짐. 사람 열통 터지게 만드는 비전문적인 인력들의 물갈이가 시급하다.""","한마디로 악하고 악랄한 사람은 없다.
대표도 사람은 괜찮다..경영관리능력은 물음표
깨끗한 근무환경","시스템의 부재와 무능한 지원 인력들이 직원들을 퇴사의 길로 친절히 안내한다.
같은 회사내에서도 기본적인 수준차이가 너무 심하다.
젠틀하고 좋은 사람들도 많지만 저정도면 아주 기본적인 가정교육도 부재했던게 아니었나 하는 의심이 들 만큼의 수준 이하의 사람도 있다.","돈 몇푼, 몇백 아끼자고 회사의 미래가 될 고급 인력들을 놓치지 마세요.
연봉을 많이 주더라도 능력있고 참신한 고급인력이 필요합니다."
1.8,(주)에스엔텍,2017. 12,4점,"""수평적 관계_전체적으로 젊은 분위기 팀장들 대부분 30대에서 40대 초반 / 시스템도입 등 실제적으로 직원 복지를 위한 소통이 많아짐.""",다양한 장비를 제조함 / 본인 커리어 쌓기에는 아주 좋은 기회임 / 다양한 분야의 경험으로 지루하지가 않음 / 꼰대 문화가 없슴,적은 인원에 비해 일 양이 많음. 구직을 계속 하지만 퇴사자가 계속 생김. 조직 관리자 자체가 경험이 많지 않음.. 젊어서 꼰대 문화는 없지만. 조직 장악력 등 관린 문제가 많음.,많은 종류의 장비를 하는 것도 좋지만. 특정 분야에서 1등이 되고 고부부가치 되는 일을 할 수 있으면 좋겟습니다.
1.8,(주)에스엔텍,2017. 12,1점,"""대학생들이거나 취업에 쫓기는 분들은 꼭 보길!!!""","회사에서 점심,저녁식사를 제공해줍니다
최고의 장점
더 이상 쓸게 없슴","우선 저녁이 있는 삶은.. 버려야 함
저녁 12시 퇴근 새벽 퇴근 하는 경우가 허다함
제대로 된 업무 인수인계 및 업무 프로세스 완전 뒤죽박죽
항상 일정에 쫓기다 보니 대부분 눈치보며 그냥 늦게까지 있음.
9시~6시 근무시간이지만
오후 9시까지 해야 야근비 1만원 12시까지해야 2만원 총 3만원
솔직히 이 돈 받고 누가 일 하고 싶겠습니까...
일은 고액 연봉을 주는 것 같지만 현실은 할 말이 없음..
그냥 대학생이든 경력자건 피해야 할 기업입니다","경영진분들의 아들,딸이거나 누구의 어머니,아버지...
라면 이런 기업 보내고 싶을까요.."
1.8,(주)에스엔텍,2017. 08,1점,"""기업 발전가능성 이러거 보지마라. 어짜피 배부른사람은 따로 있는 곳.""","회사에서 저녁밥을 먹을 수 있어서 밥걱정을 안해도됨.
최대의 장점","돈은 마치 칼퇴근하는 사람처럼 지급하고, 마치 수천만원의 고액 연봉의 직장인인마냥 일을시킴. 대학생이라면 더할나위 없이 피해야할 곳","자신의 자식이 이곳에서 일한다면 만족할수있는가를 항상 가슴에 새기며, 누군가의 아버지 아들 어머니 딸들을 훔쳤다고 생각했으면 좋겠다."
1.8,(주)에스엔텍,2017. 05,1점,"""일한만큼 대가가 주어지지않고 책임을 다하는 직원만 호구취급 당하고, 적당히 눈치보며 일하고 골프치러 다니면 승진의 기회가 널려있는 불합리한 기업...""","딱히 뽑을 만한 장점이 없습니다.
굳이 뽑자면 마당쇠 처럼 군말없이 일하여 납기 달성에 최선을 다하는 직원들..
참 안쓰럽게 일하고 개고생하지만 알아주는 사람 하나 없음.","진급을 할 수록 연봉이 줄어들고 18시 퇴근시간이나 허울뿐이고 24시 까지 근무해야 직급에 따라 2만원, 3만원이 고작이며 그것도 새벽 근무나 철야 근무는 아예 주지도 않는다.
최저시급에도 못 미침..
노동부 조사 한번 쯤 나왔으면 좋으련만.
사장님은 옳은 이야기 하는 직원 보다는 옆에서 아부하는 직원을 더 신뢰하는듯 하고 직원들의 고충을 모르는 건지 알고도 신경을 안쓰는건지.
임원들자질은 한번쯤 평가해봐야할 기업이다.","합리적인 복지와 정당한 수당지급을 해주었으면 좋겠고 직원들의 고충을 듣고 무시하지 마시고 사장님께 꼭 전달해주세요.
자신의 자식들이 이러한 대우를 받으며 일 하고 있다면 이 기업에 취업을 시키시겠습니까?"
1.8,(주)에스엔텍,2017. 05,2점,"""부서마다 큰 편차가 있지만 일배우기엔 좋다고 생각한다
한 3년쯤 하다보면 커리어에 만족감이 생긴다
하지만 그 이상은 몸도 가족도 버티질 못한다. 첫 회사라면 죽었다 생각하고 3년만 버텨 보시길""","직급에 대한 상하관계는 없음, 수평적인 관계로 직원들 사이는 좋은 편임. 상장회사에대한 메리트는 있음","현대판 오징어 잡이 배를 연상시키는 회사
밤늦게도 환한 사무실을 볼수있음
저녁이 있는 삶은 포기",복지는 다른게 아니라 개인시간과 저녁을 최소한으로 보장해 주는것
1.8,(주)에스엔텍,2017. 01,3점,"""Lgd 진공장비를 주로 다루고 코스닥 상장사에 emi, 저온 증착 기술등을 보유하고 있어 이후 발전 가능성이 큰 기업""","괜찮은 복지 기숙사 식대 무료에 가족같은 수평적인 사내 문화, 회사분들 다수가 좋은 분들,
야근,특근수당을 챙겨주긴 합니다",야근을 매일 같이 하는것을 너무 당연시 여기고 사내 직원들은 업무시간에 일하는 사람만 일을 하고 다수가 쉬엄쉬엄하는 것 같았습니다 이는 평균 퇴근시간이 9시를 넘어가기 때문인 것 같습니다 그리고 경영진은 장비 테스트를 너무 소홀히 하는것 같습니다,너무 굴리지 말고 업무시간에 업무를 열심히 하고 야근을 최소화 시켜줬으면 좋겠습니다 라이프 벨런스가 맞아야 더욱 생산적인 활동을 할 수 있다는 것을 경영진이 알아 주었으면 좋겠습니다
1.8,(주)에스엔텍,2017. 01,3점,"""체계가 잡히지않은 외적인부분에대한 성장이 큰 회사
갈수록 발전하는 회사임""",수평적인 조직문화에 체계가 안잡혀있는만큼 신입사원도 바로 실무에 투입 단순반복적인 의미없는일이아닌 자기직책보다 더 많은 일을 하므로 개인업무발전에 도움이 됨,부서별로 군대문화존재 사원주임대리보다 과장이상이 훨씬 많음,"야근특근이 당연시되는 문화를 바꿔주셨으면 좋겠음
업무시간에 열심히 하게끔 동기부여를 시켜주면 좋겟음"
1.8,(주)에스엔텍,2017. 01,2점,"""향후 발전가능성 있어보임
매출액에 비해 부족한 인원
잦은 야근 주말출근""","비전 비전 비전 비전
연구소 비중이 큼
미래에 대한 투자가 많음","인원이 너무 부족함
업무강도가 셈
출장도 잦음 주먹구구식 업무","인원..이 턱없이 부족하고
일하는사람만 일하고 노는사람은 아주 많음"
1.8,(주)에스엔텍,2016. 12,1점,"""반도체 디스플레이 커리어를 쌓고 싶으신 분 추천드립니다""","회사에서 저녁식사를 제공해줍니다
최대의 장점입니다
저녁식사 주고 일을 시킴","일은 마치 대기업의 고액연봉을 주듯이 시키는 상황
말도 안 되는 업무 프로세스와 말도 안 되는 일정과 수박 겉핥기같은 업무
정말 대학생들이라면 피하셔야 합니다
아무리 취업이 힘들다고 해도 피할건 피해야합니다
사실 기업 한줄평은 의미없는 말입니다
피해야합니다!! 그리고 왜 평점이 낮은지 아실겁니다",자신의 아들 딸들이 고생한다고 생각해주십시요
1.8,(주)에스엔텍,2016. 11,1점,"""LGD 장비에 대해 취급하지만 연차가 낮은 직원은 아무것도 배울수 없는곳. 하지만 코스닥 상장과 무상증자, 새 사옥 건축등으로 비전은 있어보임""","일 한만큼 까진 아니지만 수당을 받을순 있다. 파견나가있는 본사의 직원들에겐 별도의 식비도 지급. 하지만 그뿐. 학벌,경력이고 중요하지않음","야근,주말 근무 필수. 방진복을 입는다는것도 고려해야함.","3명이 할일을 2명에게 시키지말고, 2명할일을 3명에게 시킬 생각을 했으면 좋겠다."
1.8,(주)에스엔텍,2016. 11,3점,"""기업의 성장이 이뤄지고 있는 회사. 그만큼 바쁜 회사""",수평적인 사내 분위기와 사람들도 다수가 좋은 분들입니다.,"회사에 일이 많아 업무량이 많으며 주말, 야근도 많은 편.",신규 인력에 대한 처우를 개선해야 함.
1.8,(주)에스엔텍,2016. 08,3점,"""회사분위기가 좋음, 직급보다 평준화 분위기""","개인의 능력을 최대한 발휘할 수 있음, 복지가 나쁘지 않은편, 성장중인 회사","맡은 프로젝트에 따라 업무량이 천차만별, 프로젝트 잘못잡으면 힘들어짐","필요 없이 늦게 퇴근하는 경향이 많음, 업무가 없으면 퇴근하는 분위기 필요함"
1.8,(주)에스엔텍,2016. 01,3점,"""회사가 크기위한 경영진의 노력이 크게 보임""",한창 발전하는 회사라 경력 쌓기에 좋은 회사이고 점점 복지가 좋아지고있음,업무강도가 높아서 평범한 생활을 영위할 수 없음. 일한만큼의 급여는 아님.,업무강도가 높은만큼 그만큼의 대우가 더 있어야 한다고 생각함
날 괴롭힌 삭제된 댓글,(주)에스엔텍,경기,,,,,
날 괴롭힌 삭제된 댓글,(주)에스엔텍,경기,,,,,
날 괴롭힌 삭제된 댓글,(주)에스엔텍,경기,,,,,
2.6,엑스큐어(주),2022. 08,1점,"""워라벨이 중요한 사람이라면 추천해주고싶은 회사지만 그 외에는 잘 모르겠음""","야근이 없어 워라벨이 좋음
근무환경이 좋은 편임
사내 휴게공간이 잘 갖추어져 있음","직원들을 위한 복지가 없는 편임
반 강제적인 회식
사무실 내 흡연
고인물이 많은 편",8~90년대 마인드을 좀 버리고 리더쉽이 무엇인가 생각 해 볼 필요가 있다고 봄
2.6,엑스큐어(주),2022. 08,1점,"""삭제된 리뷰만 봐도 알수있는곳...
변하지 않는 않을 곳""","사무실이 깨끗하다
커피머신이 있고 ..
휴가는 눈치안보고 쓸수있다","탑다운방식에 거쳐야할 단계가 많아서 업무가 비효율적으로 돌아간다. 임원보다 중간관리자들이 꼰대가 많고 아랫사람에게 막말하는 소리가 종종 들림
회식이 잦고 일정도 통보임
위에서 액션을 취해도 중간에서 미지근함
IT회사라고 볼수없는 군대식 문화가 많음","직원들이 왜 계속 나갈까?
회식으로 단합시킨다는 옛소리 그만좀
돈으로 주세요"
2.6,엑스큐어(주),2022. 07,2점,"""국내 굴지의 카드개발 회사로 여러 솔루션이 많고 개발자들이 대우를 잘 받음""","사무실 분위기 자체는 좋음
시설 및 업무환경도 좋음
사내 복지 좋음","사내 정치질이 매우 심하며 타부서에 관심 없음
부서에 따라 꼰대사수 때문에 고생할 확률큼
회식 술자리 잦음
파견이 많은 부서일 경우 상기 장점 누리기 힘듬","파견업무자 관리 및 처우에 대해 조금 더 신경 써야함
파견지에서 갑질 및 상사의 괴롭힘등을 관리하는 주체가 없음"
2.6,엑스큐어(주),2022. 05,3점,"""퇴사 당시만해도 괜찮았다. 그럭저럭인 팀장과 팀원들이 대부분.. 가끔 이상한 사람 한두명빼곤 좋은 사람도 많았으니..""",휴가 자유롭게 쓰고 얼마안되지만 상여도 줬었고.. 특정 분야에 대해 배우기 좋은 곳이었다.,중소기업의 한계.. 비전을 제시하는 리더가 없고.. 그냥 내 밥벌이에 집중..각자 도생모드,퇴사전에도 바라는건 없었는데 퇴사했는데 바라는게 있을리가..
2.6,엑스큐어(주),2022. 03,2점,"""직원과 경영진이 함께 발전 할 수 있는 기업""","자유롭게 연차 사용이 가능 하고 정시 퇴근에 구애 받지 않습니다.
팀간 자유로운 분위기로 업무 할 수 있습니다.","기존사업은 관심이 없어보입니다..
신규 사업에만 투자하고 기존 사업은 유지만 하다 정리될것 같은 분위기네요",기존 사업에도 많은 관심과 투자 해주셨으면 좋겠습니다.
날 괴롭힌 삭제된 댓글,엑스큐어(주),2022. 03,,,,,
날 괴롭힌 삭제된 댓글,엑스큐어(주),2022. 02,,,,,
날 괴롭힌 삭제된 댓글,엑스큐어(주),2022. 02,,,,,
2.6,엑스큐어(주),2022. 01,1점,"""그럭저럭 다닐만한회사였던 대부분 사람들이 다 난간듯""","연차를 자유롭게 사용
자유로운 분위기
월급나오고 있음
옹기종기모여 일하는 환경","미래가 안보이는 가장 큰 단점을 가지고 있음
이상한 넘들도 많아보임",새로운 사업 추진이 필요하고 서로서로 좋게좋게 어울렸으면함
날 괴롭힌 삭제된 댓글,엑스큐어(주),2022. 01,,,,,
날 괴롭힌 삭제된 댓글,엑스큐어(주),2021. 12,,,,,
날 괴롭힌 삭제된 댓글,엑스큐어(주),2021. 12,,,,,
2.6,엑스큐어(주),2021. 12,3점,"""오래 근무한 직원들이 있고 전체적으로 일을 강요하지 않는다. 회사가 한솔에서 나오게 된 후 많은 변화가 있는것으로 보인다.""",연차가 자유롭다. 재직 당시 출퇴근 조정이 가능해 개인 스케줄을 유연하게 쓸 수 있어 워라밸이 좋았다,전체적으로 꼰대분위기가 있다. 회식이나 화합에 꽤 신경을 쓴다.,미래 먹거리를 제대로 찾아 사업에 안정성을 확보했으면.
날 괴롭힌 삭제된 댓글,엑스큐어(주),2021. 12,,,,,
2.6,엑스큐어(주),2021. 10,2점,"""맘 편히 큰 성장을 기대하지 않는다면 다니기 좋은 회사입니다.""",복지에 신경쓰고자 하는 점이 가장 큰 장점입니다.,연봉 상승이 힘들다는 것이 가장 큰 단점인것 같다고 생각합니다.,기술에 대한 투자와 사람들에 대한 투자가 필요하며 연봉이 너무 낮습니다.
날 괴롭힌 삭제된 댓글,엑스큐어(주),2021. 09,,,,,
2.6,엑스큐어(주),2021. 08,3점,"""나름 자유로운 분위기에 복지 좋고 워라벨은 좋은 회사.""",연차 이외 연중휴가 5일. 격주 금요일 2시간 일찍 퇴근. 사람들이 좋은편. 자유로운 근무 환경.,일하는 사람만 하는것같고 회사에 이슈가 많음. 경영진 교체가 빈번했음.,말만 앞서는 경영말고 책임감있게 직원들과 회사를 잘 이끌어주었음함.
2.6,엑스큐어(주),2021. 08,3점,"""프로그램 개발자의 다양한 개발환경을 경험하기에 괜찮습니다.""","업무 분담 체계가 잘 이루어져 있습니다.
사내 분위기도 수평적","윗분들이 너무 많아 살짝 눈치..?
시스템자체는 체계적인듯하나 신경써야할것도 많은..",회사내부 합리적인 직원복지문화에 더욱더 힘써주셨으면 좋겠습니다.
2.6,엑스큐어(주),2021. 08,3점,"""복지제도와 워라벨은 좋으나 경영진 교체 후 회사의 비전과 성장에 대해서는 의문""","유연근무제, 월2희 단축근무, 연차외 리프레쉬휴가, 공동연차 사용 및 자유로운 휴가 사용. 기타 복지","특이한 경영진, 기존 사업의 부진, 자리유지만 생각하는 일부 관리자","공표했던 말들은 꼭 지키기 바라며, 회사 성장을 위한 정상적인 사업에 집중해주길."
2.6,엑스큐어(주),2021. 06,1점,"""개발자를 개똥으로보는곳 아니다 개똥보다 못하게봄""","연차는 비교적 자유롭게 쓸수있음 사람들이 순하고 좋음
근무분위기좋음 복리후생좋음","경영진이 무슨생각인지 모르겠음
개발로먹고사는회사인데 개발자를 똥으로 봄
연봉이 똥",제발 좀 직원들좀 생각해주시고 열심히일하세요
2.6,엑스큐어(주),2021. 04,2점,"""안타깝다
좋았는데 현재는 주인바뀌고 문화가변하고 있다""","연차 눈치안보는회사
나름의 워라밸이 보장되는 회사
그러나...","최대주주가 변하고
회사에대한 직원의 주인의식이 떨어짐","기존직원들의 직장에대한 불안감좀 해소시켜주시죠
보이기위한 액션과 실질 마음을 움직이는 액션의 차이가 있는듯"
2.6,엑스큐어(주),2021. 03,2점,"""사람이 좋아서 참고 다닐 수 있는 곳
직원들이 불안정해서 마음이 놓이지 않음""","휴가 연차 이외에 5일 더 줌
한달에 두번 금요일 2시간 조기퇴근
연차 눈치 안보고 쓸 수 있음
사람들 좋음","회사에 계속 시끄러운 문제 발생함
직원들이 마음놓고 다닐 수 없음
앞으로 뭐해먹고 살 수 있을까...","직원들 생각 좀 해줬으면
제발 불안하지 않게 해줬으면.."
2.6,엑스큐어(주),2021. 03,2점,"""연봉을 어느정도 포기하면 신경안쓰면 편하게 다닐수있다""","자기계발비, 연차를 눈치 없이 쓸수있으며 탄력근무제를 시행하고 있다",새로운 사업에 투자하여 실패한 이후로 도전을 꺼려하는 분위기가 많아 성장이 힘든회사,낮은 연봉 인상으로 계속 신입인력이 빠져나가는것을 신경써야함
2.6,엑스큐어(주),2021. 03,3점,"""워라밸은 훌류하나 발전가능성이 없음. 추후 이직이 힘듬""",워라밸 훌륭. 1~2년에 한번 10일정도 야근 외엔 야근할 일 없음,현재 업무분야의 경우 개인적으로든 기업으로든 발전가능성이 없음. 신규사업 얘기만 하지 딱히 신규사업도 안함,직원들이 역량을 키울 수 있는 다양한 기회를 주면 좋겠음.
2.6,엑스큐어(주),2021. 02,3점,"""욕심을 버리고 생각없이 다니기는 좋다.""","중소기업이지만 사무환경이 쾌적한 편이다. 눈치 안보고 휴가 사용할 수 있는 자유로운 분위기이며, 야근이 많지 않은 편이다.",사업구조가 너무 단순하고 취약하다. 유심 판매에 편중된 매출 구조의 개선이 절대적으로 필요해보임.,이대로 가면 회사가 어려워질 것이 뻔히 보이기 때문에 새로운 먹거리 발굴이 시급해보임.
2.6,엑스큐어(주),2021. 01,5점,"""개발자가 대우받으면서 일 말할수록 있는 곳
소소한 이벤트가 많습니다.복지가 괜찮은 편입니다.""","같이 일하는 사람들이 좋습니다.
회사의 위치가 좋습니다. 신호등 기다릴 필요 없습니다.","출근 시간에 사람들이 엄청 많습니다.
엘리베이터 타기가 힘듭니다.","새로운 다양한 사업전략을 제시해줬으면 좋겠습니다.
새로운 다양한 사업전략을 제시해줬으면 좋겠습니다."
2.6,엑스큐어(주),2021. 01,4점,"""자유로운 분위기인 편에 속하고, 구성원 모두 전반적으로 친절한 편. 업무양 대비 연봉은 높은 편.""",나는 워라벨이 중요하고 커리어는 개의치 않는다고 생각하면 추천. 경조사나 명절 상여도 정기적으로 받는 편.,"업무를 본인이 찾아서 해야하는 편. 배울 수 있는 기회가 한정적. 그렇지만, 교육 지원이 잘되어 있기 때문에, 나는 스스로 클 수 있다 하는 분에게는 매우 추천.","신규 사업에 대한 결과 제시와 관리 체계 적용이 필요하다고 생각. 경영진들이 준비하고 있다고해도 직원들에게 보여지는 결과가 없고, 관리 시스템이 출퇴근 외에 부재한다고 생각"
