총점,회사,날짜,별점,요약,장점,단점,경영진에게
1.9,세원물산(주),2018. 05,1점,"""대구의 특성상 보수적인 분위기 가족중심 회사기 때문에 답답하다""",연봉이 대구 지역내에서는 높은 편에 속한다. 다른 점은 딱히 모르겠다,너무 보수적인 분위기와 가족회사 라서 그런지 가족끼리 운행한다,보수적인 분위기를 버리고 개방적인 분위기로 바뀌길 바랍니다
1.9,세원물산(주),2018. 04,3점,"""현장중심 오래다닐수 있는회사 장기근속이 애사심이다 강조하는 회사이고 현장 평균 근속년수가 15년 정도 될겁니다""",장기근속자가 많다보니 맨파워가 대단하다 경쟁업체 대비 장기근속자가 많다 보니 품질이나 생산성이 높을것으로 생각됨,"복리 후생이 부족한것 같고 노조가 있긴하나 단일위원장으로 너무 장기집권이라
아무래도..",복시에 조금더 신경써주시기 바랍니다 그리고 글로벌 기업으로의 신규고객 확보에 더욱더 매진해주셔서 좋은 결과있길 바랍니다
1.9,세원물산(주),2018. 04,3점,"""일하는 만큼 돈은 준다 그래서 연봉이 높다 하지만 7일중 6일은 일하는회사""",일한만큼 돈 준다. 현장직 사람들 성격이 좋다. 일거리 엄청 많다. 현차가 내수로 먹고사는한 망하지는 않을것.,생산직 인원들 뽑을 때 공채로 뽑지 않아 나이많은사람들도 들어오고 자격증없어도 들어온다. 복지가 없다. 위에 경영자 마인드가 군대식이다.,오너일가들 자기들만 돈벌려고 나쁜짓 하지말고 번만큼 직원들한테도 돌려주면 좋겠다.
1.9,세원물산(주),2018. 03,1점,"""망하지는 않습니다
다만, 개인역량에 따라 근속이 달라질수 있습니다

버티면 오래 갑니다(어떻게 버티냐 그게 문제입니다)""","지역에서 비교적 연봉 높은편
단, 사원 대리까지만 그뒤로는 타사 비슷한듯 합니다
이외 장점은... 잘 모르겠네요","기업문화가 너무 뚜렷하고 확실해서
자칫 여기 분위기에 쉽게 적응 못할수도
있습니다","“세원가족~~”
정말 저희 가족 맞죠?

저희도 가족이고 싶습니다"
1.9,세원물산(주),2018. 02,2점,"""수익 규모에 비해 속이 차있진 않은 회사""","지역 기업중에는 높은 초봉
기숙사를 제공하여 언제든 일할수 있는 분위기
칼퇴가 없다시피 하여 일에 매진할수 있음","안전에 대해 관심이 부족
복지에 필요한 금액을 전부 연봉에 몰아주는 느낌",직원의 사생활을 조금만 더 보장해 줬으면함
1.9,세원물산(주),2017. 12,1점,"""연봉은 지역에사는 꾀 되는 편입니다. 그 외에 장점은 하나도 없는 회사입니다.""","연봉이 그럭저럭 괜찮음.
아침 점심 저녁 다먹을수 있고 먹게 될것임",연봉 외 모든 것이 단점. 회사에 되는 일이 없고 체계가 없고 북한식 문화 후지고 후지고 후진 문화와 제도가 나아질 기미가 없는 회사.,"전문경영인에게 맡겼으면 함.
경영권 승계를 하루 속히 마무리하고 회사에서 빠져야 될 사람은 빨리 빠져야 된다. 안보이는 안력싸움에 드는 에너지와 소위 경영자라는 사람이 생각들도 다르고 교통정리가 안되서 여러가지 로스가 크다"
1.9,세원물산(주),2017. 11,1점,"""연봉 빼고는 장점이 전혀 없다 아무리 생각해봐도 연봉밖에 없다""",정말 생각해봐도 연봉밖에 없음 회사 생활이 힘드니 젊은 사람들끼리 서로 위로하며 친해지는 분위기,보수적이고 정말 일이 많다 입사할 때 동기가 17명이었는데 1년도 안되어 10명이 퇴사했다 업무나 직원 복지에 돈 쓰는거 상당히 예민하고 안전 개념없음 실제 일하다 다치는 사람많다 절대 추천하지 않는다,퇴사해서 별로 바라는 점 없음 이 회사가 매출 1조 넘을지는 상상도 못했다
1.9,세원물산(주),2017. 11,2점,"""임원급이 아닌 이상 짤릴 걱정은 없다 멘탈이 강하면 살아남는다""",좋은 사람이 많다. 연봉이 높다. 여러 업무를 배울 수 있다. 아침형 인간이 될 수 있다. 회사에서 밤 셀 수 있다. 자동차 1차 벤더라 갑과 친해 질 수있다.,좋은 사람은 많은데 별로인 사람은 더 많다. 연봉만 높다. 업무강도가 빡세다. 출근시간이 너무 빠르다. 당직서면 이틀이 날아간다. 1차벤더라 갑과 상대하는게 까다롭다.,근무환경 개선이 필요하다. 아무래도 현기만 바라보지 말고 해외수요 확보도 필요한거같다.
1.9,세원물산(주),2017. 10,1점,"""돈은 괜찮게주지만 체계적이지못한 중구난방적인 회사이다.""",짤릴일은 없어서 멘탈만 강하면 계속해서 다닐수있는 회사이다,체계적이지 못하고 주먹구구식으로 일을 진행시킨다. 실적위주의 회사,체계적인 프로세스 구축과 좀더 복지가 활성화되었으면 싶다
1.9,세원물산(주),2017. 08,1점,"""개발자가 대우받지 못하는 회사 월화수목 금금금
추천하지 않음 절대로""","눈을씻고 찾아봐도 없음 돈을 대구경북비해서 많이줌
대구와 가까움","부서별로 업무강도 편차가 심함
사람을 뽑지않음 대리급 모두 퇴사함","책임을 떠넘기는 경영방식 이해불가
복지가 없음 퇴근 늦고 야간수당 없음"
1.9,세원물산(주),2017. 08,1점,"""대구에서 돈은 괜찮으나 대리까지임
지역에 고려하여 인원을 배치해줫으면함
부서별 인원이 정말 부족함""","대리까지 월급만 괜찮음
월급이 사원 대리 괜찮음
초임이 괜찮음","월급빼면 그닥 인원이 퇴사하면 충원대신 그 속에서 해결하려함
결국 남은 직원이 죽어남","사람뽑아야합니다
사람필요하다라고 하세요 윗분들은
두명서 할일을 한명이 된다라는
생각...직원들이 왜 퇴사를 하는지 생각하세요"
1.9,세원물산(주),2017. 08,1점,"""아침 안먹는 하루세끼를 원한다면 좋은회사
복지는 하나도없는 망할회사""",사람들이 인상이 좋고 잘대해준다는 점 빼고는 장점이라곤 눈꼽도 없는 회사,"초봉도 세전3000도안됨
복지는 전혀없음
일주일에 3번이상 잔업해야되고 특근도 토요일 한달에 한번쉴수있음
저녁을 16시30분에먹음
몸이아파도 출근해야되고 조퇴도 마음대로못함",직원들을 좀 생각해서 공장짓는대만 급급하지말고 복지도 좀 챙겨줬으면 좋겠음
1.9,세원물산(주),2017. 07,1점,"""급여는 높으나 업무강도가 매우 높으며 칼퇴보다 야근이 더 많은 회사. 오너가 모든 결정권을 가지고 있으며 결재 절차가 복잡하고 체계적이지 못함""",현대자동차 1차 협력업체로 입지는 있음. 급여는 대구 경북권에서 높음,급여 외에는 거의 모든 부분이 단점임. 부서 사람들은 좋으나 오너의 눈치를 심하게 봄.,직원에게 믿음을 가지고 봐주었으면 함. 까다로운 결재 절차 개선 노력이 필요함
1.9,세원물산(주),2017. 07,2점,"""저녁이 있는 삶을 원한다면 절대 선택하면 안되는 회사임""",자금력이 뛰어나 글로벌 자금 위기에서도 건재할 회사이고 급여가 높음,너무 경직된 회사분위기로 인한 사내 분위기가 너무 딱딱함,직원들이 돈만 쫓아가지 않고 인간적인 삶을 살 수 있도록 복지에 좀 더
1.9,세원물산(주),2017. 06,2점,"""대구 지역에서 초봉으로는 탑5에 드는 기업. 일을 열심히 하고 싶으면 추천하는 회사.""",상여금 12달 분할 지급으로 개인 돈관리에 장점. 회사 자체 부채가 거의 없음. 부도 위험 낮음.,자동차 업계 특성상 군대식 성격이 강해 철저한 보수적 사무실 분위기. 부서별 차이는 있으나 초봉 많이 주는만큼 업무 강도도 높음,"회사의 어려움은 알지만 직원들을 위한 복지 부분이 많이 부족합니다. 휴가 기간이 짧은 부분이나 명절, 휴가 보너스 부분에 관심을 기울여 주시면 좋을 것 같습니다. 타사에 비해 많이 열악합니다."
1.9,세원물산(주),2017. 06,1점,"""인원을 줄여서 매출에서의 원가절감을 실현하는 사람을 생각한다는 초 고강도의 업무수준 철야를 하는 일이 잦고 일을 배울수 있는 상사도 없으며 떠넘기식의 직원대우""","사회 초년생 대비하여 돈을 많이 줌 하지만 복지 상여금이 없음
연봉이 전부인 회사",일을 배우기에는 좋으나 직급이 올라갈수록 더욱 힘들어지고 이직률이 매우 높음,사람다운 대우를 해주었으면 좋겠슴 인원을 늘리던지 일거리를 덜받던지
1.9,세원물산(주),2017. 05,2점,"""연봉은 상위권, 복지는 하위권, 워크라이프 밸런스 하 , 기업 발전가능성 하""","초봉이 많다. 대기업 수준
대구사람이라면 다닐만하다.","영천이 시골에 위치하여 교통불편
매우 보수적인 문화
업무시스템이 뒤쳐져있다.","더이상 회장 사장 독재 체제로 아랫사람 의견 무시하는 일이 없었으면..
발전하려면 복지부터 늘려 회사원들 마음주터 풀어주길."
1.9,세원물산(주),2016. 11,2점,"""정말 돈만보고 살고싶다 가십시오. 안말립니다""",장점은 돈쓸시간이 없어서 돈이 모입니다. 그리고 분위기가 조용해서 좋습니다,단순서류업무가 너무 많습니다. 그리고 분위기가 어둡습니다,더 나은 근무환경에 대한 고민이 필요해보입니다.
1.9,세원물산(주),2016. 08,1점,"""돈보고가면최고다. 직게 가족이다들사장이라 의견을제시할수없다.결혼후 여가생활은역대최악이다""","돈은엄청많이준다.글로벌기업에 점점커지고있는추세이다.
이거하나는진심이다.승진은4년채우면자동이다","품질팀은 4년채우고항상1년뒤누락되더라...
토욜은당연시출근이며..정구퇴근시간하고잔업시간까지핻ᆞㄷ눈치보인다.","사람들의의견을들어주는 믿음직한 경영진잉되었으면좋겠다.
회의는 의견을듣는곳이아니라 공유하기에있는것이다"
1.9,세원물산(주),2016. 07,2점,"""제조업의 특성상 딱딱한 분위기,대구경북권에서 연봉은 섭섭하지않게 받을수있다.돈이 정말 전부가아니란걸 깨닫게 해준회사""","연봉과 어렵지않은 업무 프로세스, 다른회사에 비해 진급시 다소어려움이없음 영어성적이나 다른 자격증을 요하지 않음. 근태가 대부분 진급에 반영됨",90년대 현다이. 들어가기가 타경쟁사에 비해 무난하나 그만큼 퇴사인원도 많음. 업무는 어렵지않지만 인수인계가 제대로되지않으며 부서의 업무량 및 업무분담의 형평성은 아직도 말이 안됨. 성장할만큼 한 회사라 고객사의 수주를 꾸준히받음.고로 연구개발에 투자를하지않으며 변화도 시도하지않음.오너위주의 경영...예전엔 먹혓을지 모르겟다만....2세들의 경영에따라 미래가 뒤바낄 회사인듯....하지만 피는 못속임,너무 국내 고객사에만 의존하지말고 변화를 시도해보는 것도 나쁘지않음 관리직 임금 줄여 인원 넉넉히 뽑아서 적절하게 업무 분배하고 근무강도 및 칼퇴는아니더라도 적어도 퇴근할때 눈치 주는일 업으면 좋을텐대....반드시 경영컨설팅으로 변화를 시도가 필요한 시점임
1.9,세원물산(주),2016. 06,1점,"""창업자의 판단으로 모든 의사결정이 되는 회사 빗자루 하나까지 결재 받아야 되는 회사""",짠돌이 기업 운영으로 쌓아둔 돈이 많아 현차 망하고 1~2년 더 버틸 수 있는 회사,마른걸래도 짜내는 마인드 개인의 삶보다 회사가 우선인 회사. 부장까지 올라가면 동기들이 자연도태 되어 임원진급 경쟁률은 낮지만 임원 진급이 어려운 회사,창업자는 그래도 나름 철학과 주관이 있다지만 2세 경영 전환시 걱정 됩니다
1.9,세원물산(주),2016. 06,5점,"""미국 중국으로 진출한 글로벌 기업으로서 지속적 발전이 가능한 회사""","대구 경북권의 최고의 연봉
현대기아자동차 1차 협력사","업무분장의 재구성 필요
업무강도 높음
관리직 인원이 너무 적음","효율적인 업무분장이 필요한것 같습니다.
잔업비 특근비 출장비가 너무 짭니다..."
1.9,세원물산(주),2016. 05,1점,"""회사의 크기와 수익성으로 비교했을때 업무프로세스가 소기업보다도 못함""","현대,기아자동차를 주고객으로 현대,기아자동차가 망하지않을 경우 회사가망하는일은 없음","전형적인 현대,기아자동차의 OEM회사로 발전가능성이
전무함, 극보수적분위기","퇴사율이 높은 이유를 생각해보고 고쳐나갔으면 좋겠음
직원들에게 모범이되는 행동을 하는 오너가 필요"
1.9,세원물산(주),2016. 05,3점,"""개인시간보다 금전적인 여유가 필요하면 좋은 곳!!""","1. 자동차부품 제조 1사차사로 오래 다닐 수 있다.
2. 제무구조가 튼튼하여 급여는 정확한 날에 지급함.
3. 회사 규모가(매출) 커지고 있음.
4. 연봉은 높음","1. 개인적인 여유시간이 부족함
2. 자기개발은 자는 시간을 줄여서
3. 복지는 그닥..","1. 회사 규모에 비해 내부 프로세스가 부족함
2. 부하 직원들 의견도 반영해주세요."
1.9,세원물산(주),2016. 05,2점,"""현대자동차 1차 협력업체 이지만, 내실이 불안전하고 고리타분함""",현대자동차 1차 이므로 연봉이 괜찮은 쪽에 속함. 회사 사내보유금이 많음,"업무강도가 매우 높으며, 주6일 근무함 부서마다 다르지만, 매일 회의로 일할 시간이 없어서 퇴근하고 일한다고 생각해야 함. 윗사람들이 프로그램을 다룰수가 없어 업무를 아래로 던지기 바쁨","팀장들이 무능력 하므로 사태파악 필요. 담당자 업무량이 많아 불필요한 회의를 줄이고, 회사 투자가 매우 미흡함"
1.9,세원물산(주),2016. 04,3점,"""대구 경북권에서 고연봉을 주는 손가락안에 드는 회사. 그러나 소통이 부족하고 사장이 직원에 대한 믿음이 부족하여 피곤하게 만드는 회사.""",현금 보유가 많아 망할 걱정없으며 고연봉으로 업무강도가 비록 쎄더라도 참고 견딜 힘이 생김.,업무강도가 심각함. 어느 자동차 1차사는 다 힘들지만 이곳은 사장이 직원을 신뢰를 못하므로써 간단한 업무도 복잡하게 처리함.,연봉을 다소 줄이더라도 직원수를 늘릴 필요가 있으며 직원을 신뢰하여 업무 처리 절차를 단순화 할 필요가 있습니다.
1.9,세원물산(주),2016. 02,3점,"""최소한 지금의 상태를 계속 유지해나가고 망하지는 가능성은 거의 없다고 생각함(한국 자동차업계가 망하지 않는한)""",동종 업계뿐만아니라 전체적으로 봐도 높은 연봉으로 모든걸 포기하고 자신이 하고자 한다면 정말 좋은 기업,결재제도가 좋지않고 여러가지 보여주기식의 문서가 많음. 이런 문서를 줄이면 일의 진행이 빨라질 것이라 생각함,복지에 조금 더 신경써주주면 정말 좋은 기업으로 거듭날수 있을듯 함
1.9,세원물산(주),2015. 12,2점,"""오너위주의 회사 운영과 직원들에 대한 복지는 없는회사이다 주말을 포기해야되고 생산관리 쪽은 매년 사람들이 왔다가는 곳이다""",자기가 열심히 한다면 뭐든지 할수 잇겠으나 이사진들부터 새로운 것에 대한 도전을 싫어함 회사에서 현장직원분들과 친해지면 많은것을 배울수 잇음,일단 프로젝트 관련해서 위에서는 책임을 아래로 전가하는 경향이 잇음 그래서 대리 사원 급들이 많이 퇴사함 과장급 부터는 사장님 퇴근전에 퇴근 할수없음(기본 오후12시-새벽2시)사이 엿음,"직원들에 대한 복지 마인드 결여가 심각함
생산부서는 토요일 심지어 일요일도 나와서 일해야괴는데 이사진은 코빼기도 안보이는데 다른가 생각하지말고 직원들에 대한 마인드부터 바뀌길"
1.9,세원물산(주),2015. 06,2점,"""보수적이고 보수적인 오너중심의 회사. 일과 삶의 밸런스 잡기가 힘든회사. 회사에 충성을 다할 마음이 있으면 성공가능성은 열려있음""","대구, 경북지역 업계대비 높은 연봉.
중국에 공장을 짓고있으며 1차 밴드 치고는 업계내에서 위치가 상승중","까탈스러운 오너, 기본사항인 야근, 수직적인 기업문화, 한달에 주3회정도 되는 주말출근. 한마디로 삶의 균형을 찾기는 쉽지않음","체계적인 업무분담이 이루어 졌으면 좋겟음.
아직까지는 일이 터지고 나서야 소잃고 외양간 고치는 식으로 무마하려는 경향이 강함. 주먹구구식 운영이 좀더 체계를 갖추어 져야 발전할 수 있을것"
1.9,세원물산(주),|,3점,"""경험 쌓고 업무강도 부분에서 적응만 한다면 좋은 기업입니다""","신입사원은 동종업계 최고 수준 연봉
안정적인 기업","근무강도 상(업무적응하면 하기나름에 따라 휴식가능
부서별 특징이 있지만 아무리 적응하고 노력해도 시간을 만들 수 없는 기간이 있음)
연봉에 비해 낮은 복지 수준(부서운영비, 출장경비, 유류비 등 지원은 받을 수 있으나 눈치를 보며 사용 신입의 경우 애사심이 생길 수가 없는 수준)","출장경비, 우류비와 같은 필수적인 복지만 개선되면 일하고 적응하기 좋은 기업"
1.9,세원물산(주),2015. 01,3점,"""급여는 대구 경북지역 최고수준.
아침 7시반 출근, 저녁 8시퇴근 생활 반복
한달 평균 3회 토요일 출근.""","대구 경북지역 임금 최고수준. 동종업계 타기업보다 많음.
퇴사율이 높은 기업의 특성상 입사후 실무를 하는데까지 시간소요가 적음.","Work & Life 밸런스 맞추기가 힘듬.
자동차 벤더 특성상 업무강도가 강한편이며 주5일제로 명시되어있으나 월 3회씩은 토요일 출근.
급여가 높은편이긴 하나 급여체계가 납득하기 힘든 구조로 만들어져있음.
잔업수당 시간 상관없이 1만원 등.",경영진의 역할이 무엇인지 다시한번 생각해 볼 필요가 있음.
날 괴롭힌 삭제된 댓글,세원물산(주),|,,,,,
날 괴롭힌 삭제된 댓글,세원물산(주),|,,,,,
날 괴롭힌 삭제된 댓글,세원물산(주),|,,,,,
2.5,썬텍(주),2022. 08,4점,"""일을 배우고 싶은 사람들에게 추천합니다. 자동차 세계의 일부가 되어 역동적인 산업을 직접 체험 가능하고, 실제 도움이 될 것입니다.""","제조업의 핵심 파악 가능하며, 해외에서 달러를 버는게 얼마나 힘든 일인지 알 수 있음. 자동차 산업의 다이내믹한 현장을 알 수 있고, 실제 일부가 되는 회사. 비록 중소 규모지만, 여기서 배운일을 실제 다른 직종에도 무한히 적용가능.","지난 10년간 큰폭의 변화가 없었음. 시도는 많았지만, 역시 글로벌 비즈니스가 쉬운것이 아님.","히터처럼 훌륭한 아이템 발굴이 가장 최적. 사람이 아닌, 제품이 영업하던 히터처럼 막강한 아이템 필요."
2.5,썬텍(주),2022. 08,1점,"""임직원이 미래를 구상할 수 없게 만드는 회사""","일이 없어서 워라벨 유지 가능
망할 일은 없어보이는 아이템","여자들이 다니면 좋은 회사라는 글들이 있는데
아니 여긴 여자들이 다니면 절대 안되는 회사다
다닐 시 2년다니고 바로 이직한다는 각오를 하고 다녀야함
돈 많이 주긴 싫으니 젊은 신입 여자애들로 다 뽑아 놓고 나선
결혼하거나 애가지면 이 회사는 다닐 수 없다는 암묵적인 현실을 계속 여러방식으로 표출함 실제로 회사에 자녀가 있는 여자 직원은 아무도 없고 기혼도 거의 없다 비출산 할 사람만 다닐 수 있음
즉 여성은 이 회사를 다니면서 미래를 구상할 수 없음
하지만 연봉이 짜서 여초회사인 현실
모든 직원들이 2년 3년 다니고 도망가야지 하는 생각을 갖고 일하고 있는데 회사에 미래가 있을까? 일이 제대로 돌아갈까? 싶음
실제로 사람이 너무 자주 바뀌어서 업무 히스토리를 알고 있는 사람 없음 프로젝트 기간이 7년씩 되는 자동차 부품회사에서 이게 얼마나 치명적인 문제점인지 정말 모른단말임?..
사람을 갈아 치워댈거면 전산이라도 잘되어 있어야되는데 ERP는 그냥 폼이다 실 재고와 맞지도 않음 그게 다 돈인데 실제로 얼마나 자산이 있는지도 모르는거 아님?
경영진은 이걸 알면서도 모르는척 하는건지 아님 정말 모르는건지 모르겠음",정말 이 문제점들을 모르시나요? 사람에도 전산에도 기댈 수 없는 총체적 난국
2.5,썬텍(주),2022. 08,2점,"""매출액 양호하고 월급 잘나오고 워라벨이 보장되고 여자들이 다니기 좋은 회사""",연차가 자유롭고 중식이 제공되고 석식도 필요시 사먹고 청구하면 잘 처리해줌,능력보단 윗사람에게 잘보이는 사람이 승진을 빨리하고 급여인상도 좋음 이해안되는 업무와 일처리가 있음,객관적이고 정확한 인사평가가 필요하고 아부하는 사람과 듣기 싫은소리지만 진짜로 필요한 얘기를 하는 사람을 구분하십시오.
2.5,썬텍(주),2022. 07,3점,"""첫직장으로 업무를 익히는데는 적당한 기업이다. 그 이상 가기엔 시간 아까움""","연차 눈치 없음, 개인적으로 터치 별로 없고 자유로운 분위기, 복장 자유로움, 야근 거의 없음","업무분장이 제대로 이루어지지 않으며 주먹구구식으로 일을 함
개인별로 업체 맡아서 일을 하기 때문에 실수해도 조용히 넘어가면 아무도 모름, 그걸 알아채는 사람이 많지않음
2000년대식으로 일을함 (수기로 업무를 많이함)
퇴사를 많이해서 중간관리자들이 없어 전부 사원들끼리 일함",직원들이 의견제시를 할때 받아들이는 태도를 보였으면 좋겠습니다.
2.5,썬텍(주),2022. 06,2점,"""생각없이 다니면 좋은 회사. 발전은 없음""","칼출근, 칼퇴근 가능.
개인적인 분위기. 회식 거의 없음.","복지가 전혀 없는 것에 가깝고, 월급이 매우 적음.
서로 일 떠넘기려하는 분위기.",월급인상과 복리후생에 많은 신경을 써야할 것 같다.
2.5,썬텍(주),2022. 08,4점,"""일을 배우고 싶은 사람들에게 추천합니다. 자동차 세계의 일부가 되어 역동적인 산업을 직접 체험 가능하고, 실제 도움이 될 것입니다.""","제조업의 핵심 파악 가능하며, 해외에서 달러를 버는게 얼마나 힘든 일인지 알 수 있음. 자동차 산업의 다이내믹한 현장을 알 수 있고, 실제 일부가 되는 회사. 비록 중소 규모지만, 여기서 배운일을 실제 다른 직종에도 무한히 적용가능.","지난 10년간 큰폭의 변화가 없었음. 시도는 많았지만, 역시 글로벌 비즈니스가 쉬운것이 아님.","히터처럼 훌륭한 아이템 발굴이 가장 최적. 사람이 아닌, 제품이 영업하던 히터처럼 막강한 아이템 필요."
2.5,썬텍(주),2022. 08,1점,"""임직원이 미래를 구상할 수 없게 만드는 회사""","일이 없어서 워라벨 유지 가능
망할 일은 없어보이는 아이템","여자들이 다니면 좋은 회사라는 글들이 있는데
아니 여긴 여자들이 다니면 절대 안되는 회사다
다닐 시 2년다니고 바로 이직한다는 각오를 하고 다녀야함
돈 많이 주긴 싫으니 젊은 신입 여자애들로 다 뽑아 놓고 나선
결혼하거나 애가지면 이 회사는 다닐 수 없다는 암묵적인 현실을 계속 여러방식으로 표출함 실제로 회사에 자녀가 있는 여자 직원은 아무도 없고 기혼도 거의 없다 비출산 할 사람만 다닐 수 있음
즉 여성은 이 회사를 다니면서 미래를 구상할 수 없음
하지만 연봉이 짜서 여초회사인 현실
모든 직원들이 2년 3년 다니고 도망가야지 하는 생각을 갖고 일하고 있는데 회사에 미래가 있을까? 일이 제대로 돌아갈까? 싶음
실제로 사람이 너무 자주 바뀌어서 업무 히스토리를 알고 있는 사람 없음 프로젝트 기간이 7년씩 되는 자동차 부품회사에서 이게 얼마나 치명적인 문제점인지 정말 모른단말임?..
사람을 갈아 치워댈거면 전산이라도 잘되어 있어야되는데 ERP는 그냥 폼이다 실 재고와 맞지도 않음 그게 다 돈인데 실제로 얼마나 자산이 있는지도 모르는거 아님?
경영진은 이걸 알면서도 모르는척 하는건지 아님 정말 모르는건지 모르겠음",정말 이 문제점들을 모르시나요? 사람에도 전산에도 기댈 수 없는 총체적 난국
