총점,회사,날짜,별점,요약,장점,단점,경영진에게
2.5,유니슨(주),2018. 03,2점,"""풍력발전이라 향후 미래 장담할 수 없어...""","크게 별다른 제약없고 교육이많아 새로 배울 기회가 많아요 퇵,나도 출장 빼면 빨리 하는편",역시 미래에대한 불안 장기 근속여부.. 출장지가 본사기준으로 멀다.. 엄청,풍력발전인만큼 발전은 어렵지만 개척한다면 국내에서 성공할 기업이라 생각해요
2.5,유니슨(주),2018. 01,2점,"""어려운 일은 없으나 발전가능성에는 한계가있을 수 있음. 부서에 따라 다름""",퇴근 눈치 안보며 직원들간의 분위기는 대체적으로 좋은편임.,직원들의 고충을 안듣는것같음. 전형적인 꼰대의 마인드가 자리 잡고있음. 일잘하면 힘들기만함,직원들의 말을 좀 들어줬으면 함. 듣기만 하고 개선방안은 안 찾는거같음.
2.5,유니슨(주),2017. 08,3점,"""전공 외 다양한 경험을 할 수 있어 개인 능력향상에 도움이 되므로 전공에 대한 지식이 어느정도 갖춘사람이라면 폭넓은 경험이 가능함""","담당업무를 원할하게 수행할 수 있으면 정시퇴근에 대한 자유가 있음(눈치는 보임)
4대보험, 퇴직금별도, 자녀 학비지원","신입에 대한 교육이 확립되어 있지 않음
업무에 대한 강도가 높아 야근이 당연시됨(업무에 따라 다름)",효율적인 업무가 될 수 있도록 업무 시 딱딱한 수직관계를 수평적인 관계가 될 수 있도록 개선이 필요함
2.5,유니슨(주),2017. 03,4점,"""직원들이 책임 미루기 이런것이 없으며 사람들이 좋은 회사
신재생 에너지로 아주 미래전망적인 사업이다
하지만 계약이 잘 되지 않으면 월급등 걱정하는 회사""",사람들이 서로를 위하며 윗사람을 공경하게 할 수 있는 회사,"너무 윗사람이 보수적이며 눈치를 많이 보게 되는 회사
주말 특근비를 받지 않고 출근을 강요함",밑의 사원들은 잘 대우해주며 적당한 권리를 준다면 좋은 회사가 될것이라 믿습니다
2.5,유니슨(주),2016. 12,3점,"""신재생에너지 풍력발전 분야 국내 선두기업! 기술력이 뛰어나다.
하지만 자금사정으로 수주에 난항을 수년째 겪고 있는 안타까운 기업""",기숙사가 제공되고 승진의 기회가 열려있는 편이다. 신재생에너지 풍력발전 분야로서 성장 가능성이 있다.,"인적자원관리가 다소 부족하다. 교육투자비용이 현저하게 낮은것 같다.
지식경영이 미흡하다. 부서에 따라 강압적인 업무 분위기가 존재한다.",내부고객인 직원관리에 좀 더 관심을 가지면 좋겠다.
2.5,유니슨(주),2016. 12,1점,"""부서별 편차가 심하며 메리트도 부서별로 편차가 심한회사임 경력쌓기도 애매함. 월급은 걍 입에풀칠 할정도 회사""",사천 본사의 경우 기숙사가 무료로 제공되며 사내식당 3끼가 모두 무료,"위의 장점빼곤 전부 단점인 회사.
인사이동 이리저리 노예처럼 부려먹고 회사가어렵다고 직원들에게희생만 강요.
부서별로 사내분위기가 극명하게 다름 같은회사라고 믿기힘든정도
부서별로 업무강도도 극명하게 다름 놀고먹는 부서가 있나하면 매일야근에 주말출근하는 부서도 있음","바라는게없음 어차피 안바뀜
소통하는척은 하지만 사실은 눈과 귀를 닫고 있음"
2.5,유니슨(주),2016. 11,2점,"""풍력발전 분야에 대해 배우고 경험할수 있으나 위치나 복지가 아쉬움""","1인1실 사내 기숙사가 있어 3분이면 출근 가능
사내식당에서 아침 점심 저녁 제공","시내까지 택시비 편도 8000원 거리로 위치가 너무 외진곳에 있음
부서에 따라서 야근, 주말근무 편차가 있음",경영진의 방침이 자주 바뀌고 지나치게 수직적 분위기
2.5,유니슨(주),2016. 08,2점,"""소통이라곤 찾아보기 힘든 회사임. 그러나 경력을 쌓기에는 적당함. 매년 연구직 인원중 많은 연구인력들이 다른 회사로 옮길 정도로 이직율 높음.""","대기업처럼 풍력발전 완성품을 만들기 때문에, 배우는게 좀 잇음. 기계요소부품에 대해서 전문적으로 하려 하지만 잘 안되지만 그래도 노력하는 모습이 있는 회사.",소통이란 것은 찾을수 없음. 인력에 대해 귀중히 생각 안함.,밑에 사람에게 심하게 하는 수석급 몇명은 잘라야 함. 그게 유니슨이 발전하는 길임.
2.5,유니슨(주),2016. 06,2점,"""풍력발전 분야에서 일할수 있는 경험이 되지만 연봉 인상률이나 회사 위치로 볼때 주변에 살지 않으면 비추천""",기숙사 시설이1인 1실 로 잘되어 있다 잔업같은 경우 그렇게 심하게 강요하지 않는다,생산직의 경우 신입들이 많이들어오지만 많이 그만두고 시급도 하는일에 비해 적다,업무분배가 효율적이지 못하고 딱히 정해진 파트가 없다.
2.5,유니슨(주),2016. 05,2점,"""풍력발전단지개발 선두기업! 최근 실적부진으로 어려움을 격고있음""",국내풍력발전단지를 개발한 선두기업으로 풍력 에너지 개발에 대해 많이 배울수 있으며 미래에너지 개발에 있어 전망이 좋은 회사이다.,최근 실적 부진으로 회사의 내부 경영이 어려운상태! 출장과 현장 근무후 사용한 비용을 청구하면 제때 비용을 받은 적이 없음. 대부분 3~4개월 후 수령,풍력에너지에 대한 직원들 교육에 많은 투자를 했으면 합니다.
2.5,유니슨(주),2016. 03,1점,"""임원들이 하고싶은대로 막하는회사 세력싸움 심하고 줄타기 심함""",일이 너무 몰리는 경향이 강함 일이 한참 없다가 한참몰리고 너무 들쑥날쑥하는 회사,일이없어서 위에서 엄청눈치줌 근태관리 엄청 깐깐하고 완전 군대식 마인드가 넘처흐름 주머니에 손넣는고 걷는것도 뭐라하고 8시출근인데 7시 30분까지 오라고 난리침,직원들 못살게 구는 꼰대같은 마인드가 없어져야함
2.5,유니슨(주),2016. 02,3점,"""국산 풍력기업중 국내에 생산제조 r&d 유지관리 시스템을 갖추고 있는 기업""",대전에 연구소와 유지관리팀이 있어 출장이 잦음에도 지역적으로 유리함,부서간의 업무분담이 애매할때가 많으며 일하는사람에게만 일이 집중적으로 부과됨,기존의 남아있는 특정실무진에게만 현장업무를 부과하지말고 관리자급에서 적절히 분배하여 실질적인 업무의 효율을 얻기를 바람
2.5,유니슨(주),2015. 12,3점,"""풍력발전기제작업체로써많은기대가컸지만예상보다는발전하지못함""","풍력발전이라는특수성,기숙사1인1실,공기좋은지역에회사가위치함","보수적인분위기,기숙사에서사무실까지걸어서3분,뛰면1분도안걸림",직원교육에많은투자가있었으면함.지나친수직적분우니기보다는수평적분위기였으면~~~
2.5,유니슨(주),2015. 11,3점,"""주주가도시바산업은행이라서안정적임 그러나고정적인매출처가없음""",풍력이라는아이템이좋으며 국내에서는경쟁력이있음 근무강도약함 급여보통,보수적이며 풍력에대한수요가없어매출이저조함 나태한분위기와 경쟁없는사내분위기,"분위기전환이필요하고 직원들에게동기부여가필요한듯
조금만변화한다면경쟁력있는회사라고생각됨"
2.5,유니슨(주),2015. 09,1점,"""풍력발전기 제조업체로 년간 수주가 미비하고 도시바가 최대주주지만 수주가 안되고 있음""",공장이 바닷가 근처에 있고 멀리산이 보이며 건물이 오래되지 않았음,"연봉수준이 낮고 일을 많이 시키고 이직이 잦으며, 기술축적이 안되고 있다 또한 특근비가 없고 야근이 잦으며 하계휴가는 연차로 대체함",인력관리가 절실히 필요하고 연구소와 생산공장의 유기적인 관계가 필요함
2.5,유니슨(주),2015. 08,2점,"""미래가 불안한 회사입니다. 풍력발전이 성장하면 같이 빛을 보겠죠?""","회사 밥이 맛있고, 회사 땅이 커서 일할때 자부심이 느껴져요",미래가 불투명하고 군대문화가 심하다. 연봉은 낮은데 일은 진짜 많이 시킨다.,확실한 경영 해주세요. 풍력발전 외에도 다른 사업영역을 확보해주세요
2.5,유니슨(주),2015. 08,2점,"""풍력에서의 미래를 생각하면 가능성이 있어보이지만, 아직 많이 미흡합니다.""","모든 일을 스스로 수행하고, 많은 공부를 할 수 있는 기회입니다. 만약 자기 자신이 스스로 할 능력이 되면 윗사람의 터치 없이 능력을 마음껏 발휘 할 수 있습니다.",장점의 반대로 기존의 사람들의 많은 퇴직 및 기술 개척 초기 단계로서 많은 기술과 지식 전달이 제대로 이루어지지 않습니다. 그런 점에서 많은 업무에 어려움이 있습니다.,"회사가 어려움은 것은 알고 있지만, 사람이 자산이라는 것을 명심하고 경영에 신경써주세요."
2.5,유니슨(주),경남,3점,"""기술개발 및 좀 더 혁신적이고 창의적인 기업이 되었으면.....
좀 체계가 부실한 기업같음.""","부서마다 다르겠지만, 업무강도가 나름 편함.
독점 분야 및 신재생분야에서 두각을 나타냄.","체계가 좀 부실한거 같으며, 주식에만 신경 많이 쓴다는 느낌을 받는 분들이 있음.","기술에 중점을 두고, 좀 더 혁신적인 기업이 되었으면 합니다."
2.5,유니슨(주),2015. 04,4점,"""도시바인수 후 발전가능성이 보임, 그러나 도시바 투자가 생각보다 적음""","낮은 근무 강도, 체계적인 제도, 도시바 자회사, 풍력이라는 희소성있는 아이템, 자유로운근무","낮은급여, 사천이라는 지리적특성, 의욕상실 분위기",단합되는 분위기를 만드는데 노력을해야할듯
2.5,유니슨(주),2015. 01,1점,"""생산직과 사무직의 근무환경은 매우 다릅니다.""",업무강도가 낮습니다. 다른 스트레스가 있지만..,"정체된 마인드, 고정관념, 직원간의 낮은 신뢰와 협력.",연구에 투자하시는 게 회사에 보탬이 될 것 같습니다만 확고한 지침이 없다는 것도 아쉬웠네요.
2.9,유테크,2022. 05,3점,"""좋은 면도 가지고 있으나 좋지 않은면도 가지고 있음 발진하기는 어려울거 같다.""","연차를 눈치 보지 않고 자유롭게 사용 가능함, 구내식당있음",단순 보고를 위해 필요한 문서 작업이 많아 보여주기식 업무를 처리함,신규 사업 아이템을 확보하여 경영의 어려움을 해쳐나가야하는게 한쪽만 바라보고있음
2.9,유테크,2022. 03,5점,"""자동차부품 생산업체이며, 장기근속자가 유달리 많은 회사입니다.""","생산성압박이 없으며 눈치볼 필요없이 휴가나 퇴근이 자유로운편이며, 대표님과 직원들간의 자유로운 커뮤니케이션 및 작업환경. 가족같은 분위기가 가장 큰 장점임",자체 연구개발품이 많이 없다는것과 소음이 조금 심한편임,지금처럼만 직원들 생각하는 마음이 변하지 않았으면 좋겠습니다.
2.9,유테크,2021. 08,2점,"""경영진들이 바뀌면서 기업사냥꾼들이 판치고 있는 회사입니다. 상장회사지만 거래정지가 되면서 어려운 상황입니다.""",상장폐지가 안된다면 새로운 먹거리에 대한 경영진들의 노력이 있을 것입니다. 거기에서 새로운 기회가 있을 수 있습니다.,상장폐지가 된다면 회사 내부적으로 투자가 힘들것으로 보이고 앞으로 미래 먹거리에 대한 지원이 없을 것으로 예상됩니다.,상장유지를 최우선 과제로 삼아 직원들의 고용을 유지시켜주시길 바라겠습니다.
2.9,유테크,2021. 05,5점,"""좋아요 중소든 중견이든 본인이 받는 페이도 페이지만
사람이 제일 중요합니다 마음 고생보다 육체 고생이 나아요""",텃세가 없어요 다들 아버님 뻘이신데 잘 해주십니다. ㅎㅎ,"젊은 사람이 많이 없어서 조금 외로운거?
이직 생각은 아직까진 없어요","앞으로도 이대로만 잘 부탁드려요
감사드리구요 더 열심히할게요"
2.9,유테크,2020. 02,1점,"""개발자가 대우을 받지못하고 야근수당을 받지못하는곳""","점심식대가 자유로운편, 회의중에 흡연이가능한점
설계자가 세금계산서부터 영업까지 다양한일을 혼자 할수있어서 배울것이 있다.","퇴근시간이 정확하지않음 야근수당이 없음. 대표에게 일일히 보고
직접설계안함.",매일 야근을하는데 야근수당과 저녁은 주었으면 좋겠다.
2.9,유테크,2019. 10,2점,"""일을 열심히 하면 대우받을 수 있음. 연봉협상은 제대로 안되지만 가족같은 분위기""",회사 분위기가 엄격하지 않음. 복장도 자유고 누구하나 기분나쁘게 토다는 경우가 없음. 사람들이 좋음.,퇴근시간이 정해지지 않음. 그날 부여받은 일을 무조건 다 해놓고 가는게 맘이 편함. 일이 제대로 되있지 않으면 스트레스를 많이 받을거임.,직원들에게 조금더 관심을 가져주었으면 함. 유능한 직원들이 퇴사하는 경우가 많음. 열심히 일하면 그만큼의 보상이 필요하다고 생각함.
2.9,유테크,2019. 10,2점,"""제조와 관리부서의 기싸움이 너무 격하다.""","그때 당시 중소기업 수준에서 크지도 작지도않은 딱 중간 정도의 연봉.(지금은 알수없음.), 점심 회사에서 지원해줌.(구내식당)",제조와 관리부서의 기싸움이 너무 심해서 사원급에서 박이터진다. 매일 계속되는 야근 야근 야근... 술강요...심지어 주말출근까지...,그만둬서 이제 바랄것이 없습니다. 그만둬서 이제 바랄것이 없습니다.
2.9,유테크,2017. 08,3점,"""상장기업이며 서로 협력하며 파트별 단합이 잘되있음""",환경적으로 매우 일하기 좋으며 방진복 착용하고 날씨영향 안받음,불필요한 잔업과 관리직의 힘든 업무에 적응해야함 윗선과의 대인관계가 필요,직원들의 복지에 더 신경 써야하며 윗선에서 연봉및 정책 에 신경써야함
2.9,유테크,2017. 08,5점,"""제조회사에서 많은걸 배웠고 깨끗한시설에서 생활할 수 있는 기업""",체계가 잡히지 않은터라 직급 높으신분들과 함께 어울릴수 있으며 줄만 잘타면 진급도 탄탄대로 연봉도 협상 가능,야근이 심함 단순업무지만 날샐수도 잇는 강요없는 야근,체계적인 업무 시스템과 야근을 최소화 하며 일에 능률을 향상해야 될 필요성이 있음
2.9,유테크,2016. 04,1점,"""권위적인 상급자들과 군대식 사내문화. 낮은 연봉과 잦은 야근""",신입으로 들어간다면 기초적인 것부터 세세하게 일을 배워나갈 수 있음,"낮은 연봉, 잦은 야근과 토요일 출근, 심부름 및 잡업무","근무시간을 줄이던가, 연봉을 올리던가, 사내분위기를 바꾸던가 대대적인 개편 없이는 나아가지 못할 회사"
2.3,자연과환경(주),2022. 08,2점,"""함께 일하는 직원분들은 좋으나 제일 윗선으로 인해 분노하거나 당황하는 경우가 빈번함""",함께 일하시는 직원분들이 모두 좋으신 분들이셔서 사람때문에 그만둘 일은 없다.,회사가 만들어진지 얼마 되지 않아 체계가 잘 잡혀 있지 않다.,체계를 획일화해서 보다 나은 회사를 만들기를 진심으로 기원합니다.
2.3,자연과환경(주),2022. 01,1점,"""늙은기업, 변화하지 않는 기업, 추락하는 기업, 성장하지 않는 기업, 평탄한 기업, 코스피 상장 왜 되어있는지 모를정도인 기업입니다.""","커피머신 있고, 사무실 넓음 ,칼퇴 가능하며 일 안해도 열심히 하는척 하면 되는 그런 기업. 성장 하고 싶지 않고 평탄하게 다니고 싶다면 다녀도 됩니다.","연봉 너무 짜고, 나이든 사람이 너무 많아서 일이 젊은사람들에게 몰림. 근데 돈은 얼마 안줌.",바뀌고싶으면 당신들 부터 바뀌었으면.....
2.3,자연과환경(주),2022. 01,4점,"""솔직히 이 정도면 개꿀. 업무량도 적당하고 무엇보다 사내 분위기가 화기애애함.""","꼰대 문화 없음. 탕비실이 항상 풍족함. 야근을 강요하거나 휴가를 눈치 주는 일이 없어서 편함. 과중 업무에 대한 팀장님의 배려가 좋음. 건물 부대시설이 잘 되어있어서 대부분의 생활을 편하게 할 수 있음. 12층에 있는데, 고층 엘베가 11층부터 시작해서 개꿀.","식대가 급여에 포함이라 점심을 사서 먹는데, 건물 식당이 너무 비쌈. (한 끼 먹는데 최소 8000에서 10000원 이상 쓸 각오하고 내려가야 됨) 특성상 여러 지역에 공장이 있어서 간헐적으로 출장이 발생함. (자주 있는 일은 아니지만 발생 시 포상 휴가 지급)","사무실도 깔끔하고 근무 환경도 좋지만, 업무 특성상 (사무) 고사양의 컴퓨터가 필요합니다.. 지원해 주세요^^"
2.3,자연과환경(주),2022. 01,1점,"""직원은 소모품이며, 대표이사는 종일 주식만 하고, 회사운영에는 관심없음,
21년 콘크리트 PC 시장이 활성화되어 매출이 상승했으나, 물류, 철근, 레미콘 값이 더 상승해서 최대 적자 예정""","사무실은 좋음, 지하철에서 도보 15분, 퇴근은 잘시킴, 공장이 여러개임, 매출채권이나 부채로 소송 많음(전담 변호사 있음)","대표와 사장은 하루종일 주식(주식장 끝날때까지 업무보고 못함)
직원들 급여인상을 담보로 프로젝트업무를 떠넘김
임원이 직원보다 많음, 대표 밑에 사장만 3명, 각종 비리 다수
월요일 전직원 주간회의 때 (교회)예배함(대표가 기독교), 직원들 교회데려감
대표 누나가 국힘당 정치인, 촛불집회때 직원들 동원됨
적자 회산데 코스닥 유상증자로 먹고삼","일좀 하자~ 주식이랑 술만 퍼먹지말고, 기업사냥 그만하자."
2.3,자연과환경(주),2021. 12,3점,"""보람차게 일할 수 있으며 만족스럽습니다!!!!!!!""",일을 자랑스럽게 할 수 있씁니다!!!!!!!!!!!!!!,일이 조금 복잡하고 힘이 듭니다!!!!!!!!!!!!!!,발전과 미래를 위해 힘써주십시오!!!!!!!!!!!!!!
2.3,자연과환경(주),2021. 11,4점,"""직무에 따라 다르겠지만 업종은 비전이 있음.""","일이 깔끔하고 복지가 좋다.
연차를 눈치보지않고 쓸수있다.
출퇴근하기 편하다(지방공장은 어려울듯)","연봉이 적다
일을 찾아서 해야함
단점이라고 하긴 뭐하지만 끊임없이 공부해야함.","영업이익좀 내서 성과급좀 받고싶다.
사원수대비 매출액은 높은데 참 요상한 일이다."
2.3,자연과환경(주),2021. 10,4점,"""업무 강도가 높지 않고 마음 편하게 다닐 수 있는 회사""","눈치보지 않고 연차를 쓸 수 있다
입사 후 야근이 단 한번도 없었음 (9시 출근 6시 칼퇴)
회사 생활에서 가장 중요한게 사람인데, 인간관계로 인해 스트레스 받은 적도 없음
건물이 좋고 주변에 맛집이 많음
캐주얼한 복장으로 편하게 다닐 수 있음","회사가 스타트업만큼의 자유로운 분위기는 아니라서 요즘 문화를 추구한다면 안맞을 수 있음. 개인적으로, 직원분들 연령대가 높은 거에 비해서 답답한 구조는 아니라고 생각함.","중간 관리자의 필요성이 느껴집니다. 어느 회사나 그렇겠지만, 일 잘하고 능력있는 사람이 일을 도맡아서 하는 경향이 있는 것 같아요."
2.3,자연과환경(주),2021. 06,4점,"""열심히 하면 기회가 많은 곳. 열심히 안하면 쉬어갈수 있는 직장.""","회사 시스템 상 알아서 해야 하는 분위기, 그만큼 일 찾아서 하면 승진도 빠르고 기회도 많은 편. 인사고과도 개인적인 생각으론 나름 정확하게 돌아감. 일하고 싶을때 일하고 쉬고 싶을때, 쉴 수 있는편. 승진 포기한 사람들은 편하게 일하는 곳.",자기월급은 자기가 만들어야 하는 곳. 그리고 업무는 크게 터치는 안하는 편인데 그게 불편한 사람들이 있더라 자기가 스스로 일 못하는 사람이면 여기서 잉여될 확률 많음 자기를 위해 남을 위해 그런사람은 나가주는게 좋을 듯.,"중간관리자가 더 필요한 듯, 경영진 방침이 잘 전달되고 실행되지 않는거 같음. 중간관리자만 잡아도 좋아질거 같은데 아쉽"
2.3,자연과환경(주),2021. 05,2점,"""야근은 없으나, 급여가 너무 적음. 세사람 위주로 돌아가는 회사.""","야근이 없음.
그냥저냥 일만 하면 안잘림.
회식도 팀끼리만 하지 거의 없다고봄.
직원들은 착한사람들 있음.","굉장하게 미치도록 보수적인 회사임.
직원들을 위해 해주는게 없고,
자기들을 위해 열심히 해주실 바램.","본인들에게는 엄청나게 관대하며,
직원들에게는 불만이 엄청많음.
그나저나 직원들 나가는데는 이유가 있을텐데...
그걸 모르는것같음."
2.3,자연과환경(주),2021. 04,3점,"""각자 일에 너무 신경을 안씀 좋은 점도 있지만 알아서 일을 찾아서 해야하는것도 있음""",연차를 눈치 안보고 쓸 수 있음 나쁜 사람들은 없음 각자 할 일만 하면 돼서 편하긴 함,일을 찾아서 해야함 식대를 주긴 하는데 10만원이라 너무 적음,업무 좀 그만 떠넘겼으면 좋겠습니다. 식대도 안나오고 월급도 적어요.
2.3,자연과환경(주),2020. 12,1점,"""고인물들 너무많고 복지없음 공고사이트에 점심밥제공이라 되어있는데 구라임.""",장점 찾기 힘듦 굳이찾자면 회사건물예쁨 주변에 먹을곳 많음,입사해 보면 중간직급이나 밑에 직급이없고 다 최소대리이상이다 그만큼 고인물 많고 신입이없음(보수적느낌임) 복지도 없고 매월1일마다 아침 조회로 찬송가부르고 기도드림 강요는 아니라하지만 전직원 다 참여(반강제) 공고사이트에 점심밥 무료제공이라고 되어있는데 임원들이 사비로 사주는거아니면 알아서해결해야됌 지하철출퇴근하기 힘듦,매월1일마다 조회랍시고 하는 기도 없애주세요 점심밥제공한다는 공고내용 삭제해주세요
2.3,자연과환경(주),2020. 12,1점,"""고인물 잔치로 오랜 사람들의 그들만의 리그.우물안 개구리들 천지""","상장사 간판
그밖에는 생각나는게 없음
서울에서 근무하면 주변환경은 좋음","고인물들이 사장 옆에 붙어 생명연장 중임
능력은 없는데 자존심이 쎈 직원들 많음","바란다고 바뀔 고인물이 아니다
제발 영업이익 좀 내서 인센티브좀 받게해주소"
2.3,자연과환경(주),2020. 03,2점,"""고인물의 회사, 밑의 직원은 계속 바뀌며 개선의 의지가 없어보임""",본인의 업무 충실하게 하면 가늘고 길게 가기 좋습니다.,"오래다닌 사람들만의 회사, 새로들어간 직원들 인수인계가 잘 안되어 업무배우기 힘들었던 점이 아쉬움,종교가 있는 회사라 주중에 예배가 있었음","업무가 체계적으로 분할되어야 할 듯, 회사 회식문화가 변화해가는 현재에 따라가질 못함(건강한 회식문화가 정착되어야할 듯)"
2.3,자연과환경(주),2019. 07,1점,"""업무 강도가 쉬운 대신 대인관계 스트레스가 반비례하는 기업.""",임원진과 같이 식사할 경우 점심 지원. 특별한 일이 없고 상사가 퇴근한다면 제 때 퇴근 가능. 파티션 있음.,"특정인에게 업무가 몰려 업무량이 많은 사람은 지나치게 많고, 없는 사람은 지나치게 없음. 업무 외적인 간섭이 많음. 성비 차이가 심함. 회의날 30분 일찍 출근해야 함. 야근 수당 없음. 기본급에 식대 포함.",공사 구분이 필요함. 업무량 분배와 아래 직급의 의견을 받아들여줄 필요가 있음. 인식 개선 시급.
