총점,회사,날짜,별점,요약,장점,단점,경영진에게
3.0,디아이디(주),2022. 08,3점,"""경영이 많이 아쉬웠던곳. 지금 생각해보면 이만한곳도 없었음.""",위험한 약품을 다루지않아 안전했고 일도 어렵지 않았었음. 클린룸이라 온도가 쾌적했다. 기숙사가 신축 풀옵션 원룸이었고 기숙사만 가는 통근버스가 있어서 출퇴근이 편했음. 상여 600이었고 명절 상여외에 전직원 선물도 챙겨줬음. 야간때 음악도 틀어줬음.,라인에서 라인장들이 소리를 많이 질렀다. 귀아팠다. 밥이 무척 맛이 없었다. 치커리..치커리..치커리..재직 당시 치커리가 자주 나왔어서 난 아직도 치커리를 안먹는다.,큰 회사도 이런식으로 경영하면 망할수있다는걸 몸소 실천하셨는데 다음부턴 그러지마시길
3.0,디아이디(주),2021. 09,4점,"""첫 직장이었습니다. 다닐땐 몰랐지만 퇴사하고나서야 괜찮은 직장 이었다고 생각되네요""","나름 체계잡힌 회사. 기숙사, 어린이집, 식당을 갖춘회사","독자적인 기술, 아이템이 없음...............",이젠 없어져서........................
3.0,디아이디(주),2021. 02,3점,"""그냥저냥 천안에서 다닐만한곳이였다
어린나이라 버틸수있었다""","어린나이에 골수까지 빨릴정도로 일이 많고
많은걸 배울수 있는게 장점
밥이 맛있다","엄청 힘들다 진짜로 쉬는시간도 적고 딱 일한만큼 돈준다
어려서 버틸수있었다","바라는건 쉬는시간좀 늘렸으면 좋겠고
이제는 바랄수가 없다"
3.0,디아이디(주),2021. 01,3점,"""잠깐 근무했을때 좋은 회사였던 것으로 기억합니다.""","1.일 마치면 상사 눈치없이 바로 퇴근했습니다.
2.오래 있진 않았지만, 사람들이 좋았습니다.
3.밥도 잘 나오고 전반적으로 괜찮았습니다.","1.저 다녔을때 회사 분위기가 그리 좋진 않았는데, 아마 회사사정이 어려웠을 것으로 판단됩니다.
2.가끔가다 고집센 상사들이 있었습니다.","이미 없어진 회사여서 바라는건 없지만, 그래도 잠깐 다녔을때 전반적으로 좋은 회사였던 것 같네요"
3.0,디아이디(주),2020. 10,3점,"""지금은 없어졌지만 나름 다닐만했던회사 처음이였던 시기라 나름 만족하고다님""",그 당시 식사 잘나오고 일도 그렇게 힘들진않음 기숙사도 사외줘서 편했음,쉬는날이 2주에 한번이고 뒷이야기가 사원끼리 돌고돔 이게 멘탈유지가 안됨,다시 생긴다면 다시 경험해 보고 싶은회사임 난 다시가서 해보고싶음
3.0,디아이디(주),2020. 08,2점,"""그냥 공장에 대한 추억 쌓기 좋았던곳.. ...... 그냥 애들 수련회 같은곳?""","고3때 취업으로 나갔는데 다 또래이고 갓 취업 하는애들이 많아서 다들 친해지기 좋았음
사외기숙사 사내기숙사 다있음 ,, 여자 사내기숙사였는데 화장실이랑 샤워실 공용이였다 그치만 재밌었음 각지역에서 모여서 사투리 쓰는애들도 많고 신기했음
일 잘하면 싸이 콘서트 티켓 줬다 난 받진 못했지만 흑","액정 테두리에 스티커 같은거 붙였는데 중국인들 손 엄청 빠름 중국인이 500개 붙일때 한국인 300개 붙임 수량도 하나할때마다 눌러서 셈....... 못하면 반장이 삭 소리지르고 비교하면서 뭐라함... 여잔데 개무서웠다 진짜..... 다들 친해지면 좋은 사람들 이였음 반장도 맨날 화내다가 가끔 웃으시던데 소름이시더라 ..
일이 개바빠서 한달에 일요일 딱 한번꼴로 쉼ㅋㅋㅋㅋㅋ일요일도 맨날 일했던듯 이때는 이렇게 풀근무 교대 해도 220-240 정도 받았음",망해가지고 다 짤린걸로암 ㅠㅜ아쉽......... 그치만 너무 힘들었음
3.0,디아이디(주),2020. 07,4점,"""20살때 가서 처음공장일해봤는데 나름 추억도많고 재밌었음""","내가4조3교대 였나? 무튼 밤에 생산일하면 노래도 틀어줬음
그리구 밥이 진짜 맛있음,,뷔페식이라고해야하나 밥이 두종류
골라먹는건데 진짜 여기 밥은 아직도 생각남 ㅠㅠ기숙사도
두정동에 원룸이었는데 신축에다가 1층엔 편의점까지,,완벽 했음
회사에 매점도있던걸로 기억함","나는 흡연자였는데 어느순간 금연의 날이라는게 생김
그땐 담배도 못폈음 ;;; 그리고
나는 더 다니고싶었는데 어느순간부터 라인정지되고
쉬라고 그러다가 그이후로 공장 문 닫았음
그리고 라인장 이라는사람 일하는내내 겁내 소리지름ㅋㅋ아직도생각나네","다시 열면 다시 일하고싶은곳임
다시 안여나?????????"
3.0,디아이디(주),2020. 07,5점,"""어린사람들이 많았지만 일하기에는 참 좋은 회사였습니다. 다시 입사핦수 있다면 하고싶습니다.""",제가 재직당시에는 고등학교 졸업하고 오는 학생들이 많아서 그런지 분위기가 자유롭고 재미있게 일할 수 있었습니다. 그리고 식당밥이 참 맛있었어요. 급여도 높은편입니다.,"체계가 없고 아무래도 계약직 아웃소싱 직원이 많다보니 어수선합니다
그리고 약간 위험한 일도 있으니 그게 좀 단점같네요. 그래도 단점보다는 장점이 많은 회사였습니다.",바라는점은 딱히 없고 더 좋은 더 나은 회사로 발전했으면 좋곗습니다.
3.0,디아이디(주),2020. 02,3점,"""사람들도 착하고 일도 빡세지않고 무난하고 좋음""",자유로운 분위기이고 칼퇴근이 좋았었음 밥도 맛있고 일도 누구나 배울수있고 작업 환경도 깨끗함 위험하지 않음,딱히 없는듯 그나마 써보자면 쉬는시간에 방진복 입고 벗는시간때문에 제대로 쉬는시간은 5분이 채 안된다는것,반장님이 좀 무섭긴해서 ㅠㅠ 그점만 좀...
3.0,디아이디(주),2020. 01,4점,"""고되게 일하는 사이에 친구들과 더욱 돈독해지고 싶은 사람, 무시당해도 좋은 사람 근데 여기 망했는데;;""",힘들고 고되지만 퇴근후에 다같이 떠들고 뭐 장보러 가고 그런게 넘 즐거웠음 근데 여기 망함;,연근.특근.잔업 시키는사람만 시킴 경력자들만 좀 세게 굴림 근데 여기 망했다구,없음 바라는 점 말해서 바래진적도 없음 근데 여기 망했는데 이거 왜 쓰라고함?;
3.0,디아이디(주),2019. 11,5점,"""첫회사이자가족같은사람들이많아서정깊은회사였음ㅋㅋㅋㅋㅋㅋㅋ""",저렴하고 최상의 풀옵션기숙사를제공하고 복지가 너무 좋았음,관리직들이 맘에드는 사람만 승진시켜주는 제도가 맘에안듬,경력을 인정해주고 회사가 다시 살아났으면 좋겠다......
3.0,디아이디(주),2019. 10,1점,"""2조2교대 헬근무 돈은많이 주지만 자기 생명 깎아먹는 느낌 육참골단""","유치원 식당운영
식당밥이 맛있으며 사람들이 좋아 다녔었습니다
다른 장점은 부족함","일이 너무 힘들고 근로시간이 길고 눈치주는게 심함
연차없으며 돈은 많이줬던걸로 기억함","직원들좀챙겨주시고 연차가 생겼는진몰라도
생겼으면 좋겠다"
3.0,디아이디(주),2019. 09,2점,"""기업 내 경영 부족으로 인하여 상장 폐업 등 다사다난한 회사였다.""",밥도 그럭저럭이고 퇴근시간도 눈치보여서 좀 힘들었다. 그나마 직원 휴게공간은 마음에 들었다.,"직장 내 상위 관계자의 텃세, 그리고 신입이 들어오면 하루라도 버티기 힘든 체계가 단점이었다.",이제는 다들 무얼하고 지내실지 모르겠지만 디아이디 그만큼 잘 버틴 회사라고 생각합니다.
3.0,디아이디(주),2019. 07,4점,"""글로벌 제조업체로써 한때 매출 1조억 회사
삼성디스플레이의 매출 하락 및 중국 공장철수로 결국 매출 급감으로 어려워짐""","한때 매출 1조억 달성, 복지수준도 매우 좋음 환경의 회사.","경열진의 판단 미스
신사업 부재로 결국 안타깝게도 무너진 회사","신사업을 좀 더 신경쓰고, 탈 삼성을 빨리 했어야 했는데 그런 노력이 없었음"
3.0,디아이디(주),2019. 03,4점,"""고등학교때 일했는데 만족했어요. 실습으로 나갔는데 좋았어요""",근무 환경 좋음. 상여금 있어서 전체적으로 만족했습니다.,교대근무라 힘들었고 야근이 은근 자주있어서 힘들었어요. 12시간 근무라서 힘들었어요,야근과 근무시간을 좀 줄여줬으면 좋겠어요
3.0,디아이디(주),2019. 03,3점,"""회사 규모도 크고 사내 기숙사 사내 매점등 좋은점도 있으나 교대근무 특성상 몸이 힘듬 기타 복지는 보통수준, 삼성 하청으로 삼성물량에 휘둘림""",교대 근무다보니 수당이 좋음 천안에 위치해서 주변 거주환경이 양호하고 기숙사도 있고 사내 식당도 있음,교대근무 특성상 몸이 힘들고 바쁜 시즌에는 쉴틈이 없음 또 당시 아웃소싱으로 들어갔는데 일이 없어서 한달정도 쉬고 오라고해서 퇴사함,경영진에 바라는점은 딱히 없고 일은 역시 같이 하는 사람이 중요하므로 급여 복지도 괜찮은 편이니 사람만 조심하면됨
3.0,디아이디(주),2019. 02,3점,"""같은 업종에 비해 나름 괜찮은 업체입니다.
그렇지만 야근이 잦음""","동종업계에서는 연봉이 나름 괜찮은편임
수직구조이기는 하나 부서나름 괜찮은 곳 존재","근무여건이 좋지만 야근이 너무 잦아
개인생활이 보장이안됩니다.","직원들을 먼저 생각하고 힘써야한다.
너무 경영진위주로 진행하는 부분이있음"
3.0,디아이디(주),2018. 12,2점,"""고등학교에서 실습생으로 나갔는데 일단 많은 고등학생 실습생들과 젊은 층의 사람이 많음""","회사의 내 풍부한 삼시세끼 , 적절한 휴식, 다양한 연령층과의 의사소통","일거리가 많이 없음, 일일 제품 수량에 촉박함, 기숙사 통근 등.","사업 추진에 적극적인 열의는 보였으나 군대 문화같은 문화를
개선화"
3.0,디아이디(주),2018. 11,1점,"""체력 좋고 개인시간이 없어도 되는분께 추천합니다.""","중견기업이고 복지가 나름 갖추어져 있다.
건물이 통로로 연결되어 있어 이동하기 편리함. 사내 매점이 있다.","연차는 생각도 못하고 휴무일에도 거의 쉬는것이 힘듬.
2교대 근무이며 12시간 근무하는데 2주동안 못 쉬고 교대 할때가 많은데
그게 유일한 휴무;;",직원들의 불만을 듣지만 말고 해결책을 주셨으면 합니다.
3.0,디아이디(주),2018. 10,3점,"""몸이 힘들지만 사람들이 텃세 없고 그냥 그럼 딱 중견 기업인듯""",어린이집 운영 정규직 전환이 빠름 일 잘하면 시급 올려줌,일이 유동적임 부서 이동이 잦음 성수기 비수기 구분이 확실함,"보너스좀 많이 줬으면 합니다
일하는 강도가 힘듦"
3.0,디아이디(주),2018. 08,3점,"""사내 기숙사가 있어서 출퇴근 하기는 좋았음. 체계를 중요시 하는 분이라면 추천하지 않음""",업무 분담은 확실하게 되어 있는것 같음(다만 맡은 업무 물량 없을시 다른 업무 지원 돌림),직원들 교육이 제대로 되지 않아 불량율이 높았음. 관리자들 실력 부족.,관리자를 성의 있게 뽑았으면 좋겠음. 체계를 제대로 확립할 필요가 있어보임.
3.0,디아이디(주),2018. 06,1점,"""적당히버는거 같아요 그렇게 많지도 적지도 않고요 그래서 딱히 추천하고싶지않아요""",젊은 사람들이 많아서 밝고 활발한 분위가 있어서 좋아요,텃세가 너무심해서 진짜 힘들어요 너무부려먹는다랄까?,그냥 제발 밥이라도 잘먹게해주라
3.0,디아이디(주),2018. 05,1점,"""그냥 사람 막 뽑습니다.
그래서인지 회사 분위기 개판입니다.
편한게 다닐만한 회사입니다.""","젊은 사람들이 많아 회사분위기는 밝고 좋습니다.
월급도 나쁘지 않게 줍니다.","관리직 사람들이 텃세가 너무 심합니다.
파벌도 있는거 같고요","돈 좀 더주고 텃세 좀 그만부리세요.
밥이라도 맛있게 주면 몰라도...."
3.0,디아이디(주),2017. 07,3점,"""같이 일하는 사람들이 좋았으며 처음 접하는 일도 쉽게 알려주는 기업이였음""",다른 공정 라인은 잘 모르겠으나 내가 일 했던 공정은 가족같은 분위기가 좋았음,여자같은 경우는 한달에 한번 하는 생리 휴가가 앖다는게 아쉽고 아파도 조퇴 절대 불가 사람보단 무조건 일일일 하는 상황은 좋지않았음,지금 기업이 다시 살아났는지는 모르겠으나 다시 만약 다시 살아난다면 경영에 다시 힘 입어 성공 하셨으면 합니다
3.0,디아이디(주),2017. 07,3점,"""좌식보다 입식공정이 훨씬 더 많음. 인원수급 조절이 어려워보임. 무급휴가하다가 갑자기 15시간 16시간 근무할때도 있음..""",밥이 맛있음 월급 밀리지 않고 잘 줌 일이 힘들다보니 텃세가 심하지 않고 젊은이들이 많이 와서 분위기는 좋음,일이 많을 때는 한달에 두 번 겨우 쉬면서 일이 없을 때는 일주일도 넘게 쉼..대책이 없음,업무량 조절 좀 잘 했으면 좋겠다 진심
3.0,디아이디(주),2017. 01,4점,"""일을 많이하지만 급여도 괜찮은편, 하지만 출근이 너무 불규칙적이라 몸이 상할수있는회사""","장점은 즐겁게 일할 수 있고 급여야 많음, 어린 아이들이 많아서 분위시가 밝고 젊음","출근이 불규칙적이고 야간근무가 있어서 몸이 힘듬, 회사사 너무 구석에 있음",출퇴근을 전날이 아닌 미리 말해서 스케쥴에 지장없도록 해주셨으면합니다
3.0,디아이디(주),2016. 05,3점,"""글로벌 제조사에세 많은 경험을 할 수 있었다 그러나 속 빈 강정""",삼성디스플레이의 1차 벤더 회사로써 어지간한 중소 기업에서 맛볼수 없는 회사 규모와 업무,규모에 비해 속빈 강정...내실이 없음 경영진의 책임감 없는 경영이 회사를 망쳤다,일본 최대 주주의 책임감 없는 경영으로 회사를 망쳤음
3.0,디아이디(주),2016. 04,3점,"""여자들의 기싸움과 텃세가 좀 있고 밥시간도 너무 빡세고 기계같은 느낌""",일한만큼 급여가 나와서 좋다 한달 일하면 기본 180정도,무작정 소리만 지른다고 다 되는게 아닌데 너무 왔다갔다 옮겨지면서 바로바로 적응해야하고 못하면 쓴소리듣고 밥시간도 너무 빠듯하며 아파도 잘 쉬지 못함,무작정 소리만 지른다고 다되는게 아닙니다 상사분들 .
3.0,디아이디(주),2016. 03,3점,"""특출난 사람은 없지만 그만 그만한 사람들이 모여서 열심히 해보자고 한 회사""",다소 부족하지만 그래도 직원들 복지를 신경 쓰려고 한다.,"삼성에 너무 의존하여 물량 감소시 대책이 없었음.
LCD 업종의 하락으로 인해 어려워짐",예스맨 보다는 오너에게 소신있는 발언을 했으면 좋겠다.
3.0,디아이디(주),2016. 01,3점,"""처음으로 전자 회사에 입사햇고 새로운경험을 햇다
괜찮았다""",일단 대기업이었으며 사내 유치원이잇는 교육복지 출퇴근통근버스 상여 600의 좋은복지와 좋은 시설로 사원들이 근무하기 편한 환경,생산직이다보니 꾸준한 근무는 어려웠고 초과근무또는 보름이상 휴일이 생기는일도 있었으면 생산기본 심했다,사원들이 서로어울릴수있는환경 더 효율적인 근무 발전이 필요할것같다
3.0,디아이디(주),2016. 01,3점,"""비록 지금은 폐업직전이지만 체계가 잘 갖추어진 회사
실력을 쌓을 기회가 많았음""",업무체계가 잘 갖추어져있었으며 실력을 쌓을 기회가 많았음,삼성의존도가 매우높아 삼성 정책에 따른 리스크가 매우 컸음,"삼성 의존도를 줄였으면 현재와 같은 상황은 오지않았을 것
임가공보단 독자기술력을 확보했어어야 함"
3.0,디아이디(주),2015. 11,3점,"""삼성에 거의 의존. 근무할때는 도시바도 거래하긴 했는데 지금은 어떤지 모르겠음. 부도나서 상장폐지됐다고는 들었음.""",분위기는 괜찮음. 여자가 많아서. 그리고 강압적인 분위기는 아님.,파벌싸움이 있음 여자가 많아서. 강압적이진 않지만 고위직의 전문성이 떨어지는듯함.,딱딱하지 않은 분위기는 좋지만 한분야만 파는것보다 사업 활로를 다양하게 펴는 것은 어떨까.
3.0,디아이디(주),2015. 09,3점,"""충남에 위치해 있으며, 삼성 협력업체로 테플렛 pc, 대형 tv 등 LCM 전문 기업입니다.""","경영진이 직원들 복리에 힘써주고 있으며, 직원들과의 의사 소통을 적극 적으로 하는 회사 입니다.","삼성 100% 협력 업체이다 보니, 매출이나 생산에 있어서 기복이 심합니다
이점을 참조하여 주시기 바랍니다.","새로운 먹거리 사업 창출해야 회사가 먹고 살 수 있습니다.
직원들을 위해서 새로운 사업으로 찾았으면 합니다."
3.0,디아이디(주),2015. 09,4점,"""삼성 1차 벤더로써 국내유일하게 애플 후공정 제품도 취급하고 있었고 급여 및 복지 수준도 좋았지만 부채가 많았던게 흠""","가정적인 근무환경, 동종 평균이상의 급여조건 , 사내 기숙사 및 어린이집 운영","임원들의 부도덕성,무리한 사업확장,무사안일 주의,자기 메이커가 없고 특별히 내세울 기술력은 없음",자유로운 경쟁으로 회사가 발전되야 하는데 부서 차별 및 텃세가 많았습니다
3.0,디아이디(주),2015. 09,3점,"""중견기업 급의 회사로 기술적으로나 배울것이 많은 회사 하지만 텃세가 있어서 적응하기 힘든 곳""",삼성의 1차 벤더여서 기술적으로 배울것이 많음 / 사내에 근무자를 위한 복지시설이 갖춰져있음,일단 천안 회사는 부도가 남. 더이상 다닐수 없음. 아쉬움.,돈먹고 도망간걸로 알고 있음. 그전에 나와서 다행이란 생각 밖에 안듬..
3.0,디아이디(주),2015. 09,3점,"""다양한 업무 습득하고 실력 쌓기에는 최고의 회사""",삼성 같은 대기업을 제외하고 천안지역 다섯 손가락 안에 드는 큰 규모의 기업,삼성의 1차 벤더이기에 삼성의 물량 의존도가 매우 높음,회사 경영에 조금만 더 신경쓰면 .....
3.0,디아이디(주),2015. 08,3점,"""삼성 협력사 매출 설장 기대되나 삼성에 의해 좌지우지됨""","기업이 젊다, 업무강도 강하지 않음
삼성 물량에 따라 현장직 이동이 심함","독자적인 기술력 미흡
삼성에 의해 좌지우지하며, 해외법인도 어려움","전문성 없음, 직원들에 대한 배려 없음
복지여건은 좋은 어린이집, 기숙사"
3.0,디아이디(주),2015. 08,3점,"""글로벌 기업으로 좋은 경험을 할수 있는 기회가 있으며 진급 누락은 없음""",월급이 제때 잘 나오며 남녀평등의 분위기로 승진도 평등하게 진행,신규사업 창출 능력의 부재와 대주주의 관리 무능력에 의한 관리부족,신규사업을 할 필요성은느끼지만 그만한 역량이 되는 관리자 확보필요
3.0,디아이디(주),2015. 06,4점,"""디스플레이 계열에선 직원들 복지에 있어선 최고인것 같아 다시일하라면 다시 일하고싶은 기업""",직원 복지에선 손꼽을만큼 탁월하여 업무중 부담감을 덜할 수있고 연봉도 남부럽지 않을만큼 받을 수 있다.,연봉이 높은만큼 쉬는날이 많이없고 또한 잔업도 꾸준히있어 업무가 힘들수가 있다.,2조2교대 업무라 쉬는날도 많이없어 업무를 하는중 직원들 몇몇이 쓰러지는 경우도 봐왔습니다. 개인 연차정도는 눈치보지 않고 사용 할 수 있으면 좋겠습니다.
3.0,디아이디(주),2015. 05,3점,"""회사 복지 및 근무여건은 좋으나 임가공 회사란 단점은 배려하여함""","코스탁 상장기업, 근무여건 상, 근무강도 중",주공정에 대한 관심이 있을뿐 그외 후공정에 대한 지원 미흡,회사 회생신청은 포기바랍니다. 그게 진원을
3.0,디아이디(주),2014. 12,1점,"""한국인에게는 미래가없음. 중국인 조선족 베트남인이 대다수. 휴식시간도 짧고 식당까지 거리도 너무 멀어서 제대로 쉬는거 불가능. 단순작업이라 단기간에 돈을 빡세게 벌수 있겠지만 한달에 두번밖에 못쉬게함""",휴계실에 안마기가있다. 매점이있다. 안쉬는만큼 돈을 많이받는거?,식당이5층에있음 아침30분 시간으로 왕복하면 밥시간은 단10분뿐.,외국인이나 쓰십시오 한국인 뽑지말고. 자국민에게 민폐
3.0,디아이디(주),2014. 04,3점,"""내 인생을 되돌아보게 해준 회사""",많이 쉴수있고 작업환경이 괜찮다,들쭉날쭉한 월급,밥만은 돈을 아끼지 마시길
날 괴롭힌 삭제된 댓글,디아이디(주),충남,,,,,
날 괴롭힌 삭제된 댓글,디아이디(주),충남,,,,,
날 괴롭힌 삭제된 댓글,디아이디(주),충남,,,,,
2.3,(주)디엠씨,2022. 09,5점,"""음 방향이 안 보인다
그래도 방향을 잡고 갈려고 한다.
그러나 아직""","연차는 자유
모는게 내 마음대로 할수있다
마이웨이다
토일출근안한다","정시칼퇴근이 문제다
주 4일 근무를 안한다
연봉이 작다.","신규사업에 대한 투자와 경영진의 적극적인
활동이 필요하다"
2.3,(주)디엠씨,2022. 09,1점,"""평점 1.0 만 보시면 될 것 같습니다. 지금까지 이런회사는 듣도 보도 못했습니다.""",밥 줍니다. 책상 줍니다. 노트북 줍니다. 모니터 줍니다.,한 사람의 갑질과 횡포로 업무 시 눈치를 볼 수 밖에 없습니다. 말 안시켰으면 좋겠다. 로 하루를 시작 합니다.,부바부가 아니라 한 사람 때문에 직원들이 힘듭니다. 업무 잘 모르시는 것 같은데
2.3,(주)디엠씨,2022. 08,3점,"""회사가 인수되어 여러면이 바뀌고 있던 과도기이나 그속에도 나름 사람들 정이 있던곳""",장점부분은 제조업이다보니 회사사람들이 나쁘지 않았음 그러나 많은 고객이 있다는게 장점 일순 있을듯,제품의 수익구조가 이익을 높이기 쉬운 구조가 아님 일부 일안하는 사람들 발생,직원들에게 직접적으로 느낄수 있는 복지 증진이 필요
2.3,(주)디엠씨,2022. 06,2점,"""윗사람 눈치 많이 보는곳 일이 힘들어서 사람들끼리 잘 뭉침""",장점을 잘 모르겠습니다 이 일대에서 그나마 연봉이 좀 높다는 정도?,단순보고에 따른 문서가 많고 하나하나 일일히 체크함 인력줄이고 아끼는게 심람,신규 사업 추진에 힘써주고 인력을 추가해주면 좋겠음 매번 흑자를 위해 아끼는것도 너무 심하게 아낌
2.3,(주)디엠씨,2022. 05,1점,"""오면 안될회사 이걸 본다면 도망치세요""",밥 세끼준다 말고는 없다 아무리생각해도..........,"비효율적 업무프로세스 퇴사자가 넘쳐난다 야근 눈치보인다
업무강도가 강함",사람답게 살게해주세요 제발 소모품이 아닙니다
2.3,(주)디엠씨,2022. 05,3점,"""연봉은 중간정도 이며 워라벨 가능함. 연차사용 자유로움""",워라벨이 가능하며 업무분담이 잘 되어있다. 아침. 점심. 저녁 다 먹을수 있으며 근무강도는 중~강으로 단 시간에 많은 경력을 쌓을수 있다.,연봉은 높지도 낮지도 않은 중간 정도. 그러나 주변 중견기업에 비해서는 낮음. 업무강도 다소 높음. 직원 복지가 약함.,"직원복지 개선과 효율적인 업무 분배가 필요함. 바쁜 포지션은 계속 바쁘고, 한가한 포지션은 느긋함."
2.3,(주)디엠씨,2022. 04,2점,"""바지사장에게 휘둘리는 공장 누가 다니고 싶을까요 툭하면 도망가는 작업자들""","연차는 눈치 없이 쓸 수 있으나, 이거 빼고는 장점이라는게 없네요",아무것도 모르는 바지사장에 휘둘려 원가절감이니 올해는 적자니 하며 상여금도 줄어드는 추세의 회사 누가 다닐까요.....,바지사장은 바꾸고 전문경영인이 회사를 경영하는게 더 좋을듯 합니다...
2.3,(주)디엠씨,2022. 04,3점,"""큰 장점이 없고 복지가 거의 없는 일반적인 수직형태의 자동차 회사""",점심이 제공되는 것 . 그 이외에는 장점을 잘 모르겠다. 뽑자면 연차를 다 소진하게 하는 것과 이월 된다는 것,복지제도가 아예 없다 싶음. ot 1시간 기본으로 깔고가는 회사,복지체계좀 만들어줬으면 함. 성과금 상여금 아예 없어서 오로지 연봉
2.3,(주)디엠씨,2022. 03,3점,"""다산네트워크라는 회사에서 가지고 있는 회사""",자동차 부품을 만드는곳으로 조금은 열악하지만 사람들이 좋음,현장분들은 교대 근무라 좀 힘들어보임 조금이라도 복지를 늘려주길,신규 아이템 개발 수주에 적극적이길 바라고 직원 복지에 힘쓰시길
