총점,회사,날짜,별점,요약,장점,단점,경영진에게
2.0,(주)상상인인더스트리,2019. 05,1점,"""노력한만큼 댓가가없는 회사
경영만잘하면 얼마든지 발전할수있는회사""","일못해도 윗사람에게 잘보이면 성공하는회사
현장직보다 사무직이 인정받고 편한회사
연차 반차 눈치안보고 사용할수있는회사 단현장직은 눈치봐야함","좋은 아이디어가있어도 제안하고싶지가않은 회사
기술개발에 관심없고 신경안쓰는회사
직원복지에 관심없고 신경안쓰는회사",아부하는 사람만 좋아하지말고 진흙속에 있는 인재를 잘찾아 등용하여 회사발전에 더움이되도록했으면합니다
2.0,(주)상상인인더스트리,2019. 04,2점,"""""노력에 대한 결과가 없다""
노력한 자 보다는 잘 보인자의 결과가 좋은곳...""","출발선상은 늦었으나 임직원의 노력으로 드라마틱한 성장을 이루한 회사.
모두가 되지 않는다 불가능하다는 것을 임직원들의 노력으로 불가능을 가능하게 만들어 내던 기업","단순보고, 단순업무, 계층적 구조 등 투명하지 않고 많은것들의 간섭이 많았던 회사",투명한 평가와 균등한 배분이 따라야 끝까지 갈수 있는 좋은 기업이 될수 있다.
2.0,(주)상상인인더스트리,2019. 04,3점,"""다사다난한 회사, 언제 무슨 일이 생길지 예측하기 어려움""","중소기업 중 비교적 자유로운 근무환경(퇴근시간, 주5일제 등), 동종업계 대비 중상위권의 연봉.","경영진이 자주 바뀜(코스닥 상장사의 비애), 공장이전으로 절반 정도의 직원이 바뀜.",다시 들어가고 싶은 회사로 만들어 주시길...
2.0,(주)상상인인더스트리,2019. 04,3점,"""선박크레인 회사로 꾸준히 성장중인 회사이며 조선불황에도 불구하고 매출타격은 거의 없음""","부서내 좋은 사람들과 일할수 있으며 연차사용이 자유롭고, 승진도 비교적 상승이 잘되는편. 구내식당있으며 전라도로 회사 이전 예정",야근이 많으며 군대적인 문화가 잔존함. 회사 체계가 완벽히 잡히지 않았고 외부 스카우팅을 통해 경력직을 많이 뽑음,군대 문화를 좀 줄여주고 조금 더 자유로운 문화가 되었으면 한다
2.0,(주)상상인인더스트리,2019. 02,1점,"""워라벨은 최고이나, 연봉은 동종업계 아니 평균적으로 최악입니다..""",워라벨이 좋아 주말이 있는 삶을 보장합니다. 아이템 관리 난이도가 낮아 업무강도가 어렵지 않습니다.,전체적인 연봉 지급 단위가 턱없이 부족하며 M&A로 인해 인수한 회사 직원과 인수당한 회사 직원 사이의 갈등이 생각외로 높아 업무 협업이 어렵다,연봉을 동종직군과 비슷하게라도 맞춰주시길 바랍니다. 워라벨이 좋아도 돈이 없어 주말에 여가생활이 힘듭니다.
2.0,(주)상상인인더스트리,2018. 12,1점,"""덩치는크나...사람이없음...실무자는 다나가는상황임.""","엘레베이터가있음.
기숙사가있는데 원룸을 제공해줌.
주말 유류비 지원해줌.","실무자는 대부분 나가고 역피라미드구조.
밥이너무 맛이없음.
주말 유류비는 타지사람만 가능.",사람이 재산인것처럼 실무자를 위해 힘써줬으면 하네요
2.0,(주)상상인인더스트리,2018. 12,1점,"""한마디로 개념없는회사 꼰대들 많고 업무체계 엉망
업무를 어떤식으로 풀어나가야하는지모름""","잡다한 아이템많이받고 매출만 늘린회사 외관상 매출만높음
실상은 적자아이템 천지","물류부서는 그야말로 꼰대들이 다 말아먹음
남직원 인격모독심함 여직원에게는 아빠같은 존재들
업무체계는 80년대식 업무 사무직이아닌 현장일이 80%이상
배울거 하나없음
매출대비 영업이익 최악","장기근속 꼰대들 정리할필요있음
불필요인원많음 자기살자고 밑에 직원 죽임
기본적인 출하쪽 현장인원 및 지게차 인원없음
사무실직원이 현장일과 지게차 운행(100%)
생산현장에 현장QC없음 불량률도 높음"
2.0,(주)상상인인더스트리,2018. 12,3점,"""솔찍히 좋은회사였으나 과거에 불과하다 지금은 심각한수준""",현대라인을 끼고 있기때문엔 망할일은 절대 없어보임 업무강도 무난,법정관리중이라 미래적인관점에서볼때 회사가 어떨지 의문이든다,청렴 결백하게 경영을 이끌어나가고 두번다시 같은일이 반복되지않았으면 한다
2.0,(주)상상인인더스트리,2018. 12,3점,"""전형적인 중소기업의 형태를 띄고있는 가족같은 분위기의 회사. 너무 가족같아서 그게 독이될지 아닌지는 본인이 판단해야한다.""",연차/반차에 대한 제약이 크게 없음. 낮은 직급도 휴가기간에 눈치볼 필요가 많이 없음. 업무의 자율성이 높아서 본인이 하고싶은것을 해도 됨,업무의 자율성이 높은만큼 그에 따른 책임은 자기 본인 스스로가 져야함. 주말에 근무가 종종 잡힘. 부서간 이해관계도가 낮음,회사 외부적으로 이미지 관리를 할것이 아니라 회사 내부에 어떤 비명과 고성이 오가는지 직원들의 목소리에 귀를 기울이고 개선해 나갈 필요성이 있음
2.0,(주)상상인인더스트리,2018. 12,1점,"""사람을 도구로 생각하는 기업
노는 사람 따로 일하는 사람 따로""","주 5일
5시 정시 퇴근 (은연 중에 야근 강요)
같이 일하는 사람들은 좋음","퇴사인원은 많으나 충원이 없어 업무는 부서내 기존 인원이 처리해야 하여 업무 과부화
연봉 삭감, 복지혜택 감소
구내식당 밥 맛없음
부서 간 협조 안됨",그나마 있던 복지제도도 없애버리고 연봉삭감만 생각하면서 야근 강요 좀 하지 맙시다. 돈 벌러 회사다니는데 돈돈 거리지 말라니까 어이 없습니다.
2.0,(주)상상인인더스트리,2018. 12,3점,"""경영진 횡령으로 디엠씨에서 상상인으로 넘어간 회사""",광양으로 이사를 와서 숙소와 주말 주유비 도로비 지원이 된다.,"잦은 경영진의 교체 및 최근에는 정리해고로 인해서 분위기가 많이 안좋은 상태
얼마나",회사를 투명하게 경영하여서 직원들이 걱정 없이 다닐수 있는 회사가 되었으면 한다.
2.0,(주)상상인인더스트리,2018. 11,3점,"""업무난이도는 어렵지 않으나 잡다한 업무가 많음""","다른 회사에 비하면 업무 난이도가 어렵지 않음
부서마다 다르겠지만 정시 출 퇴근 가능","연차를 월, 금은 사용하지 못함
한가지 업무를 하기 위해서 기타 잡다한 업무가 많음
각부서간 협조가 바로바로 되는 편은 아님",각부서 간 협조가 잘 되었으면 좋겠음
2.0,(주)상상인인더스트리,2018. 11,2점,"""체계라는 것이 없으며, 모든것이 즉흥적 긴급적으로 대응해야 하며, 일하는 사람 일안하는 사람 확연히 구분됨""",연차를 쓰고싶을때 쓸수있음. 퇴근이 자유로움 야근이 별로 없음 직무에 따라..,"체계가 없으며, 모든것이 긴급하게 진행됨, 일안하는 사람이 오히려 일 하는 사람에게 목소리가 크며 보상은 따로 없음","제대로된 인재채용이 필요하며 , 대대적인 인원 개편이 필요함. 업무 구분에 따라 확연한 성과와 차별이 필요함"
2.0,(주)상상인인더스트리,2018. 10,3점,"""열심히하는 사람에게 기회가있는 회사""","담당업무 완료시 칼퇴가능
일에 대한 눈치안줌
일잘하면 진급기회 많음
국내 자동차 삼성빼고 모두거래
다양한경험 가능","직원을 소모품으로 생각하고 원가절감만 강요함
업계평균 낮은연봉
잦은 주말근무
주말근무시 특근수당은 있음","애사심을 가지고 일할수 있도록 직원들 복지 개선이 필요
급여 개선을통한 동종업계 부족함 커버가 필요"
2.0,(주)상상인인더스트리,2018. 10,3점,"""여기 다니다가 다른회사 가면 야근하는건 그냥 우습게 느껴질 것이라 생각되며, 사회 초년생은 내공을 단련하기 위해 좋은곳이라 생각됨""",모 회사가 탄탄하기때문에 당장 말할 것 같지는 않다. 하지만 현재 주력사업을 포기하고 있는 단계......................................,애매모호한 진급기준 때문에 불만이 많았다. 모 회사 총수가 감빵을 갔기 때문에 이것이 자회사에 어떤 영향을 미칠지는 두고봐야 알것같다.,강제 야근이 업무효율을 높일 수 있다고 생각하지 않는다.
2.0,(주)상상인인더스트리,2018. 09,2점,"""주인이없어서 엉망입니다. 회사 전산은 잘되어 있어 회사 체계는 어느 정도 잡혀있다고 봅니다.""","장점이라하면,,, 의료비 지원인데 지금은 없어 졌습니다.","조선산업 지원으로 5시 퇴근하지만 급여도 작고,
현재 법정관리 중으로 좋지 못하다고 봅니다.","좀더 급여체계 바로 잡아주세요.
서로 좀 상생하는 회사가 되었으면 합니다."
2.0,(주)상상인인더스트리,2018. 08,2점,"""체계가 많이 잡혀있지 않지만 사람들은 대부분 다 좋습니다. 경영에 아쉬움이..""","1. 대부분 직원들 간의 사이가 좋다.
2. 오래된 직원들이 많아서 배울것이 많다.","1. 오래된 직원들이 많아서 융통성이 조금 부족하다.
2. 월급이 너무 적다.
3. 회사 위치가 많이 아쉽다. 멀다.",회생절차에 있어서 많은 아쉬움이 있고 전 대표 이사 외 경영직이나 재무부서에 많은 아쉬움이 있습니다. 비리가 터지는것도 알려주지도 않고 직원들은 어떡해 먹고 살아라는건지 모르겠네요.
2.0,(주)상상인인더스트리,2018. 08,1점,"""부서별 이기주의. 떠넘기기 만연. 군대식 문화 및 희생 강요""","국내 해양크레인 제조 1위 업체 였으나, 전 경영진 비리로 몰락","불필요 문서, 결재 시스템. 딱딱한 조직문화
부서별 차별이 존재함","연봉 획일화.
특정 부서 연봉이 과도하게 높다.
부서별 원활히 업무협조할 수 있는 시스템 필요성"
2.0,(주)상상인인더스트리,2018. 07,2점,"""디엠씨라는 크레인 회사 검색이 되지 않아, 같은 이름의 회사 선택.
회사에서 직원들에게 비전을 제시하지 못하며, 미래가 보이지 않음""",연차를 부담없이 원하는 일자에 사용 할 수 있는 장점이 있습니다. 그외는 장점을 찾을 수 없습니다.,"직원을 생각하지 않으며, 경영 상태도 엉망이며 어디서부터 회사를 고쳐야할 지 모르겠습니다.",직원들의 불만을 듣지만 말고 귀 기울여 듣고 개선을 하려는 의지가 필요합니다.
2.0,(주)상상인인더스트리,2018. 07,2점,"""자동차 1차와 2차 사이 어딘가에 위치한 회사, 성취감도 프라이드도 느낄 수 없다""","부서별/직급별 업무강도,난이도 상이함
1+2차사 업무를 모두 경험할 수 있음
부서별 업무구분이 크게 없어 자동차 개발 전체 과정에 걸쳐 업무경험 해볼 수 있음
판교는 영천에 비해 근무환경 우수함, 비교적 자유로운 복장
남자직원은 판교 근처 기숙사 제공한다는 아주 큰 장점이 있음
연차/휴가 보장, 급여일 칼같이 지켜줌","잦은 입사/퇴사로 내부 분위기 어수선하고,
역피라미드 인력구조(중간관리자 부재) 형태임
사내정치하는 임원들덕에 부서간 내업무 아니라는 식의 태도와 문제 발생 시 타부서로 책임회피, 서로 디스하기 바쁨
실무자 업무 과중
다른 자동차 업체와 마찬가지로 군대식 서열 존재함
자녀 학자금 일부 지원 외 직원 복지 거의 없음
비상경영체제라는 이유로 직원복지 삭감
포괄연봉제로 상여 등 모든 금액이 포함되어있음","잦은 인력교체는 회사에 독이 될 수 있음, 개인의 탓이라고 생각하지말고 왜 퇴사자가 많은지 뭐가 문제인지 진지하게 고민해보기 바람"
2.0,(주)상상인인더스트리,2018. 06,2점,"""부서간 이기주의 팽배함. 조선기자재 업체 중 월급은 낮은편이나, 연차 자유 사용 가능함.""","선박크레인 업계 1위, Offshore Crane 제작 가능한 기술력을 보유중인 회사",부서간 이기주의 심함. 전담당자가 퇴사하면 후 담당자는 전 담당자의 퇴사를 이유로 업무 진행이 늦고 무책임함.,사측과 노동자측 갈등이 심함. 대규모 횡령금액으로 상폐위기인데 현명한 경영을 했으면..
2.0,(주)상상인인더스트리,2018. 06,2점,"""중소기업 답지않는 연/월차 사용. 그외 수당이나 이런건 없고 딱 기본급만 받아갈 수 있습니다""",복지가 몇개 없지만 그 몇개없는 복지라도 지켜주는 회사. 하지만 그 복지가 직장생활에서 당연시 여겨지는 기본적인 복지. 하지만 중소기업중에 이마저도 지키지 않는 회사가 많다.,체계적이지 않은 업무 배분. 내가 2-3년뒤 어떤 경력이 쌓여있을지 가늠이 되지 않음. 단순 월급쟁이로는 딱이나 미래를 생각한다면 생각해봐야할것,눈앞에 놓인 이익만 쫓지말고 직원들을 챙겨줬으면 하는 바람입니다. 직원의 만족도가 곧 회사의 성장이니까요
2.0,(주)상상인인더스트리,2018. 05,2점,"""무책임한 사람들의 모임. 니탓내탓하기 바쁨.""",판교에 위치. 업무강도는 중. 건물만 좋음. 진짜 건물이랑 판교에 있다는 것만 좋음...,이상한 사내 문화. 텃새. 8:30~6:30 근무. 성취감 없음. 이상한 절약정신,지원이 필요한 곳엔 지원 좀 하세요.. 진짜 이상한데서 아끼려고 노력하는데.. 그러다가 다 떠나요..
2.0,(주)상상인인더스트리,2018. 04,2점,"""노는 사람은 매일 놀고 일하는 사람만 죽어남""","뭐가 됐든 상승됨
끝가지 버티면 올라갈수 있음
끝가지 버티기가 죽을 맛임","조직이 산만함
조직이 자주 바뀜 업무 내용도 수시로 변경
뭐 하라는 건지 모르겠음",중간 임원진에 대한 평가가 이뤄져야 함
2.0,(주)상상인인더스트리,2018. 03,1점,"""물 경력 쌓기 좋은 회사 . 점점 더 분위기 안 좋아지는 회사""","복지 없음, 연차는 눈치 안보고 사용 가능, 회사 주변 인프라가 좋음",8:30-6:30 한시간 추가 근무/ 체계없음(담당자들이 본인일이 아니라고 생각함) / 무능력 차부장급 많음( 배울거 없고 아는것도 없음) / 텃새 / 신입이 다니기 힘든 회사,인간대접과 깨끗한 회사였으면 ... 꼰대문화아닌 변화가 있었으면...
2.0,(주)상상인인더스트리,2018. 03,2점,"""고무 가공업체로서 처음엔 냄새가 지독하다. 적응하면 코 안막고 다닐만하다.""",복지가 그럭저럭 괜찮다. 특별히 해주는건 없는데 신기하게 해주는게 있다.,돈이 없다. 어딘가에서 잔뜩 벌면 어딘가에서 새는가 보다.,돈되는 아이템 좀 만들어서 성과급 좀 받아봤으면 좋겠다
2.0,(주)상상인인더스트리,2018. 01,2점,"""영업부진으로 인한 매출액 감소, 1차벤더 업계 연봉최악, 업무강도 중상""","1차벤더답게 휴가 및 연휴계획이 완성차를 따라가므로 휴가는 보장, 중간관리자(과장급 포함 그 이하) 사람들이 좋음","1차벤더업계 중 연봉 최악을 자랑, 필요없는 낙하산부서가 존재하여 업무효율 떨어짐, 고위관리자 (차장 이상) 마인드가 최악이다. 인성문제, 업무미루기 등으로 실무자 업무과중, 수요가 필요한 인력부서에 매출액을 핑계로 인력보강 소극적임.","업력에 미달되지만 중요직책을 맡는 낙하산인사들 해결이 우선되어야 함.
연봉을 동종 동레벨업계만큼 끌어올릴 필요성 있음. 고위관리자의 일 미루기 관행을 타파해야 함."
2.0,(주)상상인인더스트리,2018. 01,2점,"""줄어드는 실적과 영업이이률 그리고 발전이 없는 회사구조. 직원들을 도구로만 생각하는 경영진 마인드.""",욕심없이 적은 돈으로 소박하게 살기에는 좋음. 직원들끼리 서로 친목없이 자기 일만 집중하여 할 수 있음. 이곳에서 일하고 다른곳으로 이직 하면 적응하기 수월함,적은연봉과 야근 그리고 경영진의 자기중심적인 생각때문에 밑에 직원들이 고생을 많이 함. 내 일이라고 생각하지 않고 잠시 머물다 갈 곳이라 생각하며 마인드컨트롤함,직원들은 인격적으로 대하고 기존에 있던 매출구조를 다각화하여 주저함이 없이 도전하고 투자해야 이 난국을 뚫을거임.
2.0,(주)상상인인더스트리,2017. 09,2점,"""판교근무. 다산그룹 자체 사옥 보유 및 주변 인프라 등을 감안할 때 업무 환경 좋음. 단, 한 두 명의 매니지먼트 결정에 따라 움직이는 경향이 강함. 열정을 가지고 일하면 다칠 수 있으니 적당히 쉬어가기만 할 것.""",점심/저녁 제공. 접근성 용이. 재경팀 마감 시 제외하고 대부분의 부서 칼퇴. 프리한 복장. 한 두명의 상사만 없으면 자유로운 업무 환경.,출근 8:30 / 퇴근 18:30 9시간 근무임. 복지 없음. 사람을 중시 하지 않는 기업 문화. 편향되어 보일 수 있는 인사평가. 회사 실적 어려워지니 직원 통신비(3만원) 먼저 없앰.,사람대접 해줬으면. 신규투자 검토 적극적이었으면. 면전에서 담배피지 말고 술 강요 안 했으면.
2.0,(주)상상인인더스트리,2017. 06,1점,"""경북영천위치 신입연봉인상 기존직원들은인상안하고 복지도없는데 더안좋아지고있음""","몇몇부서제외 전부 6시칼퇴
단 그 몇몇부서로가면 지옥임 욕만함","욕만하고 일터지면 밑에직원한테 책임전가하기바쁘고
부서간 책임전가하기바쁨
복지는 1도없고 그냥 경력쌓고 지나가기에 좋은회사
연봉,복지, 마인드 2차업체수준
부서",욕그만하고 우기지좀말고 직원들복지나 업무부하상태 애로사항이나 파악좀하시길
2.0,(주)상상인인더스트리,2017. 04,2점,"""크레인,조선 기자재를 생산하는 업체로서,김해시 한림면에 위치하고 있음
직원들수는 대략 130명 가량이며,직원들 세대교체가 자주 되는편임""","1.회사업무는 여유로운편.
2.월급은 꼬박꼬박 나옴
3.몇몇 부서 뺴고는 6시 칼퇴,주말 휴일
4.","1.부서마다 틀리지만 몇부서는 공휴일,주말 모두 출근해야함.(수당도안나옴)
2.연차쓸때 눈치
3.복지 형편없음
4.사람귀한줄 모르는 .(몇년새 대표이사 4번바뀜)","희생하는 몇몇 부서는 수당을 챙겨주고,휴일,공휴일에는 회사전체 쉬던지 아니면
탄력 운영을 하던지 그랬으면 직원들의 애사심이 생길듯."
2.0,(주)상상인인더스트리,2016. 07,2점,"""핵심 임원들이 친현대 마인드 가지고 있음
기타 조선소 비중은 올라가고 있으나 인식변화는 글쎄..""","장점) 일부 부서 제외하고 칼퇴가능.
생각없이 다니는 직원들 많아 같이 묻어가면서 다니기에는 나쁘지 않음.",단점) 임원진들의 방향제시 및 결정력 결여. 이로 인해 실무진들 죽어남. 낮은 연봉.,실무적인 부분을 잘 모르는 관리부문의 입김이 너무 셈.
2.0,(주)상상인인더스트리,2014. 10,2점,"""여자직원들에게는 좋은 직장이며 남자직원에게는 많은 경쟁과 실적을 요구하는 회사 단 이회사를 다니고 나면 어떤 회사도 다닐수 있음""",IT와 자동차 부품을 조합한 기존의 자동차부품의 보수적인 분위기와 달리 IT의 열려있는 문화,기업의 주인이 없다보니 기업의 문화가 인수되는 회사의 문화가 상충하여 다문화 시스템임.,가족과 같은 회사를 만들어 주세용
날 괴롭힌 삭제된 댓글,(주)상상인인더스트리,경기,,,,,
날 괴롭힌 삭제된 댓글,(주)상상인인더스트리,경기,,,,,
날 괴롭힌 삭제된 댓글,(주)상상인인더스트리,경기,,,,,
날 괴롭힌 삭제된 댓글,(주)상상인인더스트리,경기,,,,,
2.7,한솔신텍(주),2022. 09,3점,"""회사 문화는 좋으나 새로운 직원을 뽑지 않아 다들 고인물임.""",연차를 눈치 안보고 쓸 수 있음 복지제도도 괜찮음 휴가도 여름휴가도 5일임,팀장들이 꼰대가 많고 문제 발생 시 책임을 밑에 직원에게 떠 넘김,회사를 지속하려고하는지 모르겠음 제발 신입사원쫌뽑으세요
2.7,한솔신텍(주),2022. 02,2점,"""직원관리 안되고 때되면 사람 집에보내는 무책임한 회사임""",사내분위기는 좋음 년차쓰는데 눈치볼 필요없이 자유롭게 쓸수 있긴 함,기업 성장성은 눈꼽만큼도 안보이며 연봉인상이 없는 기업,열심히 일해서 돈벌었으면 직원들 복지에 신경쓰고 월급인상도 해줘야되는데 자기들 배불리기에 급급함
2.7,한솔신텍(주),2021. 08,4점,"""발전플랜트 업종이 대외적인 환경으로 악화되면서 회사경영이 어려워 졌으나 대체적으로 문화는 평이한 편임""",발전플랜트 설계에 대한 경력을 쌓기에 좋으며 연차는 일정에 맞게 쓸수 있음. 여름 휴가가 7일임,회사의 임원진 및 경영진의 대외적인 수주활동이 다소 부족한 것으로 판단됨,"신규 사업에 대한 수주로 회사의 비전을 보여주었으면 하며, 복지체계도 개선되었으면 함"
2.7,한솔신텍(주),2021. 06,2점,"""행정사무에서 공정에 대한 예측이 불가하였음
불량의 원인 또한 소재측면에서 원자재 가공 불량 등 과도한 일정을 푸쉬하기 위한 물량몰아넣기가 다소많음""",직원들끼리 서로 으쌰으쌰가 없음. 그러다보니 직원간의 간섭이 심하지 않고 서로 니일 내일 알아서 하는 편.,하도급업체의 다수분포로 인한 QC보증 불가 및 제품의 바이어 연계 등 경영측면에서 유지존속이 어려웠을만 하였음,신규 사업 추진에 대한 적극적인 추진의사 피력이 필요해보임. 과도한 M&A로 인해 직원들의 애매한 거취 등 보장이 없었다고 생각됨. 직원들의 복지측면에서도 불편한 점이 많았다고 생각됨.
2.7,한솔신텍(주),2021. 03,4점,"""자유로운 문화이면서 시스템을 갖추고 있어 나름 다니기 좋은회사 입니다 또한 동아리 활동이 활발하고 부서간에
관계도 원만함""","연차를 의무적으로 쓰야하며 어느정도 자율성이 있으며
젊은 구성원들이 많아 다양한 사고를 할수있는 회사
야근근무가 더물며 퇴근시간에 제약을 받지 않음","문서업무가 많으며 조금은 피드백이 부족하여 일을 진행함에
있어 다소 늦고 일이 한부서에 치우치는 경향이 있음","의사 결정하는데 있어 조금은 신속하고 정확하였음 좋겠음
발전 관련 전문지식이 부족하여 대화시 이해시키는 시간이 오래
걸리는 문제있음 전문성을 확보하였음좋겠음"
2.7,한솔신텍(주),2022. 09,3점,"""회사 문화는 좋으나 새로운 직원을 뽑지 않아 다들 고인물임.""",연차를 눈치 안보고 쓸 수 있음 복지제도도 괜찮음 휴가도 여름휴가도 5일임,팀장들이 꼰대가 많고 문제 발생 시 책임을 밑에 직원에게 떠 넘김,회사를 지속하려고하는지 모르겠음 제발 신입사원쫌뽑으세요
2.7,한솔신텍(주),2022. 02,2점,"""직원관리 안되고 때되면 사람 집에보내는 무책임한 회사임""",사내분위기는 좋음 년차쓰는데 눈치볼 필요없이 자유롭게 쓸수 있긴 함,기업 성장성은 눈꼽만큼도 안보이며 연봉인상이 없는 기업,열심히 일해서 돈벌었으면 직원들 복지에 신경쓰고 월급인상도 해줘야되는데 자기들 배불리기에 급급함
2.7,한솔신텍(주),2021. 08,4점,"""발전플랜트 업종이 대외적인 환경으로 악화되면서 회사경영이 어려워 졌으나 대체적으로 문화는 평이한 편임""",발전플랜트 설계에 대한 경력을 쌓기에 좋으며 연차는 일정에 맞게 쓸수 있음. 여름 휴가가 7일임,회사의 임원진 및 경영진의 대외적인 수주활동이 다소 부족한 것으로 판단됨,"신규 사업에 대한 수주로 회사의 비전을 보여주었으면 하며, 복지체계도 개선되었으면 함"
2.7,한솔신텍(주),2021. 06,2점,"""행정사무에서 공정에 대한 예측이 불가하였음
불량의 원인 또한 소재측면에서 원자재 가공 불량 등 과도한 일정을 푸쉬하기 위한 물량몰아넣기가 다소많음""",직원들끼리 서로 으쌰으쌰가 없음. 그러다보니 직원간의 간섭이 심하지 않고 서로 니일 내일 알아서 하는 편.,하도급업체의 다수분포로 인한 QC보증 불가 및 제품의 바이어 연계 등 경영측면에서 유지존속이 어려웠을만 하였음,신규 사업 추진에 대한 적극적인 추진의사 피력이 필요해보임. 과도한 M&A로 인해 직원들의 애매한 거취 등 보장이 없었다고 생각됨. 직원들의 복지측면에서도 불편한 점이 많았다고 생각됨.
