총점,회사,날짜,별점,요약,장점,단점,경영진에게
2.7,(주)코스온,2022. 01,2점,"""장업계중 안타깝고 불쌍한 업체 .
여기까지가 끝인가보오..""","다른회사 몇군데 돌다보니 코스온 직원들의
업무속도나 프로세스가 그나마 정말 잘되있었다는걸 느낌.
다닐때는 몰랐음...","오너 돈관리실패..많은 임원들의 환장콜라보..
그나마 지금은 다나갔고 갈데없는사람들만
남았다던데","공장,설비다팔고 돈해결하고 초심으로 돌아가도록
가까운 절에가서 108배올리시길"
2.7,(주)코스온,2022. 01,3점,"""다양한 개발환경을 배울수 있었음
작은회사에서 한순간에 커져서 고생이 많았었지만 나름 배울만 한 환경이었음""","신입사원이 다니기에 괜찮은 회사였어요
나름 다양한 분야를 베울수있음
야근 수당 있었음 지금은 모르겠네요","비효율적인 업무작업, 연차쓸때 눈치 보였었어요
복지가 없어서 좀 아쉬움",직원들이 성과내면 보상해 줄수있 환경이 되면 좋을것 같아요
2.7,(주)코스온,2022. 01,4점,"""업무 범위가 넓었지만 많이 배울 수 있어 내가 성장할 수 았었던 곳""","사람들이 좋았고 모든 부서가 협조적,
바쁜 시즌 빼고는 워라벨 괜찮은 듯","업무가 완성되는 프로젝트가 별로 없어서 커리어에 도움이 되는지 잘 모르겠다.
낮은 연봉.",업무 추진이 잘 되었으면 좋겠습니다.
2.7,(주)코스온,2021. 12,3점,"""회사는 좋으나 기업이 좋은 사람 많이 놓친 곳 윗선에서의 재무문제""","연차를 윗사람 눈치 안보고 쓸수 있음, 제조사치고 자유로운 분위기","재무 관리 심각, 윗선에서 내용 공유 안함, 위에 문제가 심각","직원들의 이야기에 귀를 기울여주고 지키지도 못할 약속은 하지마셨으면,,,"
2.7,(주)코스온,2021. 12,3점,"""신입이라면 배울점이 많았었던 회사였으나,,,,지금은 안타까움""","연차 미리 얘기하면 자유로운 편
통근버스 있음
사내 식당 있고 밥 맛있음","통근버스 놓치면 교통 까다로움
주변에 아무것도 없음
월급,,,","많이 아쉬움이 남습니다,,, 오래오래 다니고 싶었는데,,,"
2.7,(주)코스온,2021. 12,2점,"""가능성이 있을 회사 같았으나 아쉽게도 미래가 안보이는 곳""","연차 쓰기 어렵지 않고 칼퇴가 가능하다.
회사 분위기가 자유롭워 아침에 살짝 지각도 가능하다.",어느 순간부터 사내 정치가 있고 다양한 이슈가 너무 많아 정신이 혼란스럽다.,회사 규모를 키우는것도 중요하지만 그보다 내실을 먼저 채웠으면 하고 바래봅니다.
2.7,(주)코스온,2021. 11,1점,"""거의 뭐 없는 회사이다. 그냥 그렇고 하는 회사임 한번 다녀보는것도 괜찮은 생각이 든다...""",장점은 뭐 없다 그냥 다닐만하고 다니고 하는 회사 경력쌓을 만한곳이다... 하지만 그이상도 이하도 아니다.,야근도 많고 서류도 많고 그리고 눈치도 봐야하고.... 이런저런 이유가 있다.... 다른 회사가 좋을수도 있단 생각이 든다... 하지만 뭐 다녀볼만은 하다...,경연진에게 바라는 점은 없다... 그냥 아무것도 안하는것이 회사를 위하는 길인가 싶을 정도이다....
2.7,(주)코스온,2021. 11,5점,"""좋은회사였는데 대표하나로 인해 망해버린 안타까운 기업이네요""",연차 눈치안보고 쓰고 직원들이 너무 착하고 좋네요 기초라인 좋구요,인센티브 없고 지금은 자금이 없어 언제 어찌 될지 모르는곳,제발 직원들을 생각 하세요 직원들 다나가면 혼자 하실건가요
2.7,(주)코스온,2021. 10,3점,"""팀내 분위기가 매우 좋았고 프로세스도 확립된 편이었으나 경영 악화로 무너진 매우 아쉬운 회사""","연차 사용 시 눈치 안보고 사용 가능, 팀 분위기 좋음",월급이 밀린다는 치명적인 단점. 퇴사자들도 아직 밀린 연봉 못받은 상태,회사 경영을 더 신중하게 하셨으면 좋았을텐데…………….
2.7,(주)코스온,2021. 10,3점,"""실무자들의 의견을 반영하지 않는 기업""","수평적인 팀내 분위기(팀장 아래로)
자율적인 제품 연구 및 개발 가능
ERP 사용으로 업무 편리
구내식당","상여 없음
성과금 없음
상사들과 의사소통 불가
직원들이 모르는 윗사람들만의 일이 많음",말로는 직원들을 위한다고 했지만 그러지 않아서 지금의 코스온이 된 것 같네요
2.7,(주)코스온,2021. 09,3점,"""워라밸과 급여수준은 좋지만.. 재무가 불안정하고 다시 일어설 수 있을지 모르겠다""","연차를 마음대로 쓸수있다 반반차 가능 마이너스 연차제도있음
칼퇴 가능
급여 높음","임금체불, 급여 밀림, 경영진들은 나몰라라함 상폐직전임 회사가 너무 아깝다",직원들 신경 좀 써주고 공지를 제때 띄어주던가 제발!!!!!!! 노력을 하세요 좋은 회사 망해갑니다
2.7,(주)코스온,2021. 09,3점,"""업무 분위기는 좋으나 복지 및 급여 체제가 너무 불합리적.""",수평적인분위기. 연차사용 자유로움. 점심저녁식사 제공.,복지 전무. 연봉 및 상승률 타 기업대비 적음. 야근수당없음,회사가 성장할 수 있는 원동력은 맨파워로 생각됨. 직원복지및급여처우 생각부탁
2.7,(주)코스온,2021. 08,1점,"""이렇게 망할줄 알았어요
자기회사 코스닥 오른 엄청난회사라고 자랑하더니""",장점이라면 회사밥이 맛있었어요 그거하나는 인정합니다,"꼰대 짬있으면 일안하고 놀러다녀도 상관없고 밑에사람만 일하고
생산파트는 그냥 바퀴벌레보듯 보던 연구직 사무직 직원들 ㅋㅋㅋㅋ 개웃김",어차피 망한회사지만 그 경영진들로인해서 가정 개파탄난 사람들 한테 맞아죽는게 어떤지
2.7,(주)코스온,2021. 08,2점,"""상장회사였으나 현재 상폐 위기
공개매각으로 활로를 뚨으려하나 미래가 불확실하다""","대체적으로 자유로운 분위기 일에 여유가 있는편이다
부서마다 다르겠지만 윗사람 눈치를 크게 안본다","회사가 돈관리를 참 못한다는 생각이 든다
상폐 위기에 놓인건 무능력한 윗선들의 문제
매출액 대비 경영을 너무 못해 이익이 없다
연봉이 참 짜다",경영마인드를 좀 깨끗하게 가지고 내부적으로 무능력한 임원들은 과감히 내치고 혁신을 했으면 합니다
2.7,(주)코스온,2021. 08,4점,"""회사는 수평문화를 권장하지만 부문장(임원) 스타일에 따라
차이 분위기 차이 큰편""",기업문화 갠찬은편이며 연차사용이 자유로워 회사생활 하면서 자기계발이나 취미활동에 대한 목표도 잡을 수 있었음,"임원에 대한 환상 깨는분 몇 있었음. 업무적 소모보다, 감정 소모가 더 많은 날들이 있다 보니 일하러 회사가고 싶다는 생각 들 정도",직원들이 비슷한 이야기를 한다면 신중하게 고민하고 썩은가지는 쳐주기도 했으면 좋았을듯
2.7,(주)코스온,2021. 07,4점,"""괜찮았어요 나름 만족합니다 좋은 경험 쌓았고
다시 기회되면 다녀보고 싶어요""","장점은 일단 밥이 잘나오고 직원들도 대체적으로 다들 착합니다
잘해주시고 일도 나름 할만해요",단점은 거리가 일단 멀다는것이고 기본급이 그리되지않아요,"직원들 근무 환경 개선이 필요합니다
그리고 직원들에게 복지도 늘려주셨음합니다"
2.7,(주)코스온,2021. 07,4점,"""연구원이 대우받으면서 일할 수 있는곳. 좋은 연구소장님.""",연차를 윗사람 눈치를 안보고 쓸 수 있음. 개인 연구 공간 있어서 전념할 수 있음.,경영진의 생각이 자주 바뀌는 듯. 직원들은 열심히 하는데 경영 전략이 없는 듯,제대로 자금 확보를 해야 할텐데 무리한 투자로 회사가 휘청거려서 아쉽네요
2.7,(주)코스온,2021. 07,4점,"""회사 비전과 사람들 모두 열정이 있었으나 대표 한 명 때문에 골로 갔다.""","사람들이 착하고, 그나마 업계 중 체계 또한 잘 잡혀있다. 부서들간의 협업도 나름 잘 되는 편",열심히 일한 매출이 다 어디로 갔는지 모르겠는 .. 직원들은 벌고 돈은 흘러나간다,허튼 곳에 투자할 생각 말고 회사 직원부터 챙기세요..
2.7,(주)코스온,2021. 07,2점,"""망하기 전까지 다니기 좋은회사
사람들이 너무좋아요 소장빼고,,,,ㅋㅋㅋ""","연차 눈치안보고 다들 젊어서 재미나게 다닐수있어요
많이 배울 수 있어서 좋아여!!!!!!","월급이 적어도 너무 적음 ㅜㅜㅜㅜ
돈을 잘안씀
개발 기간이 너무 짧음","일좀 적당히 시켜주세요………………
돈 삥땅치지마세요 진짜!! 해도해도 너무함
우리가 벌어다주면 뒷돈챙기지마시고요"
2.7,(주)코스온,2021. 06,3점,"""야근많고 특정출신만 대우받는회사 그외 일하는 사람만 하고 능력자 몇사람으로 굴러감""","야근수당 특근수당 잘나옴, 노력하면 배울것또한 많음. 시설및 환경은 좋은편",일이너무많아 워라벨없음. 야근 특근 기본. 요즘엔 그나마 빨간날쉬지만 이전엔 모두 출근,진짜 일을하는사람에게 맞는 대우를 해줘야함. 결국 능력자는 모두 떠남
2.7,(주)코스온,2021. 06,2점,"""본사와 공장뿐 아니라 모든 부서간 소통 부재""",자유롭게 연차 쓸 수 있는 분위기 그 외 세세한 규제가 없어서 자유로운 편,"복지제도 중에 실제 사용가능한 것이 무엇인지 모르겠다.
각 팀간 소통의 부재로 회사에서 무슨일이 일어나는지 소문으로 대충 안다.
회사에 무슨 일이 있는지 아무도 관심이 없다. 그래서 지금 현재의 코스온이 되지 않았나 싶다. 매 달 나오는 급여만 받으면 되는 사람들에게 적합한 회사였으나 20년 말부터는 월급도 제때 나오지 않는다고 전해 들음. 목표없이 다니기 좋은 회사
각 자 자리에서 열심히 일은 했으나 회사에 돈이 없음....why?","회사에서 무슨 사업을 할거면 공유가 필요하지 않나 싶습니다.
자유로운 분위기 속에 회사 업무는 너무 폐쇄적입니다."
2.7,(주)코스온,2021. 06,3점,"""자기가 열심히 하면 괜찮은 평가를 받을 수 있는 곳 규모에 비해 체계는 없는 편이었음""",열심히 한 만큼의 평가는 받을 수 있었고 윗분들의 인품이 좋았습니다.,일을 주먹구구식으로 하는 경향이 있어서 삽질하는 것 같은 느낌을 받을때가 종종 있었음,여러사업을 벌이기보다 정해진 사업에 집중하여 예전의 영광을 찾길 바래봅니다
2.7,(주)코스온,2021. 06,4점,"""상황이 좋았으면 연구개발 배우고 성장하기 좋았을 것이다""","아주 센스있는 소장님, 실력있고 열심히 할 수 있는 스탭들까지.. 사람이 최고다",경영상황이 안좋아서 직원들끼리 만나면 퇴사 언제하는지 월급 언제 나올지 얘기하는게 주 일이었음,"어떻게 이 상황을 타진해 나가야 할지, 실제로 가능한 일을 이야기 해 줬으면"
2.7,(주)코스온,2021. 05,4점,"""빠르게 업무를 배우기 좋고 체계가 잘 잡혀있다.""",같이 일하는 사람들이 좋고 분위기가 좋다. 기본적인 복지가 다 갖춰있다.,윗사람들이 별로이고 기분파이다. 바쁠땐 너무 바빠서 워라밸이란 존재하지 않음.,"상황 공유를 잘 해주면 좋겠다, 사람을 소중히 여기면 좋겠다"
2.7,(주)코스온,2021. 05,3점,"""화장품 제조사로 큰 도약을 기대했으나 여러가지 내부 외부 악재로 안타깝게 방향을 잃어버린 비운의 회사""","자유로운 분위기 , 오래일한 직원들간의 연대감이 좋음.","무리한 사업 확장으로 인한 재정난, 임원들이 많아 산으로 가는 정책",내부가 튼튼해서 외부에서 오는 바람을 막아낼수 있흡니다
2.7,(주)코스온,2021. 05,2점,"""오너리스크가 분명한 회사
직원들이 대표 마인드로 일하는 회사""","워라벨이 좋음
부서간 업무 분담이 확실함
부서간 업무 소통 이 매우 좋았음","오너리스크로 인한 회사 붕괴
경영진들의 직원들에 대한 배려심 부족",하다 못해 직원들에게는 솔찍하게 얘기 해줘서 설득 했으면 좋았을 것을 직원들이 너무 좋았는데 매출 2천억 까지도 바라볼 충분한 회사 였는데 아쉽습니다
2.7,(주)코스온,2021. 05,1점,"""퇴사한 지 곧 반년이 되어가는데 아직 임금이랑 퇴직금 못받았어요""",연차 반차 자유롭게 쓸 수 있게 장점입니다. 고객사들에 납품을 하지 못하기에 거의 대부분의 고객사들에게 손절당해서 일이 없어요. 정말 편하게 근무하실 수 있습니다. 왜냐면 일이 없으니까요! 일도 없고 월급도 없는 편안한 근무환경이 최고의 장점입니다.,알바할때도 월급 밀린 적이 없는데 회사에서 무슨 임금이 밀리나요 여기 답없어요 내 돈 내놔요 공장은 돌아가는 지도 모르겠구요. 제 돈 좀 주세요. 요즘 세상에 누가 월급을 떼어먹습니까?,내 돈 내놔라.... 꼭 소송까지가서 끝을 봐야겠니...
2.7,(주)코스온,2021. 05,3점,"""임원에 의한, 임원을 위한 회사
임금체불 후 대응이 매우 미흡한 회사""","복지) 연차사용이 용이하며 반반차(2시간) 사용이 가능함.
연장근로수당(야근수당)이 별도 지급됨.
업무) 신입의 경우 상급자에게 직업훈련을 받기 적절함.
업무 분배가 비교적 잘 되어 있었음.","연봉인상율이 저조하며 내부주차가 어려움.
미수금 등 안좋은 소식들로 인해 앞으로 성장이 어려울 것으로 예상됨.",신규 경영진이 곧 투입될 예정이라고 들었으니 대표만 배불리지 않고 남은 직원들에게 잘하길
2.7,(주)코스온,2021. 05,3점,"""OEM사로 국내 AP계열 및 해외 매출이 중점""","1. AP계열 및 해외 고정기업 수주 보유
2. 국내 10위권내 매출
3. 오산1공장 및 2공장
4. 기초 및 색조 연구진","1. AP 및 해외고정기업에 수주가 몰려있음
2. 화장품업계 해외수출 저하
3. 2공장 매각
4. 주가급락",특정 수주기업 의존금지 및 무리한 확장 주의 및 연구진 타사 대거 이동을 막기위한 대처 미흡함에 대해 개선이 필요할듯
2.7,(주)코스온,2021. 05,2점,"""코스온 자체만으로는 훌륭했으나 경영진 때문에 어려워진 회사""",직원들이 열심이었던 회사였으나 무능한 대표와 경영진 때문에 망하게 된 회사로 안타까움,경영진과 대표의 무능력과 그 주변에 있는 무능력한 사람들... 잘하는 사람은 모두 나가고 현재는 갈데 없는 사람들만 남아 있음,경영진과 자회사 때문에 아깝게 된 회사
2.7,(주)코스온,2021. 05,2점,"""사람들이 좋으며 일 배우기에는 좋은 회사지만 경영이 아쉬운 회사""","자유로운 연차 사용
좋은 동료들
구내식당
업무 프로세스","월급의 불안정성
인센티브 없음
복지 없음
교통이 불편함",회사 경영의 문제로 회사가 어려워져 업무에 지장을 받아 안타까움
2.7,(주)코스온,2021. 05,2점,"""사람들 좋고 밥도 맛있었으나 회사가 어려워져 다들 퇴사함""",사람들이 좋고 밥이 맛있습니다. 공장 시설이 깨끗합니다.,회사 사정이 어려워져서 퇴사를 하였습니다. 공장으로 가는 교통편이 불편함,경영 정상화가 빨리되었으면 좋겠습니다.
2.7,(주)코스온,2021. 04,3점,"""화장품 업무 배우고자 하는 분들에게 추천""","연차 자유롭게 쓸수있음, 자기업무만 끝내면 칼퇴가능, 통근버스가 있어서 자차없는 사람들도 출퇴근 가능","문서작업이 많아 비효율적, 부서 간 업무 떠넘기기가 많음, 직원들에 대한 복지제도가 열악함.",힘들게 일하는 직원들의 처우대한 고민이 좀 더 필요할것으로 생각됨.
2.7,(주)코스온,2021. 04,2점,"""내가 한 만큼의 대우가 없다고 봐야하며 직원들을 뭐 보듯이 봅니다.""","일을 할때 편하고, 자유로움이 많습니다.
쉬는 시간이 정해져 있지만, 그 쉬는 시간을 짐키는 사람이 없습니다.","윗사람이 있으면 배울 수 있는 범위가 적어집니다.
일을 강제적으로 단순 반복작업을 해야하는 경우가 생깁니다.",직원들을 먼저 생각하고 복지를 좀 만들어 줬으면 좋겠습니다.
2.7,(주)코스온,2021. 04,3점,"""회사 분위기가 나쁘지 않고 동료들도 착함
무능한 경영진 때문에 회사가 망했음.""","연차 반차 반반차까지 자유스럽게 사용 가능함
사내 정치가 거의 없음","변화사 없음
경영진 많이 보주적임
회사 복지 거의 없음",투자를 제대로 했었으면 회사 망하지 않았을.........
2.7,(주)코스온,2021. 04,3점,"""기술력도 좋고 부서간 협업도 좋고 실무진들도 좋은데 현 상황이 너무 안타까운 기업""",실무진들도 실력이 있고 부서간 협업이좋다. 화장품업계에서도 평이 좋음,최근 경영의 문제로 자금이 묶인건지 재무상황이 안좋다고한다.곧 나아진다는데...,지금 상황이 너무 안타깝습니다. 정상화 빨리 부탁드립니다.
2.7,(주)코스온,2021. 04,1점,"""사람들이 좋고 다 같이 으쌰으쌰 하는 분위기 지금은 너무나도 안타까운 회사""",연차 눈치 안 보고 상사분들도 다들 좋았고 분위기 좋은편,경영진분들께 속았습니다 왜 좋아질거라고 하셨어요ㅜㅜ,희망적으로 말고 현실적으로 제발 말해주세요 제발.....
2.7,(주)코스온,2021. 04,2점,"""규모가 큰 회사에 이나 막상 들오가보면 작은 회사처럼 느껴지고 실감나지 않음 체계가 부족하고 급하게 하는 느낌입니다 더 자리잡ㅇㅏ야할 것으로 보임""",프리란 분위기이나 회사가 휘청이더니 급여를 미지급함 복리후생도 나름대로 괜찮고 좋았으나 점점 상황이 언좋아져서 아쉽게 되았습니다,너무 변동이 많고 재대로 되는 부분이 적음 급여를 늦게 주는개 최대 단점,약속한 말은 제 때 지켜줬우면 좋겠습니다
2.7,(주)코스온,2021. 03,3점,"""워라벨이 가능하지만 현 상황으로썬 안타까운 회사""","1.식당 잘되어 있음
2. 통근버스 잘되어 있음
3. 복장 자유
4. 사람들이 좋고 자유로운 분위기","1. 부서간 일을 떠넘기는 경우가 있음
2. 재정상태가 어려워 월급이 밀림
3. 오너의 판단 실수",회피 하지말고 현재 회사 상황에 대한 책임을 져줬으면
2.7,(주)코스온,2021. 03,1점,"""급여 지급이 안되는 회사입니다. 현재 2개월치의 급여가 미지급상태라고 합니다.""","단순 보고를 위한 문서 작업은 자체 개발한 ERP 프로그램으로 운용하고, 견적서 등은 홈피가 구축되어 있어서, 쉽게 작성할 수 있습니다.","화장품 본업에 충실하여야 하나, 본업외 투자를 통해 큰 이득을 취하려는 회사입니다.",화장품 본업에 충실했으면 합니다... 집중이 안됩니다.
2.7,(주)코스온,2021. 03,3점,"""회사는 좋음
경영악화로 인하여 어쩔수없이 나옴""",말그대로 눈치 많이 안보임 다들 잘해줌 너무 잘해줘서 내가 무기력해질수있음,단점 없음 일할때도 불편한거 딱히 못느낌 다만 경영악화로 인하여 월급밀려서 너무힘들어서 나옴,나름 열심히 노력해주시는데 뭐.. 바랄게 있습니가
2.7,(주)코스온,2021. 03,3점,"""현재 상황이 오기전까지는 커리어 쌓기 좋았으나,,,,,,,,,,,,,,,,현재는 상황이""","연차 사용 자유로움
구내식당이 맛있음
통근버스가 있음
업무 배우기 좋았음","임금지연이 현상황에 가장 큰 단점
위치가 대중 교통이 불편함","뒤늦은 공지사항 지키지 못하는 약속
빠른시일안에 원만히 해결되길바랍니다."
2.7,(주)코스온,2021. 03,1점,"""대표얼굴을 본적이없어요 또 마케팅팀 나이많은 마녀때문에 최악""",간섭이없다 칼퇴다 경쟁이없다 돈에대한압박이없다 장점이없는데 오쪼지,연봉동결을 일방적으로한다 공채가없어 명문대와 지방대와 고졸이 동등하게취급된다 최악이다,룰루랄라 사람 너무 ㅁᆞㄷ지마세요 룰루랄라 나오길잘했다
2.7,(주)코스온,2021. 03,3점,"""실무진들은 좋지만 윗분들께서 문제점을 자각하고 해결해야할듯합니다""","통근버스 5대 운영중이고 자취비용 50%부담해줌(지금은 경영사정상 못내주는거로앎)
자체 식당에 풀무원과 계약해서 맛있는밥 제공됨
실무진들 인성 좋음","경영진이 투자를 잘못해서 월급이 밀리는 상황
일 잘하나 못하나 월급은 똑같고 인센티브도 없음
보상체계를 이제 잡는다고하는데 글쎄..",경영진이면 책임감있게 일해주셨으면 좋겠고 일할수있는 동기를 만들수 있는 환경이라도 만들어줬으면 좋았겠다는 생각이 듭니다
2.7,(주)코스온,2021. 03,2점,"""제목은 직원들이 좋다로 하겠습니다 하지만 경영실패를 곁들인""","1. 구내식당 (중,석식 지원)
2. 같은 팀 내 좋은 분위기 (일부는 아님)
3. 자유로운 분위기
4. 연차가 자유로움","1. 월급이 안나옴.
2. 경영이 투명하지 않음.
3. 대표이사의 잦은 거짓말
4. 미래만 지향적인 회사
5. 직원들을 챙기지 않음.
6. 문제가 생길시에는 항상 통보식
7. 이직하려고 하는 사람이 많음.","할말은 많지만 하지 않는다.
경영을 어떻게 하는건지 모르겠고, 거짓말을 하지 말자.
임원들이 항상 블라인드 와 같은 어플이나 잡플래닛을 보고 있을거다."
2.7,(주)코스온,2021. 03,3점,"""회사 전반적인 시스템은 좋은듯. 상호커뮤니케이션 화합이 낫베드""","연차 윗사람 눈치 안보고 쓸 수 있음
회의가 많아서 부족한 부분을 채울 수 있음","야근을 피할 수 없음
상사 눈치밥 먹느라 배가 부름..",과한 투자로 인해 직원들 월급을 밀리게 하는 일이 없도록 했으면 좋겠음
2.7,(주)코스온,2021. 03,2점,"""현재 회사 상황상 전체적인 분위기가 너무 다운되어 있음""","칼퇴, 사우간 사이가 좋음, 타부서와 큰 트러블이 없음","앞에 적은것들을 제외 하면 장점이 그닥..
회사가 앞으로 어떻게 될란지...","제발 미리 얘기좀 해주고, 진정성있으면 좋겠습니다.
회사 돌아가는게 외부가 더 빠른게 말이 되나요"
2.7,(주)코스온,2021. 02,1점,"""재무상황이 안좋습니다.
직원들의 입장에 생각해주셨으면 좋겠습니다.
그래도 회사사람들은 착합니다.""","연차를 자유롭게 쓸 수 있습니다.
사내 분위기가 좋습니다.
직원들이 착합니다.",재무상태 최하 중 최하이며 미래가 없습니다. 월급이 밀립니다.,주식가지고 장난하지말고 직원들 월급이나 제대로 주세요.
2.7,(주)코스온,2021. 02,2점,"""다시가라면절대안갈회사에요.. 사내정치심합니다.
이것저것 하는것도많고 매일야근..""","이것저것 모든업무를다할줄알아야하기에
그만큼배우는건있을거임",수두룩...사공이 너무많은사내정치... ....ㅜㅜㅜㅜ,사공이많아서...지금은 어ㅉㅣ됐으련지........ㅜㅜㅜ
2.7,(주)코스온,2021. 02,2점,"""연봉이 적고 업무량이 많을 땐 사람 굴리는 편 또래들과 일하는 자유로운 분위기""",건물 깨끗하고 구내식당 제공 나름 수평문화 셔틀 운영함,연봉 적음 연봉협상 폭 적음 승진했다고 연봉 오르지 않음 보고를 위한 보고가 잦음 복지 없음,투자 적당히 해줬으면 재직자들 우선순위로 직원 경영부터 해주시길 복지 개선 바람
2.7,(주)코스온,2021. 02,1점,"""20년 하반기부터 급여 엄청밀리기 시작함. 약속도 안지킴""",연구원한테만 있는 기숙사 지원제도 그 외 생산직은 혜택도 없음. 연봉도 우리만 1/13임,"급여밀림, 복지없음, 대표가 거짓말 엄청함, 임원들 멍청함 진짜 멍청하고 권위의식만 가득한 꼰대들임, 직원들 어떻게되든 전혀 신경안씀",뭐 바란다고 불러도 이상한소리만 하고 이젠 바라지도 않습니다. 바란다고 들어줄건가요??
2.7,(주)코스온,2021. 01,3점,"""개인의 역량 및 마음가짐에 따라 발전의 정도가 다른 곳""","실무진들과의 단합 잘되는 편이라 인간관계에 대한 스트레스 적은 편
직급이 낮아도 기회가 있는 편","현재 기업 상황이 힘든 것으로 알고 있음
잠재력과 성장가능성이 있는 회사지만 언제 다시 회복될지는
미지수",더 이상 비효율적인 투자는 그만하고 내부 기반부터 다졌으면
