총점,회사,날짜,별점,요약,장점,단점,경영진에게
2.5,화신테크(주),2021. 02,3점,"""자유로운 분위기 연차 편하게 사용 가능함 눈치 안봄
분위기 좋고 사람좋음""","사람들은좋음 직원들과 관계가 좋고 식당 밥도 맛있음
연차 안쓰면 나중 돈으로 보상 출퇴근 눈치 안보고편하게 할수있음","연봉이 안오름 기술력이 부족하고 출퇴근이 힘들음
상과금도 없고 노조 파워가 쎄서 관리직 불만
기술 계발이 필요합니다",연봉 인상 필요함 명절 여비도 인상 필요하고 승진적체되어 승진도 필요 많은 개선이 필요합니다
2.5,화신테크(주),2021. 01,2점,"""경영권 분쟁이 난무하는 주인없는회사
야근 없고 일도 없음""","밥 잘나옴, 연차 자유롭게쓸수있음, 야근없고 칼퇴근 가능","새로운 경영진이 서울에 있으며 현재 금형사업을 중단한 상태임
주인의식이 없고 각자 업무를 중구난방으로함","체계를 확실히 잡고
새로운 영업을 하던지 기존영업을 하던지 결정을 정확하게 해주셨음 합니다"
2.5,화신테크(주),2021. 01,2점,"""경영불화 및 품질문제로 고객사로부터 클레임을 밥먹듯이 받는회사. 더이상의 발전은 없다. 망한회사""","생산 및 기술부서를 제외한 타부서의 경우, 출퇴근 눈치 안봐도 된다.","경영진 및 임원/팀장급 관리자의 능력부족으로 현장작업자 관리가 되지 않고, 생산/품질에도 많은 문제점을 남겼다.","제대로된 회사 사업계획 및 규정,방침, 관리가 필요합니다. 전문경영인이 와서 경영을 해야됩니다."
2.5,화신테크(주),2020. 09,2점,"""대구에서 근무하기에는 적당한 회사
급여수준은 중간정도""","출퇴근 이점있으나 현풍공장 출퇴근 별로임
기숙사 지원없음","회사경영악화로 문제
경력직 퇴사문제로 근무인력이 없음
경영진들의 급여 압박이 많음",경영악화로 인한 문제에 대해 결단이 필요
2.5,화신테크(주),2020. 08,2점,"""현풍사시는 분들 아니면 그닥 추천하지 않습니다.
경영진이 바뀌면서 봉급체계나 인사 운영부분이 모두 바뀌어버림""","현풍에 위치, 자동차 주물 금형에 대해 배우고 싶은 사람에게는 추천하나 딱 거기까지.","현장 관리 부재, 낮은 맨파워와 운영방식, 부사졀 업무 경계 불분명","경영진이 바뀌어서 딱히 멘트가 할게 없음.
전문경영인이 있을때는 그나마 회사가 어떻게든 굴러갔으나 그분이 퇴진 후 대책이
없음,"
2.5,화신테크(주),2020. 07,1점,"""한때 이름있는 금형회사가 망했다
이제는 화신테크라는 이름도 찾기 힘들고 사람도 찾기 힘들다""",화목하고 밝은 사무실 분위기 업무 협조가 아워홈이 들어와 밥이 맛있다,"경영진 때문에 회사가 망했고 사공이 많아 산으로 간다
일이 없다...수주도 못받고 현장에서는 경영진 눈치 본다고 가라 보고자료가 많네요",회사를 팔아 이득본다고 125명의 직원을 버렸냐
2.5,화신테크(주),2020. 02,2점,"""힘들었던 회사 그이상 이하도....요즘 바이오기업으로 탈바꿈""",밥이 괜찬앗고 그 외에는 딱히 장점이라고 할만한게 없엇음,긴 근무시간 힘든 작업 현풍이라는 조금은 외지인곳 ...,앞으로 탈바꿈 해서라도 승승장구 할수잇는 기업이 되길...
2.5,화신테크(주),2020. 02,2점,"""국내 자동차 대기업 1차밴더로 1차밴더의 업무를 배울 수 있는 곳""",업무 기량에 따라 개인의 성장 기회가 다르며 다양한 업무 경험 가능,개인의 성장이 직급이 올라가는 승진을 뜻하는건 아님. 승진은 나이 순으로 진행되는게 가장 큰 흠,경영에 보다 적극적인 의지가 있었으면 함
2.5,화신테크(주),2020. 02,3점,"""새로운 사업 변경 추가로 인해서 재 도약의 시기임. 기존 사업의 방향성또한 추진중""",새로운 사업 변경 추가로 신사업 발굴이 추진성이 있음.,기존의 사업이 어떻게 진행되는지 여부가 아직은 잘 모름.,새로운 사업을 토데로 열심히 잘 이끌어가길.
2.5,화신테크(주),2020. 02,2점,"""주주가 바뀌고 현재 업무량아 많이 줄어서 어려워지고 있음""",금형기술로 많은 노하우 및 선임자가 많으며 기술력은 많이 가지고 있지만 현재 회사가 많이 않조으며 많은 살마들이 왔다갔다 하고 있는 실정,현재의 인원감축 및 예전 윗 사람들이 많이 나가서 지금은 자리 지키고 있는 사람만 있으며 능력을 가진 인재들은 다들 다른 회사로 이직하고 있어 이런 점을 보안해야함.,본래의 화신테크 초기 회사로 돌아가기를 바람
2.5,화신테크(주),2020. 02,3점,"""경북 지방에서 금형을 배우기에는 좋은 환경""",적긴 하지만 복지나 수당이 정확하게 지켜지며 대구 지역에서는 나쁘지 않은 연봉,"기존 대구 공장 조직의 정체화 , 현풍 공장 확장으로 인한 새로운 인원 유입이 반대로 기업문화가 짬뽕되어간다.",경력때문에 정체되고 실무력이 떨어지는 인원을 정리할 필요가 있다. 호봉제가 아닌 업무 능력을 기준으로 하는 실제적인 임금으로 직원 경쟁력을 재고 해야 한다.
2.5,화신테크(주),2020. 01,3점,"""전직원모두 일에의욕이넘치는 회사
대기업 하청업체로 망하진않을거같음""","복리후생이탄탄한편
체계가 탄탄하게잘잡혀있음
자체그룹웨어사용
야유회등 복지가 좋음","그당시퇴근시간이 정해져있지않앗음
사무실사람들모두 잔업을하는수준","기억이나진않지만 잔업을 줄이고
현장에로사항을 잘반영해주시길"
2.5,화신테크(주),2019. 12,2점,"""한때는 잘나갔으나 지금은 경영권 교체로 인한 불안정한 회사""",현기 1차밴드로써 금형 업계중 인지도가 높고 기업 역사가 있음,나이 많은 월급 루팡들 많으며 수직적인 업무 쳬계와 부서간 협력이 잘 안됨,경영진이 교체 된 만큼 혁신적인 체계로 직원들이 안정되게 일할 수 있는 환경을 구축해야함
2.5,화신테크(주),2019. 11,3점,"""""미래가 있었으나 점점 희미해져가는 등불""""","가족친화적이고 현장 또 한 가족친화적 다들 형 동생하는 사이
연차 쓰는데 눈치 볼필요 없고 퇴근시간도 자유적","1세대 아집들 때문에 점점 잃어가는 희망
실무자 우선이 아닌 윗 선들의 희미해져가는 판단력",실무진들에게 제대로 된 기회를 주시고 장비가 아닌 사람에게 투자 부탁드립니다.
2.5,화신테크(주),2019. 10,2점,"""여길다니면서 내가 왜 다니고 있는지 도저히 모르겠음ㅋㅋㅋ""",동종업계에 비해선 일은 편하고 밥은 잘나옴 일도 별로 없는걸로 들었는데 퇴근늦게함,부서간 협력 1도 안됨. 꼰대 팀장들 다수임. 말 안통함.,연봉좀 인상시켜줘요. 4년째 동결이 뭡니까 출장비 늦게줘. 회사카드막혀 어휴..
2.5,화신테크(주),2019. 10,3점,"""기업의 안정성이 떨어져 잠깐 일을 하기에는 괜찮은 곳입니다.""","야근 눈치없이, 원할 때에 퇴근할 수 있어 돈 욕심이 크게 없는 사람이라면 워라밸을 보장 가능","다만, 기업의 안정성이 떨어져 10년, 20년 다닐 마음이 있는 사람에게는 조금 불안한 기업일 수 있습니다.",회사의 뿌리를 단단히 하여 성장할 수 있는 회사가 되길 바랍니다.
2.5,화신테크(주),2019. 10,1점,"""고인물들로 인한 성과 없음 화신관계없음으로 하락만하는 회사""",동종업계 타회사 대비 업무가 편한편 현장직은 좋은회사 사무실은 글쌔,기업의 궁극적 목적인 영업이익을 어떤수로도 해결하지못하는 능력없는 회사,회사 경영 개편 극도로 필요 앞으로의 미래가 보이지않는 회사 이미지 쇄신 필요
2.5,화신테크(주),2019. 06,3점,"""현장근무직 사무직 근무여건 복지는 좋으나 고인물이 많음""",업무량에비해 급여부분이 좋음 복지좋음 새로생긴 공장에 새거새거새거,고인물 불필요한 인원들이 속속들이 보여지는게 있음 업무강도는 바쁜사람만 바쁨,고인물 고인물이 회사를 이끌어 가지는 않는거 같습니다
2.5,화신테크(주),2019. 05,2점,"""화신에서 나온 뒤 꾸준한 하락으로 미래를 알 수 없는 기업.
앞으로의 5년 후를 예측할 수 없음.""","서로 서로 신경을 잘 안쓰는 사내 문화.
1-2년 경력쌓기 좋은 회사.
인원이 많지 않아 협업하는 업무가 다수 존재.
전반적인 업무의 흐름을 파악하기 좋음.","업무의 강도가 강하지 않으나 업무의 질 또한 보통.
자신의 전문성을 기르기엔 다소 부족한 기업.
하지만 연봉을 조금 포기하면 무난한 회사생활 가능.","전문 경영인을 고용하여 회사의 미래에 투자할 수 있는 눈을 기르길 바람.
사업 다각화를 통한 경영난을 극복할 방안을 구색해야 함."
2.5,화신테크(주),2019. 10,2점,"""여길다니면서 내가 왜 다니고 있는지 도저히 모르겠음ㅋㅋㅋ""",동종업계에 비해선 일은 편하고 밥은 잘나옴 일도 별로 없는걸로 들었는데 퇴근늦게함,부서간 협력 1도 안됨. 꼰대 팀장들 다수임. 말 안통함.,연봉좀 인상시켜줘요. 4년째 동결이 뭡니까 출장비 늦게줘. 회사카드막혀 어휴..
2.5,화신테크(주),2019. 10,3점,"""기업의 안정성이 떨어져 잠깐 일을 하기에는 괜찮은 곳입니다.""","야근 눈치없이, 원할 때에 퇴근할 수 있어 돈 욕심이 크게 없는 사람이라면 워라밸을 보장 가능","다만, 기업의 안정성이 떨어져 10년, 20년 다닐 마음이 있는 사람에게는 조금 불안한 기업일 수 있습니다.",회사의 뿌리를 단단히 하여 성장할 수 있는 회사가 되길 바랍니다.
2.5,화신테크(주),2019. 10,1점,"""고인물들로 인한 성과 없음 화신관계없음으로 하락만하는 회사""",동종업계 타회사 대비 업무가 편한편 현장직은 좋은회사 사무실은 글쌔,기업의 궁극적 목적인 영업이익을 어떤수로도 해결하지못하는 능력없는 회사,회사 경영 개편 극도로 필요 앞으로의 미래가 보이지않는 회사 이미지 쇄신 필요
2.5,화신테크(주),2019. 06,3점,"""현장근무직 사무직 근무여건 복지는 좋으나 고인물이 많음""",업무량에비해 급여부분이 좋음 복지좋음 새로생긴 공장에 새거새거새거,고인물 불필요한 인원들이 속속들이 보여지는게 있음 업무강도는 바쁜사람만 바쁨,고인물 고인물이 회사를 이끌어 가지는 않는거 같습니다
2.5,화신테크(주),2019. 05,2점,"""화신에서 나온 뒤 꾸준한 하락으로 미래를 알 수 없는 기업.
앞으로의 5년 후를 예측할 수 없음.""","서로 서로 신경을 잘 안쓰는 사내 문화.
1-2년 경력쌓기 좋은 회사.
인원이 많지 않아 협업하는 업무가 다수 존재.
전반적인 업무의 흐름을 파악하기 좋음.","업무의 강도가 강하지 않으나 업무의 질 또한 보통.
자신의 전문성을 기르기엔 다소 부족한 기업.
하지만 연봉을 조금 포기하면 무난한 회사생활 가능.","전문 경영인을 고용하여 회사의 미래에 투자할 수 있는 눈을 기르길 바람.
사업 다각화를 통한 경영난을 극복할 방안을 구색해야 함."
2.5,화신테크(주),2019. 04,3점,"""금형 업계특성상 근무시간이길고
근무시간이 공수라고생각해
긴근무시간을 장려함""","대구지역에서는 급여가 높은편
회사사정상 연차사용 장려
부서에따라 근무강도차이가 심함
금형업계 대부분의 경력직이
이 회사를 거쳐갔다고봐도됨
금형업계에서는 유명한업체","일을 하는사람에게
일이집중됨
능력있는 분들은 대부분퇴사한듯
대구에서 조금 떨어진곳에 위치해서
출퇴근 문제가 있을수있음","최근 경영진 교체
지속적인 투자가 진행되야된다고
생각함
금형업 전반적으로 사정이 좋지못하는게
아쉬움"
2.5,화신테크(주),2018. 11,3점,"""충분히 성장가능하고 배울 것이 많다고 생각합니다. 지원해보세요. 금형에 대해 배우기 위해서는 여기보다 좋은 곳은 없다고 생각합니다.""",가족같은 분위기라서 일하기 좋습니다. 군대분위기 아닙니다. 회식도 한달에 한번 있을까말까해서 좋습니다.,잔업이 많습니다. 워라벨을 중요시 여기시는 분은 지원을 다시한번 고려해보십시오. 그리고 연봉은 몇년째 동결이였으나 이제 오를 수도 있습니다.,"직원들을 조금 더 신뢰하며, 경영진과 함께하는 회의를 줄였으면 좋겠습니다. 매번 회의로 인해 업무가 원활하게 돌아가지 않음을 느꼈습니다."
2.5,화신테크(주),2018. 10,3점,"""대구 자동차 금형 메이커로써 금형을 경험 쌓기에 좋은 기업""","보수적이고 군대 계급의 대구 에서는 다소 열린 분위기 ,일하기 편한 환경,성과 인정해 주는 분위기가 장점입니다.",대부분의 업무가 고정되어 있고 이미 체계화가 되어 있어 변화가 적습니다. 다양한 경험과 새로운 지식을 연구 개발을 하고 싶은 분들에게는 반복적인 프로젝트 업무가 지루 할수 있습니다.,"새로운 기술에 투자하고 업무를 좀더 효율적으로 개선할 필요가 있습니다.
회사내에 인력 구조가 상당히 폐쇠적이고 친목이 업무를 방해 하고 생산성 저하로 이어질수 있음을 알고 새롭고 열정적인 젊은 인력의 필요성을 인식 하길 바랍니다."
2.5,화신테크(주),2018. 08,1점,"""꼰대 문화가 즐비하며 업무 체계가 안잡힌 회사, 시간이 갈수록 하락세가 보이는 회사""","대구 경북 지역 금형 업체중 큰 회사임. 현풍 신설 공장으로 근무 환경 쾌적, 높은 연봉",기존에 근무 연수가 오래된 부장급이상 직원들의 꼰대문화와 일 터지면 부서간 협업이 되지 않으며 서로 책임을 미룸,부장급 이상 직원들의 관리가 필요하며 현대 1차 협력업체중 이미지 쇄신이 관점
2.5,화신테크(주),2018. 08,1점,"""회사 사정이 갈수록 안좋아짐 매우 어려움 체계적이지 못한 업무분장 업무이해도가 낮음""",급여는 잘나옴 현풍공장 이전후 새건물이라 환경은 나쁘지 않음,체계적이지 못한 업무분장 업무의 이해도가 낮고 성장가능성이 낮음,합리적인 복지 및 보상체계를 마련하고 직원들의 성장 기회를 마련해줬으면 좋겠다
2.2,(주)일야,2022. 04,3점,"""여러가지 사업을 추진중이나 코로나 등 외부환경의 악화로 어려움을 겪고있음.""",어려운 경영상황으로 직원간의 유대관계는 좋은 편이며 업무강도도 적당한 수준임. 주5일은 근무 야근은 가요 안함,경영진의 능력이 아쉽지만 한계점에 달하였음 최근 몬 역량을 집중해 샤브샤브 프랜차이즈 사업에 뛰어들었지만 코로나 직격탄으로 실적의 단기적 호전은 난망해보임,지금이라도 사업구조의 개편과 인력에 대한 업적평가를 통한 냉정한 신상필벌이 필요해보이며 기존 직원들에 대한 합리적 보상기준도 마련해야 할 듯
2.2,(주)일야,2022. 03,4점,"""사람들이좋고회사가변화하는시기 업종전환에성공하면 다시한번 전성기""","연차사용이자유로움
사람들이친절하고모난사람이없다
과도하지않은업무량","급여가높은편이아니다
업종전환으로 프랜차이즈업을하고있지만 코로나로 실적저조","업종전환으로힘든시기인건알지만직원들복지좀신경써주세요
열심히일하는직원들사기진작해주세요"
2.2,(주)일야,2022. 02,2점,"""인천 남동공단의 중소기업의 표본을 보여주는 회사입니다.""",코스닥 상장사이다보니 이직할 때 수월하게 옮길 수 있었음.,"엘지전자 mc사업부에 너무 치중되어, 엘지 mc사업부가 없어지면서 자연스레 회사도 몰락",직원들의 불만을 내치기 보다는 수용하는 자세가 필요했음.
2.2,(주)일야,2022. 02,1점,"""21세기에 이런 회사도 있다는 사실을 알게 해 준 회사""","역세권 - 5호선 마곡역과 사무실이 근접해있다.
신축 빌딩 - 오피스 환경 깔끔
연차 당겨 쓰기 가능","100% 수기 기안 및 품의 (전자 결재 X)
임원급 월루 너무 많고, 회사 경영에 악영향을 미치는 듯?
진실보단 거짓이 너무 많다",적당히 하세요 ㅎㅎㅎㅎ 꼬리가 길면 밟히는 법
2.2,(주)일야,2021. 10,3점,"""구내식당 및 기숙사 있음.
기숙사는 주로 생산직 사원이..""","위에 쓴것처럼 기숙사, 구내식당 있었음. 직원들간 분위기가 나쁘지 않음.",글쎄.. 미래를 보면 계속 다닐만한지는 고민해봐야할듯..,"직원들에게 회사의 비전을 보여주셨으면 하네요..
이 외에는 딱히.."
2.2,(주)일야,2021. 09,2점,"""LG전자 모바일 사업부 1차 밴딩 업체이며
나름 상장기업이다. 직원들은 외국인 근로자 포함
200명은 넘는 나름 큰 회사이다.""","나름 큰 회사다 보니 업무 분담은 정확하다.
회사내에 구내식당이 상당히 크게 있어서
밥 먹으러 가는 시간 절약 이부분은 아주 좋다.
휴게실 및 자판기 설치되어 있다.","정직원 되는게 무지하게 힘들다.
잘 안해주려고 한다.
정직원이 된다 해도 연봉 잘 안올려준다.
정직원 되서도 시급제다.
무엇보다 진급이 너무 힘들다.","직원들의 조그만한 목소리라도 들어줄수 있는 경영진이
너무나 없는거 같다.
들어오는 사람 안막고, 가는 사람 안잡는다.
이 마인드 버리고 신입이라도 그 직원의 가능성을
열어줄 생각을 했으면 좋겠다.
불량 난다고 소리만 치지 말고
근본적인 원인을 해결해주길 바란다."
2.2,(주)일야,2021. 09,3점,"""업무강도가 쎄지않은 어느정도 적절히 보상받을 수 있는 회사
하지만 돈을 너무 많이쓰는 사람들이 너무 많다""","연차를 자유롭게 쓸수 있고 눈치 안보고 쉴 수 있는점 그점은 매우 좋다
직원들도 프리하고 좋지만, 윗상사들이 항상 문제
자금적으로 여유로울때가 있지만 그게 얼마안간다","구식이다. 전자결재시스템이 아닌 항상 종이로 보고하고
구글메일 이런걸 안쓴다. 소통이 그래서 매우 부족하다","회사 돈을 마음대로 쓰는것이 아닌 직원들을 위해
복지가 매우 필요하다
그래서 매우 충실하던 직원들이 다 나가지 않았나 싶다"
2.2,(주)일야,2021. 09,1점,"""여러가지 경험은 할 수 있으나 많이 힘듦""",여러가지 업무를 할 수 있어서 스펙을 키울수있다 월급이 밀리지않는다 밥이 맛있다,일이 너무 많다 퇴사율이 높다 팀간 협업이 잘 안된다 고객사가 너무 타이트하다,팀간 협업이 잘 이루어지게 이끌어주시면 좋겠습니다
2.2,(주)일야,2021. 07,2점,"""군대식 문화가 아직도 남아있는 회사
매출 떨어지면 사람부터 정리하는 회사""","사내 식당이 있습니다 맛은 없어요
생일날 케이크 줍니다 연차도 쓰라고 독려해주는 분위기","매출이 떨어지면 사람부터 짜르는 경영자 마인드
회사 시설이 오래되서 구립니다 주차장은 있으나 일부 직급만 사용 가능","신규 사업 아이템 선정이 잘못된거같숩니다.
직원을 대체품처럼"
2.2,(주)일야,2021. 06,3점,"""예전이긴 하지만.. 좀 정신 없었어요 부조리하게 느껴지는게 가끔있었습니다""",월급을 밀린적은 없습니다. 야근수당이나 초과수당을 누락하지 않고 주었습니다. 식당 밥이 맛있었어요..,정직성이 부족한 행동을 하는 분들이 몇몇 있었습니다. 그 행동이 회사에 도움이 되는 행동같지는 않았습니다.,되지 않는 부분을 되게 하라고 강요하기보다는 왜 안되는지 먼저 파악을하면 좋겠습니다.
2.2,(주)일야,2021. 01,2점,"""(인천.남동공단.제조업) 중소기업의 한계를 보여주는 회사임""",중소기업의 특성상 여러일을 접하면서 스킬업을 할수 있었고 같이 일하는 동료들이 괜찮았음,"사내정치, 낮은 급여수준 등이 여러움으로 다가오고, 워라벨 충족이 어려움",회사가 많이 어려워진걸로 아는데 lg에 올인하기 보다는 다각적인 시선으로 경영을 하면 좋겠음
2.2,(주)일야,2021. 01,1점,"""핸드폰사업을접으며 하락세를타기시작 프랜차이즈로업종전환하며 경영악화""",좋은사람들 편한업무량 워라벨보장 편한사내분위기를 통해 업무하기에는편한회사,직원을 너무 소모품으로생각해 구조조정이 너무잦음 식당밥도 업체변경으로 질이떨어짐,새로운직원보다기존직원들대우도좀해주셨으면합니다 연봉차이가 너무확납니다
2.2,(주)일야,2020. 08,1점,"""중소기업이라 그런지 시스템이 많이 부족한것같음""",사람들이 좋고 월급이 안밀리고 일이 크게 어렵지는 않다,시스템이 부족하고 직원들의 마인드가 살짝 아쉽다. LG 1차 협력업체이기 때문에 당연한거겠지만 LG가 너무 까다로워서 일이 힘들다,어떤 체계적인 시스템을 구축해서 업무를 진행하게 해주세요
2.2,(주)일야,2020. 08,4점,"""밥맛있고 사람들 좋습니다. 다들 잘 대해주시고 기숙사 있구요""","핸드폰 아세이 업체, 재미있고 선배들도 착해서 좋은기억.",계약종료 후 재계약이 힘들었음. 현재는 어떻게 바뀌었는지는 잘..,"복지 및 계약직 연장, 야간 수당을 높여주고 기숙사 시설 개선"
2.2,(주)일야,2020. 07,3점,"""일은좀 빡빡해도 다니면서 보람을 느끼면서 다닐수 있었습니다""","출퇴근시간 주5일근무
중소기업보다는 대우가 좋음 기숙사도 있음","나이 많은 상관이 많아서 보수적인 회사입니다
시키는 일만 해야함","전체를 바라보는 해안이 있었음 좋겠습니다
그럼 좀더 좋은 회사로 발전할수 있을것 같습니다"
2.2,(주)일야,2020. 04,1점,"""엘지 믿고 허세부리다 결국 쪽박.. 예견된 현실
윗대가리들 스스로 만든 결과""",눈치 잘보고 윗사람들한테 꼬리 잘 치면 한 없이 편하게 다닐 수 있다,"1990년대 기업 문화를 그대로 가지고 21세기를 맞음
사무실에 직원들 먹을 커피하나 안사주는게 말이 되나
커피는 손님만 직원들은 알아서 사먹기
꼰대중에 상꼰대들이 회사를 차지하고 쥐락펴락하니
뭐가 될리가","신사업 보다 경영진 고인물들 처리하는게 더 시급해 보입니다
그런식으로 신사업 해봤자 또 개꼴 납니다"
2.2,(주)일야,2020. 03,4점,"""자기일 묵묵히 하면 돈은 잘나옴 핸드폰과 자동차쪽에 강세기업 및 코스탁 상장기업이며 경력을 쌓을수있는 회사""","건강검진,식사제공,유류비제공,기숙사지원,퇴지금,4대보험,연차,휴가,주차장제공등 일야가 직원들에게 다양한복지를 제공하려 노력하는모습이 보임",남동공단 중간에 위치에 있어 교통편이 불리하고 약간은 보수적인면이 있으며 빨리빨리문화를 강요함,음료사업등 신규확장산업을 늘리고 있으며 신규사업추친에 앞으로더 비전을 보여줬으면함
2.2,(주)일야,2020. 01,3점,"""그냥 저냥 대우는 보통
자세히는 알아보지 않았다.""","눈치볼일이 없어서 좋았고 출퇴근도 깔끔해서
다니기 편함","특별한 단점은 없고 그저 비젼이 안보였다 정도
간식같은게 좀 더 비치되어 있었으면 합니다.","경영진에게 바라는 점은 없습니다.
앞으로도 번창하시길 바랍니다."
2.2,(주)일야,2019. 09,3점,"""상사들보다는 주변에서 일하는 아줌마들때문에 적응하기 힘든 곳...텃세가 매우 심하며 야근의 압박감이 있다""",잘하는 사람에겐 기회가 있다는 점. 아웃소싱에서 왔음에도 불구하고 일을 잘하면 정규직 전환의 기회를 준다. 젊은 사람들에게는 관대한 편이다. 일을 잘하면 텃세부리는 아줌마들은 신경도 안쓰이긴한다.,사무실에서 일하는것이 아니라 현장에서 일한다면 힘들다. 아줌마들의 텃세가 적응하기 힘든 사람이라면 힘들것이다. 대기업의 하청업체이다보니 힘들다. 야근이 거의 반강제인편이다,"사람을 너무 물건취급하지 않았으면 좋겠다,. 아웃소싱에서 아무리 데려온다고 하지만 사람 한명한명을 소중하게 생각하기보다는 일용직이다보니 물건 대하듯이 대하는 경우가있다"
