총점,회사,날짜,별점,요약,장점,단점,경영진에게
3.6,(주)액션스퀘어,2019. 10,3점,"""개발력있던 인재들이 있던 시기가 있었으나, 위쪽 정치로 다 날려버리고 이젠 과거에 개발한 타이틀만 남아있는 회사""",개발자를 우대해주는 분위기였었음. 개발력이 있어서 게임 완성이 되는 회사였음,"블레이드1 개발진들이 흔히말하는 회사 성골? 뭐 그런거처럼 있었던때가 있었고
대부분은 회사 윗쪽 정치로 팀이 무너지고, 정치하고 그러면서 사람들 무더기로 나가고...",참 마음이 씁쓸한게 개발력이 있던 사람들을 내보내고 회사하나 빈껍데기를 만드는 재주만 가진자들이 결국 회사를 차지하는걸 보면 게임개발이란게 쉽지 않구나란걸 느낀다.
3.6,(주)액션스퀘어,2019. 10,3점,"""좋게 시작했으나 많이 무너지고 있는 회사. 과연 반동 가능?""","어떤 일이라도 시작할 수가 있음.
새로운 출발을 하는 만큼 새로운 프로젝트에 대해 오픈마인드일거임.","경영진에게 전달받는게 느림.
담당자가 모르는 일이 진행되기도 함.","의사소통이 빨라야 한다.
한 부서를 담당하고 있는 담당자가 모르는게 말이 되는가"
3.6,(주)액션스퀘어,2019. 08,1점,"""지금 상황 모두 알거라고 봅니다.
한치앞도 내다볼 수 없는 상황.""",괜찮은 복지 괜찮은 복지 괜찮은 복지 괜찮은 복지 괜찮은 복지,미래를 장담할 수 없음 당장 한치앞도 내다보기 어려움.,어려운 시국이기 때문에 딱히 할말은 없습니다.
3.6,(주)액션스퀘어,2019. 06,2점,"""매년 대표가 바뀌는 회사.
이제 내리막만 바라보고 있는 회사.
더 이상 미래가 보이지 않는 회사.""","점심 식대 지원
팀마다 다르지만 자유로운 분위기.
매주 들어오는 다양한 간식
복지비 월 10만원","총4개의 팀에서 1개의 팀을 제외하고 2년을 넘게 개발을 했는데 모두 적자.
딱 봐도 답이 안보이는 팀을 거진 3년간 질질 끌고가서 회사 전체에 타격을 입히는 경영진의 능력.",남은 게임들 라이브 서비스 잘 진행하셨으면 좋겠습니다.
3.6,(주)액션스퀘어,2019. 04,5점,"""개발력있는 회사 환경좋고 사람들 좋다""","연차 눈치 안보고 쓸수있다. 작은 기업임에도 불구하고 복지가 좋다, 코스닥 상장",경영진의 의사결정이 매우 매우매우 늦다. 좋은 회사가 점점 안좋아지고있다,예전처럼 돌아갈 수있을까요? 우리의 찬란했던 그떄로
3.6,(주)액션스퀘어,2019. 03,3점,"""433의 그늘에 가려져 날개를 펴지못한 회사, 현재는 참 아쉬운게 많은 회사인거 같음.""","현재 회사 상황이 안좋으나 복지는 좀 있음.(계속 유지될지는 의문)
리프레쉬휴가(5년근무 3개월 유급휴가), 실비보험, 종종 간식 잘 나옴, 주택대출금 이자지원, 건강검진 지원(가족)
원래 매년인가 2년인가 한번씩 해외여행 있었으나 없어짐.",능력좋은 사람들 다 나갔다. 팀 다시 꾸리고 있으나 버거운 상황. 회사 자금적 상황이 좋지 못함.,"블2는 안될거라고 알았을텐데 너무 많은 자금을 쏟아 부은거 같음, 주식회사라 주주들 항의에 개발자들까지 피해 오지 않았으면 좋겠으나 현재. 현타옴"
1.8,(주)에이유테크,2022. 07,2점,"""분위기 어수선하고, 정리가 안 된 듯한 느낌을 받았음""","점심, 간식 제공되고 교통이 편한 것 외에는 그닥 없는 듯?","사무실에서 과장?급이 오고 가며 소리를 지르고, 한 명씩 불러서 호통치는 소리가 바깥 사무실까지 다 들림. 처음 입사했을 때 사원이 나밖에 없었음.",어수선한 분위기를 만드는 게 위에 적은 과장 급 사람인 듯. 직원을 하대하는 느낌을 많이 받았음.
1.8,(주)에이유테크,2022. 07,1점,"""사람은 나가지만 윗선은 진급하는 무슨 이런 아이러니한 상황?""",연차쓰는데 눈치 안줌 생각보다 자유로움 주차장있음 사람 많이나가서 자리많음,사원대리없음 역피라미드 최고치 어떻게 이럴수 있나 싶을거임 사람없어서 일못돌아감,다나가는데는 이유가 있지 않을까 싶네요 다나가서 일이 안되는상황에 윗선 진급소식듣고 웃었습니다
1.8,(주)에이유테크,2022. 05,1점,"""개발자로써 커리어는 많이 쌓을수 있지만 장기근속은 비추천""",연차는 프로젝트 없으면 마음대로 사용할수 있음. 그외에 장점 없는데 30자 채워야되네.,팀간의 구분이 없음. 잡일을 많이 해야함. 야근도 많고 국내든 해외든 무조건 출장가야함. 급여 불만족. 직원들 관리가 안됨. 퇴사자가 상당히 많음,직원들 처우 개선 및 직원 관리가 되었으면 함. 퇴사자들이 너무 많아서 남아있는게 의미가 없음.
1.8,(주)에이유테크,2022. 01,1점,"""사람 소중한지 모르는 회사. 원수가 입사한다고해도 뜯어 말려야 됨""",야근 수당이 있는거 외에 장점 없음...........,야근하지말라면서 업무량은 야근 할수밖에 없음. 그냥 야근 강요라고 보면 됨,직원수도 적은 중소기업에서 장기 근속자도 대표 눈밖에 나는 순간 바로 좌천. 자르지는 못하고 스스로 나갈수밖에 없게 만드는 마인드는 반드시 고치셔야될듯
1.8,(주)에이유테크,2022. 01,2점,"""다양한 업무를 경험해볼수 있는곳, 밤하늘의 별을 많이 볼수있는 기업""","기업의 장점 잦은 야근으로 인해 휴식에 대한 자유도가 괜찮습니다
어쩔수없이 다양한 업무를 경험해서 다른 직무에 대한 이해도가 높아집니다","엄청난 업무강도와 잦은 야근, 프로젝트 진행시 필수적으로 철야 작업이 필요. 밤을 길게 보낼수있는 생활을 할수있습니다",신입사원에 대한 교육이 체계적이지 않아 업무에 적응하기 힘들고 특유의 회사 분위기로 적응이 힘듭니다. 또한 정확한 직급별 연봉 테이블이 없어 연봉인상이나 지급에대해 기준이없습니다
1.8,(주)에이유테크,2022. 01,2점,"""웹디라고 해서 갔지만 제품디자인 로고디자인 인쇄물 디자인까지 진행했던곳..""",디자인팀이 마케팅팀과 같은소속이고 서로 팀의 분위기는 무지 좋다 다들 착하고 여기는 왜 나쁜사람이 없지 라고 생각할정도였음 그리고 지하에 구내식당이 있다 식당이 한식뷔페 느낌이라 반찬도 많다 또한 회사안에 스낵바가 있어서 음료수 과자 및 여러가지를 먹을 수 있고 한달에 한번 직원들이 먹고싶은 과자나 음료 체크해서 채워넣기도함 야근수당을 칼같이 챙겨준다,체계적이지가않다.. 일단 디자인팀 대리가 없기 때문에 마케팅팀 대리님이 디자인까지 맡아주시는데 지시는 또 다른팀대리님들이 지시를 하는편 게다가 컴퓨터가 너무 느리고 자꾸 튕기는 바람에 저장도 이상하게 되는데 다른팀대리님이 지시를 안내려주시길래 어떻게 진행되냐고 물어보면 다른분들에게 받은 지시가 있는지 오히려 물어보고.. 나중에 일주일 남겨놓고 갑자기 일주일만에 인쇄물을 제작해서 뽑는것까지 일주일안에 끝내야한다는 말을 하신다 이미 이틀만에 끝내야하는 일들이 있는데... 컴퓨터가 너무 느려 야근하고 결국 집에서까지 일했지만 수습기간이기때문에 80퍼만 지급받음.. 그리고 오히려 느리다는 이유로 눈치주심.. 다들 대표님이 일을 주지만 자신들이 뭘 맡아서하는지 생각보다 몰라서 스펙같은거 물어봐도 다들 다 다른 스펙을 주셔서 그거 정리하는데만 5일이 걸렸다.. 스낵바가 있지만 코로나때문에 먹지말라고 대표님이 은근히 눈치주심.. 왜 스낵바를 만든걸까..,솔직히 저는 마케팅팀인데 저희팀 대리님은 너무착하다는 이유로 다른팀대리님 이야기에만 귀기울이고 .. 여기는 팀끼리 싫어하는게 느껴져요 체계적이지가않아서 차라리 디자인팀 대리를 뽑으시는게 좋겠네요
1.8,(주)에이유테크,2021. 11,3점,"""아무생각없이 다닐만 함.회사가 나날이 망해가는 기분이 듬.""",연차 눈치 '덜' 봄. 그래도 좋은사람들도 꽤 많이 있음. 회식 잘안함.,"비젼이 없음. 복지도 없음. 연봉 동결심함. 꼰대 많음. 일하는데 체계가 없음. 이상한 사람들 많음. 오지랖도 오지게 넓고, 야근 많음. 밥 맛없음.",보너스 좀 주세요. 떡인지 쌀인지 말고
1.8,(주)에이유테크,2021. 11,3점,"""모든것이 평범했던 회사로 기억합니다..! 좋은 사람들도 많았던걸로 기억합니다!!""",기업의 장점은 사람들이랑 으쌰으쌰 함께 올라가고 성장하려는게 보임,기업의 단점은 업무량이 많을때는 화장실도 못갈정도.. 한가할때는 뭐해야하 하나 싶을정도..!,크게 바라는 점은 없습니다. 저에게는 평범하고 좋았던 회사였습니다.
1.8,(주)에이유테크,2021. 10,1점,"""야근업무가 너무많은회사 하지만 수당마저도 제대로 챙겨주지않고 달에 몇시간은 제하고 수당지급 수당도 말도안되는금액으로 쳐줌""",월급은 밀리지 않는다 야근시 밥은 준다 말고는 없는거같음,기존직원들이 자신들의 시간을 포기함 새로온직원들도 포기해야함 기존직원들이 직장내에서 일진놀이를함,직원들이 개인 워라벨이 높아야 회사에서의 효율도 높아지고 더하고자 합니다 물론사람마다 다르지만 지금식으로가면 시간때우는식이고 비효율적인 경영이라고생각합니다 검토하세요
1.8,(주)에이유테크,2021. 08,1점,"""발전없이 머무르다 점점 퇴보중인 회사. 사원부터 대리까지 줄줄이 퇴사중이나 인원충원이 없음
높은 직급자가 대부분의 소득을 가져가는 듯""","점심, 저녁줌(야근시)
딱히 적을게 없는데...
노트북 지급.
해외출장비 지급, 국내출장비(식대정도)","너무 많아서 나열할 수 없음.
고지식한 문화
연봉동결 잦음
진급의 어려움",아랫 직원도 챙겨야 근속연수가 늘어나고 회사의 발전이 가능하다고 생각합니다.
1.8,(주)에이유테크,2021. 05,1점,"""2018년도 당시 최저시급도 안되는 야근수당을 주는회사""",2018년도 당시 사람들이 좋아서 재밌게 다녔음 물론 과장미만 급만 착함 과장라인이 그냥 정상인이 단 한명도 없음,야근이 엄청나게 많고 과장들이 엄청나게 이상함 그리고 다른사람을 보니 장기로 해외출장을 다녀옴 지금은 코로나 시즌이라 안갈듯,이 회사 야근을 없애고 사람을 늘려서 일을 빠르게 추진하던가 해라
1.8,(주)에이유테크,2021. 01,1점,"""별로 생각하기싫은곳, 열심히 노력해야 여기같은곳을 안오게 만들어주는 자극제""","야근시 밥은 맛있는걸 시켜먹을수있음, 신입에게 많은걸 바라지않고 기다려줌","18년당시 야근수당도 시간당 4500원이엿으며 그것도 한달에 16시간을 제외함 주말에 출근시 10시간근무하면 45,000원 버는꼴 야근수당은 너무말도안되게 낮은데 항상야근이며,주말출근도 잦음",지금도 그러는진 모르겠지만 야근을 시키려면 합당한 금액을 주면서 시키세요 제조업이라 납기관련 문제는 알겠지만 어차피 외주고용하여 조립하고 진행하는데 관리자 한두명 당직개념으로 진행하면되는걸 굳이 자기직원 합당하지않은금액주면서 고생시키는지 이해가안됨
1.8,(주)에이유테크,2020. 10,2점,"""동종업계 연봉은 적정 수준이며 야근이 정말 많습니다. 개인시간 없이 기술 배우고 싶으신분들만 가세요.""",소규모 회사로 가족같은 분위기에서 일할수있습니다. 나름 자유로운 분위기.,퇴근시간이 정말 늦습니다. 9시가 기본 퇴근이며 새벽까지 일하시는 직원도 많습니다.,설계자로 근무중 제조쪽 지원요청으로 장기출장을 하는일이 없도록 부탁드립니다.
1.8,(주)에이유테크,2020. 08,4점,"""성과급이 나오며 명절보너스 추가 연말보너스도 나옴.""","세정기 기술이 있는 회사로써 일은 힘들지만 그만큼 보상이 이루어지는 회사
밥도 잘나옴",퇴근은 6시이나 잔업을 하게되면 일정시간을 채워야 잔업비가 나오는걸로 알고 있는데 지금은 어떤지 모르겠음,복지를 좀더 늘려주세요~ 잔업비 및 기타 유류비등 그외에는 다 좋습니다.
1.8,(주)에이유테크,2020. 08,3점,"""세정장비 생산으로 꾸준한 매출 있음, 부서간 협업함에 있어 많은 어려움이 있음""",프로젝트 종료 시 다름프로젝트 전 까지 여유가 있다면 연차 사용 가능,"잦은 야근(기본 11시, 철야도 서슴없이 함)으로 업무강도가 강함, 프로젝트 퐁당퐁당 들어갈 시 휴가 기회 없음",신규채용으로 업무 로스를 줄여주었으면 함
1.8,(주)에이유테크,2020. 05,1점,"""정말최악의 회사 시간이지나도 종종 소식들으면 달라지는게없음""",밥은 잘나오고 야근시 에도 밥을준다 월급제때 나온다 .,너무 군대식 문화 야근을안하면 눈치를주고 주말출근도안하면 직원취급 안하며 뒤에서 공무원이라는소리를하면서 비아냥거림,제발 야근시킬꺼면 야근비 정상적으로 쳐서 지급하고시키고 그게싫으면 외주를 고용해서 일을진행하세요
1.8,(주)에이유테크,2020. 03,3점,"""그냥 다니기 나쁘지 않는 회사 같기도 하다.
오래 버틸 자신이 있으면""","연차 사용에 대해서는 사전 보고 하면
크게 문제 되지 않는거 같음","야근이 잦은것이 가장큰 흠이다.
위로 갈수록 대우 해주는 거 같음","그냥 딱히 없음
ㅋㅋㅋㅋㅋㅋㅋㅋㅋㅋㅋㅋㅋㅋㅋㅋㅋㅋㅋㅋㅋㅋㅋ"
1.8,(주)에이유테크,2019. 11,1점,"""개인시간이 전혀 없는곳 1년중 반을 출장으로 보내고 반은 야근으로 보내는 회사""",월급안밀리고 나온다. 진짜 장점을 뭘 써야 할지 모르겠는데 해외가면 출장비 나온다. 12시넘으면 야식준다. 돈쓸시간이 없어서 돈모으기 좋다,회사 체계가 제대로 잡혀있지 않음 나이차서 더이상 갈곳없는 사람들만 억지로 버텨내서 위에 과장만 많고 아래는 죄다 퇴사해서 젊은 사람 없고 1년안에 대부분 퇴사한다 야근 밥먹듯이하고 야근수당 말도 안되고 야근 많이하면 200시간 가까이 한다. 1년중 반을 중국이나 베트남에서 보낸다.,회사체계가 너무 엉망이에요. 그러니 젊은사람이 다 나가서 회사직원보다 외주가 더 많은겁니다.
1.8,(주)에이유테크,2019. 07,2점,"""위로갈수록 편한곳이다. 밑에 있을때에는 고생하지만 위로가면 나름 빠른 퇴근 가능""",사람들간의 사이가 직책을 뛰어넘어 형동생사이가 된다. ㅋㅋ,장점으로 인해 막내만 고생하는 부분도있음 ㅋㅋ 군대라 보면 될 듯,체계를 잡아줫으면 좋겠고 업무분담을 확실 하줬으면 좋겠음
1.8,(주)에이유테크,2018. 11,1점,"""버틸수있다면 추천할만하지만 어중간한 각오로 버티기 힘든회사.""",회사 복지가 좋음 야근수당이 나옴 사람들이 괜찮음 버틴다면 배울건 많음,바쁠때 많이 바쁨 새벽에 퇴근 매우 잦음(바쁠때기준) 주말출근도 각오.(강요는 아니지만 눈치밥 먹을 각오도 해야함),여기에는 딱히 뭐라 써야될지 모르겟네 쓸말이 없습니다.
1.8,(주)에이유테크,2018. 07,3점,"""신입이라면 여러가지 일을 배울 수 있음. 하지만 야근이 너무 많은 회사""","간식이나 비품 잘 사줌. 기숙사 제공. 회사 식당은 없지만 점심,저녁 줌. 저녁은 원하는거 시켜먹을 수 있음",야근이 많음. 교통이 불편함. 일 하는것에 비해 급여가 적음. 근무 체계가 안잡혀있다.,"연봉을 높여주시고, 사람을 더 많이 채용하여 기존에 있는 직원들이 편하게 일 할수있게 해주세요."
1.8,(주)에이유테크,2018. 02,1점,"""로봇이아니면 다니기 힘든회사 개인보다 회사가 중요한 회사""",월급은 꼬박나옴 그리고 주말 출근시 밥은 맛잇는거 시켜먹을수있음 .,회사에서 거의 살아야됨 회사가 인생의전부가되어야 버티고 나아갈수있음. 너무 군대식 문화 가 심함 야근이나 주말에 출근못할시 눈치를주는게 심각함 야근 특근안할시 직원취급 안함 다른팀은 모르겠으나 생산팀은 심각함 생산팀으로 는 안다니는걸 추천 야근및 주말 특근시 시간당 4500원 지급 그것도 20시간 제외함 왜그런건지는 모르겠음,"야근이나 특근비를 제대로 못챙겨줄꺼면 시키지를 말던가 주말에 12시간 근무하면 49000원 벌수있음 지금이 어느시대인데... 너무하다고 생각하며 , 직원들을 위해서 회사를 운영했으면 좋겟다"
날 괴롭힌 삭제된 댓글,(주)에이유테크,경기,,,,,
날 괴롭힌 삭제된 댓글,(주)에이유테크,경기,,,,,
날 괴롭힌 삭제된 댓글,(주)에이유테크,경기,,,,,
1.9,(주)에이트원,2022. 09,3점,"""사람은 좋은데 나머지가 정말 아쉬운회사
뭔가 애매합니다 ㅎ...""",새로합병된 팀말고 기존 사업부는 분위기좋고 연차 눈치안보고 가능,사람이 너무 자주 바뀌어 전문가가 없다보니 일정이 문제입니다..,사람이 재산인데 걱정입니다. 기존의 히스토리를 아는 인재들의 부재 위험...
1.9,(주)에이트원,2022. 09,5점,"""2022년 상반기 이후 변화하려는 움직임이 보이는 기업""","주말 근무 및 야근을 최소화하고 있으며, 동료간의 수평적 분위기로 자신이 하고자 하는 업무 및 사업을 편하게 제안하고 건의할 수 있는 분위기가 조성되어 있음","교통이 불편하여 출퇴근이 편하지 않으며, 주변 먹거리가 다양하지 않아 점심식사 및 회식 시 선택의 폭이 좁음.","신규사업을 적극적으로 추친하는 모습은 좋으나, 직원들에게 자세한 사업 방향성 및 향후 미래에 대한 비젼제시가 필요해 보임"
1.9,(주)에이트원,2022. 07,1점,"""설마 연봉 올려주는거 대신 주식 받고 좋아하면서 다니는 사람은 없겠죠...""","시설 자체는 깨끗함.
월급을 떼먹는 정도까지 막장은 아니다.
출장을 자주 다닐 수 있어 지방 구경을 할 수도 있음.","여기 기업 사냥꾼 출신 회장이 운영하는건 아시죠.
지금 있는 대표는 그냥 꼭두각시일뿐.
월급 올려주는 대신 주식주는 이유가 어차피 털고 나올려고하기 때문에 그럼.
코스닥 상장회사가 어떻게 개미를 빨아먹는지는 시사기획창 다큐에 잘 나와있음.
영상보고 한번 판단하기 바람. 여기도 비슷한 회사이다..","지키지도 않을 약속 일단 던져놓고 나중에 나몰라라하는거 사회초년생들이 모를꺼 같나요?
19년도 말쯤에 연봉을 대기업급 4000만원 이상 올릴꺼라고 그렇게 말해놓고 지금 지켜졌나요? 그거 믿고 열심히 일한 사람들은 뭐가 됩니까.. ㅎㅎ"
1.9,(주)에이트원,2022. 07,1점,"""뱃사공이 너무 많음
이 회사 경험해본 사람들이라면 다 알거임""","눈 씻고 찾아보니.. 화장실이 깨끗함
근처에 사람이 많이 없어서 좋음
월급 안밀림","화장실 깨끗한거 빼고는 모든게 다 단점인듯
오너리스크 팀원관리능력 없는 팀장 및 임원들 등등
특정 전문직 출신 임원들 선민사상 심함","뭐 알아서 잘 하시겠죠 대단한 분들이시니!!
지금 주가를 보아하니 많이 노오력하셔야될듯 싶네요"
1.9,(주)에이트원,2022. 07,1점,"""미래에서부터 온 당신을 위한 메세지..... 만약 입사를 하게 된다면 1년안에 이 글을 보고 무릎을 탁 치게 될 것이다..""","불러주는 곳이 거의 없는 밑바닥 구직자라도 쉽게 입사 가능함.
광명역에서 가까운 지리적 거리.
회사 시설은 좋다.
야근식대 나옴.","오갈데 없는 사람의 경우 코스닥 상장 기업이라는 유혹이 있을 수 있다. 그래서 잡 플래닛을 보며 에이 설마 그러겠어? 요즘 악의적으로 나쁜 리뷰를 남기는 사람도 많아 하면서 입사를 하는 당신.. 다시 생각해보라..

에이 요즘 평생 직장이 어디있어 딱 1년만 눈감고 다녀보자하며 입사하는 당신.. 다시 생객해보라...

평균 근속연수 7개월인 이 회사에 절대 입사하지 말길 바란다. 참고로 필자는 입사하고 1년동안 1주일도 안하고 퇴사하는 사람 9명을 봤다. 그중 당일 퇴사는 2명이었다.

요즘 회사측에서도 잡플래닛 점수 올릴려고 조작을 많이한다. 그럼에도 불구하고 2.0 이하라면 진짜 밑고 거르시길 바란다.

이 글을 읽고 설마설마하며 입사하고 1년이 지나고 이 글을 다시 읽는다면, 아직 세상은 살만하구나.. 이런 말도 안되는 기업을 피해가라고 진심으로 후기를 남기는 사람이 있다는걸 뼈저리게 느끼게 될 것입니다. 이글 정말 허투로 보지마세요.",여긴 태생부터 바뀔 수 없는 곳이라는걸 뼛속까지 알고 있는 사람입니다. 바라는거 없습니다. 더 많은 희생자가 생기기전에 이렇게 잡플 남깁니다.
1.9,(주)에이트원,2022. 05,2점,"""IT인듯 IT아닌 IT같은 너. 개발직군보다 경영직군의 힘이 강한 IT 회사. 낮은 임금만큼 보장된 워라밸.""","도서 구입비 지원(단, 신청기간이 있음). 퇴근시 눈치 안보고 퇴근할 수 있고 연차사용 자유로움(단, 부서마다 분위기 다름). 간식 있음.",인사이동이 너무 많음. 연봉이 적음. 일이 체계적으로 진행되지 않을 때가 많아 스트레스받음. 교통편이 안좋음. 윗선에서 소통이 잘 안됨.,직원들의 사기는 임금에서 나오는데 적게받고 많이 일하는 열정페이는 옛날에나 가능했다는걸 알면 좋겠음.
1.9,(주)에이트원,2022. 04,2점,"""IT 방산업체, 큰 희망은 없어 보이며...언제 상폐되려나... 매 사업마다 저가로 수주를 하는 바람에 직원들만 죽어나는 회사""","팀 및 파트마다 분위기가 다르지만, 팀 및 파트 잘 만나면 편하게 월급 루팡할 수 있는 회사","차 부장급 중에 놀고 먹는 인원들 넘쳐 남....회사가 돌아가는것도 신기하고, 재무제표보면 언제 망해도 이상할 것이 전혀 없는 회사. 연봉은 두말할 것도 없고....","연봉이나 복리 후생을 동종업계 및 경쟁업계와 비슷한 수준을 못 따라가면, 직원들 편의 시설이나 연차라도 넉넉하게 주세요"
1.9,(주)에이트원,2022. 04,2점,"""국방산업에 치중된 형태 자신의 업무가 아닌 잡 업무를 맡아할수도있음""",사람들 간의 불화는 많이 없는편. 야근식대나 휴일 근무시 대체휴가는 제공함,"연봉도 낮고 개발자를 일반 회사원과 동일시하게 생각함 능력에 따른 인정은 받으나, 인정만큼 돈이나 휴식이 따라오진 않음 야근이 잦고 휴일근무도 많을수있음.",군대식 문화나 계약직에 대한 쓰고버리기식 운영을 멈췄으면 좋겠습니다.
1.9,(주)에이트원,2022. 04,2점,"""개발자가 턱없이 부족하다. 연봉이 높진 않음""","광명역 바로 옆에 본사가 있어, 출퇴근 환경은 좋다. 부장, 차장등 인력은 좋은 사람들이 많다.","장기 근무자가 적다. 즉 퇴사자가 많이 발생하여, 업무 인수인계를 받기 힘들다. 영업이익이 적자가 자주 떠, 인센티브가 거의 전무하다고 보면 된다.",직원들 복지가 전무하다. 복지에 신경썻으면 한다.
1.9,(주)에이트원,2022. 04,3점,"""전문지식이 없어도 큰 어려움이 없는 회사.""",연차 사용이 비교적 자유롭다. 야근은 많지않으며 가급적 정시퇴근을 지향하고 있다.,"신입사원교육이 다소 미흡하다. 상용프로그램이 아니므로 직장에서 배움과동시에 실무를 진행하기에 어려움이 있을수맀다.
그리고 포괄임금제이다.",신규사원의 교육을 단기간이지만 커리큘럼이 있었으면한다.
1.9,(주)에이트원,2022. 03,1점,"""조직문화 최악, 그나마 젊고 깨인 젊은 직원들.
직원들 힘들게 마시고, 경영진들, 팀장급들 정신 차리시길""","젊은 직원, 간식, 몇 안되는 책임감 있는 실무급 직원들","과제 중심 회사라 대기업 고객 마인드 하나도 없음
직원들 정치질 이간질 심하고, 뭐하나 재대로 된거 없는 회사","사람 수 많큼 많은게 회사, 회사를 움직이는 것도 사람
사람 중요함을 좀 아시길"
