총점,회사,날짜,별점,요약,장점,단점,경영진에게
3.5,(주)한길더블류아이티,2018. 09,3점,"""엔지니어일을 하기에 고객대응의 능력을 키울수있다 하지만 기술적인 교육이 부족하고 거의 모든일을 맡기는 경향이 있다""",일이 많지 않은편이고 연차도 자유롭게 사용할수 있다. 어느정도 경력이 있는사람이라면 편안하게 일할수있다,일거리가 적은만큼 신입사원의 경우 교육에대한 부족함이 많다. 경험이적고 신입이라면 피하는게 좋을거같다,엔지니어에게 바라는것이 많이 있듯이 엔지니어에게 투자도 많아야 한다고 생각한다.
3.5,(주)한길더블류아이티,2018. 09,4점,"BEST
""다양한 고객과 다양한 장비에 대한 지식을 배우기엔 좋은 회사입니다.""","엔지니어에겐 많은 권한을 주어 고객과의 관계 개선에 쉬이 다가갈 수 있습니다.
자기 개발을 위해 교육도 적정 수준 이상으로 받을수 있습니다.",엔지니어가 고객의 커버리지까지 케어를 해야 하는 부분이 있어서 대인관계가 약한 분은 처음에 적응하기 쉽지 않을수 있습니다.,"회사의 미래와 현실적인 유지를 위해서 어쩔수 없는 일을 강요 하는 일이 없어야 합니다.
또한 엔지니어에겐 기술이 비전이 될수 있는데 기술적인 부분을 개발 하기 위해서 영업또한 기술에 대한 교육과 지식이 필요 합니다."
날 괴롭힌 삭제된 댓글,(주)한길더블류아이티,2018. 09,,,,,
날 괴롭힌 삭제된 댓글,(주)한길더블류아이티,2018. 09,,,,,
날 괴롭힌 삭제된 댓글,(주)한길더블류아이티,2018. 09,,,,,
2.5,(주)이브이수성,2022. 05,3점,"""부서별로 분위기가 다르지만 어느정도 워라밸을 챙길수있음""","연차사용, 부서별 업무 분장 잘 되어있는편입니다.
부서별로 다르겠지만 워라밸 가능한편","적자로 인해 회사가 기울다가 1, 2년 전부터 회복세로 진입한 듯 하며 신규 사업을 진행하는건 좋지만 실무자들의 일은 늘어나고, 연봉 인상은 글쎄??요 입니다.","일은 늘어나지만 연봉은 거의 비슷한 수준,, 합당한 연봉 협상과 처우개선 필요"
2.5,(주)이브이수성,2022. 05,3점,"""워라벨 가능하고 오래 다닌 사람들 많다.
주말근무도 거의 없음""",연차 마음대로 사용할 수 있고 퇴근도 정시퇴근 가능하며 주말 근무도 거의 없다,"기업 경영진이 바뀌면서 회사가 엉망이 됐다
퇴사자들 늘어남",운반기계 사업에만 집중해주길 바란다 이런저런 사업 끌어오지 말고
2.5,(주)이브이수성,2022. 03,2점,"""40~50대가 직장생활하기 편한 회사............""",연차를 쓰는것이 자유로우며 동료간에 분위기가 좋은 회사,진급이나 급여 부분에 대한 처우가 성과제가 아닌 나이가 크게 영향을 미치는 회사,여러모로 회사 경영에 힘써주시기를 바랍니다...........
2.5,(주)이브이수성,2021. 05,2점,"""역피라미드 구조라서 꼰대가 많다 느낄 수 있음.
근무시간은 항상 정해져 있고 주말 특근은 없음 잔업은 1주에 두번 선택사항. 생산직에 대한 이야기임""","그때 당시 밥이 맛있었으나 대표가 바뀌면서 식당 주인이 바뀌며 지금은 비슷하겠지만 장담 할 수 없음.
주안역에 통근차량이 있음.","생산직은 진급같은거 생각하기 힘듦.
대중교통만 이용해서 출근은 거의 불가능 너무 동 떨어져 있음.
기본 최저 시급.
비전 있는지는 모르겠음","생산직 현장의 관심이 있는지 모르겠음. 실적만 생각함.
생산직 연봉도 관심이 있는지 모르겠음.
복지에 대한 관심이 있는지 모르겠음."
2.5,(주)이브이수성,2021. 05,2점,"""자기들끼리만 싸움
복지따윈없고
몇명 사람들이 망침
커가려면 많은 노력이 필요""","칼퇴가 가능하다
물론 부서에 따라 다름
연차 사용 하기 좋음","보여주기식이 너무 많음
몇명 사람들에 의해서 회사가 움직임
커뮤니케이션 없음","복지 및 직원들 말좀 들어주세요
현장이 어떻게 돌아가는지 확인 부탁해요"
2.5,(주)이브이수성,2021. 02,3점,"""퇴근 후 삶은 보장받는 곳. 야근 거의 없음 워라밸 가능""","퇴근이나 연차는 윗사람 눈치 안 보고 쓸 수 있다.
회사가 오래돼서 강요하거나 이런게 없음","회사 경영진 바뀐 이후로 발전 가능성이 없음
월급 밀린적은 없으나 그냥저냥 월급 받으면서 직장생활하기엔 괜찮음","회사 발전을 위해서 투자를 했으면 좋겠다.
주가 올리려고만 하지 말고."
2.5,(주)이브이수성,2020. 07,3점,"""오래다닌 사람한테 좋으나 새로들어오면 답 없음..
점점 갈수록 상황 악화 좋아지지 않음""",칼퇴보장...... 그이후로는 ......음 잘 모르겠습니다,체계가 없음 윗선에선 나몰라라함 밑에서 정리하기 바쁨 직원이 자주자주 바뀜,"직원을 너무 소모품으로 취급하시는 거,, 사람 귀함을 아셨으면 좋겠습니다"
2.5,(주)이브이수성,2020. 07,1점,"""현 상황과 동 떨어진 기업마인드
부서간 협력은 찾아 보기 힘들고
다들 자기가 잘낫다고 함""","칼퇴 할수 있다는거
몇명 부서는 업무 강도가 약함

인사만 잘하면 반절 먹고 들어감","너무 많아서 쓰기가 힘들다
권력싸움 너무 심하고
서로 이간질하기 바쁘다","제발 임원들 말고
현장 사람들 말좀 들어주세요
제대로된방향을 가지고 이끌어 주길 바랍니다"
2.5,(주)이브이수성,2020. 06,3점,"""실무자 중심의 회사로,
내가 얼마나 하느냐에 따라 달라짐.
단, 회사가 바뀔지는 미지수.""","1. 물류장비 업체로 동종업계에서는 브랜드 가치가 있는 회사. (전국 40여개 대리점 보유)
2. 자사 모델의 제조 및 판매
3. 주5일 근무제
4. 야근 강요는 없으며, 개인 업무능력에 따라 결정됨
5. 구조조정으로 50대 이상의 근속자가 거의 없음
(전체적인 연령대가 낮아짐)
6. 사람간의 스트레스가 크게 없음
7. 자유로운 연차 제도
8. 내일채움공제 가능
9. 교통비지원 5만원 (청년바우처)","1. 회사의 부채 증가로 인하여 자금 보유량이 떨어짐.
2. 동종업계 증가로 경쟁력이 낮아지는 추세.
3. 장기 근속자와 신입직원 간의 근속년수 차이가 많이남.
(중간급 관리자가 많이 없음)
4. 대중교통이 어려워 자차 필수 or 카풀
5. 낮은 연봉 제도
6. 업무 능력에 따라 매년 연봉협상을 해야하나 회사 자금난과 경영진의 보수적인 성향으로 3~5% 일괄 인상 및 동결
(대표자 변경으로 추후 변경 될 여지는 있음)
7. 빠르게 변하는 시대에 회사도 맞춰야 하나, 실질적인 주인이 없는 상장회사로 변화를 원하지 않음
(경영자가 시장을 알아야 하나, 시행불가)","회사의 여러 사정이 있지만, 아래급 직원들은 나이가 어리고 아직 기회가 있기에 언제든 이직 할 수 있습니다.

회사가 유지되려면 능력에 따른 연봉제도와 그에 맞는 대우를 해야 한다고 생각합니다."
2.5,(주)이브이수성,2019. 10,3점,"""일은 편하지만 주업무보다 부수적인 업무가 많고 군대 문화가 남아 있다""",업무 분단 체계가 잘 잡혀 있고 임금체불 없고 통근버스가 있다.,"복지제도는 다양하지만 제대로 쓸 수 있는데 한계가 있는거 같다.
대중교통 이용이 불편하다.",재직중인 사람들을 위해 많은 노력 부탁드립니다.
2.5,(주)이브이수성,2019. 08,2점,"""전형적인 책임 회피형 근로자들이 일하기 적합한 회사""","연차를 윗사람 눈치 안보고 쓸 수 있음, 근무 환경이 자유로움, 사무실은 시원함, 식당이 공장 안에 있음, 흡연장소가 여러곳",착불비도 대표이사 결제를 받아서 진행해야한다는 단점(1원 이상은 모두 대표이사 결제를 받아야 진행이 가능함),"어려운 시기에 고생이 많으심, 회사가 변하기 위해서 많은 노력이 필요하다고 생각함"
2.5,(주)이브이수성,2019. 05,3점,"""안정적으로 다니고 싶은 사람에게 추천""",업무 분장이 잘 되어 있어서 다른 사람 눈치 보지 않고 자기일만 하면 되는 곳입니다.,"기본적인 승진제도가 있지만, 매년 근무평가제도가 형식적이라 어필을 많이 해야 되며, 승진제도가 어렵다",신규 사업 등 다양한 회사의 방향에 대해 오픈이 되었으면 한다.
2.5,(주)이브이수성,2019. 04,1점,"""군대를 다시왔다 군대보다월급은 더 주지만
여느회사보다는 덜준다 너무짜다""","친해지면 서로간에 의 롭기는하다
밥이 잘나와서 좋지만 천원^^","이곳의 연봉은 어떤 기준에서 책정 되는지 궁금.
인사를 중요시하는데 군대보다더심함.","젊은층으로 바꾸 자니 연봉이안맞아 들어오질않고
또 중장년층은 꼰대문화에 젖어 회사를 군대로 만들지않나
그시점에 회사는 주식이 재상장 될지도 의문
과연 이곳에 미래는 어디에있는가"
2.5,(주)이브이수성,2019. 02,3점,"""평범한 회사입니다 대표님이 자주 바뀌기는 했지만 최근 2년동안은 안바뀌는군요""",일단 출근과 퇴근은 정상근무만 진행하는경우가 많고 야근은 일부러 남지 않는이상 없다고 보셔도 되겠네요 근무강도도 약한편입니다,월급이 적다는게 가장 큰 단점이라고 할 수 있겠네요 자기발전적인 일을 하기도 애매합니다 .,딱히 바라는점은 없습니다. 그냥 이대로 유지하면 좋겠습니다
2.5,(주)이브이수성,2018. 08,5점,"""자신의 능력을 다양하게 펼쳐볼 수 있는 기업""","연차 등 윗사람의 눈치를 안 봐도 되고, 대기업 처럼 본인업무에 몰두하면 됨.","승진률이 다소 어려우나, 개인의 능력에 따라 변동이 많은 회사이므로
단점이자 장점이 될 수 있음.","복지제도에 있어 회사의 여력이 된다면, 좀 더 나은 복지제도와
승진제도의 개선이 필욧"
2.5,(주)이브이수성,2018. 07,2점,"""불투명한 미래. 젊은 층은 있으나 다소 수직적 문화. 워라밸은 지켜짐.""","어딜가나 팀마다 좀 다르지만, 워라밸은 회식(거의 없음)이나 혹은 특이사항으로 야근을 하지 않는 이상 지켜짐. 단, 자신의 자발적 야근은 논외로 하겠음.

야유회 11월 정도에 1번 있는데 보통 등산을 감. 당일치기로 다녀옴. 안 올라가도 상관없음.

월급은 잘 나옴.

대중교통이 불편한 산업단지에 위치해 청년대중교통비 지원사업에 해당해 월 5만원의 교통비 지원 가능. (자차 있는 사람도 됨)

구내식당에서 식사 제공 (점,저 제공. 둘다 먹어도 1000원 공제, 한번만 먹어도 1000원 공제)

사람들이 좋음.

반차있고 퇴직금 따로 있고 연차수당 있음.","교통이 불편해 대중교통은 안되고 카풀이나 통근버스(주안역, 청라국제도시역)를 이용.

현재 이전 대표로 인해 주식 거래 중지 상태이며 어떻게 될지 모름.

현장에 있는 약간의 군대 문화. (인사)

연봉 상승이 매우 적음 (인사 평가 최고점을 받아도 ?)

공고에 명시된 연봉은 연차 수당이 포함된 금액임. (초봉이 적으니 추후 올라도 별 티가 안남. 그러면서 많이 준다고 함.)

휴가 쓸 때 별 제약은 없는데 이유를 묻는다 (팀장 케바케)","지금 위기를 타파하기 위해 매우 노력하시고 계신 것은 잘 알고 있습니다. 하지만 그 속내를 보면 참 답답하네요. 언제고 다시 이런 위기가 찾아올테죠.

인재를 붙잡아두기 위해서는 다른건 몰라도 연봉이 가장 중요합니다. 초봉도 그렇고 상승폭을 많이 높여 주세요.

현장에도 그렇고 말도 안되게 돈만 많이 받아가는 사람들이 있네요. 회사 돈 없다면서요?"
2.5,(주)이브이수성,2017. 11,2점,"""정시출근 정시퇴근이 가능. 장점보다는 단점이 수두룩""","각 팀에 약 3명씩 배치. 사람들이 좋음.
정시 출근 정시 퇴근.
하루에 1000원(점심), 저녁은 공짜.
통근버스 주안역까지만 운행.
일이 거의 없음. 편함.
그냥 저냥 연봉이나 다른 거 생각없이 다니기 좋음.","1. 초봉이 곧 퇴사때까지 연봉 (직책수당만 추가로 받는다) - 해마다 안 오름
2. 회사가 되게 어렵다. (주식을 보면 알 수 있음)
3. 임원들의 보수적 마인드
4. 생산직의 군대식 문화 (인사병 걸린 사람들 몇몇)
5. 애매한 복지 시스템
6. 연차는 있으나 샌드위치때 다 뺌. 연차 돈 안 줄 예정.
7. 위치가 안 좋아 차가 없으면 힘듦. (카풀을 하던 해야함)
8. 라인으로 입사한 사람들이 많음 (장기 근속자들)","연봉 협상은 매년하는 겁니다. 입사때 한번 연봉계약서 쓰고 끝?이라뇨.
해마다 물가가 오르는데 초봉이 계속 안오르고 직책수당만 받는게 말이 되나요?
장기 근속자(라인) 말고 그냥 일반 직원들은 평균 2~3년마다 바뀌네요."
2.5,(주)이브이수성,2016. 03,2점,"""보수적이고 군대식 기업문화, 연봉도 별로""",다양한 업무를 경험할 수 있다. 특별한 일이 없는 한 정시 퇴근은 가능하다.,경영진이 너무 보수적이다. 기업문화가 이른바 '멀티'라 전문성을 갖추기 어렵다. 급여나 복지도 만족할만한 수준이 아니다.,"직원의 말에도 귀를 기울여주고 군대식 문화 좀 고치주길 바랍니다.
나야 떠났으니 상관업지만 앞으로 들어올 사람을 위해..."
날 괴롭힌 삭제된 댓글,(주)이브이수성,인천,,,,,
날 괴롭힌 삭제된 댓글,(주)이브이수성,인천,,,,,
