총점,회사,날짜,별점,요약,장점,단점,경영진에게
3.0,한솔인티큐브(주),2020. 11,3점,"""성장가능성은 모르겠고 편하게 다닐 수는 있다
코로나 피해가 있긴한가? 모르겠는데 비상경영이랍시고 돈을 안줌""","팀장, 임원 눈치 안 보고 편하게 다닐수있다.
그게 다임","회사 분위기가 어수선하고 뭘 하는지 모르겠다
곧 망할것같기도 함 ㅋㅋㅋ",ㅋㅋㅋㅋㅋㅋㅋㅋㅋㅋㅋㅋㅋㅋㅋㅋㅋㅋㅋㅋㅋㅋ할말이 없네요ㅋㅋㅋㅋㅋㅋㅋㅋㅋㅋ
3.0,한솔인티큐브(주),2020. 10,2점,"""보람차게 일하고 싶으나 일할 수 없는 곳이 되어버림. 예전에 있었던 사람들이 하나 둘 씩 떠남.""","연차를 눈치보지 않고 쓸 수 있고, 리프레시 휴가가 있음. 나름 쾌적한 사무실",연봉이 타사보다 낮아 실제로 비교하기 시작하면 답 없음,"합리적인 보상 체계 마련과 인력 충원이 요구되며, 여러가지 사내 복지가 축소되지 않았으면 좋겠음."
3.0,한솔인티큐브(주),2020. 10,2점,"""처음입사에서 일을 배우기는 좋은회사.............""",비슷한 크기에 회사 중에서는 복지가 좋은편에 속함...,일을 하는사람과 안하는 사람이 따로 존재하고 일을 하면할수록 일이 늘어남,인력에 추가로 뽑아서 일에 강도를 낮춰줘야 할것같습니다.
3.0,한솔인티큐브(주),2020. 09,2점,"""노말... 시스템 유지보수로 타사에 파견 근무하는 방식이므로... 회사는 잘 모르겠음""",복지. 중소기업에서 합병된 이후 그룹복지 적용이 좋았음,"과업 과다. 회사와 관련된 제출서류, 확인 등 관리가 까다롭다","인원 고용 늘려서, 일과 삶의 안정적 밸런스 맞춰주셨음면"
3.0,한솔인티큐브(주),2020. 08,3점,"""지금은 모르겠지만 그 당시에는 미래가 크게 보이진 않았음 현재 AI의 발전과 클라우드 발전으로 제대로된 목표만 있으면 충분히 클 수 있을 지도 모르겟음""",연차나 이런건 눈치 안보고 쓸 수 있던 듯 그냥 여느 기업과 동일하게 내가 잘 하면 다들 대우해주고 못하면 대우안해주는 그런 기업 그닥 특별하게 기업문화가 안좋고 그런건 없었음,한사람이 가지고있는 프로젝트가 너무 많아서 고객 관리가 너무 힘들었었음 솔루션 판매업을 해야하는데 에이전시 형태다보니 어려웠던듯.. 지금은 솔루션이 있으려나,R&D를 적극적으로 밀어줄 필요가 있었음 그당시엔 지금은 그렇게 하고있을거라 믿고있고 내부 솔루션만 어떻게 만들면 좋지 않을까 싶음
3.0,한솔인티큐브(주),2020. 08,3점,"""기업 자체 복지나 분위기는 좋으나
몇몇 윗사람들이 물을 많이 흐림""","일정에 특이사항없으면 자유롭게 연차사용 가능.
보통 IT회사의 장점을 가지고 있음.
직원들의 목소리를 노력하려고 함(아직까진 개선은 글쎄)","보통 IT회사에 비해 연봉은 괜찮은 수준이지만
경쟁사에 비해서는 연봉수준 떨어짐. 연봉인상률이 짬.
경력 인력 충원은 잘안해주면서 이익은 극대화하길 원함.","신규사업에대한 홍보가 미흡해보임.
업무 프로세스나 환경에 대한 정확한 파악 후 조직개편을 했으면 좋았을텐데 아쉬운 부분이많음.
직원들에게 요구를 충족 시켜줄 부분을 충족 시켜주고 본인들이 원하는 걸 제시하기를 바람."
3.0,한솔인티큐브(주),2020. 08,3점,"""전형적인 SI업체로 콜센터사업에 주력하고 있음""","근태가 비교적 자유롭고, 대기업 복지, 대졸 공채 연봉이 많다고 생각 함.","조직이 좀 노후화 되었고, 개인역량에 따라 업무가 편중되는 경향이 있고, 연봉인상률이 적음","사람 좀 제때 뽑아주고, 그래도 흑자날때는 연봉 못올려 주면 인센이라도 주세요."
3.0,한솔인티큐브(주),2020. 07,2점,"""한때 IPCC 분야의 양대산맥이었으나 현재는 미래에 대한 대비를 못하여 무너져가고 있으며 실력있는 인재를 대우하지 못해 직원들의 이탈이 심한 회사""",다른 회사들과 비교해보면 복지는 나름 좋은편이었다고 기억되며 이게 그나마 장점이라고 생각합니딘,너무 한 분야에만 특화되어 있고 미래를 준비하지 못하고 현재에 안주해있다. 오래 근무한 직원들은 매너리즘에 빠져있는점은 고쳐야한딘,새로운 트렌드를 읽고 이를 준비하여야 하며 말뿐이 아닌 행동할수 있는 경영진이 되었으면 합니딘
3.0,한솔인티큐브(주),2020. 07,3점,"""개발자, 엔지니어가 대우 받으면 일할 수 있는 분위기.""","연차 휴가 눈치 안보고 쓸 수 있고, 사내 프로세스 체계 잘 잡혀있음.교육 기회 많음.","그룹 보고를 위한 보고를 위한 리뷰를 위한 리뷰. 실제 업무 능력 상승에 힘 써야 하나, 그룹, 사내에 보고하기 위한 자료를 너무 많이 만듬.","간담회 시 아무말도 하지 않는다고 뭐라하지 말고. 말씀을 좀 줄이고, 직원이 말을 하면 방어하려 하지 말고, 받아들일 생각 먼저 하셨으면 좋겠다."
3.0,한솔인티큐브(주),2020. 06,5점,"""자유로운 분위기로 다닐수 있는 곳입니다. 모두들 친절하시고 분위기가 매우 좋은곳.""","연차를 윗사람 눈치안보고 쓸 수있음.
비교적 유연한 근태시스템
외근이 많아 근태가 매우 자유로움
간식이 3시쯤에 나오는데 꿀복지라고 생각함.
단일 기업규모는 매우 작은편이지만 한솔그룹에 속해있어 나름 어디가서 한솔다닌다고 할수 있음","밖에서 볼때 소속감이 그리 강하지 않다는 평이 많았습니다
하지만 소속감이 강하지않아도 다들 친절하셔서 좋은 기억으로 남아있는 회사입니다
고객사의 갑질은 어느정도 감수해야할 부분이기 때문에 그것을 이겨내는것이 중요하다고 생각합니다","구성원들을 모을수 있는 리더십이 중요하다고 생각합니다
물론 퇴사 당시 너무나도 고생하시고 잘이끌어 주셨지만 회사에 소속되어있다는 끈끈함이 필요하다고 생각하비낟."
3.0,한솔인티큐브(주),2020. 04,3점,"""의료비지원, 자율출퇴근제, 연차외 리프레시 휴가등 은근 복지가 괜찮지만 연봉이 짠편. 사람들이 좋다.""","의료비지원, 자율출퇴근제, 리프레시휴가, 오크밸리혜택, 그리고 사람들이착한편, 자유로운 연차사용.","본사위치가 너무 구석짐(역이랑도 멈), 낮은연봉인상률, 낮은연봉, 내근직은 그래도 다닐만한데 외부프로젝트 할 경우는...고객사에 출퇴근시간맞춰야하며 근무지가 계속바뀜, 야근많음",신입연봉과 기존직원들 연봉 차이가 거의 없어서 일할맛이 안나네요. 적절한보상이 필요합니다.
3.0,한솔인티큐브(주),2020. 04,4점,"""신입으로 시작하기는 좋은 회사. 과차장급이 적폐로 몰리는 회사""","자율적인 출퇴근, 팀회의비 지원, 해외연수 인원 선별, 관대한 인사, 오래된 업력과 전문성.","업력과 전문성이 회사의 자랑인데, 엔지니어에게 제너럴리스트가 되길 요청함. 기존 업무를 줄여주지도 않으면서 신기술 및 다른 기술을 배우라고만 함. 그 와중에 유지보수 이익률도 개선하라고 함
-> 결국 기존 고객사들과의 트러블이 불가피, 현장에 책임 전가",찍어누르기가 가장 쉬운 방법인 것은 압니다. 그러나 이로 인해 이탈한 직원들이 적이 되어 돌아오고 있습니다. 변화와 효율 중에 노선 하나를 확실히 결정해주세요. 그리고 그 책임은 위에서 져주세요.
3.0,한솔인티큐브(주),2020. 04,3점,"""떠났을때 그때가 좋았지 생각나는 기업. 사람도 시스템도 무난했음""",기술력 좋은 분들이 많았고 매니아가 아니면 적응하기 힘들수도 있음,통신사 SI를 하다보니 상상 이상의 갑질을 인내할수 있는 멘탈이 필요함,경영진에 바라는 점이 없던 유일한 회사였음. 한달에 한번 경영보고가 있을 정도로 투명하다는 느낌이 큼
3.0,한솔인티큐브(주),2020. 03,3점,"""사내분위기 좋고 자기업무에만 집중할수있습니다.
부서간의 협력이 잘되는거 같습니다.""","조직이 체계적으로 움직이려고 함.
업무지원이 원활하게 이루어지고 있음.","외부 프로젝트가 많은편이며
유지보수 사이트가 많은것 같습니다.",좀 더 자율적인 업무 프로세스가 이루어졌으면 좋겠습니다.
3.0,한솔인티큐브(주),2020. 02,2점,"""대기업의 틀에서 운영되는것은 사실이지만, 규모가 따라가주지 못함""","연차눈치안봄
직원을 배려해주려고 노력함
사람들이 좋음
어딜가나 나쁜 사람 있다고 하지만,비교적 없음","대기업과제수행
업무의 효율성 개선이라는 명목으로 일을 늘림
자잘한이슈가 많음","뭐하시는지 몰라서 바라는점도 없다.
오래다니고 싶은 기업으로 만들어 주세요."
3.0,한솔인티큐브(주),2020. 02,3점,"""사내 근무분위기가 좋으며 본인 업무만 잘해내면 워라벨이 보장되는 편""","자칭 꼰대상사가 얼마없으며 대부분 칼퇴.
워라벨이 보장되는기업",기존사업의 유지보수하기에도 버거워 신규사업을 기대하기가 어려움,체계적인 업무시스템의 성립을 통하여 업무배분 및 인원충당
3.0,한솔인티큐브(주),2020. 01,3점,"""근무환경이좋고 편안하다 ㅎ 이외엔 그다지 생각나는게 없음""",연차를 눈치안쓰고 쓸수있어 편안하다. 그때 그때 필요할때 쓰먼 됨,연차를 꼭 다 써야 한다는 점 돈으로 지급 못 받는다는거,불만을 듣지만 말고 방관하지만 말고 해결책을 생각해주세요 팀장님
3.0,한솔인티큐브(주),2019. 12,2점,"""성장이 끝나서 남은 사람들은 유지보수만 하고 있는 회사""",눈치를 안봐도 되는 분위기...한마디로 서로 터치 안하고 자기 할일만 하면됨.,자기 일만 하면 된다는 것은 옆에 사람이 죽어나가도 자기업무와 상관 없다면 문제 없다는 분위기임. 그리고 주말이나 연휴라도 갑으로 부터 전화받으면 나가야 함. 단 갑들이 있는곳이 경기도 지방이라 2시간은 넘게 가야 한다는것... 자기 생활이라는 것은 없음.,한치 앞만 생각 하면서 사람 갈아 넣지 말고 좀 멀리 봤으면
3.0,한솔인티큐브(주),2019. 12,3점,"""부서간 갈등있고 일찍출근하고일찍퇴근함 야근강요없이 일할수있는직장""",일찍출근하고 일찍퇴근해서 취미생활을 만들 수 있다는 점,간부출신의 비합리적인 업무분배가 가장 단점 인지 않나싶다,업무분배가 효율적으로 이루어진다면 더 커질수있는회사라고생각된다
3.0,한솔인티큐브(주),2019. 11,2점,"""전형적 수직구조의 회사. 여러의미로 다양한 경험은 가능.""",부서와 업무마다 다르나 본사 출퇴근시 퇴근 시간에 맞춰 퇴근 가능,업무에 멀티태스킹을 강조하는데 환경적인 요소는 하나도 갖춰져있지 않음,직원들의 의견에 적극적인 피드백과 개선이 필요한 것 같다.
3.0,한솔인티큐브(주),2019. 10,3점,"""내근직에게만 꿀인 회사이고 외근직들에겐 그저그런 회사이다.""",내근직에게는 대기업의 워라벨을 느끼면서 다닐 수 있는 장점,외근직에게는 딱 중소기업에 다니는 것처럼 다닐 수 있음,바라는 점 없음. 이미 포기임..............
3.0,한솔인티큐브(주),2019. 09,4점,"""기업 컨택센터 구축 주력 사업을 하는 회사. 모바일 통신 3사 서버 솔루션 개발도함""",컨택센터 시장 점유율이 높은 회사. 업무 강도가 높지 않음. 분위기는 자유로운푠,부장 차장 많음. 큰 프로젝트에 참여하게되면 1~2년 고객사 상주,현재 인력에 대한 적절한 보상이 더욱 필요함. 특히 상주 인력.
3.0,한솔인티큐브(주),2019. 08,2점,"""위사람들의 이득만을 위한 회사. 위기가 생기고 극복하는 과정에서 잘못 끼워진 단추로 현 분위기는 다들 그만둘 분위기""",전반적으로 복지는 좋은편임. 너무좋아서 불편한점도 있음.,일하는 사람만 일하고 있음. 또한 매출 이익으로 채용을 안함. 팀장들의 능력이 의심됨.,능력있는 사람을 채용하고 본인들의 배를 그만채우시길.
3.0,한솔인티큐브(주),2019. 08,3점,"""바로 실무에 투입되어 다양한 경험을 처음부터 해볼 수 있음.""",연차를 자유롭게 쓸 수 있습니다. 근무 장소는 쾌적합니다.,실무를 가르치고 업무를 중재할 중간 직급이 없습니다. 연봉이 메리트가 없으며 야근 수당이 없습니다. 복지도 나쁘진 않으나 장점이라고 꼽을 만한 복지 제도나 혜택이 없는 것 같습니다..................................,일 안하는 프리라이더들과 고생하는 직원들을 분간해서 제대로 된 보상과 평가가 뒤따라야 함.
3.0,한솔인티큐브(주),2019. 07,3점,"""일이 몰리는사람에겐 몰리고 일이 많지 않은 사람은 너무 편하게 다님.""","자유로운 분위기, 주변 사람들이 다 착하고 좋음. 콜센터 특성상 업무시간이 아닐때 작업을 해야해 새벽 일이 있음.",팀내 소통이 부족하고 팀간의 소통도 부족하여 서로에 대한 배려가 부족하고 개발자의 커리어에 발전이 없음,회사의 문제점을 직시하고 개선해야할 부분을 빠르게 개선해야 한다고 생각함.
3.0,한솔인티큐브(주),2019. 07,4점,"""한솔 사람들이 좋고 , 복지도 좋았다. 어딜가든 일하는 사람만 일하는거 같지만""",복지좋고 비교적 자유로운 분위기였다. 변화하려고 하는 모습이 있었다,새로운 사업을 발굴하기엔 인재가 없어보였다. 리드자를 영입해야할듯,"직원들의 불만을 구체적으로 들어야 할거 같고, 새로운 사업을 할 시에 장기적인 안목이 필요해보였다"
3.0,한솔인티큐브(주),2019. 06,4점,"""나름 복지와 직원대우는 만족했습니다.""","자유로운 분위기였으며, 휴가 사용도 눈치 안보고 썼습니다.",프로젝트가 바쁠때는 야근을 많이하고 야근수당은 없다 생각하면 됩니다.,개발자 대우를 더 해주세요. 복지는 줄이지마세요
3.0,한솔인티큐브(주),2019. 06,3점,"""다양한 개발 경험을 할 수있으면 비전이 없는 회사
.........""","자유롭게 일할수 있는 분위기이며 자율 출퇴근, 복지가 괜찮음","인력 부족으로 개발 업무가 많음
업무 강도 대비 연봉이 작음
.........",신규 사업을 찾으려고 하지만 생각이 많아서 성과가 나지 않음
3.0,한솔인티큐브(주),2019. 05,3점,"""한솔그룹사의 IT회사이긴 하나 그룹내 IT는 PNS가 하고 인티큐브는 콜센터, 모바일을 비롯한 대외사업을 위주로 함.""",상암동에 위치하여 업무 환경 쾌적하고 자유로운 분위기. 한때 샤워실과 수면실을 둘 정도로 업무강도가 Very High 였으나 현재는 많이 normal해짐. 주말에 일하면 몇만원이라도 보상을 해줌. 복지는 그래도 쓸만함.,일을 안하는 고인물들이 많아서 젊은 사람들은 본인들에게 아래로 전달되는 업무들을 처리하는 소위 뒷감당업무가 많아 동기부여가 전혀 안됨. 시간 지나면 그냥 승진시켜줘서 직급 인플레가 심함. 회사가 이익을 내도 사원들에게 내려오는 인센티브는 쥐꼬리 수준. 동종업계에 비해 급여수준도 낮음.,"힘든일은 남에게 넘기고, 외근인척 나가서 놀다 퇴근하는 고인물에 대해 확실히 인사고과를 반영해서 그래도 일하고자 하는 젊은 사람들이 일하기 좋은 회사를 만들었으면."
3.0,한솔인티큐브(주),2019. 05,2점,"""팀마다 다르겠지만 인원이 모자라서 일이 과중되지만 성과는 또 좋지않은""",본사 내근직이면 여성분들이 다니기에는 최고의 회사가 아닌가 싶습니다,외근직은 일단 1년에 본사에 거의 없기 때문에 본인이 어떤 회사에 다니는지 까먹음,"신규 사업 추진에 적극적인 모습은 좋지만 그걸로 인해서 희생하는 부분, 불만사항도 들어줬으면 좋겠습니다."
3.0,한솔인티큐브(주),2019. 05,4점,"""회사는 변화하려 하지만 인원들이 따라오지 않는다. 준비를 잘한다면 앞으로 나아가겠지만, 변화하지 않으면 이렇게 사라지겠질듯 하다""","편한 근무환경, 자유로운 분위기, 근무환경을 지속적으로 개선하려 한다.",오래된 사람들이 많아서 변화를 바라지 않는다. 고지식한 사람들이 대부분이다.,눈치보고 자리만 차지하는 사람들이 많다. 정리를 해줬으면 한다
3.0,한솔인티큐브(주),2019. 04,3점,"""한솔그룹 ICT 전담회사로써 먹거리에 대해서 고민하는 자회사. 하지만 실제는 한솔그룹에서의 IT 관련 기반 사업에 집중""",그룹사의 복지를 그대로 동반 하지만 새로울것도 특이점도 없음,보수적인 분위기 및 임원의 노령화 등으로 결속력 및 진행능력이 떨어짐,신규사업및 새로운 먹거리에 대해서 투자 및 진행력을 높이는것에 집중하길 바랍니다. 물론 솔루션개발 등의 자기만의 힘을 키워야할것이라 생각합니다.
3.0,한솔인티큐브(주),2019. 04,2점,"""한솔 그룹사로 대기업 소속이지만 중소기업처럼 운영되고 장래는 없어 보입니다.""","연차 사용이 자유롭고 오전 반차, 오후 반차 사용이 자유롭습니다.
업무 강도는 강하지 않습니다.","문서를 위한 업무가 많습니다. 개발 진행 사항 및 업무 보고 회의가 많습니다.
한솔 그룹사로 IT 기업의 혁신이 없습니다.",신사업 개발한다고만 하지 말고 현재 있는 직원들에 대한 처우를 고려해주면 좋겠습니다.
3.0,한솔인티큐브(주),2019. 03,4점,"""직원들의 성품이 좋아 서로 배려를 많이 해주고 인간적인 회사라고 생각됩니다.""","샌드위치 휴무가 있어 목요일이 공휴일일 경우, 금요일에 연차가 자동 사용되어 쉴 수 있습니다.",직급이 오를때에도 연봉 인상률이 극적이지 않아서 아쉽다. 사무실 개인별 책상의 길이가 좁다고 생각된다.,신규 사업을 추진할 때 좀 더 적극적으로 지원해서 직원들이 마음껏 역량을 발휘할 수 있도록 해주면 좋을 것 같다.
3.0,한솔인티큐브(주),2019. 02,3점,"""주변 동료가 좋은 회사, 정확한 R&R이 주어지지 않는 곳""","친화력이 있다면 주변 동료들이 좋음, 복지가 다양하게 있음.","정확한 R&R이 주어지지 않음, 처음엔 맡은 업무만 하지만 나중에는 이 업무 저 업무 다 함. 프로젝트도 부족한 곳 채워 넣기 일수",돈벌기에 급급하기보다는 일단 사람도 같이 챙기면서 진행 했으면...
3.0,한솔인티큐브(주),2019. 02,3점,"""열심히 일하면 일할만큼 대우받을 수 있는 곳 단 열심히해야함""",어느정도 수준의 복지는 전부 받을 수 있음. 하지만 요즘 중견기업이나 대기업 수준의 복지는 아니었었음. 열심히 일하면 눈치보지않고 편하게 다닐 수 있음,업무강도가 낮지 않음 복지 자체가 그렇게 좋지 않음 점심 먹을곳이 없음 출근이 너무 불편함 잦은 지방 출장 등,딱히 크게 바라는점은 없음 다만 몇몇 디렉션으로 인해 업무 의지가 꺾이는 경우가 많음 하고자하는 직원을 좀더 믿어주고 밀어주면 좋겠음
3.0,한솔인티큐브(주),2019. 02,3점,"""개발자가 일하기에 괜찮은 편이다. 매주 나오는 간식이 맛난다""",간식이 나온다. 회사 커뮤니티 문화가 좋다. 휴가제도가 좋다,"신입과 경력의 연봉차이가 적으며, 오래 다닐수록 대우 받는다는 느낌이 적다",좀더 이 회사에서 경력이 많고 열심히 하려는 직원들이 회의감들도록 하지 않게 해줬으면 한다
3.0,한솔인티큐브(주),2019. 02,4점,"""콜센터 관련 토탈 솔루션 제공하는 업체. 한솔그룹 자회사로서 콜센터 시장에서는 국내 top기업이다. 그러나 국내 콜센터 시장 자체가 크지 않고 자체 솔루션보다는 외산 솔루션을 많이 사용하는 편.""","자유로운 분위기. HTTP 외 통신 인프라 기술을 접할 수 있음. AI, 빅데이터 관련 솔루션 개발 쪽으로 확장하는 중.","국내 콜센터 시장의 크기가 더 이상 확장되기 힘들고, 내부 개발보다는 솔루션 연계 위주의 사업 진행.",자체 솔루션 개발에 좀 더 투자했으면 함.
3.0,한솔인티큐브(주),2019. 01,4점,"""사내 분위기가 타 IT회사들에 비해 굉장히 자유로운 편""","도서구입비, 학원 수강료 등 다양한 복지 지원. 나름 삼성계열이라 그런지 복지가 좋다. 사내에 있지는 않지만 어린이집도 이용할 수 있음",복지제도가 잘 되어있는만큼 회사 행사도 너무 많아서 업무에 집중하기 힘든 느낌이 있다.,신규사업 추진에 좀 더 힘을 실을 필요가 있다고 생각한다. 한계점이 뚜렷한 느낌이었음.
3.0,한솔인티큐브(주),2019. 01,3점,"""단점 빼고, 근무환경 좋고 자유롭고 워라벨 괜찮음.""",휴가 자유롭게 사용 가능. 분위기 대체적으로 자유로움...,"연봉 적고, 매년 연봉인상도 늦음. 업무량 케마케로 많은데는 계속 많은듯.","직원들 고충에 귀기울이고, 인력보강에 신경써주길."
3.0,한솔인티큐브(주),2018. 12,3점,"""BM모델을 다양화 하려는 노력을 기울이는 중, 결과 보다는 방향성은 글쎄...""","회사에서 지원되는 간식시간이 있음. 상암근처 때를 잘 맞추면 볼거리가 다양하나, 모이는 인파로 교통은 불편 할 수 있음.","사무실 위치에 따라 다르지만 사무실이 전반적으로 어둡고 무거운 편임.
강 근처라 겨울엔 바람이센편.","잘 하고 있는 것을 집중하고, 그것을 기반으로 나아가길 바랍니다."
3.0,한솔인티큐브(주),2018. 11,3점,"""공채로 입사하면 다니기 좋지만 발전은 없음
연봉인상률이 적다""","휴가를 비교적 자유롭게쓸수있다.
분위기는 자유로운 분위기임.",몇몇 이기적이고 무능한 사람들로 인해 업무량이 집중되는경우가 있다. 일하는 사람만 일함.,사람관리에 힘썼으면좋겠다. 노는인력들이 은근히 많음. 직원들의 이야기도 좀 잘 들어줬음함.
3.0,한솔인티큐브(주),2018. 11,3점,"""같은 경영지원실 내에서 업무 시간 편차가 상당히 심함. 인간미가 넘치는 사람들이 많이 다님.""",교육에 대한 지원을 많이 해줌. 다른 회사의 좋은 문화를 많이 따라하려함.,팀간 업무 시간 편차가 심함. 따라서 상대적 박탈감이 들 수 있음.,상대적 박탈감이 들지 않는 회사로 만들어 주세요. 감사합니다.
3.0,한솔인티큐브(주),2018. 11,2점,"""본사근무면 좋은직장인것같습니다. 본사근무아니면 한솔인티큐브직원아니라고 생각하면될듯""","본사근무한다는 가정하에 워라밸,복지모두 만족하고 교육체계도 잘갖추어져있음.연차자유롭고 사람들도 몇명빼고좋음. 자율출퇴근제라는것도 한다고함(외부프로젝트뛰고있어서 써본적없음)본사근무로지원하는거면 적극추천.","외부프로젝트뛴다는것자체가단점. 잦은야근,주말출근,연차못씀,복지도거의못받음. 외부에서일하기때문에 어떤사람들과일할지모름(주로고객사니까 갑질당함)",외부프로젝트진행하는직원들에대한 적절한 대우를 해주세요.
3.0,한솔인티큐브(주),2018. 10,2점,"""워라밸은 보장해주지만 평가는 보장못함ㅋ. 징징거리는사람만 평가잘주고 실질적으로 일하는사람들은 인정못받고 곧 퇴사.""",워라밸은 좋음. 휴가 눈치안봄. 팀원들간의 분위기는 좋다고생각함.,올바른평가가 이루어지질않음. 열심히해도 징징거리는사람 못이김.,앞으로의 사업을 생각하는것도 좋은데. 사람들이 현재 왜나가고있는지 생각좀했으면 좋겠음.
3.0,한솔인티큐브(주),2018. 10,3점,"""바쁨과 잠시의 여유를 오가며 일할 수 있다. 비전은 없고 한만큼 받는다고 위안삼아야 한다.""",연차사용할 수 있다. 프로젝트 종료 후 길게 휴가 갈 수도 있다. 사람들 분위기가 좋다. 워라벨을 따라가려하고 있다.,동종업계에 비해 연봉이 짜다. 프로젝트가 계속되면 휴가가기 어렵다. 비전이 없다. 영업파워가 쎄다. 인력이 부족하다. 부족하게 만든다.,신규사업추진 열망은 없으나 사업 아이템 발굴을 못한다. 인건비를 절감하면 안되다. 결국 배로 돌아온다.
