총점,회사,날짜,별점,요약,장점,단점,경영진에게
2.4,디오스텍(주),2018. 03,4점,"""팀 분위기가 너무 좋고 해보고 싶은 것 다 해볼 수 있다.""","팀 분위기와 자기주도적 업무 체계
회식문화 비 강요..",다소 촌구석에 위치한 회사로 자차없이는 출퇴근이 매우 어려움,"직원에 대한 복지가 더 많아졌으면 좋겠다.
잔업수당등."
2.4,디오스텍(주),2017. 12,1점,"""경력을 쌓고 배울만한 선임들도 없고, 비전이 없이 그냥 집<->회사 가능한 회사.""",직원신경안씀. 자기할일만 하면됨. 식당 밥맛 좋음. 칼퇴근가능.,"아직도 어수선 하고 기본과 기준이 없음. 사람 짜르는데 최고.
조용히 일못하는 사람들만 남아있고
일잘하는 사람은 다 짤리고 다 알아서 퇴사함.
제조만 최고로 생각하는 임원, 그외 관리는 다 그냥 소모품 취급","그냥 꾸역꾸역 이어가고 있고 짤린 사람들이 계속 늘수록 이미지는
점점 더 않좋아질듯..
본인방식의 일을 진행하더라도 좀 알고서 하시고, 모르면서 계속 자기 업무방식을 강요하지 말고 사람마다 좀 성향을 파악해서 대하길.. 임원 마인드가 좀 없는듯"
2.4,디오스텍(주),2017. 11,1점,"""카메라 렌즈 회사이며, 삼성 3차벤더 이다.
전체적인 회사분위기는 개인주의가 심하며, 그냥 본인 업무만 충실하다면. 아무도 신경쓰지 않는 분위기이다.""",칼퇴근 외에는 없는것 같다. 특히 근무시간 프리하다는 점과 지각을해도 굳이 제재가 발생하지 않다.,"일단 첫째로 급여 지급문제이다.
급여담당자의 빈번한 실수 발생으로인한 급여가 적게 또는 많이 들어오는 일들이 빈번히 발생한다.
하여 수시로 체크해야 된다.
또한, 인사부분 업무스킬이 구조조정후 현재 인사팀 스킬 부족현상, 하여 인사팀 개혁이 필요할듯 합니다.","국내 본사 인력인프라 전문성이 많이 떨어집니다.
하여, 쫌더 인력인프라의 투자가 필요하다 생각됩니다."
날 괴롭힌 삭제된 댓글,디오스텍(주),경기,,,,,
날 괴롭힌 삭제된 댓글,디오스텍(주),경기,,,,,
날 괴롭힌 삭제된 댓글,디오스텍(주),경기,,,,,
1.8,(주)한프,2022. 06,3점,"""상폐, 시스템 좀 안좋습니다 다들 힘이 없어요 대표자가 바껴서 현재는 모르겟습니다""",상장되어잇을때는 회계를 그나마 배울수 잇엇는데 현재는 상폐,상폐되어 업무에대해 배울수 잇는게 적을거 같습니다...,신규사업에 적극 투자하시길 추천드립니다 프린터 관련 사업은 잘 모르겟습니다
1.8,(주)한프,2022. 04,3점,"""매출은 줄고 사람들은 의욕이 없이 시간만 보내고 급여 인상없고 급여도 밀리고 총체적 난국""",윗사람들이 거의 다 퇴사당해서 눈치를 안봄 빠른손절이 답,사업이 망해서 공장 문닫고 난리도 아님 주인이 몇번바뀌고해도 안됨,사업정상화좀 시켜주시길 엄청난적자에 정리해고 맨날 하고 ㅜㅜ
1.8,(주)한프,2022. 03,3점,"""노동력이 최대인 회사 위에 분들 말이 곧 법이었음""","유급 휴가를 주는 것 단, 평소에 야근 밥먹듯이 함 휴가를 안 주면 버틸 수 없음",각자 자신이 맡은 업무외에 시키는 건 몰라도 다 해야함 공부해서라도 다해야함,회사 살리기가 제일 급선무입니다 배채우려고 하지말고 아래 직원들 생각부터하세요
1.8,(주)한프,2022. 01,1점,"""서울 근무로 계약했는데 망해서 충북 진천으로 내려감..
다니면서 별에 별 일을 다 겪음""",당시 경영진들이 해외로 도망가거나 회사에 잘 없어서 비교적 자유로웟음,위 장점을 제외한 모든것이 단점임. 결국 회사 망해가는 것까지 지켜봄,어떻게 지내는지는 모르나 발뻗고 잘 지내지는 않았으면 좋겠음(회사 망하게한 주범들)
1.8,(주)한프,2021. 10,1점,"""경영진이 밖에서 일단 공수표를 날리고 그럴듯한 프로토타입으로 사기치는 곳""","사무실 비싼곳에 있고, 뷰가 좋음
큰 책상, 고급 의자","야근, 주말 출근 필수
사장 기분 안좋으면 트집잡아 갈굼",사기 칠 생각말고.. 건설적 일을 좀 했으면..
1.8,(주)한프,2022. 06,3점,"""상폐, 시스템 좀 안좋습니다 다들 힘이 없어요 대표자가 바껴서 현재는 모르겟습니다""",상장되어잇을때는 회계를 그나마 배울수 잇엇는데 현재는 상폐,상폐되어 업무에대해 배울수 잇는게 적을거 같습니다...,신규사업에 적극 투자하시길 추천드립니다 프린터 관련 사업은 잘 모르겟습니다
1.8,(주)한프,2022. 04,3점,"""매출은 줄고 사람들은 의욕이 없이 시간만 보내고 급여 인상없고 급여도 밀리고 총체적 난국""",윗사람들이 거의 다 퇴사당해서 눈치를 안봄 빠른손절이 답,사업이 망해서 공장 문닫고 난리도 아님 주인이 몇번바뀌고해도 안됨,사업정상화좀 시켜주시길 엄청난적자에 정리해고 맨날 하고 ㅜㅜ
1.8,(주)한프,2022. 03,3점,"""노동력이 최대인 회사 위에 분들 말이 곧 법이었음""","유급 휴가를 주는 것 단, 평소에 야근 밥먹듯이 함 휴가를 안 주면 버틸 수 없음",각자 자신이 맡은 업무외에 시키는 건 몰라도 다 해야함 공부해서라도 다해야함,회사 살리기가 제일 급선무입니다 배채우려고 하지말고 아래 직원들 생각부터하세요
1.8,(주)한프,2022. 01,1점,"""서울 근무로 계약했는데 망해서 충북 진천으로 내려감..
다니면서 별에 별 일을 다 겪음""",당시 경영진들이 해외로 도망가거나 회사에 잘 없어서 비교적 자유로웟음,위 장점을 제외한 모든것이 단점임. 결국 회사 망해가는 것까지 지켜봄,어떻게 지내는지는 모르나 발뻗고 잘 지내지는 않았으면 좋겠음(회사 망하게한 주범들)
1.8,(주)한프,2021. 10,1점,"""경영진이 밖에서 일단 공수표를 날리고 그럴듯한 프로토타입으로 사기치는 곳""","사무실 비싼곳에 있고, 뷰가 좋음
큰 책상, 고급 의자","야근, 주말 출근 필수
사장 기분 안좋으면 트집잡아 갈굼",사기 칠 생각말고.. 건설적 일을 좀 했으면..
1.8,(주)한프,2021. 07,1점,"""최악인듯............ 근데 자유로워씅ㅁ""","건물만 좋았었음....ㅋㅋㅋㅋ 그리고 자유로운 분위기?
일안해도 뭐라 안함 일하는 사람 따로 노는 사람 따로있음.","최악임 성장 가능성 없음.
이것저것 다 시작해보다 그냥 망함 그분야 전문가 없이 신입들만 잔뜩 뽑아놓음 그 결과가 이미 나와버림...................................",걍 결과과 이미 나와버려서 ㅋㅋ... 뭐라 할말이 없네요.... 주식 바닥나고 어느정도 예상했던 부분...............
1.8,(주)한프,2021. 06,1점,"""일을 해도 일에 대한 보람은 느낄 수 없는 곳""",대체로 정시에 퇴근이 가능한 점 외에는 딱히 없는 것 같음,일은 하는 사람만 하고 업무 외에 스트레스 받을 일이 많음,직원에 대한 최소한의 배려라도 있었으면.
1.8,(주)한프,2020. 10,2점,"""과거의 영광과 현재의 몰락이 공존하는 기업""","예전에 잘나갔음. 그래서 업무 프로세스가 제대로 되어있음.
상장회사라서 일반 회사와 조금 다른 차별감이 있음.","현재 잘 안나감. 업무 프로세스를 제대로 관리하던 직원들이 퇴사함.
상장폐지가 예상됨. 직원이 많이 줄어들음.","지속적이고 안정적인 경영을 했으면 함.
경영권도 흔들리고 있는 중..."
1.8,(주)한프,2020. 03,1점,"""뭐하는 회사인지 도저히 모르겠다. 고래싸움에 새우 등 터지는 곳. 일 보다 눈치 보기 바쁜 곳.""",일이 널널하다 근무 환경이 자유롭다 개인 시간이 많다(어쩌다 보니) 회식이 별로 없다.,너무 많아서 다 적을 수 없지만 가장 큰 문제는 뭐 하는 회사인지를 직원들이 알 수가 없다. 일단 하라는 일은 하지만 중구난방이다.,바란다고 들었으면 회사가 이렇게 되진 않았을 것이라고 생각한다. 회사 살리는데 주력을 다 하되 직원들을 새우 등 터지게 만들진 말길...
1.8,(주)한프,2020. 01,1점,"""일이 제대로 잡혀있지 않은 회사이며 수직적 문화가 매우 강하다""","야근 식대 제공, 직원들은 다들 좋음
좋은 사무실 탕비실 제공","연차를 자유롭게 쓸수 없음
회사 분위기가 안좋으면 거의 못쓴다고 생각해야된다
매우 수직적인 문화이며 무슨 사업을 하는지 잘 모르겠다","직원들의 얘기도 들어주는 조금은 수평적인 기업이 되었으면 좋겠음
일의 체계가 잡힐 수 있게 만들어줬으면 함"
