총점,회사,날짜,별점,요약,장점,단점,경영진에게
2.1,윈팩(주),2022. 02,2점,"""밥을 꼬박꼬박 맛있게 주시고 월급도 밀리지 않으나
그외 좋은장점이 딱히 보이지 않음.""",밥을 맛있게 아침 점심 저녁 먹을수있습니다. 월급도 밀리지 않고 잘줍니다. 명절때 선물 줍니다. 하지만 이외에 좋은점이 딱히 보이지 않습니다.,"기숙사가 있는데 외관에 비해 내부가 매우 더러움.
특히 머리감는 샤워기 상태보면 좀 짜증남. 본인돈으로
몇번을 갈았는지 모르겠음.

본인도 관리직이었으나. 사무실에서 일하는 대부분의 사람들은 배려가 부족한거같음. 마치 현장직을 아래로 보는 경향이있음. 옆에서 통화소리들으면 이게 동일한 사람인가 생각이 들정도임. 그리고 약간 군대 느낌남. 편하게 해주려는 그런행동들이 군대 느낌을 내게 하는걸 모르는듯 .. 좋게말해서
군대지 나쁘게 말하면 꼰대.. 그이상도 이하도 아님.","직원들 사이에서 합병이 되니 마니 이런소리가 자꾸들리는데
좀 확실히 알려줬으면 좋겠음 그리고 인사팀. 업무처리좀
빨리 해주셨으면. 무슨 재직증명서 요청하면 일주일이 걸리는지... 그리고 흡연장 개선좀 해주셨으면. 본인은 비흡연자지만 매우 흡연장이 개방되어있어 좀 짜증남.
뭐 월급은 꼬박꼬박 줘서 좋네요"
2.1,윈팩(주),2022. 01,1점,"""사람 갈아넣어서 매출찍고 나몰라라 하는 회사
장비수는 많은데 사람이없어서 장비를 못돌림""",1호봉기준 시급이 괜찮음 다만 ot시간이 기존 3시간에서 2시간으로 줄어서 전년도 재직자는 월급인상률이 없다고 보면됨,만성인원부족으로 작업자가 처리해야할 업무량이 타 회사보다 많음,인원수 보충 재대로 안해줄거면 장비를 늘리지말던가 사람을 재대로 충원해줬으면 함
2.1,윈팩(주),2022. 01,3점,"""월급 알바보다는 많이 주는 회사 밥 맛있을땐 먹을만 한데 맛없을땐 진짜 살락고 먹는거 같습니다. 상여 성과 없고 명절떡값 주긴 주는데 거의 없다고 보시면 됩니다. 지금 하는 사업도 위태로운 상황""",연차 대신 해줄 사람만 있다면 눈치 안보고 써도됨. 건물 그래도 나름 깨끗하고 일하다 보면 젊은 사람들 많아서 친해지면 재밌음 알바보다는 돈 괜찮아서 갈 때 없으면 잠시 돈벌려고 다니기엔 좋은회사...,연봉도 낮고 3조2교대라는 살인적인 교대패턴과 성과급이나 상여금이 없음 시급은 쌔지만 딱히 많이 받는건 아닌거같음 밥도 맛없고 단순노동이다 보니 시간이 너무 안감 쉬는시간 담배필시간이랑 밥먹는시간제외 없고 라인 안바빠도 계속 서서 일해야됨,직원들의 불만사항이나 식당 메뉴 선정에서 조금 더 신경써주셧으면 합니다 그리고 휴게공간도 따로 좀 개선하고 쉴 공간이 너무 부족합니다
2.1,윈팩(주),2022. 01,2점,"""스펙 없는 사람들이 생각 없이 다니며 돈 모으기 좋은 회사""","새로 지은 공장 화장실이 엄청 깨끗하다
한번씩 주간에 나오는 특식이 맛있다
신 기숙사가 좋다
상하수직까지는 아니어서 사내 분위기가 좋다 라인 내에서 웃고 떠들며 일 할 수 있어서 근무자들끼리 친하고 이거 하나로 버텼던 것 같다","야간에 밥이 맛없다..
성과금같은게 없고 우수사원 포상금만 있다
구 기숙사는 벌레와 곰팡이의 성지.. 원룸에 2명이 사는 우리나라 문화를 바꿨으면...
교대근무의 특성상 연차 쓰기가 빡세다
너무 외지에 있어서 자차가 없으면 놀러 나가기 힘들다. 사회 초년생들은 적응하기 힘들듯
추노가 많아서 여차여차 버티는 사람들이 정신적으로 힘들고 말도 없이 안나오는 날엔 두 사람 몫을 하느라 벅참. 일 잘하는 사람이라면 휴무일에 그런 일이 생길 시에 강요하진 않아도 나와줄 수 있냐고 연락온다","성과금 있었으면 좋겠다
기숙사 새로 계약해서 깨끗한 주거공간 제공이 시급하다"
2.1,윈팩(주),2021. 12,1점,"""그냥무난무난한곳입니다. 적당히 시간때울수 있는""",연차 사양가능하고 좋습니다. 다른거는 그냥그냥 별로에요.,인원이 너무 적어서 안좋습니다ㅣ. 인원 많이 늘려야 해요.,사람대우 좀 해주세요. 복지 처우 개선이 시급합니다.
2.1,윈팩(주),2021. 12,1점,"""진심 별로임…생산이 힘이 하나도없고 빌빌 깁니다.
인원없으면 현 직원들 여기저기 굴림""","월급 밀리거나 그럴일은 절대없고, 쉬는시간이나 뭐 특별한거 아니면 터치 하나도없음",생산일하면서 동작이 느리거나 하면 엄청 뭐라함; 열심히해도 욕먹는 회사임,현재 다니는 직원들에게 상여금(보너스) 챙겨주면 더욱더 열심히 할것 같습니다.
2.1,윈팩(주),2021. 12,3점,"""당장 일할곳이 필요하다면 여기만한곳이 잘 없다
시급도 나쁘지않음""",메인트 신입으로 들어왔을때 많은것을 배울수가 있다 분위기도 나쁘지는 않은편,"많은것을 알려주는건 다 이유가 있다
그만큼 신입이 하는일이 많음",그 교통이 안좋은데 기존 기숙사 어떻게 좀 할수 없나요?
2.1,윈팩(주),2021. 12,2점,"""모든 공정의 일을 할 수 있는 사람을 원합니다""",정규직이 전환이 쉽게 되고 회사 근처에 기숙사가 있어서 출퇴근이 가깝고 사원 복지에 신경 써 줄려고 노력을 합니다,모든 공정의 일을 다 할 수 있는 사람이 되길 바라고 사람이 너무 없고 인원도 최소 인원으로 운영을 해서 너무 힘들고 밥 도 별루 맛이 없어요,공정에 최소 인원을 가지고 일을 하니 너무 힘들어요 이쪽 일이 빨리 배워도 6개월이 걸리는데 그걸 사람 가르치면서 운영을 해야 하니 기존 사원들도 힘들고 새로 들어온 사람도 힘들어 합니다
2.1,윈팩(주),2021. 12,3점,"""다양한 경험을 해볼 수가 있음 개인이 해야하는 업무가 너무 광범위함""",연차 사용에 자유로움은 있음 그러나 사전에 해야 될 일이 많음 아침 점심 저녁을 다 줌,업무 범위가 너무 광범위해서 내가 이 일까지 해야하는게 맞나 싶음 주말에도 업무적인 연락이 많이 옴 내 시간이 사라지는 느낌,인원 충원을 적극적으로 하여 팀 간 밸런스를 맞춰주면 좋겠습니다
2.1,윈팩(주),2021. 12,3점,"""대우도 잘해주고좋습니다. 오시길 바랍니다다들 !!......""",자기개발할 시간 충분하고 좋아요 정말로 !!!!!....,바쁜 게 단점이라면 단점입니다!!.............,없습니다.!!!!!!!!!!!!!!!!!!!!!!!!!!
2.1,윈팩(주),2021. 11,1점,"""OSAT기업 중 제일 후발 주자, 생산에만 집중하는 회사""","사람이 제일 좋음, 사람대우를 해주는 직장
좋게 말로 하는 회사, 욕이 없는 회사","딱 사람만 좋은 회사, 나머지는 최악
급여는 생각하지 않고 오길.....","임원이 많네요, 거기서부터 시작되는거죠....."
2.1,윈팩(주),2021. 11,3점,"""대우를 많이 안해주고 관리자들의 텃세가 심한편임
...""",장점은 망하지는 않을거같은 회사임 삼성에서도 물건받아옴,연차쓰려면 무조건 대타가 필요함. 경력자들에 대한 대우가 안좋음,"상여정책을 마련하고 체계적으로 했으면 좋겟음.
경영진들이 너무 오합지졸임"
2.1,윈팩(주),2021. 11,2점,"""반도체 패키징에 대해서 알수있고 반도체 공정에 대해서 알수있다""",밥 세끼 다먹을수있고 타지에서 온사람은 기숙사 이용가능은 한데 좀 더러워서 치워야됨,"동마다 틀려서 잘모르겠는데 휴게소 협소하고 앉을자리도 없을뿐더러
Cctv도 없음",가족경영 하시는데 밑사람 좀 생각해주세요 사원들이 무엇을 원하고 생각하는지 알아주셨으면 그리고 관리자들 좀 정신차려라
2.1,윈팩(주),2021. 11,1점,"""OSAT 기업 중 하나이나 그리 오래 다닐 직장은 아니라고 생각 한다.""",반도체 패키지 경력을 쌓을 수 있다. 밥 세끼 공짜로 주며 기숙사 지원해 주는게 제일 좋다.,휴식 공간이 매우 부족하다. 아침에 주차 공간 찾기 힘들다. 물량 대비 인원이 매우 부족하다.,휴식 공간을 만들어 주세요 / 물량 대비 적절한 인원 배치 필요 합니다. 생산직은 특히 채용 인원 대비 탈출 인원이 더 많습니다.
2.1,윈팩(주),2021. 11,3점,"""구내식당 밥은 맛있었고 휴식공간은 많이 부족했음 지금은 어떤지 모르겠음""",사람들이 착해서 연차를 눈치를 안보고 쓸 수 있었음 근데 이것도 부서마다 차이가 심함,이상한 동아리 같은게 있는데 그게 자율이 아니라 강제적임,동아리 활동 같은것들 관리 좀 하세요. 자율적으로 차여할 수 있도록 해야지 강제적으로 하다니 참..
2.1,윈팩(주),2021. 10,1점,"""3조2교대이다 보니 워라밸 보장은 매우 지켜지기 힘듭니다.
진짜 돈 필요한 사람들이 오는 곳""","식사 3끼전부제공(아침 점심 저녁)
돈을 벌기 위함이 목적이면 갈만한곳
나중에 sk 하이닉스? 가는 사람들도 있음","단순작업이 되다보니 매우 힘듬
12시간 시간이 가질 않음.
꼰대가 많음?",사람들의 복지에 관해 신경써주시면 매우 감사하겠습니다.
2.1,윈팩(주),2021. 10,4점,"""돈 벌 기 무 난 한 회 사 입 니 다""",부 서 마 다 다 르 지 만 전 체 적 으 로 텃 세 는 없 는 거 같 아 요,인 원 보 충 이 늦 습 니 다 애 로 사 항 잘 반 영 안 됨,인 원 보 충 을 바 로 해 줘 야 남 아 있 는 직 원 이 오 래 다 닐 수 있 을 거 같 음
2.1,윈팩(주),2021. 09,2점,"""메인트넌스는 힘이 없다. 생산관리가 짱이다.""","아침 점심 저녁 야식 다 줌. 맛 보장 못함.
한가하면 놀 수 있음. 조기퇴근도 가능함.","메인트넌스 퇴근시간 늦어질때 간혹 있음. 늦으면 14시간이상 근무함.
복지가 회사사정에 따라 변경됨. 사람은 안뽑고 장비만 주구장창 늘림. 죽어난다..",장비를 늘렸으면 사람도 같이 채용하는게 당연한 이치라고 생각함.
2.1,윈팩(주),2021. 08,2점,"""반도체회사를 다니면서 여기보다 열악할 수 있을까?? 생각할 수 있지만 버티면 어디든 쉬울듯""",장점은 월급은 꼬박꼬박 잘 챙겨주고 그냥 이도저도 아닌 거 같음,"야간 근무 시 쉬는 시간 및 식사 시간 제대로 챙겨주지 못함,,","경영진분들께 바라는 점은 그냥 꾸준하게 사람들 잘 모아주세여,,"
2.1,윈팩(주),2021. 08,2점,"""일잘하면 일잘한다고 일많이주는 회사, 임원들만 배불리사는 회사, 연봉 협상 x 연봉 통보
동결만 2년쨰""","회사안에 카페 있고, 건강은 좋아질꺼같음 시골에있어서, 출근길이 별로안막힘, 기숙사 시설은 좋음, 최근 큰고객사 수주되서 앞으로 더욱 커질꺼같음","시골에있어서 아무것도 못함, 회사차량 없음, 연차 눈치봄, 꼰대 문화, 다른 팀경우 임원 갑질 엄청 심함, 무서워서 다닐수가 없음,","벌땐 배풀고, 욕설좀 안하셨으면 합니다."
2.1,윈팩(주),2021. 08,5점,"""반도체의 기본을 알 수 있는 작은회사지만, 들어가는 순간 후회하는 회사""","반도체의 기초적인 일을 할 수 있으며, 사회생활이 어떤 것인지 알 수 있게된다.","생산직 - 경력이 쌓이면 라인에 들어오지 않아도 된다. 허구한 날 정비사가 잘못하면 부사장한테 일러받침
정비사 - 차를 사라고 간접적으로 이야기하며 꼰대문화가 여전히 남아 있다 생산직의 권력으로 아무말 도 못하는 직책 중 하나",정비사 탓을 하지말고 야간근무시 생산직이 어떤한 일을 하지는 알아보세요
2.1,윈팩(주),2021. 07,3점,"""계속 성장하는 회사. 다양한 분야의 개발을 할 수 있음.""","일을 많이 할 수 있음. 다양한 업무를 할 수 있음. 개발 뿐만 아니라 네트워크, PC관리 등등 새로운 경험을 할 수 있음.","연차 쓰는데 눈치 보임, 퇴근하는데 눈치 보임, 모든것이 눈치 보임.",경영진에게 바라는 점은 딱히 없습니다.
2.1,윈팩(주),2021. 07,3점,"""돈 보고 할만한 것 같고 노가리도 좀 많이 까서 버티다 보면 생각보다 더 할 만하다 일 자체는 할만 한데 교대 근무 특성상 힘들다""",돈은 정말 따박 따박 잘나오며 수당이 많아 뛰는 만큼 받을 수 있다,군대문화가 좀 심하고 책임전가가 심해서 맨탈이 자주 깨지고 사고치면 대역죄인 급으로 뭐라고 하는데 퇴사 욕구 상승,윗 사람들이 일을 너무 안해서 신입 1-3년 차가 갈려 나가는데 윗사람들은 왜 그런지 모른다
2.1,윈팩(주),2021. 06,2점,"""경력을 쌓으려고 오는것보단 평생직장하려면 할 만 한곳입니다""",중식을줍니다. 석식을 줍니다. 카페가 있습니다. 인사과분들이 친절하십니다.,완전 고지식한사람들이 매우 많고 군대같은 분위기에서 일하면서 군대체험할수있다.,기업이 큰 만큼 서울에 있는 기업문화를 배웠으면 좋겠습니다.
2.1,윈팩(주),2021. 05,2점,"""포괄임금제. 야근철야가 많음. 주말 휴일에도 불나는 전화. 심할땐 새벽에도 옴.""",장점은 흡연실있음. 식사 나옴. 매점은 있지만 열질 않음.,비효율적 업무 로테이션. 제품 밤 10시에 들어오면 그때까지 남아있어야함,제발 포괄임금제좀 버리고 사람 덜 갈아서 했음 좋겠습니다.
2.1,윈팩(주),2021. 05,1점,"""밥이잘나옴 기숙사는별로 밥은최고 인듯""",밥이잘나옴 밥은정말잘나옴 사람들얼굴의 생기가안보이지만 밥은 잘나옴,생기가없어보임 사람들이 별로임 죄다 따로놀아서 텃세분위기가심함 거의 몇달일하면 상병장급임,"사람대우좀해주소 사무직 관리직 vsㅏ
가 너무심함"
2.1,윈팩(주),2021. 05,3점,"""지속적으로 복지가 줄어들고 있는 회사
인력 유출에 대한 대비가 필요해 보임""","유연 출퇴근제 적용 부서별로 차이있음
수직적이지도 수평적이지도 않은 관계","지속적으로 복지가 감소하는 추세, 동종 업계대비 낮은 연봉",일반 직원 입장에선 회사를 키우는것 보다 현실적인 복지가 필요
2.1,윈팩(주),2021. 05,3점,"""지금은 어떨지 모르지만 급여수준 나쁘지않았던 걸로 기억함""","연차를 자유롭게 사용 가능하다.
3조2교대 근무로 4일마다 2일씩 휴무가 있어서 좋다",12시간 근무 서서하는 근무라 다리가 아픔 다른건 딱히,"직원들의 불만을 듣지만말고 해결해줬으면 좋겠다.
합리적인 보상체계가 있었으면 좋겠다."
2.1,윈팩(주),2021. 04,3점,"""월급을 쏠쏠하지만 항상 사람들이 바뀌는 회사 몸이 금새 병나는 곳""","고졸치고도 꽤 괜찮은 페이, 상여금 연 2회 정도 지급, 명절선물 꼬박꼬박, 여름휴가 6일","공정인원 수 미달, 잦은 퇴사, 주말에는 2교대 시간대에만 있는 통근 버스, 교통 불편 함, 연장근무시간 1시간 뜯어감",빡세게 굴리지 말고 공정인원 수 좀 맞춰주세요. 엄청 힘듭니다.
2.1,윈팩(주),2021. 04,1점,"""할 일이 정말 많고 딱 수직적인 구조입니다. 경력있는 사람이 일을 덜하고 경력이 덜한 사람이 일을 더 많이하는 기업""","장점은 정말 없지만 돈을 많이 벌수 있습니다. 쓸 시간이 없거든요.
밥은 정말 맛있습니더.",수직적은 구조라 일하기 너무 힘듭니다. 일 하는사람만 하고 안하는 사람은 하루종일 아무것도 안함,위에서 공정이 잘 돌아간다고 생각하지 말고 공정에 좀 들어와서 직원들 고충이 뭔지 조사좀 했으면...
2.1,윈팩(주),2021. 04,3점,"""자금은 많이 좋아졌다고 들었습니다 저때는 무지 힘들었고요 밤도 많이 새면서 일했습니다만 첫 회사이고 패키징 이란걸 처음 배우면서 현재 밥먹고 살게 해준 고마운 회사 입니다""",하이닉스 위주의 비지니스 구조는 현재도 바뀐게 없는 것 같습니다 그래서 선택과 집중의 측면에서는 배울개 많이 있습니다,일단 회사 규모가 작아서 연봉이나 복지는 중견기업이나 대기없보단 떨어지는게 사실임,패키징 하우스 중에서 좀더 성장하여 직원들이 믿을수 있는 회사를 만드는것이 중요함
2.1,윈팩(주),2021. 03,1점,"""반도체 패키지 생산을 하는 기업이라서 전망은 있는거같다.""","삼시세끼는 챙겨주며, 기숙사도 제공한다. 돈은 절대 안밀리며 ,정규직을 시켜주고, 하는만큼 벌어간다. 그냥 일 열심히하면 된다.","기숙사는 낡고 저 멀리 편의점 하나있는 곳에 있었으며, 실수 한번 하면 돈 수백~수천 그냥깨진다 실수 한번 하면 그냥사원들 입소문나고 조장한테 털리기마련","경영진은 그냥 치고 나가시면 되지만 밑의사원들은 그냥 갈려나갈 수도 있고..
뭐 지금은 잘 모르겠습니다. 경연진들은 사원 생각 잘하시겠지않겠씁니까"
2.1,윈팩(주),2021. 03,3점,"""sk Hy*** 에 편중된 회사
무난하게 다니기 좋은 회사""","무난하게 다닐수 있다.
부서마다 차이가 있지만 어느정도 워라벨 가능","이상의 발전 없음.
진급은 임원들 거수로 진행 됨. 임원이 나는 아느냐 모르냐에 따라 진급 또는 누락 될 수 있음.","묵묵히 일하는 사람도 있고, 아무도 알아주지도 않는일 열심히 하는 사람도 있습니다.
주요 보직만 챙기지 마시고 , 묵묵히 조용히 일하는 사람도 챙겨 주세요"
2.1,윈팩(주),2021. 02,3점,"""에이티세미콘, 하이셈과 같은 대표적인 하이닉스 하청업체""",2교대 치고는 생각보다 일에대한 강도가 크지 않음 공기가좋다,공기가 좋은건 시골 촌바닥에 있기때문 회사 일정을 출근 한시간전에 뒤엎음,회사 설비좀 투자좀 해주세요하지 어디서 자꾸 중고로 업어와서 컨디션이 쓰레기인걸로 어거지로 돌리니까 힘들어요
2.1,윈팩(주),2021. 01,3점,"""아직자재가 별로없어서 안바쁘지만 지금까지는 다닐만하다""",일단 따른중소기업과비교하면 일의강도는모르겠으나 돈은나름괜찮다,다른중소기업을 다닌적이 별로없어서 잘모르지만 장비가노후화되서바쁘다,앞으로 실적이 더좋아진다면 상여금좀 많이줬으면좋겟다
2.1,윈팩(주),2021. 01,1점,"""열심히 해야한다를 배울수있으며 전문적인 능력을 쌓을수있습니다. 하지만 버틸수가있어야합니다. 군대보다 힘들었습니다.""",내일청년채움공제를 하라고 먼저 말을해준다. 밥 그나마 먹을만합니다,"군대보다 더한 상하관계, 쉬는시간이 매번 다름, 휴식공간 미흡",경영진분들은 잘모르겠습니다. 하지만 근속연수가 짧고 퇴사율 높은 이유가 제가보기에는 해당부서 중간직급을 가진분들이 아닐까싶네요
2.1,윈팩(주),2021. 01,1점,"""반도체 공정 업체이다 보니 생산쪽 입지가 세며 그로인해 다른 직군에 대한 투자가 상대적으로 적음""","시골 위치, 기숙사 제공, 중식 제공, 출퇴근버스(노선이 맞는다면)","시골 위치, 낙후된 기숙사, 생산위주 투자
수많은 임직원과 시설규모에 비해 소수의 전산직 직원들이 배정되어 있으며 이로 인해 과도한 업무가 주어짐. 제조업 특유의 군대식 문화가 자리잡고 있음",성과에 대한 보상이 적절히 주어저야 할듯
2.1,윈팩(주),2021. 01,3점,"""학교소개로간거라잘모르겠습니다 면접때는 일관련물어보고 어려운건없었고요""",연봉이높은편같습니다 복지는그냥저냥 그렇구여 근무가2교대라 좀힘든편?,장비기술직특성인진모르겠는데 연차사용눈치보이네요 특근자를무조건잡아야해서,업무시간이많은거같고 상여금주는게 랜덤이라 정확히 언제어느때주는지모름
2.1,윈팩(주),2020. 12,1점,"""회사원들을 위한것들이 거의 없음. 서로 자주 싸움. 기숙사 구 기숙사 신 기숙사 있는데 구 기숙사는 살기 힘듬""",2교대라 돈은 많이 받음. 재밌는 사람도 있음 . 돈만 벌수있음,연차가 있지만 아무래도 2교대다 보니 눈치보면서 쓰거나 다른 사람이 대타를 해줘야 함,없음없음없음없음없음없음없음없음없음없음없음
2.1,윈팩(주),2020. 12,1점,"""아웃소싱을 통해서 면접 날짜 잡고 면접을 보러 가게됨""",솔직히 말해서 장점은 월급을 받아도 쓸수가 없어서 돈모으기는 괜찮음 그리고 회사 기숙사 있음,단점으로는 복지가 너무 없다그리고 몇개월마다 시험을 보는데 귀찮을 정도임 시험을 봐서 호봉이 올라가서 어쩔수 없이 잘봐야함,"복지좀 신경 써주세요
분위기 망치는 사람들좀 내보내기 바랍니다 그사람들때문에 일잘하는 사람만 나가는것 같아요"
2.1,윈팩(주),2020. 12,2점,"""돈모으기 좋음 주변에 아무것도 없어서 기숙사 이용할시 자차필수""",돈모으기 좋음 최근 투자 많이해서 장비가 새것으로 많이 들어옴,"연차 사용 시 대근필수적으로 구해야함 주변에 너무 아무것도 없음, 일 없을때 쉽게 내쫒음",일이 줄었다고 사람 바로 자르지 않았으면 함. 특정사람들에게 권력을 너무 몰아주지 않았으면함
2.1,윈팩(주),2020. 11,3점,"""전반적으로 편안한 분위기.
R&D 전문기업에서의 경력이 다수여서, 비교했을 때 다소 보수적인 분위기.""","유연근무제 운영 중으로, 사정에 따라 근무시간 조정이 가능함.","지역이 너무 외졌다.
사업구조 상 이익이 많이 발생할 수 없기에, 임금이나 복지 향상에 한계가 보인다.","직원들에 대한 믿음이 적음.
직원들 기를 죽이기만 하고 살려주지는 않음.
전에 근무했던 다른 회사와 비교는 그만 했으면."
2.1,윈팩(주),2020. 11,3점,"""무난한 연봉 ,무난한 업무 난이도, 추천은 그닥?""","밥 삼시 세끼 주는거, 업무 난이도가 높지않으며 단순 반복일상, 바쁘지않으면 칼퇴가능","위치가 너무 시골임, 근무시간이 불규칙, 패키징업계 특성상 성장가능성이 더딤",적극적인 투자 및 연구 개발이 없으면 미래도 없다
2.1,윈팩(주),2020. 11,3점,"""일한만큼 돈받고.밥먹고.자고 반복하실분만""",기숙사.출퇴근 버스. 하루 2끼 . 중간에 10분씩 휴식시간 최소한의 복지,교통이 엄청 불편하고.자차 없으면 기숙사 생활필수.외로움,"직원들 불만있을때 나서서 이야기좀 들어줬으면 좋겠습니다.
열에 열은 전부 불만이있습니다."
2.1,윈팩(주),2020. 11,3점,"""근무자가 일하기에 환경은 괜찮은편. 그러나 기업내 사내 분위기가 엄숙하고
기업분위기가 잘 조성되있다고 보기는힘듬""","연차를 눈치안보고쓸수있음, 기숙사 이용자는 통근 버스로 유이하게 출퇴근 가능한건 좋음. 주야 교대 근무 경험자들은 쉽게 적응할수잇을듯.","연봉은 상승 등폭이 괜찮은 편이나 시급직 주야교대로는 큰 월급을 기대하긴 어려움.
사내 내의 분위기가 적응하는데 그리 좋다고 볼수는없음","직원 불만에 대해 적극적으로 수립을 해줬으면 좋겟으며, 상위 직책 근무자들이 신입 들어왔을때 오래 끌고갈수있는 분위기 조성을 했으면 좋겠음."
2.1,윈팩(주),2020. 11,3점,"""와서 돈벌기 좋은곳(주변에 아무것도 없어서 돈쓰기힘듬) / 동종업계대비 급여 나쁘지않은편 / 근무강도 10중에 3~4정도 되는편""","생산직으로 오면 나름 프리한 분위기로 일할수있음 / 돈모으기좋음(세후300선) / 3조 2교대라서 야간뛰지만 야간은 널널해서 좋은것도 있음
/ 경력없어도 들어오기 수월함 / 공정마다 분위기 다르겠지만 B/G 공정이 제일 나은듯",생산직은 실수하면 질타받음(강도 하) / 설비직은 실수하면 대역죄인됨(강도 상) / 일배우는 분위기(신입입장으로) 꼰대성 있음 군대 분위기 / 주변에 아무것도 없음 / 차없으면 출퇴근 외로는 힘듬 / 반도체라 그런지 상당히 예민함,상여금좀 더주면 좋을듯 / 내리갈굼 문화 없어져야됨 / 인력관리 필요함 / 뭐든 구두로 하지말고 문서화 필요함
2.1,윈팩(주),2020. 10,2점,"""교대 근무로 월급하나는 짱짱하게 받을수 있지만, 일하는 만큼 받는 수준""","1. 급여는 정해진 날짜에 들어오는편.
2. 교대 근무기 때문에 돈은 좀 된다.","1. 경력사원 채용시 기존 인원들과 비교했을때 호봉을 더 많이 받고 들어와서 인플레이션이 심함
2. 회사 위치가 접근성이 안좋음",근무 강도에 비해 쉬는날도 별로 없고 고생하는 직원들 좀 챙겨줬으면 합니다.
