총점,회사,날짜,별점,요약,장점,단점,경영진에게
2.5,캠시스(주),2021. 03,3점,"""별거 없음. 뭐 할 말도 없는데 30자까지 적으래 귀찮게시리.""","장점이 있나? 최소한 구비해야 할건 다 있는거 같음.
아 하나 있네. 사내 배치된 자판기의 음료가 싸다.","뭐..좀 달라졌는지 모르겠는데, 품질 똥망.
야근을 해야하는데 야근 수당 받고 싶으면 임원 결재 받아야 함.
팀 야근시간 일정 이상 초과되면 팀 관리 부족으로 임원 고과 마이너스 시킴.
개고인물",바라는거 없음. 퇴사했는데 뭘 바래 알아서 잘 먹고 잘 살겠지.
2.5,캠시스(주),2021. 03,4점,"""근무 여건이나 환경은 나쁘지 않다. 적은 월급 꼬박꼬박 받는걸 좋아하면 추천한다.""",임원진에게 건의같은 것을 편하고 쉽게 할 수 있는 구조이다. 어느정도 통용되는 분위기이다. 빡센 분위기는 아니다.,같은 직종 같은 업무량의 타 회사에 비해 월급이 적다는 생각이 든다. 다만 내가 여기에서 커리어적으로 발전을 이룰 수 있을진 모르겠다. 다른 사람은 어떻게 생각할지 모르지만 나는 그랬다.,막 좋은회사다 라고는 못하지만 다닐만한 회사다 . 다만 전기차 사업은 빨리 접고 본사업에 집중했으면 좋겠다. 모든 직장인의 생각이겠지만 월급도 좀 올려줬으면 한다.
2.5,캠시스(주),2021. 03,3점,"""개발자에 대한 대우가 나쁘지않으며 업무환경이 좋은편입니다.""",아침 점심 저녁 식대가 모두 제공 되고 본사에서의 밥은 맛있습니다. 휴가나 연휴 보장이 잘됩니다.,조직 개편이 자주 있어서 불편했고 인사 평가가 제대로 이루어지지 않는것같았습니다.,직원들이 속마음을 알아보려는 노력이 있으면 좋겠습니다. 오래 더닐수 있도록.
2.5,캠시스(주),2021. 03,2점,"""발전이 없다. 다들 정체되어 있고 새로운것을 시도하지 않는다. 시도하더라도 직원을 통해 성장을 이끌어 내는 방법을 경영진이 전혀 모른다""","그냥 맘만 먹으면 월급루팡처럼 편히 일할수 있다. 자기꿈이 월급루팡인 자들에게 추천한다. 열심히 일하는 스타일이라면 손해보는 느낌이 강할 것이므로 3년를 버티지 못할것이다.

군대식 문화는 아니다. 그냥 능력없는 루팡들의 집합소라 생각하면 된다.","1. 근속연수 오래된 직원은 99.9% 일안하는 월급 루팡이라 봐도 좋다. 자기 필드에서 아는거 없고 일안하고 그냥 꼰대 마인드 또한 갖추고 있어서 아랫사람 부려먹는다.

2. 이러한 월급루팡을 걸러낼수 있는 조직문화가 전혀 형성되어 있지 않다. 그냥 짱박힌 돌처럼 10년이상을 일하나도 안하고 성과없이 앉아만 있는데도 좋게좋게 데리고 가자 하는 조직문화이다. 이러니 사원급 퇴사율이 엄청 높다. 그리고 이 조직문화를 견뎌낸 사원~과장들은 또다른 월급루팡이 되어있다.

3. 여러가지 사업실패를 겪었음에도 불구하고 경영진이 그 실패로부터 배우는 점이 전혀 없다. 그 똑같은 무능력한 경영진을 데리고 다른사업을 시도하고, 같은 실수를 10년이상 되풀이 하고 있다. 기본적 경영 마인드를 의심할수 밖에 없는 대목이다. 정리해고를 하더라도 사업부의 일반 실무진들을 정리해고 한다. 그 위에 능력없고 보여주기식 임원들은 그대로 데리고 간다. 참 이해할수 없는 경영방식이다

4. 새롭게 시작하는.사업들에게서 철저한 관리감독, 건강한 조직문화, 시장을 꿰뚫는 직관력은 전혀 찾아볼수 없다. 월례조회때 글로벌 시장흐름,환율, 국내경제 동향등을 뻐꾸기같이 똑같이 이야기만 할뿐, 정말 조직의 문제점을 철저하게 진단하고 개선하는 경영능력은 전혀 없다.

5. 실무자 개개인이 능력이 없음을 탓한다. 회사조직은 개인의 능력이 발휘되어 성공을 이끄는 것이긴 하지만 이것을 컨트롤하늗 것은 조직문화이며 경영능력에 따라 따라오는 산물이다. 이 기본적 로직을 전혀 모른다.","위 5가지 단점을 좀 깊이 생각하셨으면 합니다. 경영진이 바뀌어야 실무진이 바뀝니다
물은 위에서 아래로 흐르는것이 자연의 법칙이듯이요."
2.5,캠시스(주),2021. 02,3점,"""큰욕심없이다니기에는 나쁘지않는 회사?
밥이 정말 맛있는회사""","건물이 지어진지 얼마되지 않아 정말 깨끗하고 식당 음식 퀄리티도 엄청 좋았음
우스겟소리로 밥때문에 회사다닌다고 할정도
복도에 음료수 냉장고도 있어서 음료 취식에 있어서는 좋았음","야근이 너무 잦았음
회의한다며 10시 11시까지 남아서 쓸때없는 회의가 장시간 지속되어 지침
일하는게 정확한 메뉴얼이 없다보니 이리치이고 저리치이는일이 많았음","급여를 올려주세요
불필요한야근이 근절되야합니다
불필요한 업무는 간소화되어야합니다"
2.5,캠시스(주),2021. 02,2점,"""업무 배우기애는 좋은 환경 일이 많아서 배울수 있는 환경""","업무 사관 학교, 단시간에 업무 배우고 이직 하기 좋은 환경
월급은 적지만 일을 많이 해서 여러가지 업무를 배울 수 있음",급여가 다른 회사 대비 적음 복지가 점점 안좋아짐 사원/대리급 보다는 차장/부장 급만 다니기 좋은 회사 실제로 차장/부장이 사원 대리급 대비 비율이 많음,제발 임직원 입장에서 생각 해 주길 바람 단돈 몇푼 절감 하겠다고 사소한걸 자꾸 복지를 없애면 임직원 들은 나중에 정이 떨어져서 퇴사 할 수 있으니 유념 하기 바람
2.5,캠시스(주),2021. 02,5점,"""매년 매출 성장율 20%로 성장이 뚜렸하며, 대기업 상응하는 복지와 카메라모듈사의 선도회사 입니다.""","업무 분담이 잘 되어 있는 체계적인 회사이며, 자기 업무를 소신있게 진행할 수 있다.","회사 분위기가 폐쇄적이며, 부서간 소통이 원활하지 않다.",조직 개편이 빈번하여 신 사업 안정화가 필요합니다. 성과를 내지 인력에 대한 보상체계가 반영 되었으면 합니다.
2.5,캠시스(주),2021. 01,2점,"""개발자를 위한 개발 환경이 부족하며, 개발이 아닌 제조가 목적인 회사""","사내 식당이 있어서 식사를 건물 내부에서 할 수 있다
사내 식당에서 메뉴가 정해져 있어서 메뉴 걱정을 하지 않는다",큰 뜻으로 오래 다니기는 어려운 근무 환경과 안정적이지 못한 재무 상태,당신은 무엇을 하고 싶은가요? 당신은 무엇을 아나요?
2.5,캠시스(주),2021. 01,3점,"""카메라 모듈과 전기차 사업을 함 카메라 사업부는 매출이 좋음""",연차는 자유롭게 사용할수 있음 본사(인천) 식당은 밥이 맜있음,전기차 사업부는 조직 및 업무 R&R 프로세스 구축이 안되어 업무가 제대로 안돌아감,조직을 구성하고 인원 채용할때 재대로 된 인원을 뽑는 안목을 넓햐야 할듯
2.5,캠시스(주),2021. 01,3점,"""겉으로는 안정적인 중견기업으로 보이지만 내부적으로는 문제가 많음""","연차 눈치안보고 사용
구내식당 이용
주차장 이용 가능","보여주기식의 업무가 많고 그걸로 성과 평가 함
고여있는 직원이 많음",신규 사업 진행시 경영진이 하고 싶은 사업이 아닌 비전을 확실하게 세우고 잘할수 있는 사업을 진행하길
2.5,캠시스(주),2021. 01,3점,"""그럭저럭 다니려면 괜찮음
낮은 연차 신입이라면 비추천""","케바케겠지만 윗사람 눈치 안보고 연차 가능
회사 규모가 있어서 쉽게 안망함","밥 맛이 없음
업무 부서별 케바케
얇고 길게 지내는거 좋아하는 분들은 가셔도 될듯","모바일 모듈에 집중하고 그 사업을 기반으로 확장해나가야지
전기차, 보안모듈 이런거 정리할꺼 정리좀하시면 좋아질 것 같네요"
2.5,캠시스(주),2021. 01,2점,"""개발자별 대우가 천차만별이고 라인 잘타야함""","아침 점심 저녁 제공, 연차 자율사용가능, 급여 밀리지 않음","누군가 책임을 지게 만들고 윗 사람들은 책임 회피함
직급과 상관없이 연봉이 제 각각임",직원을 소중히 다뤄야 회사가 살 것 같습니다.
2.5,캠시스(주),2021. 01,2점,"""총알받이가 꼭 필요한 회사.. 그로인해 피해자가 생김""","- 점심 식사 제공
- 저녁 식사 제공
- 월급 밀리지 않음
- 연차 자유롭게 사용 가능","- 직원은 그저 도구.
- 기업 매출 대비 적은 연봉
- 무리한 투자............",- 되지 않을 사업에 투자를 너무 많이 하지 마세요..
2.5,캠시스(주),2020. 12,3점,"""규모에 비해 체계는 중소기업에 머물러있는 것이 아쉬운 기업입니다.""",연차를 눈치 안보고 쓸 수 있는 점. 사내식당이 맛있는 점. 주차장이 있는 점. 샌드위치 연차휴가를 전체 사용하는 곳.,주먹구구식의 업무체계로 진행되는 것이 많은 점. 직원 복지가 거의 없는 점. 고인물이 있어 세대교체가 필요한 시점.,복지와 보상에 많은 신경을 써주었으면 좋겠다. 제도 개선에 많은 노력을 해주길..
2.5,캠시스(주),2020. 11,1점,"""중견기업인데 일하는 마인드는 주먹구구식이다.""","밥을 줌
복지포인트 있음...크진 않지만
연차는 눈치 안 주는 편","사내에 줄서기가 만연...
대주주 라인과 사장 라인이 확연히 구분되어 있음.
차장급 정도 되면 다 줄을 서있더라.",대주주는 투자에 대한 의지를 보여주시고. 경영진은 전기차나 베프스같은 뻘투자 좀 안했으면 좋겠습니다.
2.5,캠시스(주),2020. 10,2점,"""워라벨이나 이런부분은 좋으나, 급여가너 무 적다.""","급여가 밀리지않고 꼬박꼬박 잘나옴, 눈치보지않고 연차를 쓸수있음. 복지포인트 나옴",급여가 타사기업보다 많이주지않는다 일처리에 있어서 너문 대기업처럼 천천히 움직인다.,직우너들과 소통할수있는 자리를많이만들고 급여 부분을 현실설있게 주었으면 좋겠다.
2.5,캠시스(주),2020. 10,3점,"""적당한 연봉, 적당한 근무환경, 적당한 분위기 입니다 만족하지만 현실에 안주하게 되네요""",연차 눈치안보고 사용 가능. 밥 맛있음. 송도 사옥이 깔끔함. 바이오단지 근처라 근무환경 좋음,전기차사업에 쓸데없는돈 쓰고있음 어느회사나마찬가지겟지만 직원들 힘 빼는 경영진들이 많음. 윗직급이 많음,적자투성이인 사업으로 인해 호황기 맞이하는 부서의 투자를 막지말아주세요.
2.5,캠시스(주),2020. 10,4점,"""도전정신이 강한하고 업계에서 경쟁사에 대비 발전가능성이 큰 회사이다.""","인천송도에 위치해 접근성이 떨어질것같지만 의외로 접근성이 좋으며,업무에 적응이 빠르게 될수있도록 업무에 대한 프로세스나 환경이 잘 구축되어있고,구내식당 밥이 정말맛있다. 직원에 대한 복지가 나쁘지않다.","유관부서와의 협업이 어려우며,모바일카메라가 캐쉬카우역활을해서그 외적인 사업부는 기를펴기 힘들다.",많은 소통을 하려고 노력하고 계시지만 조금더 실무자의 소리에 귀기울여주시길 부탁드립니다.
2.5,캠시스(주),2020. 10,1점,"""정말 갈때 없을때 가는 회사, 욕심없이 저임금만 받아도 되면 다녀도 되는 회사.""","송도에 있다, 월급은 항상 나온다, 하루 세끼 준다, 회사 건물이 깨끗하다.","정치가 너무 심해서 사원도 라인을 잘 타야한다.
제조회사인데 회계 경영 사람들은 많이 뽑고 연봉을 높게 주는데 개발 제조관련은 사람도 안뽑고 연봉도 낮다.
임원이 많고 역피라미드 구조.
월급외에 아무것도 없다.",직원을 아끼고 존중하고 회사 이익 좀 직원들을 나눠줄줄 알았으면 좋겠다.
2.5,캠시스(주),2020. 09,3점,"""월급은 안밀리고 잘나옵니다. 밥이맛있고 삼시세끼 다 챙겨
먹을수있습니다""","요즘 핸드폰들이 카메라가 4~5개 넘게 들어가니까
매출 측면에서 괜찮고 삼성이 망하지 않는이상 회사도 안망할듯합니다.
밥잘나오고 역에서 멀지않고 기숙사도 50%비용 지원나오고 월급안밀리고 좋습니다.",월급은 잘나오는데 수당이나 보너스가 너무없습니다. 초봉도 너무작고 카메라팔아서 번돈으로 전기차에 다쓰고 있는데...전기차 사업이 음...글쎄요,전기차 사업으로 성공가능할것 같은지 잘모르겠습니다...
2.5,캠시스(주),2020. 08,3점,"""1차사 느낌 외 시스템 안갖춰짐.. 전문적으로 일배우고자 하는분들에게 비추천""",식당밥 잘나오는거말고 딱히 장점이라고 여기는게... 근속년수에 따른 돈 조금씩 줌,"체계 없고, 일하는사람 따로 진급하는사람 따로임 줄잘서셈",열심히 하려고 하나 사람을 잘못두고 사업을 제대로 검토안하고 진행
2.5,캠시스(주),2020. 03,3점,"""위치는 송도에 있으며 인천에서 출퇴근하기에 좋으며 모바일 카메라 업체""",업무 로드가 걸려있지 않다면 눈치 안보고 연차 사용 가능,코스닥 상장사지만 매출액 대비다른 동종 업계에 비해 연봉이 작다,"직원의 불만이 뭔지 경영진이 심히 고심해 봐야 하며, 신규"
2.5,캠시스(주),2020. 02,3점,"""부서간의 업무 알엔알이 아쉬우며
복지는 나쁘지 않은편입니다""","맛있는 구내식당이 좋으며 리프레쉬 휴가등
1년 50만원 지급 되는 부분은 장점입니다",베트남에 생산 라인이 있다보니 어쩔수 없는 출장이 있는 편입니다,인원이 필요한 부서에 조금 더 보충 해주었으면 좋겠다
2.5,캠시스(주),2020. 01,3점,"""캐시카우가 확실하기에 무난하게 썩 나쁘지 않습니다""",캐시카우가 확실하기에 무난하게 다니기엔 썩 나쁘지 않습니다,장점 그대로 무난하게 다닐때에만 나쁘지 않습니다. 캐시카우 외에 새로운 먹거리를 찾는 시도는 많지만 제대로 성과가 나오지 않습니다,연구기술 개발을 위해서 장기적인 투자와 연구 인력에 대한 확실한 관리가 필요하다 생각합니다
2.5,캠시스(주),2019. 12,3점,"""연차사용을 눈치 안보고 자유롭게 사용하는 것을 원한다면 이 기업을 추천한다.""","샌드위치 데이를 진행하고, 연차사용이 자유로운 편이다. 사내에 식당이 있어 편리하다.",보상이 제대로 이루어 지지 않는다. 복지에 좀 더 신경써줬으면....,직원들에 대한 복지에 더 투자해 줬으면 싶습니다.
2.5,캠시스(주),2019. 12,1점,"""보통 직장인의 무난한 사회 경험이 될수 있는곳이나 경영진의 시험 무대이기도 함""",복지 및 근문 환경에 대한 개선의지 조금 있으나 전혀 나아지는게 없음,"너무 많지만, 매년 반복되는 조직 개편과 이에따른 구조조정이 심각함",인적자원에 대해 소중함을 되세겨 볼 시기이며 사업전략의 방향을 재 설정할 필요 있음
2.5,캠시스(주),2019. 11,3점,"""주어진 업무에 대해서 일은 하지만 야근이 너무 잦다""","회사내에 식당이 있는데 아침, 점심, 저녁을 제공해주고 자율배식으로 먹을 수 있음 또한 맛도 좋다!",야근이 기본이고 나같은경우 입사 한달도 안되서 철야작업을 하였었음,직원들이 고생하는 만큼 보너스도 주셨으면 합니다.
2.5,캠시스(주),2019. 10,1점,"""사람을 돈으로밖에 생각 안하는 회사
역피라미드 구조의 끝판왕""","이사, 상무 급 임원들과도 편하게 얘기할 수 있는 분위기.
밥이 맛있다.","사람이 부족하다...
그런데 앞으로 더 많~~이 부족해질 예정이다.
무슨 말인지 아시겠쥬?",없어요 20글짜 쓰는게 이렇게 힘들줄은 몰랐네요.
2.5,캠시스(주),2019. 10,1점,"""삼성전자 1차 협력사로 카메라 모듈 납품
초소형 전기차 개발하여 판매하고 있음""","매출액이 많아 복지에 조금 신경을 씀

복지카드 50만원 줌","저가 수주로 물랑은 늘어났으나 수익은 떨어짐
전기차 사업부 경우 임원이 너무 많음
연봉이 매출액 대비 높지 않음",사원들 복지에 조금더 신경써주시고 직원들 연봉도 올려 주세요.
2.5,캠시스(주),2019. 10,3점,"""블랙박스 및 차량에대한 여러가지 이해도와 경험을 쌓을 수 있는곳입니다.
디자인업무가 주된업무가아니라 어느정도 숙달된사람이 하기에 적합합니다.""",공과사 구분이 분명하고 회사내에서 생활적으로 큰 불편함이 없고 업무가 숙달되면 근무하기 편합니다.,공업관련 기업이다보니 남초현상이 있고 다소 딱딱한 분위기에서 일을하게됩니다.,디자인같은 회사내 주력 업무가 아닌 직종에도 좀 더 신경을 써주셨으면 좋겠습니다.
2.5,캠시스(주),2019. 10,4점,"""평범한 사람들이 다니기에 무난한 기업입니다. 그 이상 이하도 아닙니다.""","연차 자유로움. 아침 점심 저녁 세끼 잘 나옵니다.
맛있습니다.청결 상태도 좋고
무엇보다 사람들이 좋습니다.",주력으로 밀고있는 분야 카메라 외에 다른것들의 투자를 하고 있지만 과연 투자비용이 회수가능할지는 미지수 입니다.,신입사원 적극채용 및 역피라미드 구조를 빨리 환골탈태 했으면 좋겠습니다.
2.5,캠시스(주),2019. 10,4점,"""끊임없이 발전하는 회사.
글로벌 성장 가능성이 있는 회사.""","부지런하면 자기개발 기회가 있다.
다양한 교육의 기회가 있다.","구체적인 계획. 실현 계획이 부족하다.
불필요한 개발비용이 많이 발생한다.",인재를 잘 발굴해서. 인재중심 경영을 하였으면.
2.5,캠시스(주),2019. 09,3점,"""재무가 튼튼한 회사임.
다양한 제품 개발을 하는 곳이니 만큼
자신의 다양한 아이디어 및 특허 기술을 제품에 적용할 수 있는
기회가 있다""","자기 개발을 위한 다양한 교육을 선택해서 받을 수 있음.
팀 회식 및 개인별 기본적인 복지가 제공된다.
조식, 중식 모두 지원된다.","다양한 사업을 시도하는 만큼
성장하지 못하는 사업도 있을 수 있음.","늘 연구하고 발전하는 회사가 되었으면 합니다.
전기 자동차도 빨리 출시 되었으면 합니다."
2.5,캠시스(주),2019. 09,3점,"""그냥 폰 카메라 모듈 업체.
한줄평 쓰래서 한줄 썼더니 왜 더 쓰래는거야.
여러 말 쓸 만큼 뭐 대단한 회사도 아니구만.""","장점이랄게 있나? 회사밥은 다른 회사 대비 나은 편.
장점이 있어야 30자를 채우지.
누가 캠시스 장점 좀 알려주라.","중견된지 얼마 안됐는데, 대기업 흉내내느라 이래저래 도입하는게 많음.
덕분에 일을 이중삼중으로 해야할 때가 있음.
과도기라 그런거니까 점차 좋아질거라 생각 함.
연봉이 업계 바닥임.","다 나가기 전에 연봉 좀 올려주라.
다른 업체 가면 돈 더 받는데 뭐하러 거기 다니냐"
2.5,캠시스(주),2019. 08,3점,"""업무강도는 센편은아니며 자유롭습니다, 회사 환경도 쾌적하며 일하는 분위기는 좋습니다.(카메라모듈)""",삼성이 고객으로 모델수주는 지속적으로 되고있어서 미래가어둡지는 않습니다.,카메라모듈의 경우 고객이 삼성이라는 강점은 있으나 고객이 삼성밖에 없다는 약점이있습니다.,지속적인 기술 투자를 하면 더욱 발전될거같습니다. 직원 복지에도 신경을 많이 쓰면 좋겠습니다.
2.5,캠시스(주),2019. 08,4점,"""카메라 모듈 기술 보유, 삼성 1차 벤더 탄탄한매출
전기차에 대한 사업 걱정은 있지만 카메라가 워낙 비전 높음""","삼성 1차로 탄탄하고 안정적 매출
삼시세끼 맛있음
멋진 사옥, 나름의 시스템을 갖춘 중견기업
카메라 사업의 비전","지원부서 인력이 상당히 많음
개발 인력에 대한 지원 부족",이상한데 돈쓰지말고 돈 좀 풀어서 돈 잘버는 사업부어케 보너스 좀 팍팍주면 진짜 주인의식 가지고 더 잘할텐데...
2.5,캠시스(주),2019. 08,1점,"""사원들보다 임원이 많은 역피라미드 구조.
정식 채용을 통해서 입사하면 연봉에서 매우 손해보는 회사이며, 조직 문화가 신규 직원들이 적응하기 쉽지는 않음.""","상장기업이고 카메라모듈 삼성쪽 외주 납품을 하기 때문에
월급 걱정은 안해도 된다.",필요 이상의 문서업무가 많고 엔지니어 입장에선 미래에 대한 비전이 별로 보이지 않음,"회사규모 대비 직원들의 복지와 연봉이 너무 낮습니다.
직원들의 복지 향상에 귀를 기울였으면 좋겠습니다."
2.5,캠시스(주),2019. 08,3점,"""안정적인 국내 모바일 카메라 모듈제조사""","매출 압박과 사내에서 업무 간섭이 적음, 본인 업무에만 충실하면 됨","대표이사가 매출의 98% 차지하는 카메라모듈 사업에는 관심이 없고,
카메라모듈 사업부에서 돈 벌어 전기자동차 사업으로 다 날리는 중.
돈 벌어다주는 사업부의 연봉이 전지자동차 사업부보다 적음.",돈 벌어주는 직원들의 노고도 기억해주길
2.5,캠시스(주),2019. 07,2점,"""휴대폰카메라모듈사업부 외의 사업부 및 부서는 No.No""","버티는 능력 및 줄 잘서는 능력 좋은 사람은 괜찮음. 집가까운 인천에서
이 정도 연봉받는 곳은 많지 않겠죠","신규 사업을 할 수 없는 곳. 휴대폰 사업부 아니면 비추..
임원만 수두룩한 역피라미드 구조에 직원들 관리도 잘 안되고....
능력보단 인맥, 정치만 난무하는 곳. 모든 책임을 직원들에게 돌리는 곳","팔이 안으로 굽는다곤 하지만 낙하산, 아부 하는 사람들 외에
가치있는 인재를 좀 제대로 보셨으면.. 신규 사업안되는게 직원들만의 탓인가?"
2.5,캠시스(주),2019. 07,2점,"""삼성을 위한 삼성에 의한 거기하나만 매달리는 삼성을 바라기 회사""",법정공휴일은 다지키려고 노력하고 있는 회사 그외는 밥이 잘나옴,마음에 안들면 다 짜르려고하고 마음에 들면 굴려가며 쓰는 회사,사람을 귀히 여기면 참 좋겠어요 무슨 생각인지 알다가도 모를 회사
2.5,캠시스(주),2019. 07,2점,"""개발자를 소모품으로 여기는 회사 업무 강도는 높지 않으나 그렇다고 업무 강도가 낮지는 않음.""",연차를 눈치 안보고 사용가능. 아침 점심 저녁 삼시세끼 제공합니다.,보고서 작성 업무가 많으며 연봉 인상율이 매우 낮음. 그리고 업무상 비용 처리가 복잡함.,신규 사업의 적극적인 투자와 적극적인 영업이 필요합니다.
2.5,캠시스(주),2019. 06,2점,"""개발자를 소모품으로 여기고, 관리조직이 개발과 생산조직보다 더 큰 가분수형 제조업체 형태로 개발자는 고민하고 입사해야함.""","인천송도본사는 예전에는 지금보다 더 좋은 복지였으나 복지는 줄고있지만 그래도 공짜 음료제공에서 나중에 입사한 분들에게는 음료가 2~300원 대인 자판기가 장점이고,주차자리가 많아 주차비나 자리걱정 안해도 되는 점,흡연자를 위한 각층에 흡연공간 보유, 그리고 제일 장점은 밥이 맛있어서 나가서 먹을일이 없다와 체중관리하시는 분을 위해 셀러드 도시락을 밥대신 제공. 환경적인 면에서는 대부분 좋다.","임원이 많고 업무진행에 있어 관련 업무를 진행한 이력이 있는 임원의 부재로 누구하나 책임감있게 진행하는 일이 없고 담당자가 독박을 쓰는 일이 많다.
제조업이나 전사관리부서 인원이 개발 및 제조담당 인원보다 많으며, 업무진행에 있어서 부수적인 문서업무가 많아 진행이 더디다,
매번 바뀌는 각 업무에 대한 프로세스는 제직중인 직원도 몇일 휴가다녀오면 다시 적응해야할 판이다. 그리고 제일 큰 단점은 사람을 중요시 하지않는다는 거다,인재를 관리하고 인력에 대한 소중함을 모르고 일에 개연성없는 기획이나 돈관련 부서에 의해서 칼질당하는 일이 많다. 열심히 해서 오래다니는게 아니라 줄을잘스고 운이 따라야 오래다닐수 있는 회사.","면접에서 이직이 많다고 하셨지만 퇴사한 인원의 대다수가 퇴사를 당하는 현실입니다. 열심히 안했다고 하시면 서운합니다. 중간 관리자의 나태함과 책임전가가 빈번하며, 누구하나 담당자의 책임을 같이 하려하지 않습니다.
나만아니면 그만이다라는 생각, 그런 생각을 가진 임원,중간 관리자가 많습니다.그리고 이제는 더이상 회사에서 버려지는 사람이 없었으면 좋겠습니다. 모두가 희망을 갖고 와서 절망을 안고 가는일이 더이상은 없었으면 좋겠습니다."
