총점,회사,날짜,별점,요약,장점,단점,경영진에게
2.8,(주)투비소프트,2019. 11,2점,"""자사 플랫폼 사용하는 회사로서, 코스닥상장회사에 안정적인 회사라고 볼수있습니다.""","자사 플랫폼 기반으로 업무를하기에, 개바라 기본지식이 없어도 업무하는 진입장벽이 낮은편입니다.","자사 플랫폼을 사용하기에 개발경력에 장점이 될 수 없고, 낮은 연봉이 단점이라고 볼수있습니다.","주식관리좀 제대로 하고, 포화된 ui플랫폼시장에서 다른 사업을 추진해야합니다."
2.8,(주)투비소프트,2019. 10,4점,"""UI쪽 유명한 플랫폼 회사로 안정적이고 수평적인 관계가 좋지만, 상대적으로 적은 연봉과 역피라미드 구조의 회사. 회사 경영진이 바뀌면서 이것저것 손대고 복지도 안좋아짐.""","수평적인 조직 문화에 사람들이 대체적으로 좋음. 중소기업 치고는 출산휴가, 육아휴직을 잘 챙겨주며 한달에 한번 가정의날로 일찍 퇴근시켜줌. (그외 복지는 거의없음.)",연봉이 작음. 역피라미드 구조에 일하는사람만 일함. 회사 경영진도 많이 바뀌고 조직개편도 자주있어서 불안함. 제품이있어 다른 환경의 개발경험을 쌓을수없음.,일하는 사람만 일함. 너무 자주 조직개편하고 다른 사업도 하는데 실적이 있는지도 모르겠음.
2.8,(주)투비소프트,2019. 09,1점,"""회사는 안정되었으나.. IT기업이라기엔 역삼각형 구조의
도퇴된 곳.""","출근시간이 여유로운편임.
회사의 안정성(기존사업의 탄탄함으로 월급 밀릴 걱정은 해본적없음)","연봉인상은 기대하기 힘들다.
젊은 직원보단 높은 직급의 상사들만 우글우글","IT기업답게 현 시대에 맞는 그룹문화가
잡혔으면 한다."
2.8,(주)투비소프트,2019. 09,1점,"""UI, UX분야 국내1위 소프트웨어 전문 기업...그러나 신사업은 의문. 지금은 입사를 추천할 수 없다!""",선배 개발자로 부터 배울점이 많고 인사차원에서 교육이 충분히 지원되므로 이를 활용하면 본인 맘먹기에 따라 자기개발하기에 좋은회사임. 또안 통제가 많이 완화된 행정적 자율정책과 적당한 복리후생은 덤이다.,"사실 UI, UX기존사업만 놓고 보면 안정적이었음. 갑자기 크게 성장 할 정도는 아니나, 조금만 신경쓰면 먹고사는데 지장없다. 유일한 단점은 현재 경영도 잘 모르는 몰지각한 일부 경영진과 함께 들어온 개념 없는 직원 정도다.",그냥 개념없는 일부 직원들 다시 데리고 회사 경영에서 손 때는것이 여기 사업과 직원들 살리는 길입니다. 여기 직원들 정치도 모르고 자본시장도 잘 모르고 순수하게 맡은 업무만 묵묵히 수행하시는 분들이 대부분 입니다. 애사심과 제품에 대한 로열티도 크고요. 본인 이익들만 생각하지 말고 제발 회사를 위하는 선택 하시기 바랍니다. 본업에 충실하시길...^^
2.8,(주)투비소프트,2019. 08,1점,"""다양한 사업분야를 가지고 있는 아이티 회사..정체성이 무엇인지 궁금한 회사""",편하게 눈치것 숨어 다닐 수 있는 회사..맘 먹으면 월급루팡 가능~,"정치판..일못해도 줄을 잘서면 성공, 못 서면 일 잘해도 나가리..",인력 관리 잘하시고 선별작업도 신경쓰시길.. 비전까지는 아니더라도 직원에게 안정감은 주시길..
2.8,(주)투비소프트,2019. 08,2점,"""후..................여기는오지말아요
아이티기업인가
주주들의 판촉인가 대체 모르겠다""","있는건지모르겟다 사람만 많다
그냥있다면 옷이프리하다정도이다","많다 모든게 다 그렇다
조직상하관계도 그렇고 복지는 짜고 짜다
말이안되는 일들이 너무 많다","경영진마저 빨리빨리교체된다
이게회사인지모르겟다 솔직히"
2.8,(주)투비소프트,2019. 08,2점,"""워라밸은 형편 없으나 업무가 많아서 일은 빠르게 배울 수 있고 IT회사답게 자유롭고 수평적인 분위기라는게 장점인 회사.""",법인카드로 저녁 식대 제공. 간식을 자주 먹음. 수평적인 사무실 분위기. 야근 시 교통비 제공. 자유로운 복장.,저녁 먹고 일하고 일 끝나면 부서 회식함. 수당 없는 늦은 야근이 많아 포괄임금제의 단점을 그대로 적용하고 있음. 업무의 체계가 없고 윗사람이 갑자기 시키는 일이 많아서 체계적으로 일하고 싶은 사람에게 비추천.,점심식사 제공 등 실질적인 복지 향상이 있었으면 좋겠다고 생각함.
2.8,(주)투비소프트,2019. 08,1점,"""회사 전체 절반 이상이 수석급이다. 선임이나 책임은 거의 없음. 희귀""","최대 장점은 출산, 육아 관련 유/무급 휴직, 연차를 눈치 안보고 쓸 수 있으며 회사에서 적극 권장함. 미혼이나 출산 예정이 없는 사람한테 딱히 장점이 있는지 모르겠다. 부서마다 다르지만 정시퇴근을 목표로 한다.","승진 없고 연봉은 동결수준, 경력직으로 협의 후 들어온다면 편하게 출산, 육아하면서 다닐 수 있는 좋은 회사다.",전문경영인들은 회사에 대해 알려고 하는 건지 모르겠다. 임기만 채우고 있는듯? 임원진들은 그냥 밥그릇 지키기나 세 늘리기 열심히 하시는 듯하다. 그들만의 리그.
2.8,(주)투비소프트,2019. 07,3점,"""넥사크로 등 투비소프트 플랫폼이 많은곳에 있어서 프로젝트가 많고 많이배울수 있다""",프로젝트가 끝나면 비교적 자유롭게 휴가 등을 사용할수 있다. 사람들도 좋아서 편안하다. 매달 가정의날이 있어서 좋다.,연봉이 낮은편이고 상승폭이 적다. 프로젝트를 하고있을때는 연차사용이 거의 불가하고 가정의날 등의 본사 행사참여가 불가능하다,직원들에게 애정을 가졌으면 좋겠다. 돈을 위해서 물불 가리지 않는 느낌이다.
2.8,(주)투비소프트,2019. 04,3점,"""현상유지 할 정도의 시장 매출은 발생하여 안정성은 있는 편.""","자사 제품이 국내시장에서 꾸준히 좋은 평가를 받고 있음.
특히 고객 니즈를 만족하는 제품기술지원이 최대 장점.","회사가 더 이상 성장할 수 있는 잠재력이 많이 낮아진 점이 큰 문제.
최근 5년간 경영진이 여러번 바뀌면서 기존 IT사업은 현상유지만 집중하고
새로운 투자가 없음.
UI/UX 시장이 포화상태인 상황에서 신규사업에 대한 비전이 보이지 않음.
새로운 경영진이 신규 사업으로 투자하는 바이오/제약 사업의 전망에 따라
회사의 명운이 갈릴 수 있음.","최근 3년간 신규사업실패 및 시장 점유율 하락으로 적자 지속되고 있는 상황에
새로운 시장을 개척하기위한 보다 현실적인 사업계획을 바람."
2.8,(주)투비소프트,2019. 04,5점,"""업계 1위 플랫폼,워라벨극상,연봉인상률을 제외하면 이만한 직장도 없다고 생각합니다""","업계1위 개발 플랫폼으로 안정적인 수입구조 , 직원들 유능함, 9시넘어서 출근해도 6시땡하면 퇴근, 일과 외 업무적인 터치는 거의 없는 워라벨 , 강남 코엑스 인근 삼성동 위치, 꼰대 없음 , 회식 1달1회하면 많은편 , 사람들 착함 , 공무원급으로 정년을 보장해주는 느낌","과부장급 연봉인상률 아쉽, 주변 점심값 비쌈, 평균 연령대가 높음, 뜬금없는 사업에 투자",기존 주력제품에 좀 더 힘써주셨으면 좋겠습니다. 또 그에 맞는 복지와 처우 만을 바랄뿐.. 기존 인력들이 가장 중요하다는 것은 경영진 분들도 다들 아실거라고 생각합니다. 또 그들이 안나가게 붙잡는법도..
2.8,(주)투비소프트,2019. 04,2점,"""새로운 도전이 어디로 갈지 걱정된다. 하던 사업이나 잘 했으면...""","연차사용 자유롭고, 출퇴근도 자유로운 분위기.
회사 제품이 꾸준히 팔리고 있어, UI/UX 사업부는 지속될 것임.","인원이 많아 조직이 무거운 경향이 있음.
신규 바이오사업이 아직 투자단계라서 불안해 보임.","신규사업도 중요하지만, 기존 사업에도 관심을 보여줬으면 ...
직원이 불안해 하지 않고, 근무할 수 있는 여건을 만들어 주시길."
2.8,(주)투비소프트,2019. 03,3점,"""경영진이 너무 자주 바뀌고 현재 사업에는 관심이 없는 회사""","야근 교통비
야근 식대
관련 업계 1위 기업
친절한편인 사람들","경영진의 무관심
투자자들만 오는 회사
잘 모르겠다 뭐 하는 회사인줄","신규사업투자에만 집중하지말고
기존 직원들에게도 최선을 다해줬으면"
2.8,(주)투비소프트,2019. 03,4점,"""기술력이 강하고 연구소에 실력있는 사람들이 많이 있음""","업계 1위를 유지하고 있는 기술력, 이전 제품들의 많은 레퍼런스",경영진이 바뀌고 어디로 향할지 모르는 방향성. 연봉은 낮은편,ui/ux 사업에 대한 투자를 계속 늘려갔으면 함
2.8,(주)투비소프트,2019. 03,2점,"""IT벤더사, UI솔루션, UI/UX 아키텍쳐, UI공통 수행
평범한 IT 중소기업""","사람들이 좋습니다. 다들 착해요, 개인의 능력보단 주로 인성보고 사람을 뽑는듯..
본사 근무를 한다면 복지가 괜찮아요.. 한달에 한번 가정의 날이 있어요.
남자도 육아휴직 갑니다.","기존의 창업멤버가 회사를 양아x한테 팔고 나간후 회사가 엉망이 되었습니다.
복지도 줄어들고 회사 분위기도 흉흉해졌어요
지금은 정상화 되고 있다고 하는데 과연~
가장 큰 단점은 연봉... 젊은 사람들한테 불리하게 구성되어 있어요~",신규 사업 추진에만 매진하지 말고 기존에 정상적으로 일하는 사람들 대우좀 해주었으면 좋겠습니당..
2.8,(주)투비소프트,2018. 11,2점,"""그냥 살던데로 살려면 추천 할만 합니다. 팔리고 나서는 잘 모르겠네요 .""","기업만의 플랫폼이 있어요. 마이플랫폼, 엑스 플랫폼, 넥사크로...
월급도 잘나오고. 연봉자체는 높지 않지만.익숙해지면 다니기는 좋아요.","오래 다니다 보면 할줄 아는게 플랫폼밖에 없고.
내부적으로 오픈소스형태로 운영 하네 마네 했었는데....
오픈소스 를 잘 아는건지.. 그냥 요즘 다들 오픈소스 오픈소스 하니까. javascript 로직만 공유하면 그게 오픈소스라고 생각 하는건지....
여튼 요즘 트렌드랑은 맞지않는 개발 환경이 좀 답답하고 그러더라고요.","이미 몇번이나 팔렸는데. 무엇을 바라겠나요.
회사가 너무 가벼워진 느낌이라 슬프네요."
2.8,(주)투비소프트,2018. 11,2점,"""회사 이름은 그 영역에서 유명한 편입니다. 하지만 변화의 시기와 적응이 관건입니다.""","분위기가 자유스러우며, 사람들이 친절합니다.
즉, 밑에 사람끼리는 유대가 좋은 편인데,
윗선하고는 그냥 유지하기 위해 같이 어울리는 그런, 다른 회사에서와 비슷한
그런 분위기 입니다.","그당시에는 윗선에 잘보이거나 라인에 연연하며,
대표가 바뀐이후 분이기가 팍팍하고 위태로우며, 있던 복지도 없어지고
눈치보며 일했음",회사를 위하 회사보다는 같이 일하는 사람들을 위한 회사였음 좋겠음
2.8,(주)투비소프트,2018. 09,2점,"""엔터프라이즈 UI제품을 판매하는 국내 1등 회사
중국사업, 핀테크, 블록체인 막 하다가 바이오도 한다고 함""","본사는 정시출퇴근이 출퇴근, 휴가 눈치 안봄. 프로젝트 수행시는 SI와 동일하게 수행업체 특성이 좌우됨. 개발 실력이 좋아야 함",복지제도 별로 없음. 회사 주인 바뀌고 나서 분위기가 전체적을 다운되었음. 야근비 없음.,신규 사업 바이오 꼭 성공 시켜주세요
2.8,(주)투비소프트,2018. 08,2점,"""UI/UX로 유명한 회사.
외부의 좋은 반응에 회사 다닐 맛이 나지만
사내 정치가 가득해서 오래 버티기 힘든 곳.""","업무 분업이 확실하게 되어있어서 루틴업무만 잘 하면 반은 먹고 들어가는 곳.
팀간 커뮤니케이션이 잘 되서 프로모션 지행 시 타 부서 협조를 잘 받아 수월하게 진행 가능
마케팅에 대한 대표의 생각이 열려있어서 다양하고 재미있는 프로모션 기획 및 실행 가능 - 업무에 재미를 느낄 수 있음","사내 정치가 엄청남. 일 예로 1년차 여 직원과 3년차 대리가 팀장을 모함해서 결국 그만두게 만든 사건이 있었음. 당시 타 팀 팀장들과 저 사원들이 합심해서 계속해서 모함했고 결국 팀장 스스로 버티지 못해 나가는 사태 발생함. 문제는 그렇게 한 자기들이 잘한거라고 생각함

개발부서를 제외하고 여자들 입김이 엄청 쎄서 어지간한 남자는 버티기 힘듬
연봉이 타 회사에 비해 작음 (차이가 꽤 남)","사내 정치가 있다는건 대표까지도 알고 있는걸로 알고 있는데 그냥 두는게 너무 신기함
신규 사업에 집중하는 것은 좋으나 내부 사정도 지속적으로 파악해서 분란을 일으키는 직원은 솎아 내는게 필요해 보임"
2.8,(주)투비소프트,2018. 07,3점,"""다양한 개발 환경을 경험하고 소프트웨어 개발에 필요한 프로젝트 관리,배포 프로세스,유지보수 프로세스등을 체계적으로 알수 있음""","복리후생이 좋음,다양한 동호회 활동 지원,야근강요 없음,연차 부담없이 사용가능
보육휴가,출상휴가 지원","업무에 대한 분업화가 명확히 규정되어 있어 다양한 개발 경험(SI)을 쌓기에는
부적합,내세울 만한 커리어를 만들기 위해서는 업무능력을 인정 받아야 하고
원하는 업무를 취향대로 진행 할 수 없음",직원들과의 소통에 신경 써 주셨으면 합니다.
2.8,(주)투비소프트,2018. 06,3점,"""UI UX로 국내 최고 기업! 네임밸류 좋은 IT회사""","회사 인지도가 있어 대형프로젝트 경험 가능
지하철 봉은사역과 무지 가까움
휴가 자유롭게 사용 가능","IT회사치고는 연령대가 높음
20,30대 연령층이 적응하기 힘든 문화
업무강도가 강함
무능력한 경영자를 자꾸 대표이사로 앉힘
제품이 오픈소스에 점점 위협받고 있음",지금 하고 있는 사업이나 잘했으면...
2.8,(주)투비소프트,2018. 05,4점,"""회사가 일단 굉장히 개방적이고 분위기가 자유롭습니다
편하게 일하기가 좋은 거 같네요.""",우선은... 분위기가 딱딱하지 않았고 상당히 쿨하십니다 직원분들이,"진짜 주변에 먹을만한게... 그리고 가격도 조금씩 쎄다는점 정도가 있겠네요
회사에 대해서는 그다지 불만은 없었어요",분위기가 굉장히 자유로운 편이고 한데 어딘가 모르게 딱딱한 면은 있었습니다
2.8,(주)투비소프트,2018. 05,3점,"""높은 기술력을 바탕으로 모두가 하나의 제품을 바라보고 개발. 그만큼 다양한 기술을 배우기에는 부족.""","비교적 자유로운환경에서 근무가능
UI/UX업계 1위의 기술을 배울 수 있음
야근강요 없음","직원 휴식공간 부족과 회의실 부족.
신입에 대한 체계적인 교육부족.
적은 신입과 중간관리자 그리고 많은 고위관리자.",체계적인 신입교육이 필요해보입니다..
2.8,(주)투비소프트,2018. 05,5점,"""편안한 분위기, 강요 없음, 대우가 좋음 , 아이티 기업중에서 자유로운 편""","연차 사용이 자유로움 , 무리한 요구나 일을 하지 않음",신입을 많이 뽑고있지만 연차가 오래된 사람들이 많아서 루즈한 감이 있음,"안정적인 경영을 해 주었으면 , 기업 전체에 도움이 되도록 경영해 주었으면"
2.8,(주)투비소프트,2018. 04,1점,"""기존 UI 사업은 얼마간 괜찮응 것 같음 회사는 얼마나 갈까요""",한달에 1번 가정의 날이 있음(세째주 금요일 4시 퇴근) 부서에 따라 유연한 출퇴근,30대후반 이상이 90퍼센트. 실무진에 비해 관리자가 매우 많음. 신규입사자가 적응하기 힘듬.,"기존 직원은 근속, 신규입사자가 금방 떠나는 건 왜 그런건가요"
2.8,(주)투비소프트,2018. 03,3점,"""개발자는 개발에 집중할 수 있도록 배려하고 관리자는 관리에 집중하는 문화가 있는 편.""",업무 분담 잘되어있음. 사업 방향은 혼잡스럽지 않게 하려고 노력함. 타사업분야로 진출하고 성장하려는 노력은 함. 조직내 문제들을 조정하고 개선시키려고 노력하는 관리자는 소수 있음.,맡은 업무 영역이나 담당 분야를 넘나들며 유기적인 협업이 자발적으로 이루어지는 분위기와 문화 조성 필요. 근속년수가 길수록 자기 업무영역에 대한 집착이 강한게 대다수이고 기존 고객사들을 지켜야한다는 논리가 있지만 이게 외부에서 볼땐 거기에만 매달리고 다른 경쟁력이 없고 다른 경쟁력을 갖기위해 출혈이 있더라도 용감하게 위험을 무릅쓰고 도전하여 더 큰 성취를 이루려는 의지와 역량이 없다고 보여질 수 있음.,뜻있는 직원에게 책임과 권한을 동시에 주어 진행시키고 일부 고객사나 일부 시장 상황에 흔들리지 않는게 중요.
2.8,(주)투비소프트,2018. 03,4점,"""직원들의 근무 기간이 상당히 긴 편임""",국내 IT기업 중 안정적인 편으로 장기 근속자가 많아 직원들간의 친밀도가 높은 편이다.,오래된 기업이라 탑다운 구조의 조직문화가 자리 잡혀 있다.,최근 몇 년간 새로운 경영진의 신규 사업에 대한 공격적인 투자에 따른 여러가지 우려와 걱정에 대한 확신이 필요함.
2.8,(주)투비소프트,2017. 11,3점,"""개발자의 처우는 좋지않은 회사. 파트마다 일 빡셈이 다르다.""","월급이 밀릴일은 전혀 없음 이쪽 분야에선 탑부분을 노리는 회사.
야근강요는 없음","야근 강요는 없지만 눈치는 줌.
부서마다 일 빡셈이 너무나 다름
복지를 챙겨주려하지만 정작 들어오는건 없음.",회사가 잘 나가려면 복지를 먼저 신경써야할겁니다..
2.8,(주)투비소프트,2017. 10,3점,"""자체 기술력으로 해당 분야 1위 기업""","매월1회 가정의날 실시, 징검다리 휴무 권장, 연차사용권유, 야근식대있음. 역에서 가까움, 동호회지원, 온라인/오프라인교육기회제공, 산전후휴가, 육아휴직","사내정치, 창업주 에서 전문경영진 체제 이후 불안정, 신사업분야 확장 비전 없음, 현경영진 전문성 부족, 역삼각형구조, 불투명한연봉체제","제품과 기술에서의 강점을 이어갈 수 있는 경영
무리한 비용 절감, 꼼수 대신 R&D 투자에 집중"
2.8,(주)투비소프트,2017. 07,1점,"""신사업본부는 절대 가면 안되는 지옥같은곳.
뭐가 어떻게 돌아가는지도 모르는 수장과 본인이 이사급인줄 아는 팀장들, 직원보다 많은 외주인력, si도 아닌것이 에이전시도 아니지만 묘하게 두 분류의 단점만 모아놓은곳.
직원들이 가지고 있는 역량 후려치기는 기본이고 주말에 나오라고 하는게 너무 당연한 곳.이곳에서 R&R 구분을 바라는건 사치다.""","매월 마지막주 금요일 4시퇴근, 공휴일과 징검다리 휴가 권장, 교육지원 등 개인이 자기일 스스로 알아서 잘하면 누가 터치하지 않는 구조. (하지만 신사업본부는 예외. 휴가 잘 못씀, 조기퇴근도 예외), 회사가 역에서 가깝다","체계없음
연봉 많이 낮음
루팡 많음
카페테리아 없어서 쉴공간 없음
자기방에서 담배피는 높은분들 있어서 건강에 해로움","위에서 잘못해서 사업의 방향이 잘못될때마다 왜 직원들이 책임져야 하는지, 직원들 불러서 대놓고 눈치보라고 하는지 윗분들은 한번쯤 반성을 해보셨으면 합니다."
2.8,(주)투비소프트,2016. 12,1점,"""UI/UX 국내 1위 기업 (이라고 하네요^^;)""","회사 분위기도 좋았고, 회사 사람들도 좋았던 기억이 납니다","사업 방향이 B2B 만을 목표로 정한 아쉬움, 반강제적인 워크샵",사업 방향성에 대한 고민이 필요할 것 같습니다
2.8,(주)투비소프트,2016. 12,1점,"""신사업부는 조심해야함. 실적, 분위기, 생활여유 없음. 관리자들도 장난아님""","그나마 저녁은 먹여줌. 회사 법카로...
일반 개발자들은 그나마 괜찮음","일정 없이 일진행
시스템 조차 아무것도 없이 일진행
개발자가 다 알아서 해야함
위에서는 그냥 해 하면 다 되는줄 암. 60~70년대 마인드를 모든 관리자가 가지고 있음
과연 개발 회사 관리자인가 의심
프리로써 잠깐 치고 빠지시는 좋음.",개발회사 마인드가 아닌 관료자 마인드로 사람들이 따를런지..그러니 자꾸나가죠
2.8,(주)투비소프트,2016. 09,3점,"""대체적으로 업무와 삶의 균형을 유지하기 좋은 편인 대신, 자발적으로 열정적으로 일하는 분위기를 기대하면 안됨""",개인 생활에 대한 존중을 잘 해줌. 자신이 조절만 잘하면 업무와 삶의 균형을 잘 유지할 수 있음.,진취적으로 열정적으로 일하는 사람들보다 현재에 안주하면서 하던것만 하려는 사람들이 많음. 신입의 경우 다른 곳에 비해 성장속도가 굉장히 느릴 것임,업무에 대한 성취감을 느끼기 어려움. 직원들을 회사의 부품화하기보다는 구성원으로써 대해주기를 바람.
2.8,(주)투비소프트,2016. 06,1점,"""다단계의 분위기가 나는 회사로써, 영업이 가장 중요한 회사.""",회사내의 분위기나 직원들 사이의 분위기는 정말 좋은 것 같다.,영업을 하는 직장으로 기획보다는 영업에 더 중점이 되어있다.,영업 영업 하면서 직원들에게 바라는 것보다 각자의 위치에서 서로 전화업무를 했으면 좋겠다.
2.8,(주)투비소프트,2016. 05,2점,"""신입으로 입사하려는 분들에겐 별로 추천하고싶지 않은 회사""",혼자 프로젝트를 나가게 되는 경우가 다반사라 직장 상사의 눈치를 볼 필요가 없음,혼자 나가서 일 하다 보면 회사에 대한 애착도 없고 그냥 인력장사하는 회사라는 기분이 들게 됨,역피라미드구조를 없애고 창의적인 경영진이 들어왔으면 함
2.8,(주)투비소프트,2016. 05,3점,"""중소기업 치고 꽤 많은 인원이 상주하고 있는 기업. 최근 사업확장등으로 인해 어수선한 분위기이지만, 서서히 정리되고 있는 상황임.""","점심 식대는 제공하지 않지만, 야근 식대는 법인카드를 통해 사용할 수 있음.
봉은사역에서 5분거리로 교통편은 좋은 편.
회식 / 워크샵이 각 그룹별로 있는 편 / 사내 동호회 등의 활성화 되어 있음.
자전거 출근이 가능 하며, 5층에 샤워실 구비됨.","야근 수당이 별도로 제공되지 않는듯.
기업을 상대하는 회사이다 보니 모든 직원이 순환하는 주말 당직 근무가 존재 함
3층의 경우, 교육장이 있기 때문에 다소 소음이 있을 수 있음.
각 층에 회의실이 1개소 정도 있으나, 많이 부족하다고 느낌.
점심 식사를 할 때 도시락을 싸가지고 가는 것은 비추천. 도시락을 먹을 수 있는 장소가 회의실 아니면 5층 밖에 없음.","파견직 형태로 근무하였기 때문에, 경영진을 보기가 어렵다. 별도로 평가 하기 힘듬."
2.8,(주)투비소프트,2016. 04,4점,"""개발자가 대우받기 힘든곳이나 개발자가 없으면 안돌아가는 회사""",업무 압박이 큰편은 아니었다. 관리가 심한편은 아니라 외부 사이트 나가 있으면 일하기는 나쁘지 않다. 내가 할일만 다 하면 크게 터치는 없다.,외부 사이트 나가 있는 일이 많고 나가 있으면 관리가 너무 없다. 내가 과연 어느 소속인지 분간이 안갈 때도 있다.,자꾸 직원들 교육시키려구만 하는데 다 소용없어요. 외부 나가있으면 할일도 많은 데 교육은 실효성있게 하던지요.
2.8,(주)투비소프트,2016. 03,4점,"""Xplatfor Nexacro 등 ui 툴 개발회사. 회사와 제품에 대한 자부심은 좋은 편이나, 상대적으로 연봉이 적은편이다.""","개인적으로 훌륭하다고 생각되는 ui툴을 개발한 회사이고, 끊임없는 연구개발과 새로운 트렌드를 찾으려는 경연진의 마인드가 훌륭하다고 생각한다.",기본 제품 교육 이외에 다른 교육이 없다. 문서와 고객지원실을 사수라고 생각하고 자기만의 노하우를 쌓아야한다. 능동적인 근무자세가 필요하다.,최고의 UI회사로 튼튼하게 성장할 수 있게 힘써주세요.
