총점,회사,날짜,별점,요약,장점,단점,경영진에게
2.9,한국경제티브이(주),2017. 09,1점,"""일은 엄청 나게 할수 있다. 경제방송에서 근무하면서 경제 접근성은 뛰어나지만 접근성이 뛰어나다고 잘 배울수 있는건 아닌듯""","장점이라고 할것은 하고싶었던 일을 해볼수 있는 기회, TV프로그램을 눈앞에서 접할수 있다는 장점, 정직원과 아르바이트 정규직 대우가 차이많이남","비정규직의 경우 월급이 말도 안되게 적음, 열정페이임, 회사의 체계가 그다지 체계적인것 같지 않고 승진의 기회 역시 그다지 공평해 보이지 않음, 정직원의 경우에도 회사에 엄청 난 만족감과 애사심을 느끼는경우 많지 않은것 같음. 전반적으로 크게 멋진 회사라는 느낌은 못받았음",제작으로 일하는 계약직 직원들의 처우도 조금만 더 신경써 주셨으면 좋겠습니다.
2.9,한국경제티브이(주),2017. 09,3점,"""페이가 낮은편이고 대체인력이 많은 분야다 보니 불안정하다.
본인 방송만 하면되니 부담은 적은 편이다.""","아나운서는 프리랜서라 본인 방송시간에만 오면 되서 부담이 덜하다.
조직문화 없음
방송 팀위주로 움직임","전반적으로 페이가 낮은 편이다.
팀별로 케이스가 다르지만 개편이 잦은편이라 불안정하다.","불안정에 대한 고용 환경 개선이 필요합니다.
복지가 늘어났으면 좋겠습니다."
2.9,한국경제티브이(주),2017. 08,2점,"""생방송 경험을 쌓을 수 있고 방송국이 어떤식으로 돌아가는지 파악 할 수 있다""","업무 분담이나 체계가 잡혀있고 일 자체는 어렵지 않다
야근 많지 않고 수당 지급 철저한듯","업무가 어렵지 않아 금방 습득할 수 있으나 그 이상의 배울 수 있는 게 없는 듯하다
경제분야 특성상 지루할 수 있음
계약직이 많아 이직률 높음",계약직 사원들을 소모품처럼 취급하지 않았으면......
2.9,한국경제티브이(주),2017. 06,4점,"""방송 경제 매체 1위의 네임밸류. 워라밸이 잘 잡혀있는 듯하면서 아닌듯한 회사.""",증권시장 위주로 돌아가기 때문에 언론사 치고 주말이 있는 회사. 사람들이 대부분 경우가 있음. 외부에서는 다른 동종 회사에 비해 업무 강도가 낮다고들 평가함. 하지만 이에 대한 내부 평가는 글쎄.,오너가 없는 회사라 장기적 비전보다는 단기 업무 처리에 급급.,"회사의 나아갈 비전은 가지고 있겠지만, 사원들의 비전 역시 고려해줬음 좋겠음. 근무에는 합당한 임금을 줬으면 하는 바람."
2.9,한국경제티브이(주),2017. 02,2점,"""방송사 치고는 그리 힘들지않은편
생방송경험은 많이쌓을수잇으나 그외의면에선
부족할수있다""","업무의 경계가 잘지켜지지않음
야근이 너무김.
정규직과 계약직의 차별화가잘느껴지지않으나
계약직 또는 파견직에게 승진이나
정규직의기회를주셧으면좋겠음","복지제도가있지만 사용하기힘듬
팀마다다르지만
위계질서가 제대로다 식사시간이 정확하지못해
식사를 제시간에 챙겨먹기힘드며
잦은야근과 3시간이상 야근시 야근수당이
지급되지않음 연차쓰기어려움","정규직전환의 방법이 잘 되었으면좋겠고
정당하게 야근시 야근수당을 받을수있는다른
지원을해주셨으면"
2.9,한국경제티브이(주),2016. 12,3점,"""경제 TV에서는 1등이라고 자부심을 갖고 있다. 생각보다 방송 제작시스템이 노후화돼있다.""",본인만 잘하면 다양한 프로그램을 맡을 수 있는 기회를 준다.,진행자 또는 스텝을 지나치게 부속품을 본다. 인간적인 대우가 없다.,"장기적인 안목을 가지고 재능있는 진행자는 키울 수 있는 환경을 만들어줄 수 있으면 좋겠다. 스타성있는 사람들이 한국경제 TV를 많이 거쳐 가는데, 기반을 마련해주면 좋겠다."
2.9,한국경제티브이(주),2016. 08,2점,"""군대같은 분위기에 후배들은 사람취급 못 받는 곳""","여러 사람이 할 일을 한 사람이 하니까 배우긴 배운다
일 이년 경력쌓고 거쳐가는 곳
오래있으면 성격버린다","윗 사람은 놀고 밑에 사람은 일 하는 회사
계약직보다 월급 많이 받는 이유를 모르는 사람들이 대다수고 (윗사람은 후배 계약직보다 업무량이 현저하게 적음) 회사 분위기를 보면 발전이 힘들다는 게 느껴짐",회사가 발전하려면 젊은 사람들의 기발한 의견을 존중해야됩니다
2.9,한국경제티브이(주),2016. 07,3점,"""경제방송 중엔 가장 나은 곳- 사업 측면이나 처우나 이미지 등등""",급여는 낮지만 분기별 상여금이나 월 자기계발비 등 복지후생이 뒷받침해줘 전체적인 급여는 괜찮음,계약서엔 nine to six라 쓰지만 한시간 정도 일찍 출근하는게 암묵적인 동의로 사내출근문화 정착,뉴미디어 사업이나 기반업무 부서에 대한 인식이 너무 낮은 거 같아요
2.9,한국경제티브이(주),2016. 06,3점,"""팀 분위기 좋고 야근 거의 없다!
하지만 박봉""",연차를 눈치 안 보고 쓸 수 있고 일 강도가 높은 편이 아니다. 팀 분위기가 좋다. 야근을 거의 안 한다.,"주말 근무 할 때 많음. 하지만 평일에 대체 휴일하게 해줌. 주말 근무 수당은 꼭 줌.
전체적으로 박봉.
승진 제도 없음.
파트장 혹은 팀장 직급밖에 없음",연봉좀 올려주세요 다른건 없습니다 ...
2.9,한국경제티브이(주),2016. 06,3점,"""비정규직과 정규직의 차이가 큰 회사
그럼에도 방송국이라는 타이틀은 괜찮다""","팀마다 다르지만 분위기 좋은 팀에서 근무했다
가족같은 팀내 분위기로 근무 스트레스가 없는 편이다","단순 업무가 많아 일이 단조롭고 새로운 컨텐츠가 없다
그만큼 지루한 근무상황이 될수 있다","인재에 대한 관점이 자유로웠으면 좋겠다
비정규직 인원이 대부분이라 같이 업무하고 정이 쌓인 사람들이 없어진다"
2.9,한국경제티브이(주),2016. 03,2점,"""직원들의 윤리의식 부재로인한 내부 붕괴위험이 느껴졌다""","어렵지않게 인맥을 넓힐수 있으며, 생소한 경험을 해 볼수있다",사측은 직원에 대한 애정이 없음. 덧붙여 경직된 조직문화와 사내정치 과잉으로 인한 극단적 비효율성,경영진도 언제 바뀔지 모르는 분들이기 때문에 구태여 여기에 적을 필요는 없다고 판단함
2.9,한국경제티브이(주),2016. 03,3점,"""그냥 무난한 방송사. 그래도 방송사 다닌다고 말할 수 있다.""",거의 스튜디오 프로그램이다보니 다른 방송 프로그램 제작보다는 몸이 덜 피곤. 주식에 대한 정보를 가까이 할 수 있다,"성취감, 의욕이 높지 않다. 방송을 하고 싶다고 마냥 올만한 기업은 아님",새로운 시도를 좀 해줬으면..............
2.9,한국경제티브이(주),2016. 02,3점,"""욕심이 없다면 다니기 좋은 회사입니다. 단 스스로 커리어 개발에 회사가 딱히 도움이 되지는 않는다고 생각합니다.""",여자가 다니기 좋은 회사라는 생각이 든다. 육아 휴직 및 연차 사용이 자유롭다.(팀별 케바케) 복지도 나름 괜찮다고 본다. 경력 쌓고 이직하기에 좋다.,회사 위치가 애매하다. 승진 적체가 심하다. 회사 비전이 밝지는 않다. 사람들이 많이 이직하는 데에는 이유가 있다. 타 회사에서 질려서 오는 사람들은 만족하며 다니는 듯.,직원들과의 소통창구를 마련했으면. 구식/보수적인 방식으로는 앞으로의 시장에서 경쟁력이 없다.
2.9,한국경제티브이(주),2016. 02,2점,"""운전중 잠시 머무르는 휴게소 같은 곳으로 신입채용해도 바로 다른 기업으로 옮기게 놔두는 회사.""","업무의 강도가 세지 않다.
출퇴근이 지켜지지 않아도 뭐라 하지 않는다.
방송국에 다닌다고 폼내고 다닐 수 있다.","연령대가 높아 인사적체가 심하다.
일의 강도가 약한대신에 자기 발전이 없다.
새로 사랆이 들어와도 자기발전이 없는듯해서 바로 나가는 경향이 많음.","좀더 고연봉자들에겐 고효율적인 일들을 시키심이...
고졸자들이 해야할 업무를 40대가 하고 있는데 본인들은 업부강도 약해서 좋다지만 회사에선 손해임."
2.9,한국경제티브이(주),2016. 02,3점,"""들어가기는 쉽지 않을지 몰라도 일하기에는 무난하게 다닐 수 있는 곳. 신문에 비해 발전이 더뎌 성공할 가능성은 크지 않아 보이지만 적당하게 다니기엔 괜찮은 곳.""","현장에 나가있는 경우가 대부분이라 사무실에 매여있으면서 눈치볼 일이 거의 없고, 직업적 특성상 개인적 업무가 많아 수직적 지시가 거의 없음. 높은 사람이 더 일찍 출근해서 회의하는 문화임.","연봉이 높지 않아 이직이 잦음. 윗사람들만 오래 있고, 아랫사람들은 경력이 쌓이면 이직이나 퇴사를 고려하는 경향이 있어 윗사람이 아랫사람들에 대한 신뢰가 깊지 않음.","합리적인 복지와 보상체계가 마련되어야 하고, 신문에만 집중되어있는 투자를 TV쪽에도 할 수 있도록 노력해야함."
2.9,한국경제티브이(주),2015. 11,4점,"""급변하는 미디어 환경 속에서 전문성을 기를 수 있는 기업입니다.""",가족같은 분위기. 기자직군이라면 특별한 일이 없을 경우 휴일은 모두 챙겨 쉴 수 있습니다.,사내 권력구조 상 눈치를 봐야 하는 부분이 있지만 심하지는 않습니다. 타 미디어와 비교해 발전해야 할 부분이 많습니다.,현업에 종사하는 인원들과 많은 소통을 해주시고 직군간 커뮤니케이션 할 수 있는 기회가 많아지면 좋겠습니다.
2.9,한국경제티브이(주),2015. 10,2점,"""계약직 연출은 경력쌓는다고 생각하고 계약끝날때까지 버티는게 제일이다""","그나마 복지가 잘되어 있는편, 사람들이 좋다. 내 프로그램 끝나면 시간이 자유롭다",비합리적인 시간사용 업무가 끝났으면 집에 보내주고 담당피디를 잘못만나면 골치아프다 그리고 일하는만큼 돈을 많이 못번다 경력쌓아서 언능 나가길... 추가업무수당 받기가 쉽지않다,"연출들에게도 정규직을 주고, 일끝나기 일주일전에 사람구해서 급박하게 인수인계안했으면 , 그리고 주말엔 좀 쉴수있게 해줬으면. 몇개월에 한번씩 담당피디좀 바꿔서 여러피디에게 일배울수있도록 해주세요"
2.9,한국경제티브이(주),2015. 09,3점,"BEST
""경제방송국이기전에 방송국. 다루는 컨텐츠가 특화되었다는 잠 말고는 기존 미디어 업종과 큰 차이점은 없음. 기본은 갖추어져 있다. 업무 특성상 야근이나 잔업은 옵션""",증권투자방송 분야의 인지도 만큼이나 기본적인 인프라가 잘 갖추어져 있음. 업무간 분장이 잘 되어있는 편. 자체적인 컨텐츠 제작 능력이 있다는 점은 연출 직무 커리어를 쌓는데 나쁘지 않음,"연출파트의 경우 업무량이 많고, 고용의 안정성이 보장되지 않는 점은 고려해야 함. 메이저가 아닌 만큼 이직 사례도 심심찮음. 경제방송 인지도에 비해 매체 영향력은 크지 않은듯",투명한 경영을 통해 직원들의 신뢰를 쌓는 모습을 보여주면 좋겠음. 직원들의 목소리에 귀를 기울여주길. 경영진에 대한 신뢰가 필요함.
2.9,한국경제티브이(주),2015. 08,3점,"""경제방송 중에서는 가장 괜찮다.
경제방송 중에서만 괜찮다.""","경제방송 중에서는 가장 괜찮다.
경제 쪽 방송을 하다보면 아무래도 경제 공부에 도움이 된다.","모든 미디어 업종과 회사가 마찬가지 겠지만 야근이 잦다
복지가 미흡하다.",경제채널인만큼 비효율적인 방송시스템을 없애고 효율적인 방송시스템을 갖추어 질 수 있는 환경을 만들었으면한다.
2.9,한국경제티브이(주),2015. 06,2점,"""방송이라기보단 일반 중소기업에 가까운 기업문화. 전체적으로 노후화되고 경직된 분위기.""",1등 경제채널로서 경제 분야에 있어서만큼은 확실한 대우를 받고 있고 사세에 비해서 큰 규모의 경험 다수 가능.,절차나 복지 등이 주먹구구. 아직 중소기업 티를 벗지 못하여 복지를 희생해서 실적을 내려는 주의가 있고 방송으로서도 배울 게 적음. 일도 하는 사람에게 너무 집중.,"방송의 경쟁력은 이윤이 아니라 시청자에 대한 소구력이라는 점, 그리고 직원의 창의성은 창의성과 노동이 정당하게 존중받을 때 표출된다는 점을 알아주길."
2.9,한국경제티브이(주),2015. 04,3점,"""이정도면 규모도 크고 복지도 나쁜편은 아니다.
분위기도 좋은편이다""","작업분위기가 좋다
회식이나 ot등 참여안해도 된다","능력있어도 학벌위주로 평가한다
직급이 높을수록 일을안한다","능력위주로 사원들을 평가했으면 좋겠다.
고인물은 썩기 마련이다."
2.9,한국경제티브이(주),2015. 02,3점,"""여자라면 승진 기회가 없음""",업무시간에 비해 업무가 널널하고 야근이 많이 없음,여자라면 승진 기회가 없고 남초회사입니다,단순 성과를 지양할 것. 장기적인 플랜이 필요한데 이 부분이 부족한듯
2.9,한국경제티브이(주),2014. 09,2점,"""자본주의 자유시장경제를 옹호하면서 일할 수 있는 사람에게 적합한 직장""",매일경제신문에 이어서 우리나라 넘버2 경제신문사 계열이라는데서 나오는 자부심이 큼. 체계적인 조직과 업무 시스템을 갖고 있음.,"인지도 대비 적은 연봉, 미래가 보이지 않는 단순 업무부터 시작함(인터넷신문 기사 짜깁기해서 다시올리는 일, 팀마다 다를듯함).매경에 대한 심한 견제심.",연봉과 성과급을 지금보다 더 올려주셨으면 함. 연봉은 동일업종 대비 낮은 편임.
2.9,한국경제티브이(주),2014. 09,3점,"""증권경제방송 채널 중 1위 방송...
각 분야별 입사후 다양한 업무경험을 할 수 있다""","신입사원은 방송, IT분야에 대하여 다양한 업무 경험과 노하우를 배울수있고 경력사원은 본인의 업무분야의 전문성을 내세워 사업을 진행 할수있는 회사",방송 분야 급여가 그리 높지 않은 편입니다,급여 좀 올려 주세요
2.9,한국경제티브이(주),서울,1점,"""그냥 노점을 하는게 나은겁니다.""",일을 배우기 전에 사내정치와 라인과 구도에 대해 배울 수 있다.,여기서 배운 일들은 동종업계에선 경력으로 취급이 안됨,물갈이 좀 하세요.
2.9,한국경제티브이(주),2014. 04,3점,"""따듯한 가족같음을 느끼게 해준 회사""","업무의 자율성, 가족같은 분위기, 복지","높은 복지로 요구하는 낮은 연봉, 회사와 맞지않는 이익창출을 위한 사업",방송사의 트랜드를 따라가야한다. 고리타분한 환경은 이제 그만
날 괴롭힌 삭제된 댓글,한국경제티브이(주),서울,,,,,
날 괴롭힌 삭제된 댓글,한국경제티브이(주),서울,,,,,
2.1,한국가구(주),2022. 04,3점,"""상장회사로 안정적인 직장생활가능. 개인적이고 다소 보수적인 분위기.""",기업의 재무 안정. 넓은 사무실로 근무환경이 좋아 일에 집중하기에 좋음. 회식 없음. 연차 자유로운편. 연말 보너스. 쉴때 쉴수 있고 일할때 일하는 공과 사 구분 명확. 오랜 가구 회사로 자부심있게 일할수있음.,식대거의없음. 야근수당 없음. 연차 못써도 무급. 간식 커피머신 등등의 기본적인 직원 복지나 휴게시설 없음. 다소 보수적인 분위기라 변화없는 업무 시스템. 다들 개인 플레이 분위기라 업무간 협조 어려움. 윗선 아이디어 동조안하면 크게 까임.,직원들이 편하게 일할 수 있는 복지에 귀기울여주셨으면.
2.1,한국가구(주),2022. 04,1점,"""가족들과 노예같은 고인물들이 좌지우지하는 이상한 집단임""",근무하는 건물이 뽀대나고 좋음. 그외 장점들은 전혀없음,잘되면 당연한거고 못되면 다 직원들탓이며 사정없이 폭언과 욕설이 날아옴. 오너야 그렇다치고 그 밑에 고인물들은 대체 왜 소리지르고 욕하는지 모르겠음. 상사들이 일도 못하고 능력도 없는데 인정하지 않고 소리만 지르면 된다고 생각하는 60년대 마인드.,리워드 좀 챙겨주고 돈이 더 들어가도 우수한 인재들좀 뽑아야 혁신 가능합니다. 싼맛에 사람쓰지마세요.
2.1,한국가구(주),2021. 12,2점,"""고급수입가구회사이며 회사 건물이 너무 이쁘다
논현역에서 가까움""","고급 수입가구 회사라서 인지 회사 건물 이쁨
칼퇴근 가능
월급 안밀림","오래된 회사라 수작업이 많음
오래 다닌 사람들이 많아 쉽게 적응하기 힘듦
아래층에 있는 제원 매출이 더 높아 1층에서 만날때 챙피함이 있음 ㅋㅋㅋㅋㅋㅋ",직원들 좀 생각해주세요. 오래된 사람보다 새로운 사람들도 믿고 일을 맡기셨으면
2.1,한국가구(주),2021. 11,1점,"""Since 1960 ~ 현재진행형 역사가 오래 깊은 틀에 갇힌 회사""","연차수당을 안주기때문에 자유롭게 쓸수있음.
아부 잘하는 사람들은 버틸수있음.
본인이 옛날 스타일이라면 잘맞고 일 잘할수있음.
아 그리고 칼퇴가능.","감정소모 & 고집과 아집 나이 지긋하신 사람들과 같이 일하는게 힘듦.
복지 진짜.. 20년째 유지중이신거같음.
여러모로 유치하게 짝이 없음.",세상 변화를 받아들일 줄 알아야 회사가 성장할 수 있습니다.
2.1,한국가구(주),2021. 10,4점,"""내 일만 잘하면 장기적으로 다니기 좋는 회사이며, 특별히 힘든일 없습니다.""",근무환경 깨끗하며 조용히 집중해서 일하기 좋은 분위기 입니다.,"오래된 회사인 만큼 분위기는 보수적입니다.
체계가 좀 잡혀있지 않습니다.","직원들과 소통이 많이 필요하며, 직원들의 이야기에 귀 기울여 주세요"
2.1,한국가구(주),2021. 10,3점,"""기본적인 건 제공
그외에것은 바라지 않으면 속편함""","욕심없이 다니면 눈치안보고 본인의 업무적 기본만 한다면 편하게 다닐수있어요
시간적 자유등",더 나아지는것은 없고 해외 수입 가구의 가격과 내연봉의 갭차이는 점점 더 나고 누가 이런걸 사는건지 부익부빈익빈,가족경영이라 끝까지 회사를 지킬수있으실듯
2.1,한국가구(주),2021. 09,1점,"""경영진 전부가 보수적이고 고지식한 기업
현실을 봐주세요 제발""","이름만 대면 부모님 세대는 전부 알만한 기업
수입가구 하이엔드 인정","Erp시스템 정말 투자해서 바꾸세요
영업부 복지 신경써주세요
오래되신분들 제발 예전엔 이랬으니 그대로해
그런 마인드 제발 바꾸세요","제품만 하이엔드 취급말고
직원들 복지 연봉 인센티브 신경써주세요
마지막 물류.as 인원좀 뽑으세요
그러니 서비스가 엉망이죠
나이드신분들 빼고 30대가 나가는 이유를 현실에 즉시하세요"
2.1,한국가구(주),2021. 08,4점,"""안정적이고 장기적으로 일할 수 있는 직장.남녀간 차별이 없는 직장""",재무구조 양호.투명한 업무처리.해외 하이엔드 브랜드 보유.오랜 역사와 전통 보유.안정적이고 오래 일할 수 있는 회사.,오랜 역사만큼이나 보수적인 분위기.회사가 너무 조용하여 역동성은 부족함.서류작업이 다소 많음.,경영진과 직원간에 부담없이 소통할 수 있는 기회를 만들어 주시기 바랍니다.
2.1,한국가구(주),2021. 08,4점,"""많은 것을 배우고 느낄 수 있던 좋은 경험이렸어요 모든것을 혼자 해보는 경험을 했어요""",근무 환경이 좋고 큰 터치는 없습니다 맡은 일만 잘 하면 좋아요 월급도 밀린적 한번도 없습니다,체계적이진않아서 갈피잡을때 좀 힘들었어요 그게 단점임거겉아요,체계적인 좋은 회사로 발전해주세요 정말 발전 가능성 있는회사입이다
2.1,한국가구(주),2021. 08,1점,"""현 시대에 아직도 이런 회사가 있다는게 충격이고 놀랍습니다.""",여자들은 눈치안보고 연차사용및 칼퇴를 할수있어서 그점은 좋아요.,욕설이 난무하고 아랫직원들 하대하고 무시하는 상상이상의 회사,오래근무한 틀에박힌 사고방식을 가진 관리자들을 물갈이하시는게 회사이 큰도움이됩니다
2.1,한국가구(주),2021. 02,1점,"""전형적인 올드마인드 임원들. 라떼는말이야식의 업무강요 및 압박. 옛날 마인드를 가진 임원들때문에 새로운 발전이 없는 전형적인 꼰대기업""",눈치안보고 칼퇴할수있음. 연봉은 가구 브랜드에서는 그나마 대우 해주는 편.,윗물이 맑아야 아랫물이 맑다고하는데 여긴 윗물부터가 썪어있음,새롭고 혁신적인 기업을 만들었음 하는곳.브랜드는 좋으나 운영방식이 너무 옛날식에 갇혀있음.
2.1,한국가구(주),2021. 01,2점,"""임원진이 고인물처럼 버티고 있어 시스템이 잘 돌아간다고 보기 힘들고 사람이 자주 바뀌는게 과연 좋은 회사인지""",법정근로나 휴무 연장수당 같은 부분은 급여에 잘 반영되는 부분,근무시간 대비 급여가 많지않고 휴무가 동조업계대비 많이 적어 근무피로도가 높은점,직원 복지에 좀 더 신경쓰고 근무 환경개선에 노력을 하며 영업시스템을 잘 갖추어야 더 오래 잘 다닐 수있는 회사가 될 거 같음
2.1,한국가구(주),2021. 01,3점,"""수입 명품가구를 오래전 부터 취급하는 회사. 해외 출장이 많은 회사. 다닐만한 회사.""",해외 명품 가구 브랜드를 다수 보유. 나름 역사와 전통이 있는 회사다.,"가구로 시작한 회사인데, 가구보다 다른 사업에 집중한다. 본연의 사업에 집중 하시길. 젊은피 수혈이 급하다.","직원들의 의견을 청취해 주시고, 폭 넓게 생각 하시길 바랍니다.
코로나로 인해 힘든 시기인데 직원들과 함께 하시길 바랍니다.
잘 될것 입니다."
2.1,한국가구(주),2020. 10,2점,"""명품 수입가구 판매로 자부심 가지고 일할 수 있으나 업무에 있어서 끊임없이 자기계발을 요구. 배움의 끝이 없음 자기가 한만큼 대우해줘요""",고급 수입가구 매장으로 근무 환경이 좋고 수입가구매장 중에서도 이름있는 회사로 커리어쌓기 좋음 월급+인센티브 제도제로 개인이 한만큼 벌어간다는게 장점,전형적인 꼰대문화. 경영진 눈치 살펴야됨. 무조건적인 배움을 강요. 경영진들의 언행이 다소 거친편. 체계가 없이 시키는대로만 하면 됩니다 시키는게 너무 많아서 문제지만. 월급도 너무너무너무 작아요,"업무체계를 세워주시고
직원이 끊임없이 배우고 성장하길 바란다면 합리적인 보상과 복지가 필요합니다"
2.1,한국가구(주),2019. 12,1점,"""21세기에 이런곳이 존재할줄 몰랐음
정말로 문제많은 회사""","연봉은 나쁘지 않았음
근데 그돈 받고 정신병원 다녀야함","어르신들 심부름만 해야됨
제대로된 업무가 없음 그냥 시키는것만 하면됨
생각을 하면 안됨","정신좀 차리고 시대에 맞춰서좀 가길...
시대가 어느시댄데 아직도..."
2.1,한국가구(주),2019. 06,1점,"""능력있는 사람들은 오래못버티는 곳. 꼰대천지, 낙하산 인사, 문제터지면 해결할 인재가 없음..못난이들이 대장놀이하는 회사.""",50년 역사를 가진 자금력있고 재무건전성 있는 국내자본 가구회사,"능력없고 갈곳없는 사람들이 남아서 뻘짓거리 하는 회사, 시스템도 구리고 그냥 총체적 난국..유치찬란 그자체",사람보는 눈을 제발 좀 가지시길..입안에 혀처럼 구는 사람만 둘러쌓여있어서 진실을 못보시는듯ㅠ 그유명한 박씨처럼
2.1,한국가구(주),2019. 04,3점,"""개인이 알아서 전부 처리해야함
가족 회사라서 대표자 눈치엄청봄""","월급 잘 나오고 돈에 대한 걱정이 없음
하지만 결재 받기도 힘들어서
공격적으로 일하지않음","단순보고를 위한 결재가 많아서. 비효율적
변화에 민감하지않다
구시대적",안주하지않았으면 좋겠지만 그건 어쩔수없는듯
