총점,회사,날짜,별점,요약,장점,단점,경영진에게
2.5,이루온(주),2019. 06,2점,"""KT/LG에서 일 받아서 먹고 사는 회사.. 과거엔 삼성 일도 했음.
코어망쪽을 하는데, 이쪽 바닥에서 연봉이 하위급
최근 대리 과장 급들이 많이 나가서 인력 유출이 많고 실제 개발 가능한 사람이 1/3도 안되는 것 같음""","널널한 근태 - 이거라도 안하면 사람 다나가니까..
넓은 업무 영역 - 사람이 없어서 좀만 한다 싶으면 이거저거 다 맏겨서 대리급 되면 이직 할 곳 이 많아짐.","낮은 연봉
가끔씩 야간 작업
납기일 다되가면 철야함 <-- 요즘은 강요하진 않는데... 팀장급들 다 철야에 주말 출근들 하지.
중간 계층이 없음 - 신입 아니면 차부장
일은 그대로인데 인원이 계속 줄어들고 있음 ㅇㅅㅇ;; 새로 뽑은 사람들이 평균1년만에 퇴사를 해서 시스템을 다 알고 있는 사람이 적음 (즉 입사하면 사수는 없을태고 고생 좀 할거임 ㅋㅋ)","사원 대리급들 연봉 현실화 해서 나가는거 잡야야 하지 않을까요?
당장 동종업계 T, E사만 가도 동일 직급에 업무량은 작아지는데 연봉은 500정도 오르네요
이 분야는 숙련된 개발자 및 기술 지원 인력을 확보 하는 것이 매우 어려운데 기존 사원들을 잡아둔 물고기 처럼 대하면 나가고 싶은 생각이 들죠."
2.5,이루온(주),2019. 06,3점,"""통신사 장비 납품 하는 빡센 회사, 국내 통신사 상대하는 업종은 다 그런 듯.""","나름대로의 영업력과, 척박한 국내 통신장비 시장에서 살아남은 생존력",척박한 곳에서 살아남기 위해서 수업이 갈아넣은 사람들이 넘쳐난다. 조직간 이기주의도 강해서 협업관계로 일해야 하는 사람인대 견제해야하는 아이러니도 많다.,"고객에게 맞추려면 어쩔 수 없는 부분이 이해 되지만, 밤새 자료도 없이 고생하는 직원들이 대부분인건 개선이 불가능할까요?"
2.5,이루온(주),2019. 06,1점,"""정말 최악. Kt의 갑질의 희생양. 새벽에 정말 어의없는 걸로 전화 자주옴.""",사무실이 쓸데없이 큼. 커피 20잔 무료.이상 끝. 없음.,퇴사를 권장하는 분위기. 인수인계 따위 없음. 입사 당일부터 새벽작업 및 외근. 차량 등록시 차는 똥값됨. 개발자는 함흥차사.,인력 충원 빨리해라. 업무 투입전에 교육좀 시켜주고 보내줬으면.
2.5,이루온(주),2019. 05,4점,"""서바이벌 같은 생활 야근과 철야... 그렇게 하루가 가네...""","자기계발 나오는거 지금은 나오는지 모르겠다.
그리고 없네요.","야근, 야근, 야근 그래도 돈이 나와서 좋다. 인수인계 없네요..",신규 투자와 직원들에게 신경쓰고 복지를 줬으면 좋겠다.
2.5,이루온(주),2019. 05,3점,"""엔지니어로 다양한 것을 경험 할 수 있음
사람은 그냥 부속품 취급""","다양한 경험이 가능하다
여러가지 장비를 만져 볼 수 있다","창업자및 임원이 예 향수에 취해 대기업 마인드 있음
사람을 너무 가볍게 생각함",직원을 좀 더 존중해 주고 귀하게 여겨주었으면.....
2.5,이루온(주),2019. 04,3점,"""판교 유스페이스에 위치해 지하철역에서 가까운편이규 안정적인 기업으로 최신통신 기능을 접해볼수 있음""",사내 카페가 존재해 한달에 20잔 커피 제공하고 한달에 한번 가족의 날로 5시퇴근,입사와 퇴사가 많으편으로 업무 진행시 불편한 점이 많음,효율적인 업무 체계가 필요 다음 사람을 위해 문서화 필수
2.5,이루온(주),2018. 11,3점,"""군대식 남자들의 세상. 전형적인 copy and paste.""","도서구입비 지원, 야근시 택시비 지원, 업무분담 나누어져 있음, 한우물만 파게끔 해줌, 1년 돈 금방 모음. 사무실 깨끗함.","택시비 월급만큼 나올 수 있음, 프로젝트마다 외근 잦음, 개발자들은 체력 좋아야함. 10시출근 23시 퇴근. 앉아있는거 좋아하는사람.","장기적인 플랜, 다각화 포트폴리오 필요, 승진의 대한 기회가 더 다양했으면, 마감일자 충분히 여유를 줬으면 함."
2.5,이루온(주),2018. 10,2점,"""서바이벌같은 생활. 퇴사가 많아 죽어남. 인수인계 없음.""","1달에 아메리카노 20잔 마실수 있음
사무실 깨끗함
끝.","퇴사자가 많아 인수인계 없이 바로 업무 투입.
업무 모르는 부분은 퇴사자에게 문의하는 상황.
군대식 조직 문화.",직원들의 상황을 알면서 모르는 척 말고 개선되게 노력해주세요
2.5,이루온(주),2018. 09,2점,"""사람을 귀하게여길줄아는회사가되었으면 좋겠다.
개발자로써 배울건많으나 돈에비해힘듬""",코딩실력이나 프로젝트 경험에 있어서 배울점이 많아 신입으로 실력쌓기에는 좋음,일이 많아도 너무 많음 그리고 너무 시키며 한 프로젝트가 끝나고 쉬지않고 굴림,"사람에 대해 귀한줄 알아주길 개발자도 사람이라는것을
프로그램을 뽑아내는 기계가 아니라는것을"
2.5,이루온(주),2018. 09,2점,"""보람차게 일할 수 있으나 개인 생활은 없음.조직은 개인을 위해 있지않음""",인간관계 는 수평적임.까페테리아에서 한달에 스무잔 공짜 커피 마실 수 있음,진짜 빡세게 일함.회사가 사람을 부품으로 생각함.새인 커리어를 전혀 고려해주지 않음,신규 사업에 투자가 필요함.사람에 대한 투자가 필요함.
2.5,이루온(주),2018. 07,2점,"""직원들 복지에 신경 쓰나, 중소기업답게 적은 연봉, 정치, 비젼 부족""","석식비, 자기 계발비 제공, 사내 카페테리아 존재 등 복지에 신경을 씀","개발업무 보단 문서작업 많고, 개발팀의 구조 및 방향이 확실치 않음",확실한 비젼 공유 및 기술 개발 필요
2.5,이루온(주),2018. 06,3점,"""기업 마인드는 좋음 복지도 나쁘지 않음 다 괜찮음 아주 좋으""",복지가 많음. 유류비 통신비 저녁비 지원 됨 지원되는게 참 많음,밤낮없이 문제있음 전화옴 주말도 없음 시스템 문제 발생시 튀어 나가야함,회사 직원을 조금만더 생각 해줬으면 좋겠음 인센티브 주면 좋겠음
2.5,이루온(주),2018. 06,2점,"""개발자가 대우 받기 힘든 곳. 사람 귀한지 모르는 기업. 직원 불만이 무엇인지 관심 없고 안다고해도 해결 의지가 없음.""","딱딱하고 강압적인 분위기는 아님.
야근을 강요하지는 않음","개인 이기주의 난무
일 잘하면 일이 많아짐
정치질 난무",직원들의 진짜 불만이 무엇인지 파악하고 해결에 힘쓰길 바랍니다.
2.5,이루온(주),2018. 05,3점,"""개발자가 성장하기는 좋은 회사, 하지만 언제 짤릴지 모르는 불안감""","네트워크 회사지만, 다른 분야에도 조금씩 도전하는 모습이 좋아보임
네트워크도 알아주는 대기업의 주요 장비들을 개발하고 있음
자유로운 분위기","연봉이 동종 회사에 비해 많이 주는 편은 아님, 윗선에 잘못 보이면 오래 근무하지 못하고 어느 순간 짤림",사원들에게 조금 신경썼으면 하는 바람
2.5,이루온(주),2018. 05,2점,"""LGU+, KT 통신 분야 프로젝트를 경험하기에는 좋은 기업""","1. 눈치 없이 연차사용 가능
2. 출근 통근 버스 운영, 업무가 많지 않다면 칼퇴 자유로움","1. 퇴사자등으로 인한 프로젝트 담당의 부재를 남은 팀원에게 떠넘김
2. 365일 24시간 언제나 고객사 전화 및 현장 지원으로 인한 엄청난 스트레스가 있음","유지보수, 레거시 장비의 납품 보다 신규사업에 적극적인 투자와 직원들의 워라벨을 보장해주면 좋을 것 같습니다."
2.5,이루온(주),2018. 05,1점,"""아주아주 프리한 회사, 개발자 홀대, 그닥 추천하지 않음""","연월차에 대해서 크게 터치하지 않고, 경조사 지원이 좋음","업무가 비효율의 끝을 달림, 사내 정치 심각, 개발자도 배울게 별로 없음.",사내 정치가 너무 심합니다. 그 피해를 사원들이 받아 로열티가 떨어지는게 심각합니다. 일하는 직원들을 대우해주세요.
2.5,이루온(주),2018. 05,3점,"""시스템엔지니어로써는 발전 할수 있는 기회가 많습니다.""",연차를 눈치보지않고 사용이 가능하고 야간근무후 다음날 오프 등 대우가 좋습니다.,"외근 및 야간 근무가 많으면 사무실 들어갈 일이 거의 없습니다.
복지가 하나둘씩 없어지고있으나 최근 다시 생기고 있습니다.","경영진에는 바라는 점은 없습니다.
마주칠 기회도 없습니다."
2.5,이루온(주),2018. 05,5점,"""통신사에 장비납품을 하고 있고, 근무환경은 좋습니다.""","연차를 자유롭게 사용할 수 있고, 본인 일만 한다면 정규시간에 마무리하고 퇴근 할 수 있습니다. 근무환경도 좋고 카페도 있어 좋습니다.","복지는 줄어들고 있으나 나름 경쟁력 있고 좋습니다.
다만, 개발자 및 기술자 인력이 줄어 들고 있어 힘들어 지고 있습니다.","경영진에 바라는 점은 없으며, 직원들 위하여 여러가지 복지를 해주셨으면 합니다."
2.5,이루온(주),2018. 05,2점,"""팀마다 틀리지만 야간 작업이 많음..
망하지 않을거 같은 회사.
다양한 솔루션을 해봄.""",팀마다 틀리지만 가족 같은 분위기일수도 있지만 하지만 추천은 안함... 망할거 같진 않음.,"텃세가 심함.
문제 생기면 밤 낮 없이 미친듯이 전화옴.
인수인계 없음.","마인드가 바뀌었으면 좋겠음.
제대로 된 보상."
2.5,이루온(주),2018. 05,1점,"""매우매우매우 바빠요. 야근이 엄청 많음.""","야근이 많은 만큼 배울 수 있는 점이 많습니다.
신입사원일 경우 경력 쌓기로 좋은곳.","야근이 많아서 개인 시간이 부족합니다.
밤샘 작업이 엄청 많은 편이면서 월급은 쥐꼬리만큼
주는편입니다.","야근을 많이 하는 것은 좋지만 그에 합당한 연봉을
줘서 직원들의 열정을 조금더 도모햇으면 함.."
2.5,이루온(주),2018. 05,3점,"""몇 년간 살아남기만 할 수 있다면 가시적인 업무 능력을 체득할 수 있는 환경이다. 다만 그 과정을 감내할 수 있을지는 미지수지만.""","사내 카페테리아를 자유로이 사용 가능.
동종 업계에서는 나름 탑급이면서 2G시절부터 KT와 함께 해왔기에 통신쪽으론 배울수 있는 점이 많다.","평균적인 초봉이나 연봉, 복지는 나쁘진 않지만 그만큼을 위해 직원 수를 감축해서 남아있는 직원들에게 준다는 느낌이 강합니다. 업무로 인한 야근은 비록 어쩔수 없다 할 수 있겠으나 불필요한 야근에 대한 무언의 압박이 상당히 강한 편입니다. 업무의 효율성이 나쁜 편이며, 지금 당장의 문제들만을 해결하기에 급급할뿐 그 이후 발생할 문제점들에 대한 대비책 마련이 부족합니다.
특히 개발팀의 경우 기본적인 유지보수 메뉴얼 하나 없이 구전으로만 업무 내용이 전달되어왔는지 문제가 하나 발생하면 일일이 코드를 분석해야만 한다고 합니다.",특히나 시시각각 바뀌어가는 IT 업계에서 뒤쳐진 채 시대의 흐름을 제대로 따라가지 못합니다. 이쪽 업계에서는 나름 탑급의 위치에 있기에 되려 그 자리에 안주하려는 그런 경향이 없지 않은듯 합니다.
2.5,이루온(주),2018. 03,1점,"""중소기업 마인드가 필요할때 대기업 행세를 하고 대기업 마인드가 필요할때 중소기업 행세를 함
통신사의 한 해 흥망성쇄에 따라 사업계획이 달라짐""","유일한 기업의 장점이라면 본사의 쾌적한 환경이라고 볼 수 있는데, 그마저도 임원진이 현지출근이나, 타 오피스 출근을 강요함
경영지원팀이나 영업의 경우 연차 사용이 자유로운 편","복지에 대해선 전혀 신경쓰고 있지 않음. 싫으면 너가 나가라는 마인드가 너무 팽배해져 있어서 좋은 인재를 다 놓치고 있음. 잡을 마음도 없어보이고 잡을 방법도 없어보임.
그나마 몇가지 있던 명절선물이나 기념일 선물은 소리소문 없이 사라지고 그에대한 내용공유는 없음","근무하는 직원들은 갈데가 없어서 남아있는게 아닙니다. 실무를 하고 있는 직원들에 대한 존중과 제대로된 인력 경영이 필요합니다.
퇴사를 하는 사람에 대한 인수 인계는 남아있는 사람이 직무를 떠앉는게 아니라 새로운 사람을 채용해야합니다. 직원들은 카드 돌려막기가 아닙니다."
2.5,이루온(주),2018. 03,3점,"""통신사(KT,LGU+) 협력업체로 통신 주요 장비들을 납품하고 유지보수 진행.
국책과제 및 기타 프로젝트도 병행하여 진행.""","- 업무 진행하면서 사람때문에 힘들어본적은 없음.
- OS/DB/Network등 여러가지 지식들에 대한 습득하기 좋음.
- 계열사 INS와 LBS도 있어 생각보다 규모가 큼.
- 월급은 밀리지 않고 제때 잘 나옴.
- 복장 자율(반바지 빼고, 맨발 쪼리 빼고, 노출심한옷 빼고)","- 사람때문에 힘들지 않은데 고객사 사람들때문에 짜증남.
- OS/DB/Network등 여러가지 습득하기 좋으나 어디가서 써먹을 정도로 깊지 않음
- 계열사들이 이루온보다 매출등 더 잘나감
- 2G때 설립되어 3G를 지나 4G부터 삐걱하더니 5G는 앞이 안보임.","- 회사가 어려울 때 어려움을 극복하고 상황을 타개하자는 비젼제시가 되지 않아 끝이 안보이는 인내의 시간만 강요받는 느낌임.
- 매출감소로 인원감축은 타당하다고 생각 되나 방법이 잘못 되었음
- 현재상황을 설명해주고 위기의식 공유를 해주어 희망퇴직자를 받던지 하는 식으로 처리가 되었어야 맞다고 봄
- 인사고과 낮은 평가의 투명한 기준 제시가 필요함."
2.5,이루온(주),2018. 01,1점,"""통신사의 투자에따라 올해의 운세가 결정됨""","국내 통신사에 창업시부터 납품하여 통신사의 다양한 라인으로 소스를 받고 제안을 진행함. 국내 통신사가 망하지 않으면 여기도 망하진않음
프로젝트가 많지 않으면 칼퇴에 눈치는 주지않음","주요 핵심 개발자들의 퇴사로 프로젝트가 제대로 진행되지 못함.
임원들의 라인과 밀실정책으로 회사의 결정이 이루어짐
IT기업치고 회사마인드가 노후함
중소기업인데 대기업처럼 행동하지만, 복지는 중소기업을 벗어나지못함","직원에게 적극적인 투자와 협력이 회사에 긍정적인 영향을 줍니다.
가는사람 안붙잡는다는 형식의 마인드는 회사를 노후하게 합니다."
2.5,이루온(주),2017. 11,1점,"""영업만 중시하는 회사.
개발자 경시가 만연해 있으며, 개발은 필요시 외주로 돌리면 된다고 생각하는 경영진이 많음.""","1. 카페테리아가 있어 커피값 들어갈 일이 거의 없음.
2. 본사 환경은 쾌적함.
3. 업무능력 향상은 빠르게 됨.
4. 슈퍼맨 같은 능력을 가진 개발자들이 눈 씻고 찾아보면 팀별로 한두명 있음.
5. 영업이나 경영지원 파트는 꿀임.","1. 극악의 업무량. (= 빠른 업무능력 향상)
2. 가정을 포기한 자들이 많음.
3. 그들이 만든 꼰대 저스티스리그.
4. 집에 가고 싶을때도 야근하는 날이 더 많음.
5. 일이 너무 많아 착한사람도 까칠한 날이 더 많음.
6. 영업 중간마진 회사이지 절대 개발업체 마인드가 아님.",직원은 톱니바퀴 같은 부품이 아닙니다. 특히 개발자들 경시를 멈춰주세요. 영업과 개발간의 파워 발란스를 신경써주세요.
2.5,이루온(주),2017. 07,1점,"""미래가 보이지않는 회사
직원을 판매하는 물건으로 생각하는 회사
절대 오래다닐수 없는 회사
정리해고를 진행하여 분위기 아주 안좋음
개발자 30명정도만 남아있음""","이제는 장점이 남아있지 않음
까페있어서 커피를 먹을수 있다는 정도","팀장 중심의 회사
점점 일이 줄어들고 정리해고로 직원도 줄어들고있음
복지는 전혀없음
그나마있던 명절 선물도 없어졌음","회사와 직원을 생각하고 경영했으면
직원들은 물건이 아닙니다"
2.5,이루온(주),2017. 06,2점,"""이동통신사 (대부분 KT) 의 업무를 배울 수 있음. KT 의 경우 다양한 종류의 장비가 서비스 중임.""","신입의 경우 업무를 빠르게 습득할 수 있음.
믿고 맡기는 건지 살아남는지 보자는 건지는 알 수 없으나 ,
거의 맡겨버리는 타입. 그게 신입일지라도...
결과적으로 빠른 시간에 많은 일을 배울 수 있다.","업무량이 과도하다. 인정받는 사람만 인정받는다.
복지가 거의 없음. ( 명절 선물조차 없음 )","회사의 직원들이 어떤 생각들을 하는지 관심있게 한번 봐 주시기를...
아마도 경영진의 생각과는 많이 다르다는데 충격을 받을 수도 있을 것 같음."
2.5,이루온(주),2017. 06,1점,"""능력이 있으면 피곤하고, 능력이 없으면 맘편히 놀고먹을수 있는 기업""","1. 외근시 출퇴근이 자유로움
2. 능력이 있으면 쉽게 인정받지만 그만큼 힘들어짐
3. 능력자는 야근, 무능력자는 칼퇴하는 상황을 바라보며 끈기와 인내심을 키우기에 좋음","1. 연봉이 낮음
2. 일하는 사람만 일함
3. 어려운일은 없지만 짜증나는 일은 가득
4. 소스 관리가 전혀 안됨",아무리 바라고 원하는것을 얘기해도 들어주지 않음
2.5,이루온(주),2017. 04,3점,"""영업보다 개발위주의 회사라 신규입사자에겐 여러모로 좋은 기회가 많음""","꾸준한 일거리 , 프로젝트 과정이 주먹구구는 아님.
업무 진행 시 다른 업무로 인한 간섭이 적음","꾸준한 일거리를 갑에 대한 맞춰줌이 강하므로 일정이나 기능적으로
강도가 있음","효율적인 인력관리가 필요해 보임
좋은 기회를 주고 업무 순환을 만들 필요가 있음"
2.5,이루온(주),2017. 04,3점,"""통신장비관련 제품 개발 / 서비스 회사로 업무경험을 높일수있는 기회가 많음""",개인 업무역량을 쌓을 수 있는 많은 기회가 지속적으로 있어. 개인적인 노력이 있으면 단시간내에 성과를 올릴수있음,"인사평가 결과에 대해서는 매년 소문이 많은데
공정하지 않은 결과라서인지. 본인 상황에 따라 다름",일관성있는 정책이 제시되어서 어려운 상황을 잘 대처 할 수 있게 비전제시 필요
2.5,이루온(주),2017. 04,2점,"""다들 고생하고 다들 야근하고 모두가 힘들게일하고
정작 일좀하는사람은 나가는 회사""","팀마다 분위기 다르나 팀내의 분위기 좋은편. 통근버스 카페테리아, 개인법인카드가 좋음
일을 배우기에는 좋음(=엄청난 업무강도)
일이 너무 많아 서로가 안쓰러운 분위기","사라져가는복지 일에 비해 높지 않은 연봉
대체 무슨생각으로 경영을 이렇게하는지 모르겠는 사장
모르쇠잘하는 윗분들
허리띠를 다같이 졸라매기에는 연구소가 매우 고생중이며 퇴사율이 엄청남","통신시장이 어려운것은 알겠으나 일은 배로 하고있으면서 힘빠지게 허리띠졸라매기 식은 좋지않다고 생각함. 가족의날로 조기퇴근 지정해봤자 정작 다들 너무 바빠서 일찍갈수도, 가지도않음
연구소사람들이 밤낮안가리고 일하고있다는 것에대해 소중하게 생각좀하셨으면"
2.5,이루온(주),2017. 03,3점,"""통신사의 일차밴더사
주요 프로젝트를 맡아서 하고있음
망할일은 없는회사""",업무강도가 쎄지만 그만큼 많이배울 수 있음. 개발 업무와 기술지원 업무를 분리해 놓았음.,고객사 눈치를 너무 봄. 고객사에서 일이없으면 재정에 크게 타격을 입음.,말로만하는 경영말고 체계적인 프로세스가 고정되었으면 좋겠음. 경영진이 직원들이 하는 일의 중요성을 인지해 줬음 좋겠음.
2.5,이루온(주),2017. 02,2점,"""업계에서 나름 열심히 하고 있지만....미래가 글쎄.....""","부서별로 차이가 있지만, 개인사정 및 편의를 봐주는데 호의 적임",경영진의 능력 부재와 여러가지 이유에서의 인력 공백으로 인해 악순환이 반복되는중임,신속한 의사결정 및 미래 먹거리 발굴이 절실함
2.5,이루온(주),2017. 01,3점,"""유무선 통신장비 업계에서 정말 다양하게 많은 일을 한다. 영업중심의 회사이기 때문에 사업마인드 배우는데 좋다. 연구원 마인드는 비추천""",중소기업치고 나름 복지혜택을 주려고 노력한다. 비데도 있고..커피도 공짜고..명절선물도 주고,직원들간에 소통이 많이 부족해서 마치 각개전투하는... kt등 주요고객 의존도가 높아서 성장의 한계가,묵묵히 책임을 다하는 직원들한테도 잘해주었으면 하네요
2.5,이루온(주),2017. 01,2점,"""신입으로 들어와서 배우기에는 기본적인 네트워크가 잘 되어 있다고 봄.""","고정된 고객사가 있어 고정수입 존재
네트워크의 전반적인 구조를 이해하는데 도움이 많이 되는 회사
팀 별로 팀 내 사람들은 잘 챙기는 느낌
외근을 나가면 출퇴근이 비교적 자유로움","경영 문제로 회사 내 복지 수준이 상당히 떨어짐
상당히 수직적인 구조이며 사내 정치와 불합리한 처사가 과함
QA 시스템이 제대로 되어 있지 않음
수직적인 감시체제에 대해 상당히 민감함","지금 내려온 모든 지침들이 미봉책으로밖에 보이지 않습니다.
과연 장기적으로 봤을 때 이것이 이득인지 손해인지 좀 더 신중하시길 바랄 뿐입니다."
2.5,이루온(주),2016. 11,4점,"""다양한 코어 네트워크 장비를 개발해볼 수 있는곳
엔터프라이즈 환경을 경험""","깔끔한 사옥과 판교에서 일하는 것이 장점일듯
능력있는 사람도 많았으나 지금은 나간듯","근태를 중시 여기는 점이 별로였음
업무 성과는 차별화가 필요",개인의 능력보다는 시스템을 기반으로 회사가 운영될 수 있도록 해야함
2.5,이루온(주),2016. 11,2점,"""LGU+, KT, 삼성, 국책 등에 자사 통신 솔루션 납품 / 유지보수 등 진행
그럭저럭 무난한 회사라 생각됨.""","1. 상장 회사이며, 임금이 밀린적 없음.
2. 대기업이 주 고객이어서 망하거나 할 것 같진 않음.
3. 직원들을 대상으로 한 복지등에 대해선 합격점.","1. 군대식 문화.
2. 타회사와 같겠지만 잦은 야근
3. 비교적 적은 연봉, 연봉에 비해 업무강도는 상대적 높음","1. 제대로 된 보상체계 확립.
2. 직원을 소중히 생각해 주셨으면 합니다"
