총점,회사,날짜,별점,요약,장점,단점,경영진에게
3.0,(주)원익홀딩스,2018. 12,2점,"""일은 많지만 돈도 나쁘지는 않게 준다""",몇몇 팀을 제외하고는 연차 사용이 자유롭다 많지는 않지만 적지도 않은 연봉. 식사 제공이 가장 좋은 복지다,사람을 너무 안뽑을려고 한다. 적은 인원으로 회사가 돌아가는게 신기할 정도이다 미래 먹거리에 대한 불만이 많음.,"신규 사업에 관심을 가지고 추진을 해야한다고 생각함
누구에게나 공평한 시스템이 있어야 한다고 생각한다"
3.0,(주)원익홀딩스,2018. 10,2점,"""일의 강도가 쎄고 교대근무도 많이 시킴. 돈은 꽤 주지만 생활패턴이 망가져서 추천하고 싶은 기업은 아님""",기본적으로 초봉이 좀 되고 실적이 잘나와서 인센을 많이 받음. 다 받으면 다른 기업보다 꽤 많이 받는 편이라고 생각됨. 다른 좋은 점은 못 찾음.,"우선, 교대근무가 있고 생활패턴이 망가짐. 가끔 주말에도 출근해서 약속 잡기도 힘들고 사람 사는게 아니라고 느껴질 때가 있음. 월급받으면 잠깐 기분 좋지만 곧 힘들어서 지침. 주위에도 퇴사 많이함.","워라벨 생각 좀해서 복지 좀 늘려주고, 일할 환경 개선을 좀 했으면 좋겠음. 무엇보다도 돈보다 사람이 먼저다라는 마인드가 있어야 될 것 같음."
3.0,(주)원익홀딩스,2018. 08,4점,"""딱딱하지 않은 분위기, 미래 먹거리를 위해 부서가 지속적으로 창출하기 위해 노력하고 있음.
근속년수가 긴 직원들이 많음
사원수가 적고 과장급 이상이 많은 구조.""","자유로운 분위기
생각보다 높은 급여
현장 엔지니어에 대한 중요성 인지하고 있음",각 사이트에 인원이 부족한 경우가 있음. 사원 교육과 채용에 조금더 비중을 두었으면 함,각 사이트의 고충을 듣고 방향성을 지정해주었으면 좋겠음
3.0,(주)원익홀딩스,2018. 08,4점,"""국내 대기업을 비롯하여 중국시장으로 본격적인 진출 및 사업 확장을 시도하고 있는 회사로서 과거 10년 동안 반도체 시장이 불황일 때도 지속적으로 규모와 내실을 성장시킨 회사임""","최근 3년간 매출 급성장을 이루면서 임직원 수가 크게 증가하고 있지만, 근속년수가 오래된 직원들이 많고 가족적인 분위기가 형성되어 있어 새로 join하는 임직원들이 조기 정착하기에 좋은 풍토임","제조, 품질, 구매 관리 부서의 근무환경이 다소 열악함(사업장 위치가 재개발 지역으로 묶여 있다보니 사무환경을 모던 스타일로 바꾸려고 해도 쉽지 않음)","신사업, 신제품 개발 등에 매진하고 있는데 하루 빨리 좋은 성과들이 나왔으면 함"
3.0,(주)원익홀딩스,2018. 07,3점,"""새로운걸 만들어 가며 도전하길 좋아하는 사람에게 추천""","업계특성상 전반적으로 지역 타기업에 비해,
급여 및 복지는 좋은 수준임.
탑다운 방식이나 업무적으로 열려 있음.","합병분할을 반복하여, 규모대비 인원이 부족함.
업무적 기준이 모호하여, 담당자 판단사항이 많음.","기본이 충실해야 혁신이 가능함. 기본에 충실한 회사를 만드는 것이 혁신임.
시스템이 없는 회사에선 장기근속자가 시스템임.
장기근속자 관리가 필요."
3.0,(주)원익홀딩스,2018. 06,4점,"""자유로운 분위기에 괜찮은 회사
원익 그룹사로 안정적인 회사""","근태가 자유로운 편
야근으로 평가하진 않음
사유만 명확하면 전문역량 개발에 지원잘해줌
외근은 잦지만 보상은 괜찮은편","건물이 오래됨
고객사별 현장이 많아 외근이 잦은 편
반도체 경기에 의존이 높음",현장의 업무 과중이 잘 판단되어 효율적인 지원 및 보상이 이루어지면 좋겠음
3.0,(주)원익홀딩스,2018. 06,4점,"""- 사업특성상 잘 알려져있지 않으나, 내실있고 성장가능한 기업""","- 상호 배려하는 분위기 (부서이기주의 X)
- 개방적 조직문화 (불필요한 문서작업, 강압적 분위기X)
- 유사업계 대비 경쟁력있는 연봉","- 급여 인상폭은 다소 아쉬움
- 주요 고객사 의존도가 높음",- 지금처럼 구성원들의 의견을 수렴하여 더욱 발전하는 원익홀딩스를 만들어주세요
3.0,(주)원익홀딩스,2018. 06,5점,"""대한민국 반도체 사업을 뒷받침하는 반도체 장비사업 분야 가스공급장치 1위 기업""","1. 대한민국 대표산업인 반도체 사업분야에서, 안정적인 수익구조와 스테디 셀러인 가스공급장치를 제조/공급하는 중견업체로써,
2. 고객사와의 긴밀한 소통을 통해 다양한 Needs를 선반영함으로써, 미래 반도체 산업에 대해 꾸준히 준비하고 있습니다.
3. 임직원들의 지속적인 노력으로 창출된 안정적인 수익은, 연말에 업계 최고 수준의 보너스를 지급, 노력에 보답하고 있고,
4. 신규 입사자를 위한 교육/오리엔테이션 프로그램이 잘 갖춰져 있어, 회사 적응하는데도 큰 어려움이 없습니다.","기업문화 혁신으로 복장 자율화 및 자율 출퇴근제 등을 시행하고 있으나, 아직 모든 현업 부서에까지 시행되지는 못하고 있는 것 같습니다.",반도체 시장 사이클이 몇년안에 꺾인다는 우려가 있습니다. 튼튼한 회사가 될 수 있도록 새로운 사업아이템 발굴에 좀더 투자해 주세요.
3.0,(주)원익홀딩스,2018. 06,5점,"""회사가 최근 급진적으로 규모가 성장함에 따라, 다양한 업무를 경험할 수 있으며, 향후 본인 커리어에 매우 도움이 될 것으로 보임.""","수평적인 사무실 분위기, 직급체계가 단순하여(차장, 주임 등이 없음) 승진에 대한 압박이 상대적으로 적음, 연봉이 높음, 정시퇴근을 보장함. 학자금 지원이 됨.",출근시간이 8시반으로 상대적으로 이름. 다만 퇴근시간은 5시반이므로 근무시간(8시간)은 다른 회사와 동일,정년을 조금 더 늘려주었으면 좋겠음. (현재는 만 55세임)
3.0,(주)원익홀딩스,2018. 06,5점,"""자유로운 소통을 기반으로 다양한 경험 및 커리어를 쌓는 분들에게 적극 추천""","현 사업군의 안정성을 갖추고 체계적인 교육을 진행, 다양한 상장/비상장 계열사를 보유한 사업형 지주회사로 계열사를 통한 사업 연계 및 투자 가능성 우위
수평적 & 워라밸의 조직 문화, 회식 및 야근 강요 안함.
동종업계 최고 연봉, 정량적 평가에 의한 승진","반도체 시장 흐름에 따른 매출의 구조 유동적이며, 주 고객사가 정해지면 경쟁사 업체 시장 진입이 어려움.","신규 사업에 대한 적극적인 투자, 신 시장 발굴 및 연구 개발에 대한 더욱 적극적인 지원"
3.0,(주)원익홀딩스,2018. 05,3점,"""다닐만하지만 , 기술개발 매우 미흡하여 향후 먹거리 창출 어려워 보임""","여자들이 다니기 좋은 회사 , 학자금 지원해줌, 잘 모르겠음","복지제도 있지만 별로, 부서별 근무강도 케바케임 별거 없음",신규사업 추진 빡시게 해야되는데 연구소가 제일먼저 퇴근함
3.0,(주)원익홀딩스,2018. 05,2점,"""잘 알려지진 않았지만 나름 튼튼한 회사. 망할 일은 없을 것 같다.""",연봉이 나름 괜찮다. 하지만 CS파트는 다른 파트에 비해 개고생한다. CS파트말고 다른 파트는 나름 괜찮아보인다.,CS파트는 매일 출장가고 주말출근도 잦다. 슈퍼 을의 입장에서 근무한다. 회사내 타부서와의 관계에서도 을이다.,고생하는 CS파트 좀 잘 챙겨주었음 좋겠다.
3.0,(주)원익홀딩스,2018. 04,2점,"""임원을 위한 회사, 매출과 복지는 반비례하는 회사.
기술력의 향상이 미비한 회사.""","비교적 연차를 잘 사용할 수 있다.
일부 부서는 캍퇴근은 최고다.
공채 입사 연봉은 다른 회사보다 높다.
교육 시스템을 잘구축하려고 노력중인것 같다.
사외나 사내 교육은 잘 보내준다.","임원들의 파워가 너무 강해 한마디 말만 하면 소수의 의견은 묵살된다.
노사위원들의 힘이 전혀 없다.
매출이 높아지면 복지는 떨어진다.
복지 늘리는 것은 그룹 정책에 위배, 복지를 변경하는 것은 그룹과 별개
오래다닌 임직원들의 연봉테이블과 신규 입사자 연봉테이블이 불평등하다.
오래다닌 임직원들은 한번 회사를 나갔다가 다시 재입사하는게 연봉이 많다.
실적 및 보고서에만 신경을 쓰고, 특별한 기술력이 없다.
해외출장자들의 복지는 생각하면안된다.","신규 사업의 투자를 해주셨으면 합니다.
해외출장자들은 일하러 가는것!! 놀러 간다는 생각을 왜 하는지 모르겠습니다.

임직원들의 원하는 의견이 듣기 싫더라도 들어주셨으면 합니다.
아부가 아닌 애사심을 가지고 다니는 임직원들을 알아주셨으면 합니다."
3.0,(주)원익홀딩스,2017. 11,1점,"""시공업체입니다. 사무직이나 영업직이 아닌이상..백퍼 현장으로 빠지게 됩니다.""","삼성의 하도업체. 삼성에서 투자도 많이 하는 편이라
요즘 돈은 많이 번다.","사무직, 영업직이 아니라면 백퍼 공사현장 뛰러 가야 합니다. 출근은 새벽일찍 나가야 하는 날이 많지만 퇴근시간이 정해져있지 않습니다.","현장직 대우 이러면 고령화는 피할 수 없습니다.
공고 낼 때 정확한 업무로 적어서 내주시기 바랍니다
애꿎은 사람들 낚여서 시간낭비하게 하지 마시고요"
3.0,(주)원익홀딩스,2017. 02,3점,"""부서간 업무 프로세스 & 기업 문화를 만들어 나가는 중, 그러나 아직도 부족함""","동종 규모 대비 나쁘지 않은 초봉, 점점 더 좋아지는 기업 문화, 신사옥 건설 중","신제품 개발에 대한 성과가 없으므로 미래 먹거리 고민, '홀딩스'이지만 'IPS' 눈치를 봄, 직원에 대한 복지 동종 규모 대비 전무",복지를 늘려야함! 직원 행복은 곧 회사 성장의 원동력!!
3.0,(주)원익홀딩스,2016. 11,3점,"""일에대한 열정이 부족하고 방황 할때 일에만 몰입하기에 좋습니다
부서마다 다르겠지만 여러 사람들이 신경 써주는 분위기 입니다""",업무분담 체계를 만들려는 분위기와 부서별 유대관계가 좋습니다,기업 인수 합병과 여러가지 이유로 연봉을 제대로 못받고 있는 경우가 더러 있습니다,군대 문화의 축소와 자유롭게 의사소통 할 수 있는 분위기가 만들어져야 할 것 같습니다
날 괴롭힌 삭제된 댓글,(주)원익홀딩스,경기,,,,,
2.7,(주)희림종합건축사사무소,2022. 09,3점,"""야근이 많아서 체력적으로 많이 힘들었습니다. 그래서 좀 지쳤던것 같아요.""",야근하면 야근식대나오고 커피무료로 마실수있어요. 희림경력은 다른데로 이직할때 메리는있게 봐쥤던것 같아요.,야근이 많아서 체력적으로 많이 힘들었습니다. 그래서 좀 지쳤던것같아요.,직원들이 재미를 느끼며 복지가 많이 생겼으면 좋겠습니다.
2.7,(주)희림종합건축사사무소,2022. 08,3점,"""회장님이 따로계시고 매니저님도 고용된 형태기에 상대적으로 자유로움""",한줄평처럼 매니저가 총괄하는 분위기라 휴가제도나 근무변경이 자유로움,회장님이 요식업을 하시면 안될거같음 매장은 잘되었지만 점차 쇠퇴하는게보임,적극적으로 요식업을할거면 채계를 잡아가면서 해야할거같음
2.7,(주)희림종합건축사사무소,2022. 08,3점,"""업계에선 인정받는 기업. 연차를 쌓아 이직의 기회로 활용하기 좋다.""","비교적 융통성 있는 연차사용. 야근식대 만원 지원, 주말출근시 대체휴무 지원, 경조사 및 기타 사우회비 지원. 중견 회사에 있는 복지나 사내 제도는 다 있다. 월급도 밀리지 않고, 성과급도 매우 적지만 1년에 한번 나온다.",팀별 워라벨 상이함. 인사고과를 상사가 하여 눈치보고 비위 잘맞춰야 함. 업무에 대한 강도는 보통인 편이지만 야근 종종함.,분야에 탑 기업이 되고 싶으면 탑 급 인재를 영입할 수 있는 대우를 해줬으면.
2.7,(주)희림종합건축사사무소,2022. 07,2점,"""능력이 있다면 굳이....여길... 젊은 사람은 오지마세요""",건축 설계사무소에서 나름 대기업 느낌을 받을 수 있다. 네임벨류가 있다.,정체된 이사들이 너무 많다. 서로 공유도 안하고 자기 살기 바쁘다. 팀워크가 매우 안좋다. 급여 매우 짜다. 성과급 기대하지 말자. 부끄럽다. 젊은 사람들은 특히 이곳을 떠나야 한다.,똑똑한 사람들은 다 떠나는데 그걸 알고도 그냥 이렇게 운영하는것도 선택과 집중 같습니다
2.7,(주)희림종합건축사사무소,2022. 07,2점,"""회사에 문제가 생기면 본질적인 문제를 개선하기보다 눈에 보이는 점만 본다.""",대형회사이기 때문에 각종 업무에 대한 체계가 잡혀있다. 큰 프로젝트를 겪어볼 수 있다.,역피라미드 구조가 되어가고 있다. 내부적인 개선을 위한 노력이 단기적이다.,직원들이 주장하는 문제에 대해 좀 더 진중히 생각해주었으면 좋겠다. 잠깐 불을 진화하고자 하는 행동이 너무 눈에 티가 난다.
2.7,(주)희림종합건축사사무소,2022. 07,3점,"""좋은 사람들 좋은 선배들이 있어 배울 점이 많고 다양한 프로젝트 경험 가능.""","자유로운 연차 사용 가능, 수평적인 사무실 분위기를 만들려고 노력함, 안정적인 시스템 등.","회사 규모에 비해 아쉬운 연봉, 복리후생, 상여금 및 성과금.",직원들에게 조금 만 더 관심을 가지고 귀기울여주시면 좋을것같습니다 :)
2.7,(주)희림종합건축사사무소,2022. 07,4점,"""현장직은 정말 좋은걸로 안다
네임밸류가 높아서 자부심이 드는기업""","급여가 낮다고 하는데 딱히..
칼퇴보장
회사 네임밸류가 좋음","바보가 되기 딱 좋은 직군
스스로 자기개발할 시간은 많음",현장직은 모두 계약직인데 제발 정규직 채용해주길!! 그러면 더 높이날듯
2.7,(주)희림종합건축사사무소,2022. 06,4점,"""대체로 만족 팀바팀 본바본이 심하긴 하나, 내가 있던곳은 괜찮았음""","연차 자유롭고 편안한 분위기
프로젝트 경험 굿
연봉 좋아짐
야근 줄어듬","빨리빨리 문화
부족한 복리후생
적체가 심함
많이 올라도 부족한 급여",지금보다 더 직원이 다니고싶은 회사가 될 수 있도록 신경써줬으면..
2.7,(주)희림종합건축사사무소,2022. 06,3점,"""부서 바이 부서겠지만... 기업문화 및 체계가 선진화되어 있지는 않은것 같음.""","건축잡지 매달 스캔본으로 공유됨, 커피머신 있음, 다양한 교육 프로그램 지원.",위로 보고하고 보고하고 또 보고하게 되어있는 비효율 체계,현상 끝나고 하루정도는 쉬게해주면 좋을듯.
2.7,(주)희림종합건축사사무소,2022. 06,3점,"""상장회사로 대내외 어깨는 올릴수있는곳 근데 돈은너무적게줌""",출퇴근 버스 지하철연계 혹은 지역연계하여 교통편완화 이외는없음,사람적고 돈적게주고 플젝은많고 윗사람들은 일안하고 정치고,신규사업도 좋지만 주려사업을 내실있게 다져야 성장이 가능하지않을까요
2.7,(주)희림종합건축사사무소,2022. 06,3점,"""동종업계 네임밸류가 높다. 그만큼 다양한 프로젝트 할 수 있다""",동종업계 네임밸류가 높다. 그만큼 다양한 프로젝트 할 수 있다. 다 잘하진 않지만 업계 잘하는 사람들 만날 수 있다,낮은 연봉과 높은 업무강도. 직원들 복지에 대한 배려 없다.,아직도 많이 나간다고 들었다. 직원복지 연봉 워라밸 동등 회사 이상 해줘야한다.
2.7,(주)희림종합건축사사무소,2022. 06,2점,"""사람 빨대꽂으며 피를 빠는 시스템. 매출 수금만 목매는 회사""",일을 원없이 많이 할수있습니다. 타회사 대비 연차에 비해 일량은 많습니다.,회의목적이 뭔지 어떻게할건지 정리하지도 않고 회의한다하고 발주처협의에서 무슨의견이 있었는지 어떻게 정리해야되는지 말이 없습니다. 도면을 보면 이 회사가 설계에 대해 어떻게 생각하는지 알수있습니다. 최소한의 인원과 최소한의 비용으로 계약한 외주업체의 콜라보로 환상적입니다.,퇴사자들 속속 나오니까 대책회의 하신다는데 본인들 안바뀌면 답없습니다. 하지만 대체자들은 입사할테니 안변하시겠죠 어쨌든 지구는 돌아가니까요
2.7,(주)희림종합건축사사무소,2022. 06,3점,"""대형 설계사무소 탑티어라는 명예는 있지만 실속은 없는 회사""","여러가지 프로젝트를 경험해 볼 수 있음
연차 사용이 자유로운 편","프로젝트 대비 투입 인원이 굉장히 적어서 항상 업무강도가 심한 편
도면을 본부에서 작성하지않고 외주를 주는 경우도 굉장히 많음
낮은 연봉, 쥐꼬리만한 인센",회사 내 유능한 몇몇 인재들만 고생하는데 그런부분을 챙겨 줄 수 있는 투명하고 상세한 성과급 제도를 실시하기 바람
2.7,(주)희림종합건축사사무소,2022. 05,4점,"""건축분야에서 전망있는 회사에서 건축관련 많은 분야의 건축을 접할수 있음""","회사규모가 다른 설계사무소에 비해 크고, 쾌적한 환경
교육을 통해 트렌드 및 건축에 대한 이해도를 높임","일량이 많음 야근을 많을 할수 있음
연봉에 비해 일을 많이 해야 할 수 있음",규모가 커서 임원진이 많고 유능하신 분들로 구성 되어있어서 회사가 탄탄하다.
2.7,(주)희림종합건축사사무소,2022. 05,3점,"""변화 하려고 노력하나, 아직 실감이 나지 않는회사""","탑이어라 국내외 현장이 매우 많다
해외 근무로 성공하려면 여기서는 매우 좋다
하지만, 체계가 아직 미흡하다","탑티어에 맞는 체계가 부족하고 인역 관리를 못하는 회사
급여 또한 매우 낮은 수준이며 복지 또한 좋지 않다","변화 하려고 노력은 하나 경영진의 의지가 없으면 안됩니다
직원들이 일하고 싶은 회사를 만들어 주세요"
2.7,(주)희림종합건축사사무소,2022. 05,3점,"""어딜 가나 건축사사무소는 다 비슷한거 같다.""",다양한 프로젝트를 접할 수 있다. 사람이 많아 정보 공유하기 좋다.,타부서 이전이 쉽지 않고 과연 좋은 정보만 공유하는지는 의문.,보람차게 일을 할 수 있는 시스템이 갖춰지면 좋겠습니다.
2.7,(주)희림종합건축사사무소,2022. 04,3점,"""업계 1,2위 회사인건 사실.
희림 출신은 어디서든 알아준다.
직원수도 업계 1위""","시스템이 잘되있다.
프로젝트 자료가 많아 참고하며 배울 수 있다.
출근 버스도 있음.","매출액이 큰것은 1인당 설계 매출이 크다는 것.
그러면 프로젝트 규모나 담당 프로젝트가 많다는걸 알 수 있다.
야근의 연속. 그러나 야근비는 0.5배.
성과금 거의 없다.","직원들 퇴사율 높은 이유는 단 하나에요.
성과금으로 보상해주세요.
연봉 인상 많이 했다고 생각하면 안되요.
업계 전체 오를때 따라간것 뿐입니다.
1위이면 연봉도 1위로 갑시다"
2.7,(주)희림종합건축사사무소,2022. 04,3점,"""안정적이고, 9-6로 잘 다닐 수 있는 회사, 자기하기 나름""","셔틀버스 운행, 안정적인 급여, 정확히 구분되어있는 업무매뉴얼","모든회사 마찬가지이겠지만, 팀바팀 성향이 짙다. 사내정치가 필요할 수도..","직원들 입장에 서서 조금만, 아주 조금만 더 신경을 쓰고 생각을 해주세요"
2.7,(주)희림종합건축사사무소,2022. 04,2점,"""대형 설계사무소로 다양한 프로젝트 경험의 기회가 있으나
경영마인드가 심각하게 수준 이하인 회사""","대형 설계사무소로 다양한 프로젝트를 경험할 수있음
연차 사용은 보통 눈치보지않고 쓰는편","회사 직원은 그저 부품으로 밖에 보지않음
이익을 추구하는 집단이지만, 그 이익을 내는 것이 직원이라는 사실을 망각함
그냥 다시 뽑으면된다고 생각함
부서마다 다르겟지만, 도면 안치고 외주 주느라 한사람당 주어진 프로젝트가 많음
업무강도가 큼. 근데 윗사람들은 그냥 관리만하는데 무슨 사람이 필요하다고 헛소리함",본인들 법카쓰는데만 신경쓰지말고 직원들의 업무와 복지를 좀 더 신경써주길 바람
2.7,(주)희림종합건축사사무소,2022. 03,1점,"""사원을 하나의 부속품으로 생각하는 회사로 임원진들중에 자격미달인 사람들이 많습니다.""",메이저 설계 사무소로 설계업종에서 인지도가 있습니다 하지만 근속년수를 확인해보면 말도 안되는 업무량과 이해하기 힘든 잔업들로 설계가 좋아서 온 직원들이 지쳐서 퇴사하게 됩니다,회식때 뒤통수를 때리는 본부장이 있었고 술접대 좋아한다고 식사때 여직원앞에서 말하는 상무도 있었고 참 다양한 사람들이 기억에 남습니다.,퇴사한지 오래 되었지만 많은 부분이 변하지 않고 그대로라는 소식을 접할때면 참 안타깝습니다. 전직장으로 좀 더 젛은 회사가 되서 그 것을 다녔다는 사실을 자랑스러워했으면 좋겠습니다.
2.7,(주)희림종합건축사사무소,2022. 03,3점,"""본부 혹은 프로젝트에 따라 조금씩 다른 분위기 이건 다른 회사도 마찬가지일테지만 우선 설계외에 챙겨야 할 부분이 많아서 힘듬""",연차 쓰고싶으면 쓰게 해줌. 현상 후에 대체 휴가 가능,보고를 위한 보고 작업이 많아 소모적인 업무량이 많음 그렇다고 내 일 또한 소홀히 할 수 없음,신규수주도 좋지만 제대로 업무량을 전체적으로 파악하고 인원투입을 해줬으면 좋겠음
2.7,(주)희림종합건축사사무소,2022. 03,2점,"""건축사들 중에서는 이름들으면 알아주는 정도""",부바부이지만 직급이 올라갈수록 개편함 전형적인 역피라미드 구조의 회사,"덩어리는 커지는데 경영방식은 더 퇴보중, 경영진의 문제, 고인물 처리안함",덩어리 불리는데 신경쓰지말고 내부적으로 썩어가는 시스템 계선에 신경쓰길
2.7,(주)희림종합건축사사무소,2022. 03,2점,"""본부 마다 케바케 과연 누구를 위한 직급 통합인가""",본부 마다 케바케 지만 연차에 대해서 바쁜 시점이 아니면 쓸수 있슴... 성과급도 케바케 이고 다른 H 회사 보다 낮음.,셔틀 이 있지만 많지도 않고 복지가 거의 없다고 생각하면됨..,설계 및 전문 업무 맞는 형태 및 복지를. 최소한 노트북 제공 후 자리배치 쓸모 없는 캐비넷.
2.7,(주)희림종합건축사사무소,2022. 03,3점,"""설계직 워라밸이 지켜지지 않음. 부서별 편차 심한편. 희림 내부에서 비교적 괜찮다고 하는 부서에서 근무했지만, 주말출근, 야근 해야 하는 경우가 많았음.""","미미하지만 부서별 인센티브 있음. 명절에 대략 10만원 상당의 선물 줌, 직원 교육 시켜줌(디자인, 영어, 세미나, 그래픽 툴 등), 출퇴근 용이하게 셔틀버스 운영함, 핫라인 운영,",연봉 및 인센티브가 타 회사에 비하여 낮음. 임원이 많고 실무진이 부족함. 부서별 &개인별 편차가 크지만 야근과 주말출근이 많은 편.,"직원들의 경비(교통비 및 식비) 처리 관련하여, 부서장 파워에 따라 차이가 있습니다. 직원들에게 합리적인 방향으로 개선 되었으면 좋겠네요."
2.7,(주)희림종합건축사사무소,2022. 02,3점,"""주거본부 있었는데 팀 시스템은 좋았고 사람들 넘 힘들어보였어요 어린 직원들 보기만 하면 건설사로 취업하라고 했던..""",시설좋음 차로 출퇴근하기 좋음 좋은 선배가 꽤나 많았던,부바부 팀바팀 너무 많은 듯 합니다 어느정도 분위기가 비슷해야할텐데,요즘은 사람들 많이 갈리는것 같던데 제발 건축인 전문인으로서 취급해주는 문화 만들어나가길
2.7,(주)희림종합건축사사무소,2022. 02,2점,"""첫 회사라 기대 많이 했었고
실망도 많이 했다
요즘은 과거에 비해 아주 조금 나아진다고 하니..""","설계사무소 중 유일 상장회사
인근 맥날, 올리브영 있음
인근 산책로 있음","임원진들중 소리지르거나 목소리 큰 사람 많고
인격적으로 모욕을 주는 말을 하는 사람들도 많고","좋은 사람, 좋은 직원들 놓치지 마세요
사람이 먼저인 회사다 되시길 바랍니다"
