총점,회사,날짜,별점,요약,장점,단점,경영진에게
2.7,(주)희림종합건축사사무소,2019. 04,4점,"""일단 무지막지한 업무로드는 업계에서 익히 유명함. 저가 수주를 인건비로 떼우려는 경향이 있어서 개빡셈. 어떤 프로젝트를 배정받느냐에 따라 워라벨이 천지차이임.""",일단 회사 네임밸류가 있어서....버티고 나오면 이직할때 좋음. 프로젝트가 많아서 다양한 프로젝트를 경험할 수 있음. 월급은 꼬박꼬박나옴. 해외프로젝트도 할 수있으며 해외파견근무도 가능함. 단점도 무수히 많으나 그 내부에서 인정 받으면 그래도 그간 고생한거 보상 받을 기회는 옴.,건축설계자체의 모든 단점을 다 경험해볼수 있는회사라고 보면 적절함. 내부에서 인정받기 전까지는 소위말하는 설거지를 좀 많이 해야됨. 하나의 프로젝트를 꾸준히 진행하려면 10년차는 지나야함. 저년차에는 걍 막 돈다고 보면됨. 서울대 나오면 승진하기는 좋을꺼 같음,"무리하게 저가수주를 하는것보다 제대로 된 프로젝트를 수주하는게 어떨지 하나 현실이 그래서 이해는 합니다. 직원들 담배피는시간, 점심시간 유도리 없앤다고 업무 효율성이 올라가는거 아니니깐 제발 현실적으로 상황 반영해주세요."
2.7,(주)희림종합건축사사무소,2019. 04,2점,"""대외적으론 설계업계 1위지만 직원복지는 어떨지......""",인원이 많아서 본인이 없어도 프로젝트는 잘돌아간다.,야근은 당연히 철야는 옵션. 맨날 저녁이 있는삶을 외치지만 허울좋은구호,타회사보다 임원비율이 많은데 일할수 있는 사람들로만 조직개편해주시기 바랍니다.
2.7,(주)희림종합건축사사무소,2019. 04,3점,"""업무강도와 그에 비해 연봉수준이 높지 않고 다양한 프로젝트를 접할 수 있지만 계속 해왔던 업무위주로 업무를 분담하다보니 스펙트럼을 넓힐 수 있는 기회가 적음""","건축업계에서는 큰회사로서 회사의 네임밸류나 규모가 큰 프로젝트를 경험할 수 있고, 육아휴직이나 병가로 인한 휴직에 대해서는 눈치 안보고 편의를 봐줌.","대기업의 체계를 따르다 보니, 업무적으로 비효율적인 회사 내 임원보고가 많고, 무엇보다도 야근과 철야가 반복적이여서 힘듬. 야근수당이 따로 없고 저녁 식대와 12시 넘었을 경우 야근택시비 정도만 지원함.","합리적인 복지체계와 업무강도에 맞는 연봉수준으로 직원들의 불만에 귀기울였으면 좋겠고, 업무시간 중간 휴식시간동안 제약을 두지 않길 바랍니다."
2.7,(주)희림종합건축사사무소,2019. 04,3점,"""노력한 만큼, 상여로 힘을 복돋아 주었으면 좋겠지만, 그런게 1도 없어서 오래 볼 곳은 아닌 곳.""","이 기업에 오래 다닌다면, 자녀의 학비 및 각종 복지혜택은 나름 괜찮으나, 오래 다녀야 된다는 점. 부서마다 다르지만, 연차는 나름 자유로운 편.","복지혜택이 너무나 아쉽고, 타 회사에 비해서 상여제도가 너무나도 미비한 점. 감리들은 찬밥신세. 그 부분에서 너무 실망스러운 곳.","복지혜택의 폭과 감리들도 제도를 조금 폭 넓게 사료 잡아주면, 더욱 더 성장할 수 있는 회사지만, 나무만 바라보는 곳. 더욱 더 성장했으면 좋겠다."
2.7,(주)희림종합건축사사무소,2019. 03,1점,"""기대하면 기대할수록 기대에 미치지 못하는 곳이라는 것을 느끼게 해주는 곳""",연차를 눈치 안 보고 쓸 수 있지만 본부마다 다르면 제가 다닌 본부만 좀 자유로웠던 듯,연봉도 낮고 여기에 오래 다니면 손해라는 말이 나올 정도로 나갔다가 들어온 사람이 연봉 더 챙겨받는다고 하며 경영진은 사람이 많은데 그 만큰 일하는 실무진들이 이득을 보는 분위기는 아니다. 더욱이 본업에 업무들이 가중되는 분위기입니다.,다니는 사람들이 무엇을 원하는 지 진심으로 들어보시고 다른 회사로 나가지 않게 최소한의 노력을 해주세요.
2.7,(주)희림종합건축사사무소,2019. 03,1점,"""직원에게 베풀줄 모르는 회사 하루빨리 벗어나고싶던 회사""",규모가 큰 건축사사무소를 다니고 있다는 안정감을 주는 회사,"서울외곽에 위치, 인사상의 남녀차별있음, 회사에 수익이 나도 직원들에게 풀지 않음(성과금, 연봉인상 등 미미), 너 아니어도 할 사람 많으니까 싫으면 나가란 마인드. 2009년에 경기 안좋다고 축소시킨 복지혜택이 여태까지 유지되는 중 중간에 생긴 복지혜택은 나이있고 오래다닌 사람들만 누릴 수 있음","부서별 업무편중이 심하여 그에 대한 개선방안이 있으면 좋겠고, 신입,대리,과장을 위한 복지혜택이 증가되면 좋겠음"
2.7,(주)희림종합건축사사무소,2019. 03,4점,"""건축회사인 만큼 건물이 깔끔하고 좋았다. 아르바이트였음에도 처우가 상당히 좋았고, 감사했던 기업!""",한낱 아르바이트였음에도 불구하고 대우가 좋아서 감사했다. 직원들 복지에 전반적으로 신경을 많이 쓰는 듯 보였다. 셔틀을 운영하고 있다는 점도 장점인 듯,자세히는 잘 모르지만 업무에 비해 급여가 센 편은 아니었던 것 같다.,다른 복지보다도 연봉협상의 면에서 더 신경을 써주신다면 직원분들이 더 만족하시면서 다닐 수 있지 않을까 싶습니다ㅎㅎ
2.7,(주)희림종합건축사사무소,2019. 03,2점,"""건축설계사무소 치고는 나름 세련된 회사 분위기. 나쁘지 않다.""",조직의 일원으로 어디엔가 숨어있어도 회사 일은 돌아가고 인원도 나름 풍족하게 배치해줌. 사회초년생이 시스템을 배우기에는 나쁘지 않은 회사.,멀쩡한 사람도 정규직으로 뽑지 않고 온갖 감언이설로 계약직으로 뽑아놓음. 나름 회사 부담을 덜고자 하는 취지이겠지만 회사에 실망한 정규직이 더 빨리 그만둠.,정치좀 그만하고 회사가 정상적으로 운영되도록 직원들도 돌아봐주었으면 하는 바램
2.7,(주)희림종합건축사사무소,2019. 03,3점,"""한국 건축회사로 탑권인 회사라 큰 프로젝트를 경험할 수 있으나 이름값 만큼 노동 강도 높음""",체계가 아주 잘 잡혀있고 일이 세분화 되어있음 설계든 CM이든 큰 프로젝트를 맡아볼 수 있는 좋은 기회들이 많음. 큰 프로젝트가 많아서 그만큼 큰 시야와 큰 업무를 접할 순 있음. 건축 관련 일하는 사람은 여기 한번 거쳐가면 이직 할 때 플러스가 되는건 팩트.,큰 프로젝트를 맡을 수 있는 만큼 노동강도가 높은 편. 야근은 당연지사. 하지만 부서에 따라 분위기 다르고 좋은 상사 만나면 나름 괜찮지만 야근이 당연시되는 분위기. 그리고 전형적인 한국회사고 큰 기업이라 나이 많은 분들이 많아 주먹구구식 상사들 많음.,조금 더 높은 분들이 유한 분위기를 만들어주시면 배울것도 많고 일에 강도가 높아도 참고 할수 있는 에너지를 줄 수있을거 같습니다
2.7,(주)희림종합건축사사무소,2019. 03,4점,"""다양한 프로젝트 경험과, 커리어를 쌓고 싶은 사람들 에게 추천 합니다.""","사옥내에 도서관 이용 가능, 야근비, 수평적인 사무실 분위기, 업무 분담 체계 확실","야근과 철야가 많고, 퇴근시간이 정해져있지 않습니다. 현재는 하남 근처로 사옥 이전 하여, 출퇴근이 불편할 수 있습니다,","야근 철야에 대한 보상 과 상여금, 연봉인상이 필요합니다."
2.7,(주)희림종합건축사사무소,2019. 02,2점,"""적은 급여에 과도한 업무량. 타부서를 보면서 상대적 박탈감을 느낄 정도.""","동종 업계에서 손꼽히는 회사로 외부 이미지가 좋음.
사옥 이전한지 얼마 되지 않아 근무 환경 좋음.","타부서에 비해 과도한 업무량으로 의욕이 상실됨.
밤 11, 12시까지 야근은 예사요. 주말 근무도 거의 일상.
급여도 저조한 수준으로 체력적, 정신적으로 지쳐버림.","적합한 대우를 해줘야 합니다.
어느 회사나 꿀빠는 사람들은 있기 마련이지만 더 일하고 애쓰는 사람들에게는 그에 합당한 보상을 해줘야 합니다.
직원이 많이 바뀌는데는 그만한 이유가 있음을 경영진측에서 생각봐야 합니다."
2.7,(주)희림종합건축사사무소,2019. 02,1점,"""찍어내기식 설계 낮은 연봉
그치만 한국에서 가장 전통있는 대형설계사라는 타이틀""","희림이라고 하면 누구나 다 알아 듣는다
대형설계사, 상장회사로 이직 시 유리","영혼없이 건축하기
규모에 비해 낮은연봉과 수직적 기업문화","프로젝트 당 사람 배정이 더 필요함
전반적 복지와 연봉의 개정이 시급함"
2.7,(주)희림종합건축사사무소,2019. 02,3점,"""월급많지않지만 안정적인 회사
상여성과금 많지않지만 안정적인 회사
야근 많지만 그래도 쉬게는해주는 회사
정말 일만하기때문에 동료들과 트러블 많이없는 회사""","주말출근하면 평일에 쉼, 주말출근하면 식대 만원, 설추석선물줌, 회식 자주안함","주말에 약속잇는데 눈치봐야됨, 너무자연스럽에 하는 야근, 정말 서로에게 관심없음",야근많이한다고 잘하는것 아니고 오히려 못하는 것입니다. 업무배분 잘 해주시고 남아서 하는사람 관리해 주세요.
2.7,(주)희림종합건축사사무소,2019. 02,2점,"""야특근비로 생활비를 아낄수 있다. 물론 그만큼 월급이 적다.""",야근식대1만원 /12시근무시 택시비지원 /주52시간 넘기면 그냥퇴근 / 출근셔틀지원,야근비 10시이후부터 책정/지정시간외 흡연금지/딱딱한 분위기/ 회사위치 별로 (서울이지만 서울아님),일많이 시켜도 되고 사람 조금뽑고 돈 더많이 벌라고 해도 좋은데 우리가 벌면 좀 나눠줘라. 왜 회사 수익은 오르면서 내연봉은 오르지도 않냐.
2.7,(주)희림종합건축사사무소,2019. 01,1점,"""직원을 부품으로 생각하고 막굴리는 회사. 디자인에 관심있는 사람조차 꿈을 접게만든곳""",성계사무소 안에서 대기업이지만 그래봤자 그낭 중견기업. 사장이 너무 많은 돈을 가져감.,복지나 직원 우대해주는 것이 없음. 공채 대우도 따로 없음.,수주만 하고나면 프로젝트 신경안쓰는 당신들 양심적으로 좀 합시다.
2.7,(주)희림종합건축사사무소,2018. 12,2점,"""오너가 맘대로 하는 군대식 회사, 가르쳐 주는 건 없으나 업무를 견디다 보면 어느새 성장한 자신을 발견.""","대규모, 다양한 프로젝트를 경험할 수 있다. 월급은 제때 나온다. 승진 누락은 없다. 짧은 시간에 업무적으로 성장 가능하다.",까라면 까야한다. 업무강도가 높다. 개인한테 부여하는 책임이 많다. 비합리적인 업무 프로세스가 많다.,"단기적인 이익에만 집중하지 말고, 지속가능한 기업이 될 수 있도록 직원들이 오래 다니고 싶은 회사가 되도록 노력해주세요."
2.7,(주)희림종합건축사사무소,2018. 11,4점,"""해외수주에 적극적인 태도와 성과를 바탕으로, 국내 부동산 경기하락세에 잘극복할것같음.""",대형규모의 건설사업프로젝트과정을 경험하기 좋음. 프로젝트 아카이브가 잘되있는편,"건축설계에 있어서 디테일한 부분을 배우기 어려움, 파트별 외주관리 및 코디네이터 업무가 많음","저년차 사원들에 대한 교육 및 업무에 대한 체계적인 관리가 필요, 인력누출에 대한 대책필요."
2.7,(주)희림종합건축사사무소,2018. 11,1점,"""빛좋은개살구 인듯 보이나 빛은 바래지기 시작했고 누구를배불리하는것인가 좋은건축은 없다.""",매일 청소하시는 분들이 깔끔하게 근무환경을 마련해주신다 감사하다,비합리적인 인사제도. 노동시간 갈취. 비투명성. 로비다다,이미 건축계의 윗대가리들은 노답인사람들이라 바라는점은 의미가 없다.
2.7,(주)희림종합건축사사무소,2018. 11,3점,"""회사는 커지려고 하나 최근 수주가 잘 안되서 어려움이 많은데 이 기간을 잘 이겨내야 할 필요성이 있는 회사임""","현장 배치를 받았을 경우에는 본사에서 현장에 관한 터치는 별로 없다~! 다만, 이게 장점이자 단점이 될 수 있는 부분이다. 현장에 따라 다르겠지만 내가 있던 현장에서 연차를 쓰는것에는 큰 제약이 없었으나 작은 현장의 경우는 어려움이 있어 보인다.",젊은 사람들에게는 현장이 이어짐이 어려울 수 있다. 그리고 임금부분은 현장에 있는 기간에 변화는 어려우니 현장 배치 받을때 협의를 잘 해야지 않그러면 몇년간 같은 연봉으로 있을 수 있다.,현장이 이루어질때 사람에 대한 평가가 필요함. 본사는 현장에 대해 관심을 가질 필요가 있음. 소통의 부재가 큼.
2.7,(주)희림종합건축사사무소,2018. 11,1점,"""빛 좋은 개살구 회사 규모만 클 뿐 연봉, 복지 등 업계에서 내세울게 없음""",현장에 따라 분위기 상이함 편차가 크지만 대체적으로 본사보다는 자유로운 근무 환경 다른 회사에 비하여 현장근무에 집중할 수 있는 환경,업계 최상위임에도 불구하도 다른 회사들에 비해 연봉이나 복지 적음 경영진은 책임을 안 짐 현장에 관심이 없고 현장관리 거의 안 함 겉보기에는 번지르르한 허울뿐인 복지혜택 상여금 및 자녀 교육비 지원 장기 근속자 포상 등이 있지만 실질적으로 혜택을 받는 사람 거의 없음 직원 결속력을 위한 간담회 체육대회 등의 행사는 직원들을 피곤하게만 하고 전혀 도움이 안 됨,현장에서 실질적으로 근무하는 인력위주로 편성하고 그에 합당한 대우를 해주기 바람 보여주기식 복지혜택 말고 많은 직원들이 혜택을 볼 수 있는 제도가 필요해 보임 현장인력 쓰고 버리기식 소모품으로 취급한다면 언젠가 되돌아 올 것임
2.7,(주)희림종합건축사사무소,2018. 11,4점,"""설계 회사 중 대기업은 대기업입니다.""","설계회사들 중에서는 봉급이 높은 편이고, 복지가 그래도 괜찮은 편입니다.",설계회사의 공통사항인 야근이 당연합니다. 휴일까지 껴서 3일 쉬게 되면 하루는 나와야 되는 시스템입니다.,조금 더 일의 효율성을 만들어줬으면 좋겠습니다. 능력없는 사람들이 껴있어서 일을 더 만든다.
2.7,(주)희림종합건축사사무소,2018. 10,3점,"""회사는 회사다.
건축 설계업 중에서는 제일 회사 같은 곳.""","다양한 프로젝트, 다양한 경험, 다양한 사람(?)
전문직으로서 많은 것을 배워 나가려면 본인이 영리해야함. 아니면 노예.","건축가로서 기대하는 부분을 충족해줄 것으로 기대하면 안됨
본인 역량에 많은 것이 달렸음 (그럼에도 불구하고 일은 하는 사람에게만 몰리는..)","인센티브가 적절하지 않고, 보상제도 및 직원 평가 제도가 미흡함
획일화 된 수직구조가 여전히 존재함"
2.7,(주)희림종합건축사사무소,2018. 10,4점,"""가장큰회사에서 일할수있는자부심을 가질수있습니다. 남들이 가고싶은 회사""",글로벌1위의 자부심을 가질수있음 회외프로젝트의 참여가능성이 높고 디자인기회가주어짐,군대문화 다소 있음 부서마다다르겠지만 전채적인 노동에비한 급여가 적음,체계적인 업무를 통해 업무분배와 강도 조절이 가능했으면 좋갰급니다
2.7,(주)희림종합건축사사무소,2018. 09,3점,"""비슷한 규모의 타 설계회사에 비해 복지수준은 떨어지는편. 팀, 부서마다 분위기가 매우다름.""","부서별, 업무별 파트가 체계적으로 나뉘어 있음. 동종업계 비슷한 규모의 설계회사에 결코 뒤지지 않는 네임밸류.",강동에 위치하고 있어 출퇴근이 힘듦. 부서마다 분위기가 너무 다름. 동종업계 타 설계회사에 비해 급여 및 복지수준이 떨어짐.,합리적인 복지 및 보상체계 필요. 일부 부서의 군대식 문화 타파필요.
2.7,(주)희림종합건축사사무소,2018. 09,2점,"""설계 하는 사람한테 희림 다녔다고 하면 알아줌. 설계업계의 top3""",일을 엄청 많이 할 수 있다. 1년을 다녀도 3년치 일을 할 수 있음.,거의 매일 야근 혹은 밤샘. 주말에도 출근. 하지만 심한 박봉에 야근비 따윈 없음. 건강이 매우 나빠짐. 이직률이 매우 높은 이유가 있음.,"그만 좀 노동 착취를...
디자인회사이지 공장이 아닙니다."
2.7,(주)희림종합건축사사무소,2018. 09,3점,"""대한민국에서 건축설계분야로는 최고의 회사
자부심을 가질수 있음""",회사 규모가 있는만큼 큰규모의 프로젝트를 경험 할수있음 해외지사가 많아서 개인적으로 해외경험을 회사에서 다함,"중견기업에 이미지에 맞지않는 연봉과 복지
야근철야는 필수
워라밸 지키기 힘듬",야근철야로인해 보상휴가를 주는데 보상휴가를 쓸수가없음 업무가 상대적으로 여유가 생기면 휴가를 맘편히 썼음 좋겠음
2.7,(주)희림종합건축사사무소,2018. 09,1점,"""다양한 경험을 압축해서 해볼 수 있는 최강 업무강도의 회사""","인내력과 짧은 시간 압축적인 업무를 수행할 수 있는 기술을 배움

사외에서 경력을 희림에서의 경력을 인정해 줌","직원을 육성한다는 개념보다는, 쓰고 교체한다의 개념이 있다.

윗분들은 그대로 인데 아랫직원들만 퇴사한다.",1)전체적인 구조조정과 2)업무프로세스의 개선 3)권위적인 기업문화 4)업무강도 조정 등 많은 것이 바뀌어야 하는 회사
2.7,(주)희림종합건축사사무소,2018. 09,4점,"""조용한 사람들 조용히 일하는 곳입니다.""",인턴이라 칼퇴하고 아프면 쉴 수 있습니다.회사 버스 있습니다. 출퇴근 편합니다.,사내 식당이 없어서 밖에 나가서 밥 먹어야한다. 근데 주변 식당 몇개 없어서 매일 거의 같은 것 먹었습니다.,다들 열심히 일을 합니다.자세히 잘 모르겠습니다. 해외 프로젝트 많아서 선배들 많이 출장합니다.
2.7,(주)희림종합건축사사무소,2018. 09,4점,"""국내 최대 설계.감리 회사! 수주역량이 중요""",40시간 근로 적용으로 칼퇴문화 형성과 최고의 회사라는 브랜드가치있음. 다음회사로 이직할 경우좋음! 임원급이라면 최고,"체계적 근무환경, 건축분야가 박봉이라하지만 대기업인만큼 괜찮음","직원에 대한 복지가 늘어났으면, 크게 문제없음.. 자유롭지 못함"
2.7,(주)희림종합건축사사무소,2018. 08,3점,"""""희림에서 버틸 수 있다면 어디에서든 버틸 수 있다.""""",네임밸류. 해외사와 프로젝트 수행 가능. 규모 있는 프로젝트 수행 가능. 실력을 쌓아서 다른 회사로 가기에는 좋을 것이다.,"빡빡한 사내문화, 직원 감시 매우 심함, 융통성 없음. 직원 감시를 위한 사원증 (출퇴근 체크용도 아님). 워라밸은 포기할 것. 영업본부나 경영본부는 칼퇴할 수 있으나 설계본부 친구들을 보면 눈물이 남.. 다만 주 52시간 시작 후 나아지긴 했음",직원을 소모재로 보지 않았으면 좋겠다.
2.7,(주)희림종합건축사사무소,2018. 08,1점,"""회사 마인드가 너무 올드하다. 디자인 회사로 덩치만 크고 새로운 시도를 거부하는 치명적인 단점이 있다.""",네임밸류는 아직 유효하여 다른 직장으로 이직하기위한 발판으로는 나쁘지 않다.,회사 동치가 너무 큰데 유기적으로 상호 보완 되지는 않는다. 왜 덩치를 이렇게느 키워 났는지 이해가 안 된다. 전형적인 모래시계 구조다. 게다가 위 고인물은 안 바뀌고 저직급은 부품처럼 소모되다 2-3이면 이직한다. 그러니 회사는 노하우 축적이 안 된다. 해외플젝을 그렇게 많이 해도 매번 처음하는 것 처럼 한다.,덩치를 유지할려고 하지 말고 인재를 남길 생각을 해야한다. 그 덩치 유지할려고 수주액으로 사람 목조이면 남아있을 사람 아무도 앖다. 수주액만 쳐다보면 플젝계약해서 납품하기 급급하지 제대로 된 디자인 퀄리티를 절대 못 뽑는다. 이런상황이 유지되면 회사는 악순환을 반복하게 되고 결국 고인물들이 나떼를 외치는 회사가 될 것이다.
2.7,(주)희림종합건축사사무소,2018. 07,1점,"""노예개발에 특화된 회사 직원은 곧 부속품이며 갈아끼우면 그만""",장점은 없다. 야근과 부당한 늦장지시 훈계만 넘칠뿐. 어중이 떠중이 모이는 곳,타 설계회사보다 월등한 이직률. 고학력 정상적인 마인드이면 깎아내리고 나가게만드는 재주가 있음.,담배피지 마라 야근 시간 찍지마라가 우선이 아니라 근본적인 문제해결을 위한 경영에 시간을 투자하심이
2.7,(주)희림종합건축사사무소,2018. 07,4점,"""설계사무실 중에서는 갈만한 곳인거 같네요.""",비교적 자유로운 분위기였지만 근무시간 단축으로 빡세진거 같습니다. 연차나 휴가 눈치안보고 썼던 예전이 더 좋은거 같네요.. 무엇보다 업계에게 조직에 대한 시스템이 잘 갖춰진 회사입니다.,교통이 워낙 좋지않다보니 출퇴근시간이 많이 걸림. 요즘 점심시간도 단속한다는 이야기를 들었음.,있으나 마나한 인센티브 가지고 생색내지 않았으면 좋겠네요 주고도 욕듣습니다~
2.7,(주)희림종합건축사사무소,2018. 07,4점,"""개발자가 대우받으며 일할수 있고 시설도 깨끗하고 만족스럽다 다만 위치가 좀 좋지 않아서 불편하다.""",새로운 사옥이라서 전체적으로 매우 깨끗하고 잘 정돈되어있는 느낌이다 무엇보다도 인원수에 비해 사무실이 넓은편이라서 굉장히 쾌적하고 좋았다. 업무 분위기도 조용해서 괜찮다,모형실이 대학교보다 좋지않고 실질적인 부서마다 다르겠지만 분위기가 극과 극을 달린다. 엘레베이터가 너무 불편하다,합리적인 복지 및 보상을 하길바라며 엘레베이터는 어떻게 좀 해주는게 좋을거같다
2.7,(주)희림종합건축사사무소,2018. 07,3점,"""감리 업계중에 나쁘지 않음. 연봉이 적으나, 감리 업계는 삼우 제외하고 비슷한 것 같음.""","수주를 잘 따고, 규모도 크면서 현장이 많았음. 수직적인 문화가 별로 없어서 좋았음. 야근비 있음.","시공 경험이 없는 상태에서 신입으로 들어가니 배울 점이 별로 없었고, 아무래도 시공사 경험 후 40~50대에 입사하는 것이 더 괜찮을 거 같아요.
본사 근무 시, 야근 or 휴일 근무를 나오라고 함.","수주는 좋았으나, 해외 사업을 조금 늘려서 글로벌하게 나가는 것도 괜찮을 거 같습니다."
2.7,(주)희림종합건축사사무소,2018. 06,2점,"""직원을 위하는 회사는 아닌것 같습니다. 임원을 위한 회사에 가까움""",대기업이라는 장점과 업계 1위를 자부한다는 장점이 있고 이직할때 발판이 될 수 있다는 장점이 있습니다,분위기도 그렇고 자유로운 회사는 아님. 규모나 명성에 비해 연봉수준이 낮고 일은 많음. 직원 복지등이 규모에 맞지 않음,규모가 있는 만큼 직원들을 좀 더 위하는 회사가 되었으면 좋겠습니다. 임원들을 위한 회사가 아니라 직원들을 위하는 회사가 되었으면 좋겠습니다.
2.7,(주)희림종합건축사사무소,2018. 06,3점,"""경력직들에겐 좋으나 신입으로 쭉가는 것은 처우도 별로고 좋지 않아보임""",경력으로 들어오면 처우는 좋음 생각보다 기본적인 복지 구축,이기주의의 팽배와 파벌 비개념자 많음 미루는거 많음 책임소지 불분명,불필요하게 노는 인원은 줄이고 실력 없는데 짱박혀 있는 임원들 정리하는게 좋음
2.7,(주)희림종합건축사사무소,2018. 06,1점,"""전형적인 직원 착취형 기업. 여러가지 허울 좋은 말로 열정을 강요하는 회사.""",굵직하고 누구나 알법한 프로젝트 수행 경험을 쌓을 수 있음.,보고만을 위한 업무가 상당 부분 차지. 연차에 따라 역할이 철저히 나눠져 저 연차일 때 경험을 쌓기가 쉽지 않음. 야근 상당히 심한편.,"국내 최대 규모 건축 설계 회사로서, 건축계에 미치는 여파가 상당한데 업계 공멸의 자충수는 그만 두기를 바란다."
