총점,회사,날짜,별점,요약,장점,단점,경영진에게
2.5,(주)피제이전자,2022. 06,3점,"""어느 팀의 어느 직장동료들을 만나느냐에 따라 재직하는 자신의 삶의 질이 달라질 수 있습니다.""","자기개발을 위해 헬스비를 지원해주거나 야간대학에 진학을 하고자 한다면 큰 저항없이 서류를 지원해줘 퇴근후의 자기개발에 적극적인 지원을 해줌
재무제표를 보아 매년 성장을 하고 있음.","퇴근시간이 매일 변동되며 실질적으로 퇴근을 언제 할지 모르며 퇴근을 찍고 근무를 하는 경우도 발생하여 많은 노동자들이 불만을 가지며 건강도 많이 악화됨
승진은 능력이 좋아도 나이가 어리거나 비교적 부족하면 승진이 되지않습니다.",노동자들의 말에 귀기울이며 인적자원을 사물이 아닌 인간으로 대해줘 하찮게 여기지 마시길 바랍니다.
2.5,(주)피제이전자,2022. 05,3점,"""고객사가 다양하여 여러 산업의 경험을 할수 있는 곳
제조공정과 품질 관리는 우수하나 연봉이 적음""",오래된 회사이다보니 체계적인 업무 절차가 잘 짜여 있음,오래된 회사이다보니 남여직원에 대한 차별이 아직 있는듯,열심히하고 능력있는 직원에게 베풀면 더욱 더 성장하실 겁니다
2.5,(주)피제이전자,2022. 05,2점,"""연봉은 낮고 야근은 필수인 보수적인 회사""","연장수당은 잘챙겨줌. 그래도 중견기업에 걸침.
그 외에 장점을 찾기는 쉽지 않음","연봉이 너무 낮으며, 똑똑한 사람과 일한다는 느낌을 못받음.
생산회사의 안좋은면을 다 가지고있음",요즘 회사 트렌드를 좀 따라갔으면 합니다. 너무 보수적이고 발전의 여지가 너무 없음
2.5,(주)피제이전자,2022. 05,3점,"""신입 잘 가르쳐줌, 공장이 깨끗함, 텃세 없음""","신입 잘 가르쳐줌 , 공장 깨끗함 , 텃세없음, 무경력 신입들은 일이 많아 짧은시간안에 기초 배울 수 있음 , 생산라인 깔끔하고 좋음, 중견기업으로 얼마전 되어 발전 가능성 있어보임","중견기업인데 아직 2조 2교대 중견으로 바뀐지 얼마 안되서 그런 것 같음
근로시간이 매우 길어 피로, 근로시간에비해 박한 월급","생산직, 엔지니어 3조2교대 주간2조2교대 형식이면 발전 가능성 있어보임 신입들이 너무 빨리 나가지 않나요 ㅎㅎ;"
2.5,(주)피제이전자,2022. 05,2점,"""코스닥 상장사로 안정적인 경영을 하는 회사지만 월급이 너무 적고, 근무시간이 길다""","안정적이고, 규모가 있어서 체계가 어느정도 갖춰져있는 중견기업임. 식사 제공에 회사 위치도 좋음.","연봉이 적고, 근무시간이 길어 오래 다니기 힘듬.. 업무가 너무 많아서 단기간에 업무 배우긴 좋음.","진급체계도 이상하고, 근무시간이 너무 길어서 다들 오래 다니기 힘든거 같음."
2.5,(주)피제이전자,2022. 04,4점,"""다양한 경험과 본인 커리어 향상에 나쁘지 않은 회사
장기근속하기적합""","연차 눈치 안보고 쓰는거 가능
매출액 높고 안정적인회사","바쁠때는 전체가 다 바쁨
바쁠때가 꽤 자주있음
케바케지만 바쁠때 무조건 같이해야함",직원 복지와 급여에도 신경을 좀 많이 써준다면 더 발전할꺼같다
2.5,(주)피제이전자,2022. 03,2점,"""구시대적 문화를 가졌던 회사로 기억합니다. 뭔가 막힌""",동료들 좋음. 친절하고 배려심 돋음. 끈끈함. 동병상련의 분위기. 망할일은 옶어보이긴 합디다. 설비시설이 업계에서 큰편.,사무실 전체청소 및 정수기 물 갈기. 화분물주기. 지금은 바꼈을란가.,절이싫으면중이떠나라는명언동감자로써 뭐...그랬었지요...
2.5,(주)피제이전자,2022. 02,2점,"""같이 일하는 사람들이 좋으나
소통의 어려움이 많음. 짧게 경험하기엔 나쁘지 않다""",연차를 자유롭게 쓸 수 있다. 그 외에는 딱히 생각나는게 앖어요,비효율적 업무가 많다. 윗사람들은 책임 떠넘기기 바쁘고 고생은 밑에 사람들이 다 함,"직원들의 불만을 듣지만 말고 해결책이 나왔으면 좋겠어요
바뀌지도 않는데 자꾸 말해봐야 입만 아프고 속터집니다"
2.5,(주)피제이전자,2022. 02,1점,"""인력과 시간을 갈아 넣어 세웠으나 바닥이 모래사장이다""",월급 잘 나오고 월급이 밀리지 않는다는 것. 회사 자체 건물이 아니라 계단이나 화장실 청소를 하지 않는다 정도,딱 부러진 결재 라인이 없음. 부당하다 생각 들어도 위에서 이러라면 이러고 저러라면 저래야 함,쓸데 없는데다 신경 쓰지 말고 실무를 보세요
2.5,(주)피제이전자,2022. 02,4점,"""회사가 안정적이고 꾸준히 성장함. 의료기기 제조 비중이 높음.""",회사를 안정적으로 운영하는 편이라서 망할 걱정은 안해도 됨. 매출이 잘나오면 연말에 성과금도 잘 주는 편임.,일이 많아서 여가 시간을 가지기 어려운 부분이 있음. 회사가 수직적인 조직문화를 가지고 있음.,계속 꾸준히 성장해 나갔으면 좋겠음. 직원들 여가 시간을 보낼 수 있는 회사 운영이 필요함.
2.5,(주)피제이전자,2022. 02,3점,"""부천 smt 회사중 가장 큰편에속하는 회사 배운거 없이 다닐만한곳""",정규직 전환시 부천 다른곳보단 페이가 쎈편 젊은 층들이 많아서 어린사람들은 다닐만한곳,"정규직 전환이 너무 느림. 몇몇꼰대들 때문에 일뿐만아니라 정신도 좀 힘들수 있음
업무 특성상 연차가 쓰기 힘듬",잘한다 싶으며뉴정규직 전환좀 빨리해줬으면 합니다 연차도 좀 자유롭게 쓸수 있었으면..
2.5,(주)피제이전자,2022. 01,3점,"""일을 빠르게 배울수있고 여러가지 업무를 다양하게 해볼수있는 장점이 있었습니다.""","OP , 검사자등 대부분 직원들이 아웃소싱으로 1년 계약직이 많아서 빠르게 취업할수있는 장점이 있었고, 무엇보다 회사직원들의 성격이 좋았습니다.","정해진 연차를 월1회 사용하기가 눈치보이고 힘들었고, 연차를 사용하려면 회사에서 만족하는 사유가 있어야 됬고, 그 사유도 상세하게 설명드렸어야 됬습니다.",기본적인 연차와 간식비등 어느정도 직원들에게 맞춰주셨으면 합니다. 피제이전자 화이팅
2.5,(주)피제이전자,2022. 01,4점,"""다양한 최신 제품을 경험할 수 있는 곳. 여러 산업분야에 걸쳐있음.""",조중석식 지원되어 편하고 외주 급식업체라서 꽤 관찮은 식사를 준다,제품과 고객이 워낙 다양하고 복잡해서 처음 접하게 되면 적응하는데 오래걸림,잘하고 계시고 앞으로도 꾸준히 잘해주시리라 생각합니다.
2.5,(주)피제이전자,2021. 12,2점,"""다양한 업무를 배우기에 좋은 환경이나, 직원에 대한 배려가 적고 수직적인 관계가 매우 심함""","영어 등 자기 계발 능력 향상을 위한 지원을 잘해주며, 대출 지원이 좋음","업무가 마무리되고 퇴근시간이 지나도 눈치를 주고, 업무량에 비해 인원이 부족함",군대 문화를 줄여주길 바란다. 강압적인 분위기로 인한 젊은층의 부담감을 줄여줬으면 한다.
2.5,(주)피제이전자,2021. 10,2점,"""아파트형 기업 따로 불리 되어 있어서 적응 하기 힘들다
복잡한 구조 3개로 나누어저 있음""","월급이 잘 나온다 수당이 있다 일을 많이 한다
일을 많이 할 수 있다
야근 수당이 잘나온다","산업체 를 쓰기때문에 교체 될때 책임이 부족
야근을 많이한다 주말에도 출근을 자주한다
일할때 다른 부서와 마찰이 많다",나눠져 있기 때문에 소통이 필요 할것 같다
2.5,(주)피제이전자,2021. 10,2점,"""망할 일은 없으나 성장도 멈춰버린 곳""",여러 분야의 사람들과 정말로 가족처럼 동료애를 느끼며 업무 가능. 밀린 적 없는 안정적인 급여 지급. 정규직 전환시 상여금. 나름대로 워라밸 중시하려는 마인드.,보여주기식에 치중되어 있으며 나이 많은 양반들은 대체 뭐 하는지? 전자계의 공무원이신가? 수직적인 구조에 능력 없는 직급들이 많으며 고생은 생산직이 다 하고 생색은 그들이.. 너무나 짜디짠 급여. 발전은 없을 것이고 생각없이 다니기엔 좋다.,사람 귀한 줄 아셔야 할 겁니다. 머지 않아 큰 폭풍이 몰아닥칠텐데 감당할 수 있으련지?
2.5,(주)피제이전자,2021. 10,3점,"""아웃소싱이어도 성과금이 나오고 기업 아웃소싱으로 일하다 정규직도 노릴 수 있음""",회사 규모가 커서 월급 밀릴 걱정은 없고 수당도 확실하게 챙겨주고 잔업이나 특근은 팀마다 상이하나 많은 편은 아님. 중식은 식당이 여러곳을 선택해서 갈 수있어 만족스러움 오래된 기업인 만큼 체계가 있고 탄탄함,각 팀마다 업무량이 차이가 나고 분위기도 많이 다름 구체계와 신체계의 과도기의 느낌이 나는 회사다 보니 적응이 개인 마다 차이가 있음 정규직으로 전환 됐을 시 업무량이 많이 늘어날 확률이 농후하다.,눈으로만 쓱 보고 문제를 지적만 할것이 아니라 진짜 현장의 문제가 뭔지는 현장에서 일하는 노동자가 제일 잘 알고 있다. 업무량을 개인에게 몰아서 해결하기 보다는 인원을 늘려 효율적으로 배분해 처리하는게 더욱 더 성장하는데 좋고 사원들이 퇴사하지 않도록 해준다는 사실을 꼭 유념하시길
2.5,(주)피제이전자,2021. 09,3점,"""안정적이나 업무 강도 높음..............""",안정적입니다. 부서별 분위기가 다름 친구처럼 일할수있는 부서 있음,"업무 하향 이양, 업무 강도 높음, 진급 기회 및 기준 불확실",복지부족으로 복지가 늘었으면 좋겠다.
2.5,(주)피제이전자,2021. 09,1점,"""경력쌓기는 좋지만 그만큼 대우는 못 받는 곳""","연차 눈치는 많이 보지 않음
칼퇴는 아니지만 야근을 많이 하지 않음","복지가 너무 없음
연봉이 너무 적음
승진제도가 정해진게 없음","직원들 복지를 신경써줬으면 좋겠습니다.
포괄임금제에 비해 연봉이 너무 적습니다."
2.5,(주)피제이전자,2021. 09,3점,"""다양한 생산 설비를 다뤄볼수 있는 기업""",SMD 라인에서 근무 했음. 파나소닉/주끼등 SMD를 하는 회사들에서 최신/고급 장비를 다뤄 볼수 있음.,"2조 2교대라 쉬기 힘듬..
평일은 그냥 무조건 12시간씩 일해야됨
휴일도 일부 직원은 일해야 되서 한달에 1~2회 겨우 쉴수 있음
개처럼 일해서 일단 다니가 힘듬
물론 다행인건 연장/휴일 근무로 추가 수당은 주지만 하기 싫음.","회사의 시스템이 부서나 팀까지 내려오지 않음
팀마다 공동 정책이 다름"
2.5,(주)피제이전자,2021. 09,2점,"""꼰대문화가 활성화 되어 매우 보수적이고 수직적인 구조""","식대지원 중식, 조식, 석식 지원 , 핸드폰의 자유로운 사용, 다소 자유로운업무 분위기","수직적구조, 잦은회의, 꼰대문화, 불필요한 문서업무, 남녀차별, 업무강도 높음, 업무대비 적은 급여","요즘 트렌디한 회사 문화를 배우고 실천, 직원들이 실제로 무슨일을 하는지 잘 들여다보고 고민을 들어줄수있는 마음, 꼰대문화 타파, 남녀차별 금지"
2.5,(주)피제이전자,2021. 09,1점,"""다양한 개발경험과 사회생활을 하고 싶은 사람에게 추천 다양성""",업무 분담 체계가 확실해 다양한 경험을 할 수 있음 여러,"과장차장이 많아 승진이 힘들다
시간에 비해 돈을 많이 못버는편",합리적인 복지 및 보상체계를 갖추어 줬으면 좋겠다 생일
2.5,(주)피제이전자,2021. 09,3점,"""안정적인고용, 하지만 많은 야근과 주말특근...하지만 일한만큼 수당은 충분히 챙길수있는 기브앤테이크 기업""","EMS회사중 우수한회사, 해외 글로벌기업들과 좋은 비즈니스관계, 코스닥상장, 탄탄한 업무프로세스","야근, 잔업, 주말근무, 업무강도, 잡무, 업무량, 업무량대비 급여가 적다","급여인상, 워라벨, 근무환경개선, 업무로테이션, 휴가 자율, 복지향상"
2.5,(주)피제이전자,2021. 08,3점,"""반도체에서 제대로 배우고 싶으면 여기 추천 일이 많아서 다양한 pcb를 만나볼수있다""","복지좋고 일도 잘가르쳐주는거같다 우선 아침 점심 저녁 다주고
식당도 다양해서 좋음",연차쓰면 눈치를 좀봐야함 생산쪽 직급을 잘안달아줌 일로 직급 달아주는게 아니라 나이로 직급달아준다,직원들의 불만만 듣지말고 제대로 해결을 해줬으면 좋겠다
2.5,(주)피제이전자,2021. 07,2점,"""강압적인 근로는 없는 곳, 냉난방이 잘되어 근무 환경은 편안함, 정직원은 안정적인 직장 생활 가능""","인원이 많아 휴가, 연차 등이 자유로움. 냉난방이 잘 되는 편임 . 제휴 식당을 운영하여 점심밥을 편하게 먹을 수 있다.","평일 야근은 기본, 토요일 출근까지도 깔고 가야 한다. 일요일에 나가는 경우도 다반사.
휴게실이 따로 없어 작업장에 앉아서 쉬거나 해야 함. 상하 관계가 확실하여 불편 사항을 건의조차 할 수 없음.",최하 노동자에 대한 권리 증진과 관심이 지속적으로 필요함. 휴식에 관한 복지가 늘어났으면 함.
2.5,(주)피제이전자,2021. 05,2점,"""노는 사람이나 열심히 하는 사람이 똑같은 등급""","월급이 밀리지 않음
많지는 않지만 보너스 있음
칼퇴 가능","바쁜 사람만 바쁘고 한가한 사람은 엄청 한가함
오래 다닌다고 해서 직급을 주지 않음 특히 여사원에게는 더더욱
열심히 한다고 알아주지 않음 노는 사람이나 열심히 하는 사람이나 비슷하게 보는거 같음
관리자랑 사원들의 사내연애가 많은데 그러다 보니 관리자들의 혜택도 어느정도 있음
여자도 많다보니 텃세도 있고 소문도 빠름",열심히 일 하는 사람들을 위해 평가제를 했으면 함 그렇게 해서 확실한 진급이나 성과금의 차이를 줬으면 함
2.5,(주)피제이전자,2021. 05,1점,"""이상안 높고 현실은 전혀 고려하지않는다
더 크게 성장하려면 그에 맞는 인원과 프로세스를 먼저 구축하길""","그나마 출퇴근 덜 눈치 봄 예전대비
같이 일하는 사람들 착함","항아리형 직급구조
차부장급이 너무많다 많은건 좋은데 업무 퍼포먼스 수준이 낮다
뭐든 다른팀 책임으로 전가하려한다
연봉 그냥 중소기업 수준","이상만 추구하지말고 현실을 직시하세요
그리고 계륵같은 인원이 너무 많습니다
윗사람 몇명은 당장 없어도 회사 돌아가는데 전혀 문제없고
오히려 더 좋아질것같습니다"
2.5,(주)피제이전자,2021. 05,2점,"""사람이 좋은곳 강제적 잔업 특근 월급은 제때 줌 월급이 적음""","사람들이 좋고 모르는부분들은 친절히 알려준다
회사가 안정적이다",잔업이 반강제적이다 눈치 엄청준다 체계적으로 회사가 돌아가지않음,직원들 불만을 듣고 해결좀 해줬으면 함 듣기만하고 매번 쳇바퀴처럼 제자리 직원들 고생하는거만큼 복지좀 신경쓰세요
2.5,(주)피제이전자,2021. 04,3점,"""그냥저냥 돈 벌면서 다니기 좋습니다
현장취업으로 들어오는 고등학생이 많았습니다""",저 나올 당시에 야근이랑 특근 등 많이 개선 중 이었습니다,당시엔 특근 야간 잔업 너무 많았는데 나올 당시엔 슬슬 정리됐음,"나온지 오래돼서 잘 모르겠는데 그냥 사원들 좀 챙겨줘요
복지 너무 없었음"
2.5,(주)피제이전자,2021. 04,2점,"""관리자가 되면 일반 사원들보다 훨씬 많이 갈려나가는곳""",연차나 반차쓰기에는 좋음 돈은 안밀림 일도 꾸준히 들어와서 일을 진짜 못하지않는한 왠만해서는 잘리지않음,절대 바뀌지 않는 월급 관리자는 갈려나가지만 절다로 신경쓰지는 않음 윗사람들부터 어떻게 해결해야할일인지 모르면서 아랫사람에게 바라는게 많음,뭘 바래야할지 모르겠음 1년차나 5년차나 같은 월급받으니 애들이 나가는데도 그것에 대해 고칠생각도 없고 퇴사율이 높은걸 보면서 뭔가를 느까고있는지도 궁금함
2.5,(주)피제이전자,2021. 03,1점,"""오면 매우 후회 하는 회사입니다.장점은 정말 눈씻고 찾아봐도 없고 모든게 단점""",중견기업에 걸쳐있음 그외에 장점이 없어서 쓸 말이 없습니다,돈 적게주고 일 많고 복지 없고 시설 안좋고 사람 안좋고 기타 등등 너무 많음,직원좀 생각하세요 쓰다 버릴 생각만 하지 마시고
2.5,(주)피제이전자,2021. 03,1점,"""한번쯤은 경험하기 좋은 곳. 경험하기에만""","장점이랄게 없다. 그나마 괜찮은 건 밥 제시간에 먹여 월급 제때 지급, 팀원간의 정?","장점이 없는 게 단점이다.
소통이 중요시 되야 하는데
항상 수박 겉핥기식
언제나 소 잃고 외양간 고치려는 태도가 마음에 들지 않음","기대를 바라지 않는게 현명한 자세.
그냥 그러려니 다니는 게 스트레지 받지 않는다.
당신들끼리 잘 해먹고 사세요.
언제는 뭐 신경썼나?"
2.5,(주)피제이전자,2021. 03,3점,"""안정적인 경영을 하고 있으나 발전가능성은 적은 기업""","자금이 많고, 안정적인 경영을 하는 회사임.. 매년 흑자이며, 회사 위치도 괜찮음.","야근이 의무이고, 주말출근도 많고, 급여가 적음. 체계적인 시스템이 부족","야근만 없어도 좋은회사, 야근 시키려면 돈이라도 많이 줬으면함."
2.5,(주)피제이전자,2021. 01,2점,"""중견기업으로 회사복지와 인프라가 잘 정비된 무난한 회사""",직급보다는 나이중심으로 돌아가는 회사체계와 신입이 오면 꼼꼼하게 알려주고 기숙사시설도 상황에 따라 1~2명이 넓게 쓸 수 있고 회사와 매우 가까움 식당도 쾌적하고 따로 제휴한 식당이 있어 밥이 맛있음,사람들의 텃세가 약간있고 사내에 소문이 굉장히 빨리돌며 뒷담화가 일상적으로 들려옴 20대 여자사원들은 남자사원(직급이 높은 직원포함)들을 매우매우 조심해야 됨,경영진을 만날일이 거의 없어 딱히 바라는 점은 없습니다.
2.5,(주)피제이전자,2021. 01,3점,"""바쁘다, 여유가 없다. 회사는 큰편이고 기억으론 건물내에 어린이집 있었던거같은데 정확하진않음.""","구내식당이 여러군데 있어서 골라서 갈수있다, 기숙사 있음(주방은없음)","너무 바쁘다, 급여가 적다, 저 입사연도 기준 성과금이 줄고있었음",1.워라벨좀 지지해주셨으면 좋겠다2.계속 서서 일하면 힘드니까 쉬는시간이 있으면 좋겠다
2.5,(주)피제이전자,2021. 01,5점,"""초음파 진단기기를 주요 품목으로 의료기기 제조회사로 성장하는 중...""",회사가 매우 안정적이라서 망할일은 없다. 연말 성과평가에 따라서 성과금도 지급된다.,회사가 일이 많은 편이다. 다소 수직적인 조직이다. 주말에 근무도 자주하는편..,"안정적으로 꾸준한 성장을 하는 것도 좋지만 직원들 복지, 근무환경,조건등에 더 신경써주세요.."
2.5,(주)피제이전자,2021. 01,1점,"""같이 일하는 사람들이 좋고 각 부서마다 능력이 월등한 책임자가 있어 업무지도를 잘받을수 있다""","말 그대로 사람들이 좋다
그래서 다니게 되는 회사
딱히 떠오르는게 없다
급여 안밀린다? 정도","급여가 너무 짜다 천일염 보다 짜다
경영진의 마인드가 별로다
복지가 너무없다
자차가 있을경우 대리 미만으로 주차장이용요금을 내고 다녀야한다
진급시스템이 이해할수없다","복지 많은거 바라지 않습니다
현재 불만이 뭔지 파악하시고 개선바랍니다
어차피 불만 얘기해도 돈들어가면 개선 해주지 않을듯..."
2.5,(주)피제이전자,2020. 12,2점,"""그냥 중소기업 그 자체
그 이상 그 이하도 아니며
그냥 짧게나마 경험쌓기는 나쁘지 않음""","점심시간 빨라서 좋음
쉬는시간 철저해서 좋음
이모들 착함
회사 분위기는 적당함","2조2교대 잔업은필인데 특근은없음
밸런스가 안맞는 아이러니한 회사
돈 워라밸 둘다 못잡음
그래서 누구나 아웃소싱으로 들어갈수있음","설비가 너무 구려서 잔고장 에러 등 많음
짠돌이 마인드가 심함"
2.5,(주)피제이전자,2020. 11,3점,"""일이 많을 땐 하루종일 정신이 없고 한가할 땐 일을 찾아서 해야 함""",세끼 굶지 않고 먹을 수 있다는 게 장점. 메뉴만 생각하면서 회사 다녔을 정도로 맛이 괜찮았음. 식당도 쾌적하고 밥도 맛있는 편.,복지제도가 많이 없음. 그냥 없음. 연차도 눈치보면서 써야 하고 보고 체계가 철저한 편. 직원 입퇴사가 잦아서 신입 교육하기 바쁨. 직급이 올라갈수록 더 힘들다.,직원들의 복지에 신경써줬으면 함. 연차는 눈치 볼 필요없이 쓸 수 있게 개선 되었으면 좋겠음.
2.5,(주)피제이전자,2020. 11,5점,"""돈이 많은 회사
지금처럼 어려운 경기에 여기 다니면 걱저 없음""","월급 밀리지 않고 매년 성과급 나오고
지금처럼 어려운 경기에 여기 다니면 걱정 없음","눈치싸움이 좀 심하고 조직문화가 쉽게 바뀌지 않는다
개선이 필요하다","딱히 없네요
지금처럼만 유지한다면 좋은회사 되겠네요"
2.5,(주)피제이전자,2020. 09,3점,"""알바로는 나름 좋았어요 전체적으로 어려서 분위기도 좋았구요. 관리자도 크게 터치 하진 않더라구요""",주간조는 테크노파크단지 내 식당에서 주기 때문에 괜찮은 식사를 받을 수 있고 상여금도 저 때에는 200퍼인가 줬던거 같음(1년 이상해서 정규직 된다면) 학생취업도 많아서 산업체도 잘 가는거 같더라구요.,야간조는 식사가 부실합니다... 그리고 쉬는 공간도 좋다고 못하겠네요. 다른 리뷰도 읽어봤는데 능력 있는 사람이 일 더 한다는 말 진짜 공감해요 능력 없는 사람도 정말 왠만해서 데리고 가기에 상대적으로 일 잘하는 사람은 좀 힘들거예요.,저는 알바 했던거라 그런 점은 모르겠습니다
2.5,(주)피제이전자,2020. 08,2점,"""일은 끊임없이 들어옴
밥 맛있고 야근 많음
병특있음""","월급은 한번 밀린적 없이 제때 제때 들어옵니다
현금 많은회사 입니다
식당이 여러군대입니다","야근이 정말 미친듯이 많았습니다
연차 쓰기 눈치보면서 어려웠고 주말특근도 많았던걸로 기억합니딘","직원들 야근 하는 사람이 주로 야근 합니다
당시 3팀 직원들은 거진 야근했습니다"
2.5,(주)피제이전자,2020. 07,3점,"""아무것도 모르고 가면 후회하고 퇴사를 결심하게 되는 곳""","주간에 이용허는 구내식당 밥이 맛있음.
그리고는 잘 모르겠음.","너무 많아서 다 적기에는 내 손가락이 아플것 같아서 몇개만 적어봄.
상사의 눈치와 사람간의 구설이 너무 많고 텃세가 심하고 주야간 교대 근무로 인해 몸이 많이 상함.","본인 가족에게 하는 만큼 직원들에게 하면 좋겠습니다.
다들 생계를 위해 일을 하는거지 경영진과 상사를 위해 일하는게 아닙니다."
2.5,(주)피제이전자,2020. 06,2점,"""기계처럼 일하는회사
관리자들의 마인드가 스트레스를준다""","연차는 미리말만하면 써주는 분위기
나이대가 어려서 지내는건 문제없음","생산관리자들이 너무 힘들게한다
그리고 작업자들 모이면 관리자욕만함","관리자들의 마인드를 바꿀필요있음
이런분위기에서는 오래다니는사람없은듯"
2.5,(주)피제이전자,2020. 05,1점,"""잘리지 않고 다닐수 있으나 스트레스가 많음""",현금자산이 많음 (특히 부동산) 고로 급여 지급에 문제가 있던 경우는 없음.,"장점빼고 모든것이 단점
능력없는 사장, 눈치보는 임원, 능력있는 인원에 대한 견재, 팀간 불협화음, 진부하지만 과도한 업무량...",구시대 사고방식에 있는 임원 간부들 정신들 차리세요. 지금은 쌍팔년도가 아니예요.
2.5,(주)피제이전자,2020. 05,3점,"""큰 장점도 단점도 딱히없지만 무난하게 다니기 좋은 기업""",일한만큼 임금은 밀리지않고 정확하게 따박따박 잘나옵니다,임원들이 일반 사원들의 업무에 대한 관심은 별로없고 보여주기식이 많음,좀더 밑에 사원들에 고충이나 에로사항 들을 개선할수있는 현실적인 방안을 모색해줬으면 좋겠음
