총점,회사,날짜,별점,요약,장점,단점,경영진에게
2.6,우주일렉트로닉스(주),2022. 09,2점,"""무난 무난하게 다닐수 있는 회사 기독교 회사라서 시무식에 찬송가 부르는 회사""",아침 점심 저녁 다 주고 통근 버스 있고 연말에 성과급도 나옴,사람 귀한줄 모르고 일 없으면 계약직 줄줄이 자르고 팀 이동도 아무곳이나 시킨다,사람 귀한줄 알았으면 좋겠습니다 갑자기 일 없다고 자르는건 아닌거 같아요
2.6,우주일렉트로닉스(주),2022. 07,1점,"""중소와 중견이상의 단점, 워라밸의 단점, 사무와 현장의 단점, 모든 단점들을 다 취합해서 겪을 수 있는 회사""","밥을 3끼 다 준다. 예전에는 돈을 냈으나, 코로나 이후로 지문인식이 없어지면서 일단은 안내는 상황 유지/커피머신이 있다. 물론 이로 인해 근무태만 인원들이 많지만 커피도 당분간 공짜/IT는삼성과 애플쪽 부품을 제작하는 2차협력사고, AD는 현대와 기아를 주력 납품하는 2차 협력사라 나름 대기업 커미션","연봉으로 장난질을 진짜 심하게 한다. 단순 사무직 위주의 통합사무실은 그런 경향이 좀 덜하고 편하게 다니는데, 기술이나 생산 관련되면 여기만큼 박봉으로 주려는 곳이 없다. 경영진이나 관리자들이 실무에 대한 업무능력이 부족해서, 시키는 일에 비해 박봉이란걸 체감 못함/직급은 통일인데 지독할정도로 수직적이다. 위에서 뭐라고 하면 찍소리도 못하고 기어들어가고, 아래에서 나온 시정이 필요한 부분과 처우개선 요청 등 잘못된 부분에 대한 목소리는 중간라인이 다 커트한다./현장과 기술에 가까울 수록 퇴사율이 미친듯이 폭주중이다. 생산직은 특히 뭐 매주 나가는 상황인데, 여기보다 돈 덜주는곳 없다. 현장 근무나 생산프로세스를 제대로 겪은 관리자가 없다보니 진짜 동네 컨테이너박스 중소기업급으로 굴린다./전체적으로 학력이 낮다. 스펙도 끔직할정도로 전무하다. 어디 갈 곳 없는 고인물들이 회사가 좀 작을때 운좋게 들어와서 능력있고 성실하고 스펙좋은 신입 혹은 경력직들에게 텃세를 부리고 나가게 한다.","낙하산 사장님, 아들이라고 그냥 운좋게 자리차지한 사람으로 남지 맙시다. 밑에 직원들은 능력없는 능구렁이들과 아첨꾼들만 남아서 정작 성실하게 일하고 고생하는 젊은 직원들은 다 동망가고, 비싼 요양급여 받는 늙은 무능력자 위주로 기업이 재편되고 있습니다. 근속년수랑 보유 기술 및 능력 분석 한번 해보세요. 근속년수 양극화와 보유능력 전무한 민낯이 다 드러날겁니다. 사람을 부품으로 취급하는 임원진들은 직원을 괴롭히고 저임금으로 혹사시켜 얻은 수치상의 결과물을 실적이라고 내놓겠죠."
2.6,우주일렉트로닉스(주),2022. 07,2점,"""그냥저냥 공무원처럼 월급 받아가며 시간때우기 좋은 회사""",아침 점심 저녁이 나와 따로 식비가 안들어간다 그래도 나름 중견이고 상장사다,눈치를 봐야함 그리고 주변 똥냄새 엄청나고 주변에 아무것도 없다 교통도 불편함,딱히 바라는게 없다 사공이 너무 많아서 사공끼리 각개전투 하느라 바쁘다
2.6,우주일렉트로닉스(주),2022. 06,2점,"""다닐만한 좋은 회사 중견기업이라 그럭저럭다닐만함""",연차를 원하는 날짜에 쓸수 있다 밥도 나름 먹을만함 아침도 적은비용을 내고 먹을 수 있어 아주 좋음,단순 회의가 잦다 그리고 프로젝트를 잘못 걸리면 야근을 자주해서 업무강도가 강하다 옛날엔 야근수당 있었지만 지금은 없음,신규 입사자에게 너무 많은걸 요구하지말고 적당히 일을 시켰으면 합니다
2.6,우주일렉트로닉스(주),2022. 06,2점,"""고인물이 많은 회사. 직원을 소모품으로 생각하는 회사. 입만 잘 털고 윗사람과 취미가 같으면 편한 회사""","팀장 이하 직급 통일 시켜서 수평적인 분위기 조성 (그냥 삼성 따라 한 거임).
아침 점심 저녁 다 줌, 통근버스 있음",고인물이 많음 . 해가 지날수록 줄어드는 연봉 상승률. 그래서 지금 10년차 고인물 연봉과 내가 10년차가 되면 받게 될 연봉 차이가 큼,경영진 마저 고인물이라 뭘 바랄 수가 없음. 우리는 소모품입니다. 기술 배워서 얼른 다른데 가야됨
2.6,우주일렉트로닉스(주),2022. 09,2점,"""무난 무난하게 다닐수 있는 회사 기독교 회사라서 시무식에 찬송가 부르는 회사""",아침 점심 저녁 다 주고 통근 버스 있고 연말에 성과급도 나옴,사람 귀한줄 모르고 일 없으면 계약직 줄줄이 자르고 팀 이동도 아무곳이나 시킨다,사람 귀한줄 알았으면 좋겠습니다 갑자기 일 없다고 자르는건 아닌거 같아요
2.6,우주일렉트로닉스(주),2022. 07,1점,"""중소와 중견이상의 단점, 워라밸의 단점, 사무와 현장의 단점, 모든 단점들을 다 취합해서 겪을 수 있는 회사""","밥을 3끼 다 준다. 예전에는 돈을 냈으나, 코로나 이후로 지문인식이 없어지면서 일단은 안내는 상황 유지/커피머신이 있다. 물론 이로 인해 근무태만 인원들이 많지만 커피도 당분간 공짜/IT는삼성과 애플쪽 부품을 제작하는 2차협력사고, AD는 현대와 기아를 주력 납품하는 2차 협력사라 나름 대기업 커미션","연봉으로 장난질을 진짜 심하게 한다. 단순 사무직 위주의 통합사무실은 그런 경향이 좀 덜하고 편하게 다니는데, 기술이나 생산 관련되면 여기만큼 박봉으로 주려는 곳이 없다. 경영진이나 관리자들이 실무에 대한 업무능력이 부족해서, 시키는 일에 비해 박봉이란걸 체감 못함/직급은 통일인데 지독할정도로 수직적이다. 위에서 뭐라고 하면 찍소리도 못하고 기어들어가고, 아래에서 나온 시정이 필요한 부분과 처우개선 요청 등 잘못된 부분에 대한 목소리는 중간라인이 다 커트한다./현장과 기술에 가까울 수록 퇴사율이 미친듯이 폭주중이다. 생산직은 특히 뭐 매주 나가는 상황인데, 여기보다 돈 덜주는곳 없다. 현장 근무나 생산프로세스를 제대로 겪은 관리자가 없다보니 진짜 동네 컨테이너박스 중소기업급으로 굴린다./전체적으로 학력이 낮다. 스펙도 끔직할정도로 전무하다. 어디 갈 곳 없는 고인물들이 회사가 좀 작을때 운좋게 들어와서 능력있고 성실하고 스펙좋은 신입 혹은 경력직들에게 텃세를 부리고 나가게 한다.","낙하산 사장님, 아들이라고 그냥 운좋게 자리차지한 사람으로 남지 맙시다. 밑에 직원들은 능력없는 능구렁이들과 아첨꾼들만 남아서 정작 성실하게 일하고 고생하는 젊은 직원들은 다 동망가고, 비싼 요양급여 받는 늙은 무능력자 위주로 기업이 재편되고 있습니다. 근속년수랑 보유 기술 및 능력 분석 한번 해보세요. 근속년수 양극화와 보유능력 전무한 민낯이 다 드러날겁니다. 사람을 부품으로 취급하는 임원진들은 직원을 괴롭히고 저임금으로 혹사시켜 얻은 수치상의 결과물을 실적이라고 내놓겠죠."
2.6,우주일렉트로닉스(주),2022. 07,2점,"""그냥저냥 공무원처럼 월급 받아가며 시간때우기 좋은 회사""",아침 점심 저녁이 나와 따로 식비가 안들어간다 그래도 나름 중견이고 상장사다,눈치를 봐야함 그리고 주변 똥냄새 엄청나고 주변에 아무것도 없다 교통도 불편함,딱히 바라는게 없다 사공이 너무 많아서 사공끼리 각개전투 하느라 바쁘다
2.6,우주일렉트로닉스(주),2022. 06,2점,"""다닐만한 좋은 회사 중견기업이라 그럭저럭다닐만함""",연차를 원하는 날짜에 쓸수 있다 밥도 나름 먹을만함 아침도 적은비용을 내고 먹을 수 있어 아주 좋음,단순 회의가 잦다 그리고 프로젝트를 잘못 걸리면 야근을 자주해서 업무강도가 강하다 옛날엔 야근수당 있었지만 지금은 없음,신규 입사자에게 너무 많은걸 요구하지말고 적당히 일을 시켰으면 합니다
2.6,우주일렉트로닉스(주),2022. 06,2점,"""고인물이 많은 회사. 직원을 소모품으로 생각하는 회사. 입만 잘 털고 윗사람과 취미가 같으면 편한 회사""","팀장 이하 직급 통일 시켜서 수평적인 분위기 조성 (그냥 삼성 따라 한 거임).
아침 점심 저녁 다 줌, 통근버스 있음",고인물이 많음 . 해가 지날수록 줄어드는 연봉 상승률. 그래서 지금 10년차 고인물 연봉과 내가 10년차가 되면 받게 될 연봉 차이가 큼,경영진 마저 고인물이라 뭘 바랄 수가 없음. 우리는 소모품입니다. 기술 배워서 얼른 다른데 가야됨
2.6,우주일렉트로닉스(주),2022. 06,3점,"""부단히 신제품 노력은함.. 성과는 미비..""","급여 잘나옴 식당 괜찬음.
통근버스있음. 가끔 비정기라도 인센티브있음.","연차쓰기 어려움. 꼰대같은 관리자 한명이 내로남불 심함.
인센티브 따로 없음. 비정기 인센티브.","노는 직원 정리가 필요함. 일하는 몇명만 일함.
관리자중에서도 일하는 사람만 하고
안하는사람은 진짜 안함.."
2.6,우주일렉트로닉스(주),2022. 06,3점,"""괜찮으니 시스템이 아직 좀 미비해보임 성장 가능성은 큼""",밥 맛있고 건물이 엄청 큼 번지르르하고 중견기업 답다 돈 많은 회사,야근이 너무 많고 일적으로 심적으로 지친다 급여는 쏘쏘...,신규 투자는 좋은데 본사에 남은 인원들좀 챙겨줬으면 한다 모두가 지금 힘들다
2.6,우주일렉트로닉스(주),2022. 05,3점,"""회사는 좋은데 일하는 사람들이 문제
건물 좋고 복지도 괜찮은 거 같은데
부서간 협업이 잘 안됨. 부서 이기주의 만연""","안정적인 사업기반. 부서에 따른 워라벨.
깨끗한 건물 관리","2년차부터 오른다는 연봉
물갈이 없는 고인물 상사
부서간 협업이 안되고 일처리 오래걸림","체계적인 업무 체계와 고인물들 업무전환
정말 비밀이 가능하고 개선이 되는 업무 질 개선 질의응답"
2.6,우주일렉트로닉스(주),2022. 04,2점,"""일하는 사람만 겁나게 일하는 곳. 타부서 업무 협조 전혀 안됨.""","밥이 맛있다. 헬스장, 샤워시설이 있다. 그외엔 없다.",부서간 압무 협조가 안된다. 나만 아니면 됨. 논리적 협의가 안된다.,까라고만 하지 말고 아랫사람 말 좀 듣는게 좋습니다. 안들을거면 물어보지를 말던가..
2.6,우주일렉트로닉스(주),2022. 04,3점,"""자동차 사업부에 현재 부사장이 들어오면서 같이 들어온 사람들이 장악해버리고 기존 인원의 일부는 퇴사하게 만들어 버림. 게다가 같이 온사람들은 해당 업무 지식도 없는 사람들임""",회사 건물은 멋있음. 하지만 휴게 시설등 활용에는 눈치 제한이 많음,경영진이 참.... 어디가나 그런건지... 부사장의 지인이거나 예전 동료이거나 아부맨 아니면 기회가 적다,복지 축소와 노사관계 단절하는 방향보다 복지를 늘리고 노사관계 개선이 되었으면 합니다
2.6,우주일렉트로닉스(주),2022. 04,1점,"""직급통일 이후로 왔다면 장래가 없는 회사, 2010년대 초반 이후로 성장세 정체, 박봉""","1. 연차는 부서별로 다르나 대체로 눈치없이 사용은 함.
2. 사내 커피머신
3. 출퇴근기록 없는 포괄연봉이라서 OT수당 날로먹는 인원 많음
4. 일부 재택근무제로 인해 꿀빨기 좋음
5. 저학력자도 채용억 문제없음.
6. 밥은 공짜로 세끼 다줌","1. 해고가 쉬운 회사라 청년혜택이든 장기근속이든 국비지원 관련 사업 선정이 안됨
2. 정치질 아주 심함. 지들끼리 미생찍고있음. 직급이 비슷할 경우 모든 업무에 협조적이지 않고 방어적. 밑에사람이 잡무 다 떠맡고 윗사람이 실적챙김
3. 직급파워로 움직이는 회사라 윗선의 결정에 무조건 복종식
4. 직급통일제로 인해 과거에 직급이 있던 시절 인원 연봉만 당시 동종업계 대비 괜찮은편, 지금은 업계 하위.
5. 근로계약 편법이나 소급적용 회피로 인한 인건비절감을 함. 신입이 안뽑혀서 임금인상 할 경우 기존인원은 신입보다 연봉 낮은 경우 다수.
6. 고인물들 근속년수가 높고, 신입들은 잘 안뽑히는데 퇴사율 높음.
7. 회사 위치가 아주 악조건인데, 자차 운전으로 와도 버거울 위치임. 통근버스는 제한적이고 기숙사는 사람마다 차별해서 지원함. 자리 없다고 하지만 경력직은 제공
8. 부서별 근무강도 차이 심함. 1년내내 재택 교대 및 칼퇴하는 부서도 있고 주말출근 철야 밥먹듯이 하는 부서도 있음. 하루에 수다 몇시간 자체 티타임 몇시간 가지는 인원도 있음.
9. 전산시스템이 구식이고 서버 자주 터짐.
10. 업무 구조상 자기발전이 힘든 구조이고 사내에 자뻑말고 외부에 드러낼 수 있는 기술력있는 인원은 IT AD 둘 다 보기 힘듦.","회장님 주도로 DT 혁신이니 뭐니 하는데 현실은 디지털시대에 도태돼서 사내 전산시스템도 못다루고 기본 사무업무도 못봐서 밑에다 던져주는 현실입니다. 능력있는 사람은 나가고 정치질만 잘하는 인원이 너무 많네요.
열정적인 사람들은 다 나가고 이기적이고 요령만 잘 피우는 사람 천지에서 직원끼리 뒷담만 엄청납니다."
2.6,우주일렉트로닉스(주),2022. 04,3점,"""회사를 위한 회사
부서를 잘 만나야 함""","연봉 매년 상승
상여금 가끔 나옴 (최근 2년간 급여 500프로 이상)
복지 나름대로 괜찮은 편","해외법인으로 제조물량 넘어가게 되면서 인원감축
부서에 따라 워라밸 차이",바라는 점이라 딱히 생각나는것은 없지만 필요할때 쓰고 필요없으면 내치는 구조는 이제 그만
2.6,우주일렉트로닉스(주),2022. 04,2점,"""그냥저냥 다니기 괜찮지만, 보수적인 회사인것 같음""","삼성에서 잘 되면 협력사 인센 받을 수 있음, 분위기 좋은 부서는 직원들간 사이 좋고 편하게 다닐 수 있음.","너무 보수적이고 여남 차별 심함. 야근 강요하는 분위기, 위치상 출퇴근이 어렵고 오래걸린다.",기업 분위기가 침체되어있습니다. 직원들간의 소통도 많이 될수있게 분위기 쇄신이 필요 할 것 같음
2.6,우주일렉트로닉스(주),2022. 03,1점,"""직장내 괴롭힘이 심함. 현재 팀장급이 주도하여 팀원을 왕따시키며 피해자가 퇴사하면 다른 타겟을 만들어 지속적으로 괴롭힘. 의도적인 업무 배제 및 입사 후 경력, 전공과 상관없는 직무로 강제로 변경하려 함.""","워라밸이 좋음. 일이 많을 때에도 업종 대비 야근이 많이 적은 편임. 통근버스가 잘되어있음. 중식, 석식 무료.
삼성덕분에 먹고사는 회사라 망할 걱정은 안해도 되지만 그만큼 고여있음.
그래도 회장님내외는 좋은분들 인 것 같다. 그 밑에 임원들이 너무 문제지만.","직장내 괴롭힘이 심함. 현재 팀장급이 주도하여 팀원을 왕따시키며 왕따 피해자가 퇴사 시 다른 직원을 타겟으로 만들어 괴롭힘. 의도적인 업무 배제 및 가벼운 실수에도 전공, 경력과 상관없는 직무로 강제로 변경시키려 하며, 휴가 사용 시 팀장이 아무 연락도 없이 직무를 변경시킴. 고용노동부에 연차 사용이 어렵다는 신고가 들어오자 강제로 연차를 쓰게 하며, 연차가 남아도 다음년도로 이월하거나 돈으로 돌려주지 않고 사라짐.
승진은 무조건 정치질로 결정되며, 업무 능력은 전혀 고려하지 않음.","팀장급들의 횡포를 그만 막아주세요 회사 안에 팀장급들이 소기업 차렸다는 얘기가 계속 나올정도로 해먹는 것도 많고, 갑질, 권력오남용이 심하며, 지속적으로 팀원을 괴롭혀 언제 직장내 괴롭힘으로 고소장 날라와도 이상하지 않음."
2.6,우주일렉트로닉스(주),2022. 03,3점,"""모든 회사들도 마찬가지이지만 한 분야에서 충분한 성과를 보이는 회사임.""",부서별로 차이가있지만 같은 소속의 인원들은 소통이 우수함,장점으로 작성한 내용이 오히려 회사입장에서는 단점이 될수있음..부서간 소통어려움,직원들은 회사를 보고 열심히 일하고있습니다. 그에 맞는 복지와 불편함이 없도록 신경써주면 지금보다 더 회사에 공헌할것이라 생각됨
2.6,우주일렉트로닉스(주),2022. 02,1점,"""회사 자체는 좋아 보이지만 실상은 기업 위주에 초 고령화 꼰대가 너무 많음""",성장 가능성은 있고 건물은 깨끗하고 좋습니다 생활하긴 좋음,회사 전체적으로 연령이 너무 많고 젊은 층은 지쳐서 나가게 하는 회사,윗대가리가 바뀌고 젊은 층을 뽑아야 회사의 미래가 있을듯
2.6,우주일렉트로닉스(주),2022. 02,3점,"""그냥 저냥 괜찬음 회사지만 위치적으로 좋지않아
인근거주필수""","건물이좋고 밥잘나오고 월급밀리지않는다
요즘 성과급이괜찬게나온다","보이는게 전부고 연봉계약금액에 성과급이 전부임
사람들은 개인주의심해서 정없음","인구절벽 시대에 도래하여 사람의 소중함을알았으면함
이외없음"
2.6,우주일렉트로닉스(주),2022. 01,3점,"""그냥 저냥 다니는 회사입니다. 밥이 그나마 맛있네요.ㅎㅎ""",연차는 비교적 잘 쓸수있는 편이고 적당히 눈치보며 다닐만 합니다.,아직도 꼰대들이 득실거리고 ㅎㅎ 프로세스가 아직 미흡하네요.,회사가 크는 것도 중요하지만 직원들 한테도 신경좀 쓰세요.
2.6,우주일렉트로닉스(주),2022. 01,3점,"""생산직중에 복지는 좋은편.임금도 높은편에 속함. 창업자가 기독교라 건물도 십자가모양임. 부서마다 업무강도가 다름.""",복지에 굉장히 신경써줌 식당밥도 전문영양사가있어 맛있고 대출이나 퇴직연금등 복지프로그램도 우수함. 커피도 고급커피 줌,식후 먹던 커피가 1잔으로 제한됨 맛있었는데 ㅜㅜ 오래일한 직원들이 많아서 신입으로 들어가면 잡무를 떠앉을수있음 장기근속자들이 많아서 업무분배가 정치력이 많이 섞임,정말 좋은회사이고 복지도 우수한 회사입니다 다만 신입에게 너무 많은 업무가 떠밀립니다
2.6,우주일렉트로닉스(주),2021. 12,3점,"""인간관게로 피곤한거만 없으면 좋을꺼 같습니다""","통근차량 운영 오고 가는거는 비교적 편해서 좋았습니다.
조중석식 식당 운영으로 저렴하게 간단히 해결할 수 있어 좋았습니다.
야근 안하고 주말 출근 없어서 좋았습니다.","특정인물에 대한 무시 뒷담화는 별로 보기 좋지 않았습니다.
여기에 맞장구쳐야되는 인간관계 에서 오는 불필요한 스트레스도 귀찮았습니다.
회식은 가기 싫으면 강요 안했으면 좋겠습니다.",별 같지도 않은 걸로 정치질 하는 사내문화가 개선됐으면 좋겠습니다.
2.6,우주일렉트로닉스(주),2021. 09,5점,"""서로 존댓말하며 존중해주던곳.일이많아 월급을많이 받을 수 있었던곳""",생산직 세군데다녔는데 그중 유일하게 직급 상관없이 서로 존댓말쓰며 존중해주던곳이였음,일이많은게 장점이자 단점이였음 일이많아 월급을 많이 받을수있었지만 개인적시간이 부족했음,경영진에 바라는점은 없습니다..제가 여길 다니고있는것도아니고 퇴사한지도 오래되서
2.6,우주일렉트로닉스(주),2021. 08,2점,"""자기 노력에 따라 커리어를 키울수 있는 일 배울수 있는 회사""",아침점심저녁 밥을 다 먹을수 있고 회사 건물도 좋고 통근 버스도 있어요,"직원들을 너무 부품 취급, 일 없으면 계약직들 줄줄이 자르고 불안해서 다니겠나,,,",직원들을 소중하게 생각하고 경영해줬으면 좋겠네요
2.6,우주일렉트로닉스(주),2021. 08,3점,"""경쟁심한 업종에서 살아남아 중견기업으로서 토대를 다져나가는 기업""","연차가능 식사제공
신입,물경력자가 일배우기 좋은회사","관리자가 정체되어 눈치만보고 하라는것만함
회사 전체적인분위기가 경직되어있음",사람투자에 인색하면 결국 회사가아니라 공장에지나지않는다
2.6,우주일렉트로닉스(주),2021. 08,5점,"""평균 근속 연수 높고 오래 다닐수 있는곳
새로운 발전은 없는곳
큰 변화없이 오래다니고 싶으면 추천함""","평균 근속 연수가 높고 퇴근이 자유로운편
시골의 좋은 공기를 마실수있음
헬스장 시설이 사내에 있어 운동하기좋음","출근시 길이 좁아 빨리 출근하지 않으면 막힘
연구개발의 느낌 보다는 공장에 있다는 느낌이 큼
변화와 발전이 느린 회사","좋은 회사로 유지하며 발전 하수있도록 했으면 좋겠네요
시대에 맞게 조직 문화도 바꿀수있도록 노력바랍니다"
2.6,우주일렉트로닉스(주),2021. 08,3점,"""우주일렉트로닉스는 좋지도 나쁘지도 않아 평균적인 회사로 생각된다.""",워라벨이 있는편이다. 퇴근이나 연차 사용하는데 불편하지 않다,체계가 아직 부족하고 제품의 완성도가 부족하여 품질관리하기 어렵다,조금 더 투명하게 경영하면 좋겠다 눈치보지 않고 다닐 수 있는 회사가 됐으면
2.6,우주일렉트로닉스(주),2021. 07,2점,"""회장님 마음대로 모든 걸 결정했던 회사.""","식사 제공
소소하지만 창립기념일엔 선물 챙김
장점을 아무리 생각하고 생각해도 안좋은 기억만 남아서 별로임..
독립사옥","책임지는 사람 없고 회장님 와이프 취미를 위해 팀을 따로 만들어 줄 정도로 가족을 위한 조직 구성
독실한 크리스찬이 회장님이다보니 내 종교와 상관없는 예배를 봐야함(시무식)",평가가 공정해야 할거 같고 내맘에 안들고 안맞는 다고 사람을 날려버리는 행태는 지양해야할듯.
2.6,우주일렉트로닉스(주),2021. 07,3점,"""대기업 시스템을 따라갈려는 중견기업 하지만 실패적 사례들""","흠 .. 연차가 많아서 풍족한 연차를 갖고 있다 . 밥은 cj가 운영하는것 같다 의자가 편안한걸 쓴다 화장실에 비대가 있다
나무가 있다",그만큼 쓸시간이 없고 쓰기엔 너무 많은 제약이 필요함 의자가 백만원짜리가 넘음 상여금의 거의 없다고 생각하는게 편함,기업에서 상여및 금전적인 지원이 많이 필요할거 같음
2.6,우주일렉트로닉스(주),2021. 06,4점,"""제조업치고는 괜찮은 복지에 임금을 받을 수 있는 곳""","제조업치고는 규모가 작지 않아서 기본의 복지와 나름의 틀이라는게 있음
연 월차가 자유로우며 부서내 사람들이 좋았음
중견 중소급 생산직치고 괜찮은 분위기","거의 대부분의 생산 제조업이 그렇겠지만 제조시설의 이전으로 인원감축이 많이 되고있음
언제까지 다닐 수 있을지 걱정하면서 다니게됨","제조시설의 해외이전은 경연진입장에서는 어쩔 수 판단이라고 생각함
하지만 바라는점은 미래의 안정성을 바라는 것뿐 없음"
2.6,우주일렉트로닉스(주),2021. 05,2점,"""능력에 따른 대우가 없다. 오래다니고 나이 많으면 왕이다.""",연봉 복지는 나름 괜찮다고하나 특별한 것은 없다. 능력이 없는 사람이 오래다니기 좋을 듯 하다.,보여 주기성 업무가 많고 다들 일하기 싫어해서 결국은 특정 부서에 업무가 몰리고 해결하는 구조가 버린다.,직원들 능력의 가치를 오래다니고 말 잘듯는 예스맨이 아닌 회사를 진짜로 걱정하는 사람들에게 있다는 점을 좀 깨닫고 능력도 없으면서 회사 시스템 다 파괴하고 정치하면서 유관부서에 싸움걸고 다니면서 일하는 척 하는 중소기업 시절의 중소기업 마인드가 회사 쇠퇴시킨다. 이런 망령들을 빨리 잡아 들여야 할 것이다.
2.6,우주일렉트로닉스(주),2021. 05,4점,"""개발자가나름 깔끔한 환경에서 업무를 배울수 있음 좋은회사라 생각함""",연차사용이 자유로우며 선후배사이가 끈끈하고 서로 잘챙겨주는 좋은 문화가 있음 그래서 출근할때도 기분좋게 출근하게됨,일의 강도가 빡쎔 프로젝트별로 상이하지만 생각보다 근무강도가 높았지만 좋은사람들이랑해서 시간이 잘가는게 장점,주 고객사에게 좋은 프로젝트를 따왔으면 좋겠다 무리해서 따오는것보다 그게 낫다고 생각한다..
