총점,회사,날짜,별점,요약,장점,단점,경영진에게
2.6,우주일렉트로닉스(주),2018. 07,2점,"""부서별 텃세가 엄청심한부서가잇음 신입은 오래버티기 힘듬""","장점이 아무리생각해도 장점이없다 머리를 쥐어짜봣다
장점은 생각이나지않는다","사출부서는 텃세가 엄청 심하다 신입은 봉이다.
말도안시킨다 비전도없다 그냥 딱히 좋은기억이없다
지들끼리 놀고 신입은 죽어라일한다 그러다보면 신입은 안보인다
알아서 참고다니길 바란다","신입사원이 왜 그만두는지 왜 그러는지
뽑으면 그만인게 아니라 뽑고나서 관리가 안됨
인간은 일회성 소모품이아닙니다.
생산직에서 제일중요한건 생산입니다.
그생산을 인간이합니다"
2.6,우주일렉트로닉스(주),2018. 07,1점,"""뒷담화가 정말 심한 기업, 자기 살기위해 다른 사람을 밟고 깎아내리림.""",아무리 생각해도 장점을 못찾겠다.. 밥 맛있는거? 좋은 커피자판기?,"지리적 요건 최악, 직급이 없어 연봉인상의 불투명성, 군대 문화(젊은 꼰대들한테 찍히면 회사 그만둘때까지 갈굼, 쌍욕은 기본), 업무 강도 상(야근,특근...주말 포기해야함), 개인시간이 없어 자기계발 못함. 성과금 없음, 높은 퇴사율",몇몇 중간계층들의 더러운 부조리를 캐내시길^^
2.6,우주일렉트로닉스(주),2018. 06,3점,"""동종업계중 중위권연봉을 받을수있었다 그만큼 일많이시켜서 머리털빠질듯""","돈은 적당히주지만 그만큼 많이부려먹는다 부서마다 야근하는곳 안하는곳잇음, 주차장넓음",사내정치가심해서 일하기너무힘들다 가끔 나이많이꼰대있어서골치아픔,업무분배가효율적으로이뤄졌으면 사람짤랐으면그만큼뽑아서 업무치중안되게해줫으면
2.6,우주일렉트로닉스(주),2018. 03,1점,"""CEO가 임직원들에게 나누어줬으면 좀겠음""","부서간의 업무강도 편차가 심함
업무강도가 빡센곳에 가면 돈은 벌기 좋음.
왜냐면 돈을 못 써서","1. 특정부서가 회사에서 봉임
2. 계급을 없앰
- 계급 수당을 없앨려고 한게 아닌가 추정 됨
3. 매년 매년 위기라고함
4. 본부장과 사장(계약직) 사이에 정치가 심함","직원들에게 좀 베풀고
돈도 많으신데 너무 자기 이익만 추구하지 않으면 좋겠음"
2.6,우주일렉트로닉스(주),2017. 10,2점,"""비전은좋았으나 무리한 세력확장. 이전해서 멀어졌음""",밥은 식당에서맘껏.직원들끼리 친하고 사이좋고 일하는건 익숙해지면 할만해짐 사람때문에다녔음,"야근 특근 야근 특근 윗선 눈치보느라 시간 다가는 것같음.
적당히 유두리있게 알아서하길원함",제대로된비전제시와 임금향상.복리후생 강화 .삶의 질 증대
2.6,우주일렉트로닉스(주),2017. 10,3점,"""급여 및 복지는 평이한 수준 IT와 AD로 두개의 사업부.
두 사업부 특징이 매우 다름.""","높지 않은 업무 강도, 일부 복지 제도, 인하우스 생산으로 생산 라인 직접 견학 가능","기술력 부진, 프로세스 없음, 직급이 없어 연봉 인상률의 불투명성",커넥터관련 경력 사원들을 주요 인사로 채용해주시길 바랍니다.
2.6,우주일렉트로닉스(주),2017. 07,3점,"""일한 만큼 돈은 주는 회사. 하지만 일을 많이 함. 부자되겠네...""",일한 만큼 돈은 주는 회사. 나름 대기업을 표방하는 복지와 환경추구.,부서마다 업무강도차이 큼. 항상 위기라고 말함. 지리적요건 안좋음.,업무시간 오전8:00부터인데 최소7시45분정도까지는 도착해야함. 지리적 요건도 나쁜데 출근시간 30분만 늦추면 안될까..
2.6,우주일렉트로닉스(주),2017. 06,4점,"""우주 최고의 회사는 아니었다. 그런대로 괜찮은 회사임..""",중소치고 복지나 급여가 좋다. 점점 없어지는것 같지만...,너무 힘들다힘들다만 반복한다. 출퇴근이 헬이다......,비전을 제시하는 경영진이되길. 힘들다고 반복하는거 듣는것도 힘들어요
2.6,우주일렉트로닉스(주),2017. 05,5점,"""분위기 좋습니다. 신입보다 경력자들에게 좋은 회사인듯합니다.""","신식설비를 사용할 기회가 많습니다.
기술에 투자을 많이 합니다","차가 없으면 출퇴근하기 힘듭니다.
여름에는 덥고 겨울에 추운 회사입니다.","연말 성과급을 신경써주었으면 합니다.
열심히 일한 임직원들에게 어느정도 보상을 해줘야 한다 생각합니다."
2.6,우주일렉트로닉스(주),2017. 05,5점,"""일한만큼주는곳 자기가하는만큼받아감 목돈만들기에는 최고 돈쓸시간이없다""",적당한복지 일한만큼늘어나는 월급 노동강도가높지않음 짬이쌓일수록 편해짐,"출퇴근이너무불편 업무시간이너무길다 점심시간이짧다
사내분위기가 삭막하다",".....,.............,.,........."
2.6,우주일렉트로닉스(주),2017. 04,3점,"""야근없었음 근무시간이 자유로우나 사내 정치가 있는듯
복지는 중소기업 치고는 그나마 괜찮음. 월등히 좋지는 않음""",안정적인 회사.9 삼성과의 거래로 안정적인 물량확보. 월급 밀릴 걱정 없음,너무 외진곳에 위치. 출퇴근 불편함. 자차없을 시 출퇴근 힘듬 사내 정치,고객사 다양화 해서 더욱더 안정적인 경영 필요할둣 호
2.6,우주일렉트로닉스(주),2017. 03,1점,"""다른부서는 모르겠는데 생산쪽은 여유가 없을 정도의 업무패턴.""","건물이나 내부시설은 최상이다
대기업에 비할건아니지만 나름 봐줄만함.","생산쪽은 5분.3분이라도 담배피는 시간 외에 쉴 여유가 없다
왜 이렇게까지 하는지 모르겠다.
줄담배만 피우고 바로 일
밥도 교대로 점심시간도 30분도 안되고
쉬는시간도 눈치봐야되는..
그냥 오로지 일만하는 돈으로 보상하는 회사
주야 2교대 한달2번쉬고 350~400
그냥 내생활없이 고생해서 일한만큼 주는회사
절반 이상이 계약직인회사 3개월마다 재계약해야됨.
2년 후 정직원 시켜준다함 버텨라이거임.월급은 같음","사람을 일만하는 기계가 아닌 오로지 돈만 주면되지라는 그런거말고.
최소한 개인 휴식시간이나 보장해줬으면한다
생산쪽은 왜사람들이 퇴사를 자주하는지 그 이유를 알았으면한다
제품에 대한 최소한의 정식적인 교육이나 어디에쓰는건지 등등
수량 마추려고 사람 오래다니다 안다니나 지켜보지만말고"
2.6,우주일렉트로닉스(주),2017. 01,2점,"""IT대기업 답게 급여가 쌤 하지만 다른생산직 은 어떨지 모르겠지만 쉬는시간이 매우짧음""","급여가 쌔고 식당밥맛이 좋고 사람들 인상이 좋다
일 강도는 단순작업이고 그리 어렵지가 않다 복지는 보통정도이며 돈이 많이필요한 가장이 많다",2주2교대 라서 매우긴 근무시간 식사시간30분 하고 바로 일해야됨 계속 서있어서 다리가 매우아픔 단순반복이라 오래 일할직업은 아닌거같음 좀 쉰다십으면 눈치줌,"왜 이런일을 하는지 전문적인 오리엔테이션이 필요할거 같음
쉬는시간을 늘려줬으면함"
2.6,우주일렉트로닉스(주),2016. 10,3점,"""좋지만 힘들고 아까운 시간들. 급여는 중상위. 업무강도는 상.""",조.중.석식 잘나옴. 회사대출 및 복지가 좋은편임. 통근버스도 있고 정해진 시간과 스케쥴대로 일할수 있으며 체계적인 시스템.,비합리적인 인사평가. 인사평가가 연봉인데 사실상 좋은평가 받기 힘듬. 과도한 업무량. 군대식업무처리. 장기근무지가 많아 신입에게 과도한 노동이 주어짐.,야간근무시에 관리감독이 안됩니다. 생산량확인만 잘하면 야간근무가 필요없을것 같습니다.
2.6,우주일렉트로닉스(주),2016. 06,3점,"""한창 잘나갈때는 최고. 지금은 많이 안좋아졌지만 그래도 괜찮음.""","업무 분담이나 프로세스 잘 갖춰져있어 일이 뒤죽박죽으로 흘러가는 일은 별로 없고, 연구소쪽은 상사도 괜찮은 편. 직원들에 대한 지원이 빵빵했었다.(과거)",한번 삐끗 한 뒤로는 처우가 예전만 못함. 급여도 잘나갈때는 동종업계 탑 수준이었으나 지금은 그정도 기대하면 안될듯. 연구소는 텃세가 조금 있음.,직원들 차별하지 않았음 좋겠다. 몇몇 관리자들은 본인 위치에서 목소리 좀 내면 아래 직원들이 조금은 더 편할거 같다.
