총점,회사,날짜,별점,요약,장점,단점,경영진에게
2.6,우주일렉트로닉스(주),2019. 11,3점,"""다양한 개발환경을 경험하고 싶은 분에게 추천.""","연차사용이 자유로우며, 근무강도가 높지않으며, 잔업이 적은 편임.","관리자 위주의 업무진행으로 성장할수 있는 기회가 적으며, 창의적의 사고를 하기 어려운 환경임.","자리 보전에 연연하지말고 회사와 직원의 발전을 위해 더 많은 고민이 필요함.,"
2.6,우주일렉트로닉스(주),2019. 10,1점,"""대우 1도없고 회사자체가 발전성도 없고 재미가없음 회사가 너무 재미없음""","잔업 하기 싫으면 안해도됨 밥 잘나옴 빨간날
휴무 샌드위치 휴무가능 연차눈치안보고 사용가능","잔업해도 돈이 안됨 3개월마다 재계약 일이 너무너무 많음
체계적이지 않음 2시간일하고 무조건 10분 휴식 담배 피기 힘듬",직원들이 바라는 것좀 들어줘요 귓구녕이 막혔나 왜 안들어줍니까
2.6,우주일렉트로닉스(주),2019. 10,3점,"""연봉수준은 높다고 할수 없으나 근무이 강도가 그리 세이 않아 다닐만한 회사입니다""",과도한 업무보단 워라벨이 좋은 회사. 기업의 내외부 환경이 청결하여 좋음.업무에 비해 월급은 적지 않음.,부서별 커뮤니케이션이 어려움. 업무 진행속도가 너무 느림,각 부서별 뛰어나 전문인력이 요구되니 좀더 신중하고 통찰력있게 인원 채용이 필요함
2.6,우주일렉트로닉스(주),2019. 09,3점,"""부서마다 근무강도나 갑을?관계가 좀 심하지만 분위기는 괜찮다고 생각됨""","주위 회사에 비해 지은지 오래되진 않아서 건물이 나름 깨끗함
주차장이 넓다",화성이라 그런지 주위에 편의시설이 없다. 차가없으면 다니기 불편함,직원들의 불만을 들었다면 적극 반영하여 더 나은 회사로 거듭나길..
2.6,우주일렉트로닉스(주),2019. 09,4점,"""월급도 괜찮았고 나름 분야에서 상위권인거 같다
근무환경은 조금 개선이 필요함""",칼퇴 가능하며 기숙사 지원도 되고 오래다닐수록 월급도 많이 오른다,약간 나이있는사람이 많아 흔히 꼰대라고 불리는사람이 몇 있지만 모든회사가 똑같을거다,업무분배는 좀 필요하고 오래된 사람은 조금 많아서 막내들은 고생을 좀 하는데 알아주셨으면 좋겠다
2.6,우주일렉트로닉스(주),2019. 07,1점,"""믿고 거르는 회사. 생각 많이 하고 오시길. 일이년 다닐 생각이면 나쁘 않음""",복리후생이 다른 기업에 비해 나쁘지 않고 업무가 많진 않음,고위관리자들이 문제임. 아랫사람관리가 너무 안해서 문제,인재 좀 더 채용하고 고위관리자들 정리할 필요가 있습니다.
2.6,우주일렉트로닉스(주),2019. 07,4점,"""실패를 두려워하지 않고 도전할수있는 여건과 마음껏 자신의 역량을 발휘할수있는 회사""",복리후생 좋음. 근무강도에 비해 연봉 높은편임. 건물 깨끗하고 시설 좋음. 근무환경 양호함.,위치가 외곽이라 대중교통이 안좋음. 직급이 없는것이 장점이자 단점(승진을 중요하게 생각한다면 비추),다양한 포트폴리오로 위기에도 흔들리지 않고 지속적인 기업을 만들어줬으면 함
2.6,우주일렉트로닉스(주),2019. 07,2점,"""회사 규모는 크다. 이것저것 복지는 좋은편인데...갑자기 발전한 회사라 이것저것 안좋은 점들이 보인다.""","회사 규모가 크다. 건물도 큰편, 그리고 복지가 좋은편이다. 사람이 많고 분위기가 좋은 팀은 즐겁게 일하는거 같다.","사내 정치가 심한편, 그 분위기에 따라 여러 부서가 힘을 받기도 하고 제외되기도 한다. 어디든 그렇겠지만 일을 하는 사람만 느낌",큰 규모에 비해 체계적이지 않은 느낌이다. 흔히 말하는 고인물이 많아서 정체되있는 느낌인데 환기가 필요하지 않을까 싶다.
2.6,우주일렉트로닉스(주),2019. 06,4점,"""출퇴근시간 자유롭고 비교적 사람들이 좋다 그리고
분위기도 개방적""","기타 동종업체에 비해서 연봉과 복지가 상위권이다
그리고 사람들이 좋고 업무에 대한 스트레스가 크지 않다","일을 하는 사람만 한다 일 안하는 사람 정말 많다
그리고 보직간 업무차이가 매우 크다 매우매우",필요없는 인원감축 및 업무재배치 필요하다고 생각됨
2.6,우주일렉트로닉스(주),2019. 06,4점,"""근무 환경이 좋다. 복지도 좋은거 같다. 다만 나머진 다른 기업과 비슷한듯 하다.""",근무 환경이 깔끔하고 좋다. 또 직원들의 편의를 위한 복지도 잘 갖춰져 있다.,이해가 되지 않는 절차가 종종 보인다. 다만 기존에 진행해 왔던 일이기에 변화하려 하지 않는다.,직원들의 불만에 귀 기울이고 변화하는 더 좋은 기업이 되길
2.6,우주일렉트로닉스(주),2019. 06,3점,"""일단 화성 시골에 잇지만 건물은 깔끔한편임 . 주차장이 넓음""",일단 삼시세끼가 전부나옴. 회식도 자주는 안하는편이라서 괜찮음,조금 보수적인 면이 없지 않아 잇음. 흡연자들은 점심시간외에는 담배못핌,전반적으로 획일화된 프로세스 정립이 필요하다고 생각합니다
2.6,우주일렉트로닉스(주),2019. 06,2점,"""화성에서 오지에 있어서 회사내에서만 있어야함
부서간 경쟁있음 특히 영업팀 갑질 심함 부서마다 다르겠지만 개발할때 영업팀이 엄청 나댐...
커넥터 하나로 먹고 사는 회사여서 발전 가능성 없음
신규 사업부 있다지만 발전가능성 없음""","밥을 줌 커피시설 잘 되어 잇음 회사 내 샤워장 운동시설이 잘되어 잇음
고정적인 매출이 있어서 나름 안정적임(커넥터, 케이블)","통근 버스가 있지만 멀고 8시 출근..
새벽에 출근하시는.분도 많음....
연봉이 짜고... 여자가 다니기에는.힘든곳임 술문화있음",바라는거 없음 그냥 하던 사업 제대로 하고 다른 사업도 넓히기실
2.6,우주일렉트로닉스(주),2019. 05,4점,"""무난하게 다닐 수 있는 회사로서, 다닐 만하다. 업무 강도가 그리 쎼지 않음.
물론 이건 회사가 바쁘냐 안 바쁘냐 차이""","연차를 눈치 안 보고 쓸 수 있다. 회식 때 술 강요를 하지 않으며, 어느 정도 젊은 세대를 구축하고 있기에 꼰대 문화는 거의 없었던 회사 중 하나이다.","업무 자체가 너무 단순 반복이다 보니, 경력이 쌓일까라는 의문이 아주 많이 든다.
그래서 나오게 되었다. 그냥 하라는 식이니 다른 거 하고 싶어도 못했다.",최소 신입사원이 지원한 분야의 일을 시키길 바란다. 그게 이력서 내는 취업 희망생의 바람아닐까 생각한다. 그래도 좋은 회사였다.
2.6,우주일렉트로닉스(주),2019. 05,2점,"""그냥 빠르게 다른회사를 찾는걸 추천. 여러모로 크나큰 장점이 없다.""",주 52시간은 지키고 시급은 9300정도 그외 수당 없음. 연차는 비교적 자유로움,너무 보여주기식으로 일을 해서 없던 일도 만들어내는 기럽,보여주기식만 급급해서 일을 늘리지 않았으면 좋겠다.그게 별로였다.
2.6,우주일렉트로닉스(주),2019. 05,4점,"""생각보다 좋은 분위기에서 팀원들과 함께 자신을 개발 할수 있는 좋은 직장""","강소기업으로서 내실이 단단하다고 느꼈다.
연차를 자유롭게 사용할 수 있고 퇴근후 자기시간을 충분히 가질수 있으며
새로운 지식 정보를 습득할수 있다.",어느 회사나 그렇듯 물흐리는 미꾸라미만 조심하면 즐거운 회사생활이 가능하다.,"그나마 바라자면 군대식으로 사단장 검시도 아니고 현장방문할때 대청소?
이거말고는 직원들 잘해주시는듯"
2.6,우주일렉트로닉스(주),2019. 05,2점,"""실복지는 중소기업인데 규모만 커서 중견기업으로 중소기업 혜택없음""","좋은사람도 있음, 회식이 잦음, 시스템은 잘되어있다고 생각함","인사상 남녀차별, 꼰대가 넘쳐남, 열정페이, 사람이 많아서 그런지 뒷말이 많음","인사팀에서 너무 실무를 모른다, 성희롱 교육 좀 시키길"
2.6,우주일렉트로닉스(주),2019. 05,3점,"""진짜 거쳐가기만 좋은회사
첫직장으로오시면 3년뒤이직하시믄 됩니다
연봉이 좀 되는 이유 인상이 거의없기에 가능""","연봉이 높고 자기할일하고 가니까 아무도 안건들임
정이없는게 장점이면 장점","정이없어서 그럭저럭 일하고 퇴군하면되는데
빨간날 일요일 제외하고 거의 다출근하라하고 추가수당도 없음 이미 연벙이 포함되잇다함",제발제발 사람짜르지 마시구 업무 인원을 효율적으로하세요 짜르니까 사고나고 불량나고 쓰리아웃되고 그런거겟죠
2.6,우주일렉트로닉스(주),2019. 04,2점,"""레드오션에서 살아남기 위해 사람을 쉽게 자르는 회사""","업계대비 연봉이 높은 편, 다만 기존 있던 사람들만 높아서 다들 나가지 않음. 신입 혹은 경력으로 새로 들어온 사람들은 기존 인원대비 많이 낮음",기존 있던 사람들이 나가지 않아 업무 효율성이 떨어짐. 면피 분위기가 강함. 새로 입사하면 많이 힘들듯,기존 멤버 끝까지 잡으면 같이 망할듯. 새로운 술은 새로운 포대에 담으라고 다시 일어서려면 많이 바뀌어야됨
2.6,우주일렉트로닉스(주),2019. 04,4점,"""3~40대에겐 좋음 저녁있는삶 근무환경 좋음""",업무강도 낮음 텃세없는편 시설이 깨끗하고 밥 맛잇는편 운동시설과 샤워장 운동복잇음,초년생에겐 중견기업답지않은 중소기업연봉 상여가 없음 굳이 필요없는 잔업을 해야될수잇음,회사 특성상 잔업이 필요없는데도 하는 문화 없어져야함 다들 자기밥그릇 지키기 바쁨 일에 대한 열정잇는사람 드뭄
2.6,우주일렉트로닉스(주),2019. 04,2점,"""생산직 직원들이 텃세가 심하여 신입 사원들이 자주 퇴사함.
그리고 주5일근무 토,일 휴무 보장이 아닌 퐁당퐁당 근무를 자주 시행하고 있다.""","라인 작업이고 설비들이 전부 자동화라 사람이 힘쓰는일은 딱히 없
으며 야간 막날 (금)에는 야식으로 삼겹살 파티가 이루어져서 밥도 괜찮게 나옴 통근버스가 잘 되어 있어서 출퇴근 하기 편리 하다.","복지는 꼭 집어 세울만한게 딱히 없다.
윗 사람들에게 눈치보면서 생산을 한다.",신규 사업에 적극적인 투자와 노후화된 설비를 바꿔줬으면 바램이다.
2.6,우주일렉트로닉스(주),2019. 04,1점,"""일단 첫번째로는 인사쪽에서 대우가 쓰레기취급하고 일하는거는 평범하긴한데
꼰대부리는 사람들 많음 체제가 좀 뒤엉켜있고 한마디로 겉으로는 멀쩡하나 속은 양아치임 진짜 매우 싫음""",장점이라고 하기엔 일단 식당 밥 먹을거는 잘나오고 헬스장도있음,"일단 첫번째로는 인사쪽에서 대우가 쓰레기취급하고 일하는거는 평범하긴한데
꼰대부리는 사람들 많음 체제가 좀 뒤엉켜있고 한마디로 겉으로는 멀쩡하나 속은 양아치임 진짜 매우 싫음",딱히 없음 그냥 신입들을 도구로 생각하지않고 꼰대좀않부렸으면함
2.6,우주일렉트로닉스(주),2019. 04,1점,"""신입사원들에게는 매우 비추 조용히다니기에는 괜찮은 회사이긴함 한번 퇴사하면 재입사어려움 매우싫음""","생각보단 장점은
많이 있진 않고 밥은 잘나옴...ㄲ",신입사원들에게는 매우 비추 조용히다니기에는 괜찮은 회사이긴함 한번 퇴사하면 재입사어려움 매우싫음,"업무할때나 분위기가 좋진않음
관리체계도 엉망 대우가 별로."
2.6,우주일렉트로닉스(주),2019. 04,1점,"""미래가 안보임
작년 대책없이 대량해고하더니 이제와서 생산직 모자라다고 다시뽑는 클라스""","월급은 안밀림 안밀림 안밀림 안밀림
정말 안밀림
일하는 사람만 일하고 노는 사람은 놀아도 됨","업무능력보다는 줄서기
해고대상에는 간접직인 관리부서는 한명도 없음","현재의 부진은 미래예측을 똥같이한 경영진탓
직원들 잡으려면 통합사무실이나 잡아라"
2.6,우주일렉트로닉스(주),2019. 03,1점,"""과거에는 좋았지만.. 지금은...어디로 흘러가고 있는지 모르겠군요.""","8시출근 5시퇴근 금연회사로 일찍출근해서 회사밥먹고 5시에 퇴근하는것으로 계약은 되어있으며, 금연으로 건강한 삶을 영위할수있습니다.","8시출근이니 7시반에는 출근해야하며, 5시 퇴근은 특정부서 이야기일 뿐이며, 강제금연으로 인한 흡연자 배려가 전혀없습니다.",쌍8년도식 운영은 없애고 지금 어떻게 혁신을 해고 고인물을 덜어내고 젊은 피를 수혈해야하는지 느끼시고 어떻게 살아남을 수 있을 지 고민해 봐야할 째인거 같습니다.
2.6,우주일렉트로닉스(주),2019. 03,2점,"""좋은 회사이긴 하나 뭔가 부족한 회사""",연차가 언제나 가능하며 월급 잘 나옵니다. 사내 문화는 자유로운 편이며 배려문화가 잘되어 있습니다.,"밥은 맛없음 무조건 오래 일해야 인정 받는 그런곳입니다. 그리고 연구소, 품질만 죽어라 일함. 나머지 부서는 그냥 정시 퇴근이 이루어짐 ㄷㄷ",전체적으로 정말 좋은 곳이나 팀장급 이상 능력없는 사람들이 정말 많습니다.
2.6,우주일렉트로닉스(주),2019. 03,4점,"""연봉도 좋고 회사자체가 큼 중소기업에서 일하다가 가니 좋았음""",회사가 탄탄함 직원수도 좋음 헬스장 커피머신 등 맘에 듬,"야근강요 / 제품이 너무 작아 눈이 아픔 딱히 단점은 없음
그냥 시설이나 이런게 마음에 들었어요~",야근은 눈치 안주셨으면 좋겠습니다~ 병원간다고 해도 눈치주셔서;;
2.6,우주일렉트로닉스(주),2019. 02,3점,"""적당히 조용히 다니에 괜찮은 회사
언제 퇴사될지는 모른다""","연봉은 중소 중견기업 대비 괜찮음.
퇴근은 부서별로 차이나지만 그래도 늦은 편은 아님
근처에 살면 집에서 저녁시간이 여유로울 수 있음","줄 잘서야됨.
복지는 계속 없어지는 중
그나마 연차에 따라 오르던 연봉도 이제는 없음","무엇이 문제인지 알면서도 좌시하지마세요
과감한 결단이 기업을 살릴 수 있습니다."
2.6,우주일렉트로닉스(주),2019. 02,1점,"""여기 오지마세요 꼰대 심합니다 십입 대접 그지 같습니다""",없음 답이없음 간식 많이 주는거 말고 없음.......,십입은 오래 못버티고 나갑니다 저도 지금 다니고 있지만 왜 다니고 있는지 모르겠네요,사람들이 왜 나가는지 상의좀 했으면 좋겠네요 사람이 나가든 말든 신경 안쓰는 화사는 첨 봤습니다
2.6,우주일렉트로닉스(주),2019. 02,3점,"""복지도 괜찮고 회사 미래도 좋았던 회사""",월급 사장님들의 마인드가 좋았음. 월급도 좋고 야근도 많지 않아 좋지만 위치가 너무 외져서 자기개발하기엔 조금 쉽지 않음,"회의가 넘많아 힘듬 부서간 사이가 좋지않음, 임원들 처음 의욕적이나 최종적으로 오너의 눈치로 개혁하지못하는 단점",회사 초기에 힘들게 같이 고생한 오래된 직원애개 잘해주시기를 오래된 직원들이 책임지고 나가는 모습이 너무 좋지않네요
2.6,우주일렉트로닉스(주),2019. 01,1점,"""최악최악최악최악이라고밖에 할말이없다 신입한테는 매우 비추""",장점이라곤 월급이 제때 찍히는것 그외적인것은 그나마 동종업계에서 이름좀나있는것?,군대식 문화와 꼰대들의 집단 최악이다 서로 똥꼬빨려하고 5년된과장이 7년차 과장에게 똥꼬를 빠는 형국..한마디로 최악임,직원들 복지나 급여적인 부분도 조금만더신경써주시고 고인물들을 정리할 필요가있어요 신입들이 없는이유가 뭘까생각해보세요
2.6,우주일렉트로닉스(주),2018. 12,1점,"""재무는 탄탄한거 같고 국내에서 어느정도는 인지도 있는것 같다""",국내에서는 히로세코리아 jnt 우주일렉트로닉스 일정도로 손가락안에 꼽는 중견기업회사이며 밥 맛있고 삼시세끼 커피자판기 수원전지역 통근버스등등 화성 시골골목이지만 다니기 나름 편함 시급은 상여600%녹여서 나때는 8000원이었던것 같음 약 3년전,"중국공장에서 싸게 부려먹으려고 중국인노동자 파견이 겁나 많았음 이중에서 98%이상 아니 100%여자 노동자였던거 같음 일 은근 빡세고 처음 들어올때부터 실적평가해서 기계유지보수 잘 못하면 성과에서 -점수줌 (들어온지 7일이후부터 평가..젠장) 원래는 시급 8500원 9000원 하는거 사무직 반발이심해서 8000원으로 내렸었는데 업무강도로 보았을때
사무직 보다 많이 받아야 된다고 생각함 비전검사 현미경검사 금형교체 기계유지보수 및 삼정5s 또 구리나 박스이런거 버릴때 창고가 적어서 버리는데 겁나 고생했음",들어온지 얼마 안된상태에서 평가는 너무 박하다고 생각합니다 현미경 보는것도 적응 안된상태에서 매주 평가하고
2.6,우주일렉트로닉스(주),2018. 11,2점,"""동종업계 대비 연봉은 양호한 수준
삼성1차 벤더이다보니 성수기 비수기 차이가 크다
2017년도 대비 2018년도 매출이 현저히 감소하여 인원을 너무 마니 잘랐다.....
워라벨은 타회사대비 양호한편임
위치는 차없으면 좀 힘듬""","연차는 2틀연속 쓰기는 힘들것 같음
장점은 한줄평에도 남겼는데... 나쁘지 않음","복지 제도는 쓸만한게 없고....
사람의 중요성을 아직 깨닫지 못한 회사
애사심이 생길수가....","경영진의 경영잘못이 밑으로 내려가지 않았으면 좋겠네요
자신이 먼저 살고자 하는것이 아닌 다같이라는 말이 나왔으면 좋겠네요..."
2.6,우주일렉트로닉스(주),2018. 11,1점,"""변화에 둔감한 기업, 일 욕심없이 회사에 다니려는 사람은 적극 추천""","직원 전체적으로 근속연수가 길다
고인물이 많다는 것일수있으나 짤리지않고 적당히 말년까지 다니려는 마음이라면 적극 추천

퇴근이 빠른편이다
적당히 윗선 맞춰주고 퇴근 하면된다
물론 열심히 하는 사람은 몇몇 보였다","정말 변화에 둔감하다
다녀본 회사중 이런회사가 있을까 싶네요
변화하지않는.. 변화하지못할 회사일듯하다
경영진, 직원 모두 변화하지않는 지금 상황이 익숙해보인다","꼬박꼬박 월급주는게 직원을 위하고 챙기는건 아니라고 생각합니다.
정말로 회사가 힘들어지기 전에 먼저 비전을 제시하시고
좀더 치열해 지시길 바랍니다.
직원에 대한 물갈이도 필요해 보입니다"
2.6,우주일렉트로닉스(주),2018. 11,2점,"""회사 건물 깨끗하고 좋으나 내부 프로세스. 시스템은 부족한 부분이 많고 가족 또는 지인 경영하고 있음""","회사 건물 좋음. 주차장 좋음. 복지 시설 좋음
회사가 시골에 있어 너무 한적함","회사 건물만 좋음
복지 시설은 있으나 사용자 별로 없음
팀장 이상은 완전히 사용자편이고
임원들은 회장에게 아부 경연 대회 중
베트남으로 제조라인을 대부분 이전해서 인건비 절감 중","프로세스. 시스템 개선이 시급함
프로세스에 관심있는 관리자가 없음
그냥 감으로 일하고 절차가 매번 다름
너무 실세 라인을 타고 눈치보기 바쁨"
2.6,우주일렉트로닉스(주),2018. 11,3점,"""업무 난이도가 높지 않고 초반에 사회경험 및 경력채우기 좋은 회사""","중견기업이라는 장점과, 재무관련 안정적으로 평가된다 들었음
칼출근 대부분 칼퇴","비합리적 인사제도, 갑자기 큰회사이다 보니 윗사람들이 꼰대임 아는것도 그닥 없으며 경력으로 뭉개려는 상사들이 있음
뒷얘기가 많이 나옴, 드라마에서 보는 극단적 회사생활 몇장면을 볼수도 있음,잦은 조직 변경",복지수준이 제로에 가까우며 잦은 조직변경 으로 인한 전문성 없어짐
2.6,우주일렉트로닉스(주),2018. 10,2점,"""연봉수준은 높은편 사람이 귀하지 않으며 정치적 성향이 강함""",연봉수준이 높고 업무강도가 높지 않은편이다 루틴한 업무머 한다면 좋은 좋건,개인은 개발이나 경력상에 문제가 생길수 있으며 정치적 성향이 강함,정치를 적당히하고 회사의 발전에 도움이 되는 방향으로 의사 결정을 했으면
2.6,우주일렉트로닉스(주),2018. 10,1점,"""출근시간은 칼같으나 퇴근시간은 물같은 회사.
오래다니기엔 조금 부족한회사.""","장점...
7시전에 출근하면 차량막힘없음.
9시 이후 퇴근하면 차량막힘없음.

왜냐면 그만큼 시골에 있음.
공기 좋음.","연봉상승률은 어떻게 되는지 알수 없음
해외로 공장이전하면서 규모가 점점작아짐.","부족한 인력의 보충이 시급합니다.
회사의 이익은 직원들도 많이 누릴수있었으면..."
2.6,우주일렉트로닉스(주),2018. 10,1점,"""연봉괜찮음 하지만 기회주의자가 많고 정치판 버금가는 구조라 혀 잘 놀리는 분 적극 추천""","재무상태 비정상적으로 좋음

다르게 보면 장기적 투자가 없고 그냥 지키자는씩임","장기적 투자가 없다보니 성장에 한계가 있음

직원을 돈으로 바라보는 아주 구시대적인 분위기

조직에 머리 좋은 사람은 없고 혀 잘노리는 사람 득세하고 있음

들어오면 인생경험 징하게 할지도..","사원의 소리도 검렬 받고, 규정없이 부당한 징계처리, 주주/직원보단 윗분들 나눠갈꺼 먼저 챙기는 사람들한테 무슨 바랄것이 있을까"
2.6,우주일렉트로닉스(주),2018. 10,5점,"""군대식문화라고 해서 들어왔는데 굉장히 자유로운 분위기 서로를 존중해주고 발전하는 단계라서 굉장히 좋은 분위기임은 확실하다""",계속 발전해나가고 기아 현대 1차협력이라는 큰 장점이 있다,단점은 아직 없다 기숙사도 무료고 통근버스까지 있어서 사회 초년생들에게 돈을 모을수 있는 좋은 기회이다,앞으로 이대로만 계속 유지를 시켜줬으면 좋겠습니다
2.6,우주일렉트로닉스(주),2018. 09,1점,"""빛 좋은 개살구라는 말은 여기를 두고 하는말입니다.
중견기업이라 하나 속은 소기업보다도 못함.""",정말 없는데 하나 말하자면 징검다리 연휴는 연차로 쉬게해줌,"직원들한테 돈아끼고 이상한대 돈 많이 씀
밥 맛없음
창립기념일 선물주는데 값좀 나가는거면 직원들 월급에서 얼마씩 깜 (그럴거면 왜주는거죠? 차라리 쉬게 해주세요)",직원에게 돈 아끼지 맙시다...직원들이 일할 맛이 나게 해줘야 열심히 일을 하죠
2.6,우주일렉트로닉스(주),2018. 09,3점,"""일하는 사람들과의 분위기가 매우 좋았다.""",회사 내에서 외국어 강의 등을 들을 수 있었다. 지금은 어떤지 모르지만 내가 다니던 당시에는 일본어 강의와 베트남어 강의 중 하나를 선택해서 들을 수 있었다.,"회사에서 놀고있는 사람들이 많다는걸 경영진이 모르는 것 같다.
그만큼 회사의 돈이 쓸데없이 빠져나간다는걸 잘 알았으면 좋겠다.",직원들의 소리에 귀를 좀 많이 기울였으면 좋겠다.
2.6,우주일렉트로닉스(주),2018. 09,3점,"""신입사원 초봉이 높다. 하지만 연봉인상률이 낮아 직급별 연봉 차이가 별로없다.""",신입사원이라면 제조업 관련 업무를 많이 배울 수 있다.,"시골에 있어 교통 불편, 비합리적인 인사시스템, 연봉 인상률 낮음","객관적인 인사시스템 필요, 인원 충원으로 합리적인 업무 배분"
2.6,우주일렉트로닉스(주),2018. 07,3점,"""관리직들이 대우 받으며 일할 수 있음. 연봉도 대기업에 비하면 적지만
중견기업 수준이라 괜찬은 수준이다. 대신 돈 받은 만큼 스트레스가 있다.""","사람마다 눈높이에 차이가 있겠지만 급여가 나름 괜찬은편이었고, 교육이나 동호회 등의 지원 체계가 어느 정도 구축되어 있음.","화성시 양감면에 사업장이 위치하고 있는데, 여기로 통하는 국도가 엄청 막히는 구간이라 출퇴근이 힘들다는 점과 부서내 압박 등의 스트레스가 심하다는 점이 단점이다.",사업장의 접근 도로망에 불편함에 있으니 출퇴근 시간을 1시간 늦추거나 탄력근무제를 시행하여 자율적으로 시간을 조정하게 하면 좋겟음
